電腦編號,座落,緯度,經度,地下樓層數,可容納人數,管轄分局,placemark_address
TMA0036,宜蘭縣宜蘭市民權里中山路二段55號,24.7450829,121.7555575,1.0,547.0,宜蘭分局,宜蘭縣宜蘭市民權里中山路二段55號
TMA0040,宜蘭縣宜蘭市神農里復興路66號,24.7499707,121.7544355,1.0,83.0,宜蘭分局,宜蘭縣宜蘭市神農里復興路66號
TMA0042,宜蘭縣宜蘭市大新里新民路75號,24.7568157,121.7565307,1.0,252.0,宜蘭分局,宜蘭縣宜蘭市大新里新民路75號
TMA0043,宜蘭縣宜蘭市大新里舊城東路50號,24.7577931,121.7566483,2.0,1432.0,宜蘭分局,宜蘭縣宜蘭市大新里舊城東路50號
TMA0044,宜蘭縣宜蘭市民權里中華路146號,24.7491154,121.7531048,1.0,421.0,宜蘭分局,宜蘭縣宜蘭市民權里中華路146號
TMA0046,宜蘭縣宜蘭市民權里中山路二段261號,24.7522009,121.7527533,1.0,142.0,宜蘭分局,宜蘭縣宜蘭市民權里中山路二段261號
TMA0048,宜蘭縣宜蘭市民權里農權路90號,24.747787,121.7539603,1.0,419.0,宜蘭分局,宜蘭縣宜蘭市民權里農權路90號
TMA0051,宜蘭縣宜蘭市神農里中山路二段482號,24.7533504,121.7527402,2.0,3784.0,宜蘭分局,宜蘭縣宜蘭市神農里中山路二段482號
TMA0053,宜蘭縣宜蘭市神農里中山路二段318號,24.7500576,121.753928,1.0,1081.0,宜蘭分局,宜蘭縣宜蘭市神農里中山路二段318號
TMA0055,宜蘭縣宜蘭市大新里光復路30號,24.755192,121.756501,1.0,224.0,宜蘭分局,宜蘭縣宜蘭市大新里光復路30號
TMA0056,宜蘭縣宜蘭市神農里中山路二段432號,24.7519859,121.7533884,1.0,406.0,宜蘭分局,宜蘭縣宜蘭市神農里中山路二段432號
TMA0057,宜蘭縣宜蘭市大新里宜興路一段366號,24.7577096,121.7589454,1.0,296.0,宜蘭分局,宜蘭縣宜蘭市大新里宜興路一段366號
TMA0059,宜蘭縣宜蘭市大新里新民路79號,24.7568175,121.756469,1.0,387.0,宜蘭分局,宜蘭縣宜蘭市大新里新民路79號
TMA0060,宜蘭縣宜蘭市中山里城隍街27號,24.7589821,121.7522188,1.0,91.0,宜蘭分局,宜蘭縣宜蘭市中山里城隍街27號
TMA0062,宜蘭縣宜蘭市西門里中山路三段217號,24.7610257,121.7533615,1.0,245.0,宜蘭分局,宜蘭縣宜蘭市西門里中山路三段217號
TMA0064,宜蘭縣宜蘭市中山里城隍路59號 ,24.7591166,121.7512179,1.0,84.0,宜蘭分局,宜蘭縣宜蘭市中山里城隍路59號 
TMA0065,宜蘭縣宜蘭市西門里舊城西路111號,24.7602488,121.7502626,1.0,1460.0,宜蘭分局,宜蘭縣宜蘭市西門里舊城西路111號
TMA0066,宜蘭縣宜蘭市中山里城隍街52號,24.759383,121.7511253,1.0,204.0,宜蘭分局,宜蘭縣宜蘭市中山里城隍街52號
TMA0068,宜蘭縣宜蘭市中山里城隍街16號,24.759316,121.752078,1.0,115.0,宜蘭分局,宜蘭縣宜蘭市中山里城隍街16號
TMA0070,宜蘭縣宜蘭市東門里新民路152號,24.7577958,121.7541648,1.0,525.0,宜蘭分局,宜蘭縣宜蘭市東門里新民路152號
TMA0071,宜蘭縣宜蘭市慈安里慈安路41之7號,24.7596405,121.7626194,1.0,313.0,宜蘭分局,宜蘭縣宜蘭市慈安里慈安路41之7號
TMA0072,宜蘭縣宜蘭市慈安里林森路311巷2號,24.7607438,121.7620721,1.0,577.0,宜蘭分局,宜蘭縣宜蘭市慈安里林森路311巷2號
TMA0076,宜蘭縣宜蘭市小東里新興路86號,24.7601756,121.7580102,1.0,670.0,宜蘭分局,宜蘭縣宜蘭市小東里新興路86號
TMA0077,宜蘭縣宜蘭市東門里聖後街118號,24.7588042,121.7555299,1.0,414.0,宜蘭分局,宜蘭縣宜蘭市東門里聖後街118號
TMA0078,宜蘭縣宜蘭市新民里新民路143號,24.7574326,121.7539962,1.0,60.0,宜蘭分局,宜蘭縣宜蘭市新民里新民路143號
TMA0079,宜蘭縣宜蘭市慈安里林森路203號,24.7576965,121.7607292,1.0,265.0,宜蘭分局,宜蘭縣宜蘭市慈安里林森路203號
TMA0080,宜蘭縣宜蘭市新民里中山路三段中央商場53之5號,24.7565948,121.7524009,1.0,114.0,宜蘭分局,宜蘭縣宜蘭市新民里中山路三段中央商場53之5號
TMA0081,宜蘭縣宜蘭市東門里力新路42號,24.7597584,121.7542996,1.0,147.0,宜蘭分局,宜蘭縣宜蘭市東門里力新路42號
TMA0082,宜蘭縣宜蘭市新民里崇聖街63-2號,24.756975,121.754778,2.0,1019.0,宜蘭分局,宜蘭縣宜蘭市新民里崇聖街63-2號
TMA0084,宜蘭縣宜蘭市慈安里林森路336巷37號,24.7598929,121.761785,1.0,1669.0,宜蘭分局,宜蘭縣宜蘭市慈安里林森路336巷37號
TMA0086,宜蘭縣宜蘭市東門里新民路108號,24.757275,121.755616,1.0,403.0,宜蘭分局,宜蘭縣宜蘭市東門里新民路108號
TMA0087,宜蘭縣宜蘭市新民里崇聖街53號,24.7565092,121.7549546,1.0,122.0,宜蘭分局,宜蘭縣宜蘭市新民里崇聖街53號
TMA0088,宜蘭縣宜蘭市東門里新民路152號,24.7577958,121.7541648,1.0,853.0,宜蘭分局,宜蘭縣宜蘭市東門里新民路152號
TMA0090,宜蘭縣宜蘭市東門里崇聖街83號,24.7582272,121.7556818,1.0,325.0,宜蘭分局,宜蘭縣宜蘭市東門里崇聖街83號
TMA0091,宜蘭縣宜蘭市東門里中山路三段128號,24.7582992,121.7529174,2.0,2266.0,宜蘭分局,宜蘭縣宜蘭市東門里中山路三段128號
TMA0092,宜蘭縣宜蘭市東門里中山路三段152號,24.7591086,121.753092,1.0,484.0,宜蘭分局,宜蘭縣宜蘭市東門里中山路三段152號
TMA0093,宜蘭縣宜蘭市小東里新興路20號,24.7589349,121.7586429,1.0,314.0,宜蘭分局,宜蘭縣宜蘭市小東里新興路20號
TMA0094,宜蘭縣宜蘭市小東里樹人路37號,24.7619228,121.7584437,1.0,644.0,宜蘭分局,宜蘭縣宜蘭市小東里樹人路37號
TMA0095,宜蘭縣宜蘭市小東里小東路6之1號,24.7590405,121.7570268,1.0,835.0,宜蘭分局,宜蘭縣宜蘭市小東里小東路6之1號
TMA0096,宜蘭縣宜蘭市舊城南路1號,24.7544274,121.7536907,1.0,491.0,宜蘭分局
TMA0097,宜蘭縣宜蘭市民權里中山路二段31號,24.7445456,121.7557573,1.0,369.0,宜蘭分局,宜蘭縣宜蘭市民權里中山路二段31號
TMA0098,宜蘭縣宜蘭市民權里女中路二段287號,24.7459017,121.7547974,1.0,560.0,宜蘭分局,宜蘭縣宜蘭市民權里女中路二段287號
TMA0099,宜蘭縣宜蘭市小東里樹人路50號,24.7619245,121.758679,2.0,2829.0,宜蘭分局,宜蘭縣宜蘭市小東里樹人路50號
TMA0100,宜蘭縣宜蘭市小東里光復路43號,24.7550259,121.7556833,1.0,794.0,宜蘭分局,宜蘭縣宜蘭市小東里光復路43號
TMA0110,宜蘭縣宜蘭市大新里和睦路146號,24.7598483,121.7591403,1.0,398.0,宜蘭分局,宜蘭縣宜蘭市大新里和睦路146號
TMA0111,宜蘭縣宜蘭市小東里樹人路37號,24.7619228,121.7584437,1.0,710.0,宜蘭分局,宜蘭縣宜蘭市小東里樹人路37號
TMA0112,宜蘭縣宜蘭市新民里新民路152號,24.7577958,121.7541648,2.0,1605.0,宜蘭分局,宜蘭縣宜蘭市新民里新民路152號
TMA0113,宜蘭縣宜蘭市民權里中山路二段305號,24.7538649,121.7522621,1.0,285.0,宜蘭分局,宜蘭縣宜蘭市民權里中山路二段305號
TMA0114,宜蘭縣宜蘭市西門里同慶街95號,24.7616726,121.7507401,1.0,1404.0,宜蘭分局,宜蘭縣宜蘭市西門里同慶街95號
TMA0115,宜蘭縣宜蘭市思源里農權路101號,24.7498963,121.7395796,2.0,2150.0,宜蘭分局,宜蘭縣宜蘭市思源里農權路101號
TMA0116,宜蘭縣宜蘭市民權里弘志路26號,24.7461981,121.7531555,1.0,1043.0,宜蘭分局,宜蘭縣宜蘭市民權里弘志路26號
TMA0117,宜蘭縣宜蘭市東門里中山路三段112號,24.7579003,121.7528161,1.0,191.0,宜蘭分局,宜蘭縣宜蘭市東門里中山路三段112號
TMA0118,宜蘭縣宜蘭市神農里民權路一段65號,24.7525466,121.7538829,1.0,368.0,宜蘭分局,宜蘭縣宜蘭市神農里民權路一段65號
TMC0001,宜蘭縣宜蘭市北津里大坡路一段27號,24.7690774,121.7554639,1.0,439.0,宜蘭分局,宜蘭縣宜蘭市北津里大坡路一段27號
TMC0004,宜蘭縣宜蘭市茭白里中山路五段151巷8號,24.7709876,121.7564647,1.0,1944.0,宜蘭分局,宜蘭縣宜蘭市茭白里中山路五段151巷8號
TMC0007,宜蘭縣宜蘭市北津里津梅路180巷1號,24.7674766,121.7503218,1.0,560.0,宜蘭分局,宜蘭縣宜蘭市北津里津梅路180巷1號
TMC0009,宜蘭縣宜蘭市新生里中山路五段276號,24.774463,121.7583503,1.0,1114.0,宜蘭分局,宜蘭縣宜蘭市新生里中山路五段276號
TMC0010,宜蘭縣宜蘭市北津里津梅路58號,24.7674085,121.7533157,1.0,411.0,宜蘭分局,宜蘭縣宜蘭市北津里津梅路58號
TMC0011,宜蘭縣宜蘭市茭白里大坡路一段28號,24.769192,121.755797,1.0,438.0,宜蘭分局,宜蘭縣宜蘭市茭白里大坡路一段28號
TMC0012,宜蘭縣宜蘭市北津里大坡路一段31號,24.7692521,121.7552873,1.0,1027.0,宜蘭分局,宜蘭縣宜蘭市北津里大坡路一段31號
TMC0014,宜蘭縣宜蘭市梅洲里梅洲二路92號,24.7807186,121.7344129,1.0,120.0,宜蘭分局,宜蘭縣宜蘭市梅洲里梅洲二路92號
TMC0015,宜蘭縣宜蘭市梅洲里梅洲一路18-1號,24.7767311,121.7366388,1.0,201.0,宜蘭分局,宜蘭縣宜蘭市梅洲里梅洲一路18-1號
TMC0017,宜蘭縣宜蘭市梅洲里梅洲二路59號,24.7805108,121.735051,1.0,115.0,宜蘭分局,宜蘭縣宜蘭市梅洲里梅洲二路59號
TMC0018,宜蘭縣宜蘭市北津里大坡路一段121巷31號,24.7696154,121.7528883,1.0,1623.0,宜蘭分局,宜蘭縣宜蘭市北津里大坡路一段121巷31號
TMC0031,宜蘭縣宜蘭市北門里同興街119號,24.7632953,121.7537056,1.0,271.0,宜蘭分局,宜蘭縣宜蘭市北門里同興街119號
TMC0039,宜蘭縣宜蘭市北門里中山路三段257號,24.762344,121.7538519,3.0,1551.0,宜蘭分局,宜蘭縣宜蘭市北門里中山路三段257號
TMC0040,宜蘭縣宜蘭市孝廉里中山路三段290號,24.7624252,121.7541246,2.0,1188.0,宜蘭分局,宜蘭縣宜蘭市孝廉里中山路三段290號
TMC0041,宜蘭縣宜蘭市菜園里力行路106巷10號,24.7631486,121.7576752,1.0,402.0,宜蘭分局,宜蘭縣宜蘭市菜園里力行路106巷10號
TMC0045,宜蘭縣宜蘭市孝廉里舊城北路110號,24.7602412,121.7541617,1.0,150.0,宜蘭分局,宜蘭縣宜蘭市孝廉里舊城北路110號
TMC0046,宜蘭縣宜蘭市菜園里吉祥路126號,24.7609316,121.7560999,1.0,557.0,宜蘭分局,宜蘭縣宜蘭市菜園里吉祥路126號
TMC0048,宜蘭縣宜蘭市孝廉里舊城北路30號,24.7592252,121.7559477,1.0,327.0,宜蘭分局,宜蘭縣宜蘭市孝廉里舊城北路30號
TMC0052,宜蘭縣宜蘭市孝廉里東後街2號,24.7604892,121.7538111,1.0,379.0,宜蘭分局,宜蘭縣宜蘭市孝廉里東後街2號
TMC0053,宜蘭縣宜蘭市孝廉里新興路175號,24.7620754,121.7553223,1.0,330.0,宜蘭分局,宜蘭縣宜蘭市孝廉里新興路175號
TMC0054,宜蘭縣宜蘭市孝廉里新興路216號,24.7625035,121.754722,1.0,294.0,宜蘭分局,宜蘭縣宜蘭市孝廉里新興路216號
TMC0060,宜蘭縣宜蘭市孝廉里力行路152號,24.7640667,121.7541406,1.0,632.0,宜蘭分局,宜蘭縣宜蘭市孝廉里力行路152號
TMC0061,宜蘭縣宜蘭市菜園里環河東路93號,24.7639372,121.7574291,1.0,173.0,宜蘭分局,宜蘭縣宜蘭市菜園里環河東路93號
TMC0062,宜蘭縣宜蘭市茭白里中山路五段123號,24.7698454,121.7564582,1.0,1207.0,宜蘭分局,宜蘭縣宜蘭市茭白里中山路五段123號
TMC0063,宜蘭縣宜蘭市菜園里吉祥路88巷1號,24.7597765,121.7557659,2.0,1981.0,宜蘭分局,宜蘭縣宜蘭市菜園里吉祥路88巷1號
TMC0064,宜蘭縣宜蘭市北門里新興路268號,24.7631028,121.7530085,1.0,966.0,宜蘭分局,宜蘭縣宜蘭市北門里新興路268號
TMC0068,宜蘭縣宜蘭市菜園里力行路106巷8號,24.7638761,121.7574967,1.0,886.0,宜蘭分局,宜蘭縣宜蘭市菜園里力行路106巷8號
TMC0069,宜蘭縣宜蘭市新生里宜興路三段9號,24.7653834,121.7616059,1.0,1603.0,宜蘭分局,宜蘭縣宜蘭市新生里宜興路三段9號
TMC0070,宜蘭縣宜蘭市新生里大福路二段142巷5弄3號,24.767942,121.758042,2.0,2451.0,宜蘭分局,宜蘭縣宜蘭市新生里大福路二段142巷5弄3號
TMC0071,宜蘭縣宜蘭市新生里中山路五段166巷12號,24.7697525,121.7574036,1.0,482.0,宜蘭分局,宜蘭縣宜蘭市新生里中山路五段166巷12號
TMB0001,宜蘭縣宜蘭市思源里神農路1段1號,24.7462924,121.7475856,1.0,8840.0,宜蘭分局,宜蘭縣宜蘭市思源里神農路1段1號
TMB0002,宜蘭縣宜蘭市文化里復興路2段258號,24.7502451,121.7440239,2.0,295.0,宜蘭分局,宜蘭縣宜蘭市文化里復興路2段258號
TMB0003,宜蘭縣宜蘭市思源里神農路一段1號,24.7462924,121.7475856,1.0,2938.0,宜蘭分局,宜蘭縣宜蘭市思源里神農路一段1號
TMB0004,宜蘭縣宜蘭市文化里宜中路218號,24.7504321,121.743997,1.0,162.0,宜蘭分局,宜蘭縣宜蘭市文化里宜中路218號
TMB0005,宜蘭縣宜蘭市泰山里民權新路497號,24.7540346,121.7412051,1.0,813.0,宜蘭分局,宜蘭縣宜蘭市泰山里民權新路497號
TMB0006,宜蘭縣宜蘭市民族里神農路二段55號,24.751922,121.751019,1.0,312.0,宜蘭分局,宜蘭縣宜蘭市民族里神農路二段55號
TMB0010,宜蘭縣宜蘭市泰山里泰山路112巷2弄1號,24.7546385,121.7360522,1.0,272.0,宜蘭分局,宜蘭縣宜蘭市泰山里泰山路112巷2弄1號
TMB0011,宜蘭縣宜蘭市思源里女中路三段84號,24.7463455,121.740221,1.0,2951.0,宜蘭分局,宜蘭縣宜蘭市思源里女中路三段84號
TMB0014,宜蘭縣宜蘭市文化里軍民路5巷33號,24.7497576,121.7489098,1.0,123.0,宜蘭分局,宜蘭縣宜蘭市文化里軍民路5巷33號
TMB0017,宜蘭縣宜蘭市泰山里金六結路491號,24.7497663,121.7341129,1.0,973.0,宜蘭分局,宜蘭縣宜蘭市泰山里金六結路491號
TMB0018,宜蘭縣宜蘭市文化里民族路328號,24.751231,121.7459271,1.0,465.0,宜蘭分局,宜蘭縣宜蘭市文化里民族路328號
TMB0019,宜蘭縣宜蘭市復興里女中路二段370號,24.745537,121.752763,1.0,328.0,宜蘭分局,宜蘭縣宜蘭市復興里女中路二段370號
TMB0020,宜蘭縣宜蘭市思源里4鄰宜中路79巷23號,24.7474986,121.7426214,1.0,1531.0,宜蘭分局,宜蘭縣宜蘭市思源里4鄰宜中路79巷23號
TMB0021,宜蘭縣宜蘭市思源里宜中路100號,24.7468745,121.7427908,1.0,1083.0,宜蘭分局,宜蘭縣宜蘭市思源里宜中路100號
TMB0024,宜蘭縣宜蘭市負郭里泰山路94號,24.75427,121.7441674,1.0,127.0,宜蘭分局,宜蘭縣宜蘭市負郭里泰山路94號
TMB0025,宜蘭縣宜蘭市思源里神農路一段1號,24.7462924,121.7475856,1.0,248.0,宜蘭分局,宜蘭縣宜蘭市思源里神農路一段1號
TMB0026,宜蘭縣宜蘭市民族里文化路79號,24.7510576,121.7484446,1.0,330.0,宜蘭分局,宜蘭縣宜蘭市民族里文化路79號
TMB0028,宜蘭縣宜蘭市思源里嵐峰路三段438號,24.746895,121.7338225,2.0,497.0,宜蘭分局,宜蘭縣宜蘭市思源里嵐峰路三段438號
TMB0029,宜蘭縣宜蘭市負郭里民權新路252號,24.7523599,121.7449705,1.0,1063.0,宜蘭分局,宜蘭縣宜蘭市負郭里民權新路252號
TMB0030,宜蘭縣宜蘭市文化里復興路二段49號,24.7486958,121.7484167,1.0,248.0,宜蘭分局,宜蘭縣宜蘭市文化里復興路二段49號
TMB0031,宜蘭縣宜蘭市泰山里建軍路16號,24.7524841,121.73637,1.0,448.0,宜蘭分局,宜蘭縣宜蘭市泰山里建軍路16號
TMB0032,宜蘭縣宜蘭市負郭里負郭路25巷30號,24.7525877,121.7458756,1.0,183.0,宜蘭分局,宜蘭縣宜蘭市負郭里負郭路25巷30號
TMB0033,宜蘭縣宜蘭市泰山里泰山路112巷12號,24.7531947,121.7403535,1.0,141.0,宜蘭分局,宜蘭縣宜蘭市泰山里泰山路112巷12號
TMB0037,宜蘭縣宜蘭市文化里復興路二段15巷13號,24.7484575,121.7494674,1.0,109.0,宜蘭分局,宜蘭縣宜蘭市文化里復興路二段15巷13號
TMB0038,宜蘭縣宜蘭市文化里復興路二段15巷1號,24.7482907,121.7494901,1.0,205.0,宜蘭分局,宜蘭縣宜蘭市文化里復興路二段15巷1號
TMB0039,宜蘭縣宜蘭市思源里民族路497號,24.7483438,121.7406142,1.0,235.0,宜蘭分局,宜蘭縣宜蘭市思源里民族路497號
TMB0040,宜蘭縣宜蘭市文化里民族路338號,24.7511193,121.7456327,1.0,595.0,宜蘭分局,宜蘭縣宜蘭市文化里民族路338號
TMB0041,宜蘭縣宜蘭市思源里民族路499號,24.748239,121.740443,1.0,1344.0,宜蘭分局,宜蘭縣宜蘭市思源里民族路499號
TMB0042,宜蘭縣宜蘭市文化里復興路二段2-1號,24.7485598,121.7498358,1.0,172.0,宜蘭分局,宜蘭縣宜蘭市文化里復興路二段2-1號
TMB0046,宜蘭縣宜蘭市建軍里復興路3段92號,24.751525,121.739289,1.0,171.0,宜蘭分局,宜蘭縣宜蘭市建軍里復興路3段92號
TMB0047,宜蘭縣宜蘭市民族里民權新路184號,24.7520004,121.7468038,1.0,283.0,宜蘭分局,宜蘭縣宜蘭市民族里民權新路184號
TMB0048,宜蘭縣宜蘭市泰山里泰山路112巷4弄3號,24.7528018,121.7403255,1.0,158.0,宜蘭分局,宜蘭縣宜蘭市泰山里泰山路112巷4弄3號
TMB0049,宜蘭縣宜蘭市建軍里民族路427號,24.749292,121.743044,2.0,2625.0,宜蘭分局,宜蘭縣宜蘭市建軍里民族路427號
TMB0050,宜蘭縣宜蘭市七結里農權路3段77號,24.749636,121.740383,1.0,312.0,宜蘭分局,宜蘭縣宜蘭市七結里農權路3段77號
TMB0051,宜蘭縣宜蘭市文化里民權新路303號,24.7523416,121.7444391,1.0,274.0,宜蘭分局,宜蘭縣宜蘭市文化里民權新路303號
TMB0052,宜蘭縣宜蘭市思源里神農路1段1號,24.7462924,121.7475856,1.0,3034.0,宜蘭分局,宜蘭縣宜蘭市思源里神農路1段1號
TMB0053,宜蘭縣宜蘭市文化里民族路382號,24.7506517,121.7446506,2.0,1919.0,宜蘭分局,宜蘭縣宜蘭市文化里民族路382號
TMB0057,宜蘭縣宜蘭市復興里復興路2段70號,24.749182,121.747916,1.0,89.0,宜蘭分局,宜蘭縣宜蘭市復興里復興路2段70號
TMB0059,宜蘭縣宜蘭市思源里神農路1段1號,24.7462924,121.7475856,1.0,838.0,宜蘭分局,宜蘭縣宜蘭市思源里神農路1段1號
TMB0062,宜蘭縣宜蘭市文化里復興路2段77號,24.7490995,121.7468602,1.0,110.0,宜蘭分局,宜蘭縣宜蘭市文化里復興路2段77號
TMB0063,宜蘭縣宜蘭市復興里女中路2段488號,24.744798,121.7498927,1.0,286.0,宜蘭分局,宜蘭縣宜蘭市復興里女中路2段488號
TMB0064,宜蘭縣宜蘭市復興里神農路1段10號,24.7494076,121.7502597,1.0,111.0,宜蘭分局,宜蘭縣宜蘭市復興里神農路1段10號
TMB0065,宜蘭縣宜蘭市復興里中華路73號,24.7476159,121.7535584,1.0,987.0,宜蘭分局,宜蘭縣宜蘭市復興里中華路73號
TMB0066,宜蘭縣宜蘭市民族里文化路141號,24.7533462,121.7485549,1.0,754.0,宜蘭分局,宜蘭縣宜蘭市民族里文化路141號
TMB0067,宜蘭縣宜蘭市文化里民權新路279號,24.751557,121.744882,1.0,1798.0,宜蘭分局,宜蘭縣宜蘭市文化里民權新路279號
TMB0068,宜蘭縣宜蘭市思源里神農路1段1號,24.7462924,121.7475856,1.0,1825.0,宜蘭分局,宜蘭縣宜蘭市思源里神農路1段1號
TMB0069,宜蘭縣宜蘭市負郭里民權新路262號,24.7525981,121.744372,2.0,9682.0,宜蘭分局,宜蘭縣宜蘭市負郭里民權新路262號
TMB0070,宜蘭縣宜蘭市負郭里泰山路66號,24.7545089,121.7457287,2.0,2081.0,宜蘭分局,宜蘭縣宜蘭市負郭里泰山路66號
TMB0079,宜蘭縣宜蘭市思源里神農路1段1號,24.7461575,121.745816,1.0,2243.0,宜蘭分局,宜蘭縣宜蘭市思源里神農路1段1號
TMB0088,宜蘭縣宜蘭市南門里宜蘭市舊城西路8號,24.7576187,121.7497308,1.0,261.0,宜蘭分局,宜蘭縣宜蘭市南門里宜蘭市舊城西路8號
TMB0093,宜蘭縣宜蘭市復興里女中路二段428號,24.7450438,121.7513227,1.0,238.0,宜蘭分局,宜蘭縣宜蘭市復興里女中路二段428號
TMB0094,宜蘭縣宜蘭市南門里民權路二段10號,24.7537253,121.7509735,4.0,24674.0,宜蘭分局,宜蘭縣宜蘭市南門里民權路二段10號
TMB0095,宜蘭縣宜蘭市負郭里泰山路65號,24.7541078,121.7462674,1.0,1248.0,宜蘭分局,宜蘭縣宜蘭市負郭里泰山路65號
TMB0096,宜蘭縣宜蘭市復興里10鄰農權路191巷5號,24.7462206,121.7510277,1.0,396.0,宜蘭分局,宜蘭縣宜蘭市復興里10鄰農權路191巷5號
TMB0097,宜蘭縣宜蘭市七結里農權路三段79巷15號,24.7493723,121.740232,1.0,1437.0,宜蘭分局,宜蘭縣宜蘭市七結里農權路三段79巷15號
TMB0098,宜蘭縣宜蘭市建軍里農權路三段86巷27號,24.7503599,121.7404303,1.0,1360.0,宜蘭分局,宜蘭縣宜蘭市建軍里農權路三段86巷27號
TMB0099,宜蘭縣宜蘭市民族里民權新路169號,24.7514015,121.7479189,1.0,264.0,宜蘭分局,宜蘭縣宜蘭市民族里民權新路169號
TMB0101,宜蘭縣宜蘭市泰山里民權新路465號,24.7539453,121.7412199,1.0,744.0,宜蘭分局,宜蘭縣宜蘭市泰山里民權新路465號
TMB0102,宜蘭縣宜蘭市文化里文化路100號,24.7501889,121.7483592,1.0,101.0,宜蘭分局,宜蘭縣宜蘭市文化里文化路100號
TMB0103,宜蘭縣宜蘭市文化里復興路2段45號,24.7486381,121.748661,1.0,228.0,宜蘭分局,宜蘭縣宜蘭市文化里復興路2段45號
TMB0104,宜蘭縣宜蘭市民族里民族路143-1號,24.752584,121.7502638,1.0,221.0,宜蘭分局,宜蘭縣宜蘭市民族里民族路143-1號
TMB0105,宜蘭縣宜蘭市思源里農權路3段163巷1號,24.7497351,121.737956,2.0,4072.0,宜蘭分局,宜蘭縣宜蘭市思源里農權路3段163巷1號
TMB0106,宜蘭縣宜蘭市建軍里復興路3段8號,24.7507581,121.7418381,1.0,1935.0,宜蘭分局,宜蘭縣宜蘭市建軍里復興路3段8號
TMB0107,宜蘭縣宜蘭市負郭里泰山路86巷4弄51-3號,24.756515,121.7449319,1.0,318.0,宜蘭分局,宜蘭縣宜蘭市負郭里泰山路86巷4弄51-3號
TMB0109,宜蘭縣宜蘭市思源里民族路463號,24.749319,121.742575,2.0,3571.0,宜蘭分局,宜蘭縣宜蘭市思源里民族路463號
TME0001,宜蘭縣宜蘭市建業里凱旋路500號,24.7388255,121.7585275,2.0,10891.0,宜蘭分局,宜蘭縣宜蘭市建業里凱旋路500號
TME0002,宜蘭縣宜蘭市擺厘里嵐峰路一段6號,24.742692,121.753618,1.0,183.0,宜蘭分局,宜蘭縣宜蘭市擺厘里嵐峰路一段6號
TME0003,宜蘭縣宜蘭市南津里縣政一街5號,24.7285353,121.7651074,2.0,4644.0,宜蘭分局,宜蘭縣宜蘭市南津里縣政一街5號
TME0004,宜蘭縣宜蘭市南津里建蘭北路27巷15號,24.73383,121.761738,1.0,2186.0,宜蘭分局,宜蘭縣宜蘭市南津里建蘭北路27巷15號
TME0005,宜蘭縣宜蘭市南津里建蘭北路27巷8號,24.73383,121.761738,1.0,1505.0,宜蘭分局,宜蘭縣宜蘭市南津里建蘭北路27巷8號
TME0006,宜蘭縣宜蘭市南津里縣政一街45號,24.7279612,121.7659287,2.0,2316.0,宜蘭分局,宜蘭縣宜蘭市南津里縣政一街45號
TME0007,宜蘭縣宜蘭市南津里凱旋路129巷1號,24.7241901,121.7625611,1.0,2518.0,宜蘭分局,宜蘭縣宜蘭市南津里凱旋路129巷1號
TME0008,宜蘭縣宜蘭市南津里凱旋路129巷2號,24.7244708,121.7622028,1.0,2988.0,宜蘭分局,宜蘭縣宜蘭市南津里凱旋路129巷2號
TME0009,宜蘭縣宜蘭市進士里嵐峰路一段197號,24.7421056,121.7508847,1.0,299.0,宜蘭分局,宜蘭縣宜蘭市進士里嵐峰路一段197號
TME0010,宜蘭縣宜蘭市南津里縣政一街25號,24.7279991,121.7659093,2.0,1025.0,宜蘭分局,宜蘭縣宜蘭市南津里縣政一街25號
TME0011,宜蘭縣宜蘭市南津里凱旋路135號,24.7255512,121.7622287,3.0,1281.0,宜蘭分局,宜蘭縣宜蘭市南津里凱旋路135號
TME0012,宜蘭縣宜蘭市建業里縣政西路1號,24.7274678,121.7613725,1.0,2768.0,宜蘭分局,宜蘭縣宜蘭市建業里縣政西路1號
TME0013,宜蘭縣宜蘭市建業里縣政七街50巷1號,24.7260003,121.7573169,1.0,631.0,宜蘭分局,宜蘭縣宜蘭市建業里縣政七街50巷1號
TME0014,宜蘭縣宜蘭市建業里縣政西路81號,24.7269028,121.7595127,1.0,473.0,宜蘭分局,宜蘭縣宜蘭市建業里縣政西路81號
TME0015,宜蘭縣宜蘭市擺厘里自強路163號,24.7427519,121.7498735,1.0,1001.0,宜蘭分局,宜蘭縣宜蘭市擺厘里自強路163號
TME0016,宜蘭縣宜蘭市擺厘里嵐峰路一段134號,24.7424295,121.7521657,1.0,420.0,宜蘭分局,宜蘭縣宜蘭市擺厘里嵐峰路一段134號
TME0017,宜蘭縣宜蘭市擺厘里自強路147號,24.7427502,121.7501618,1.0,579.0,宜蘭分局,宜蘭縣宜蘭市擺厘里自強路147號
TME0019,宜蘭縣宜蘭市擺厘里嵐峰路1段120號 ,24.7424008,121.7513142,1.0,855.0,宜蘭分局,宜蘭縣宜蘭市擺厘里嵐峰路1段120號 
TME0021,宜蘭縣宜蘭市擺厘里自強路131號,24.7428053,121.7510025,1.0,681.0,宜蘭分局,宜蘭縣宜蘭市擺厘里自強路131號
TME0022,宜蘭縣宜蘭市擺厘里自強路116號,24.7431861,121.7495592,2.0,676.0,宜蘭分局,宜蘭縣宜蘭市擺厘里自強路116號
TME0023,宜蘭縣宜蘭市擺厘里進士路70號,24.7437274,121.7479706,1.0,748.0,宜蘭分局,宜蘭縣宜蘭市擺厘里進士路70號
TME0024,宜蘭縣宜蘭市擺厘里女中路二段501號,24.7445762,121.7493636,1.0,525.0,宜蘭分局,宜蘭縣宜蘭市擺厘里女中路二段501號
TME0025,宜蘭縣宜蘭市擺厘里女中路二段455號,24.7445681,121.75117,2.0,2127.0,宜蘭分局,宜蘭縣宜蘭市擺厘里女中路二段455號
TME0029,宜蘭縣宜蘭市擺厘里女中路二段491巷2號,24.7441029,121.7494715,2.0,1012.0,宜蘭分局,宜蘭縣宜蘭市擺厘里女中路二段491巷2號
TME0030,宜蘭縣宜蘭市進士里女中路三段209號,24.745077,121.742359,1.0,1324.0,宜蘭分局,宜蘭縣宜蘭市進士里女中路三段209號
TME0031,宜蘭縣宜蘭市進士里嵐峰路二段14號,24.7421712,121.7463234,1.0,290.0,宜蘭分局,宜蘭縣宜蘭市進士里嵐峰路二段14號
TME0033,宜蘭縣宜蘭市進士里女中路三段123號,24.7448609,121.7448055,1.0,302.0,宜蘭分局,宜蘭縣宜蘭市進士里女中路三段123號
TME0034,宜蘭縣宜蘭市進士里女中路三段49號,24.7447818,121.7464903,1.0,746.0,宜蘭分局,宜蘭縣宜蘭市進士里女中路三段49號
TME0035,宜蘭縣宜蘭市進士里進士路171號,24.7443745,121.7480169,1.0,840.0,宜蘭分局,宜蘭縣宜蘭市進士里進士路171號
