類別,電腦編號,村里別,地址,地下樓層數,可容納人數,派出所,備註,經度,緯度
公寓,D506000001,東山里,新北市汐止區汐平路二段63巷1號51,1,4769.0,東山派出所,,121.700144,25.060602
公寓,D507000001,長青里,新北市汐止區長青路214巷1號,1,278.0,長青派出所,,121.605734,25.113705
公寓,D507000002,長青里,新北市汐止區永春二路2號,1,362.0,長青派出所,,121.602929,25.112184
大樓,D507000003,長青里,新北市汐止區永春二路5號,1,2569.0,長青派出所,,121.602929,25.112184
大樓,D501000220,新昌里,新北市汐止區新昌里忠孝東路258巷16弄8號,1,300.0,汐止派出所,,121.6634822,25.06729897
大樓,D504000286,厚德里,新北市汐止區厚德里樟樹二路167號,1、2,614.0,社后派出所,,121.6406565,25.06815235
大樓,D504000287,樟樹里,新北市汐止區樟樹里中興路43號,3,10674.0,社后派出所,,121.6341439,25.06257593
大樓,D504000289,山光里,新北市汐止區山光里樟樹二路356號,1,3097.0,社后派出所,,121.6444309,25.07481114
大樓,D504000285,厚德里,新北市汐止區厚德里樟樹二路161號,1,238.0,社后派出所,,121.6406362,25.06806697
大樓,D504000290,環河里,新北市汐止區環河里環河街128號,2,2231.0,社后派出所,,121.6292655,25.05935906
大樓,D502000080,保新里,新北市汐止區保新里保長路431號,2,5448.0,長安派出所,,121.6831614,25.07323252
大樓,D504000288,中興里,新北市汐止區中興里福德二路288號,1,1274.0,社后派出所,,121.626818,25.06479987
大樓,D504000291,厚德里,新北市汐止區厚德里樟樹一路252巷3號,1,788.0,社后派出所,,121.6427377,25.06734409
大樓,D504000292,福德里,新北市汐止區福德里福德一路188號,1,3010.0,社后派出所,,121.6353261,25.06600781
大樓,D501000221,秀山里,新北市汐止區秀山里仁愛路106巷2號,3、4,2260.0,汐止派出所,,121.6625384,25.06341724
大樓,D504000293,中興里,新北市汐止區中興里福德一路342號,2,4352.0,社后派出所,,121.6299207,25.06264607
大樓,D502000081,長安里,新北市汐止區長安里長興街一段53號,1,376.0,長安派出所,,121.6703829,25.0795783
大樓,D504000294,金龍里,新北市汐止區金龍里康寧街459巷10號,1,1805.0,社后派出所,,121.6313775,25.06919418
大樓,D502000082,保新里,新北市汐止區保新里2鄰保長路427號,2,5488.0,長安派出所,,121.6832686,25.07328111
大樓,D501000222,新昌里,新北市汐止區新昌里35鄰仁愛路329號,3,1645.0,汐止派出所,,121.6640153,25.06828316
大樓,D501000223,橋東里,新北市汐止區橋東里20鄰忠孝東路506號,2,1863.0,汐止派出所,,121.6665809,25.07518926
大樓,D504000295,興福里,新北市汐止區興福里16鄰福德一路176巷16號,1,534.0,社后派出所,,121.6353233,25.06672487
大樓,D501000224,橋東里,新北市汐止區橋東里14鄰忠孝東路496號,2,2238.0,汐止派出所,,121.6665215,25.07437186
大樓,D501000225,禮門里,新北市汐止區禮門里10鄰中正路281號,1,418.0,汐止派出所,,121.6566373,25.06835316
大樓,D504000296,康福里,新北市汐止區康福里22鄰福德一路87-1號,2,1126.0,社后派出所,,121.6382477,25.06855507
