類別,建築物名稱,電腦編號,村里別,地址,"地下樓 層數","可容納 人數",派出所,備註,經度,緯度
大樓,帝寶花園,D501000165,福安里,新北市汐止區福安里仁愛路152巷11號,1,1328.0,汐止派出所,,121.6641,25.064674
公寓,貝克漢社區,D501000166,復興里,新北市汐止區復興里復興路1號,1,1119.0,汐止派出所,,121.6562,25.06413
大樓,東方帝寶社區,D501000167,福安里,新北市汐止區福安里仁愛路185號,1,2245.0,汐止派出所,,121.6643,25.065418
大樓,綠意東台北,D501000168,自強里,新北市汐止區自強里莊敬街30號,1,625.0,汐止派出所,,121.6571,25.061525
公寓,站前晝隄B,D501000169,橋東里,新北市汐止區橋東里鄉長路1段55巷5號,1,229.0,汐止派出所,,121.6656,25.075943
大樓,站前晝隄A,D501000170,橋東里,新北市汐止區橋東里鄉長路1段55巷7號,1,415.0,汐止派出所,,121.6654,25.076017
大樓,新幹線社區,D501000171,復興里,新北市汐止區復興里龍安路202巷39號2,1,338.0,汐止派出所,,121.6522,25.063621
大樓,遠東科技公司,D501000172,智慧里,新北市汐止區智慧里大同路2段167號1,1,110.0,汐止派出所,,121.6511,25.064139
大樓,汐止國中,D501000173,禮門里,新北市汐止區禮門里大同路2段394號,1,1740.0,汐止派出所,,121.6398,25.059725
大樓,國家交響樂社區B,D501000175,福安里,新北市汐止區福安里仁愛路159號,1,2047.0,汐止派出所,,121.6637,25.065066
大樓,汐緻社區,D501000176,橋東里,新北市汐止區橋東里忠孝東路480號,1,285.0,汐止派出所,,121.6662,25.073511
大樓,綠意青禾大廈,D501000177,自強里,新北市汐止區自強里莊敬街29巷11號2,1,350.0,汐止派出所,,121.6572,25.060891
大樓,合康京站社區,D501000178,自強里,新北市汐止區自強里莊敬街29巷9弄1號2,1,310.0,汐止派出所,,121.6575,25.061048
大樓,璞緻社區,D501000179,文化里,新北市汐止區文化里水源路1段291巷1號,1,722.0,汐止派出所,,121.6544,25.058398
大樓,大樓,D501000180,自強里,新北市汐止區自強里莊敬街29巷16號,1,112.0,汐止派出所,,121.6572,25.060307
大樓,合康東極社區,D501000181,自強里,新北市汐止區自強里新興路106號,1,2014.0,汐止派出所,,121.6581,25.060853
大樓,東別館,D501000182,文化里,新北市汐止區文化里汐碇16-1巷1號,2,1615.0,汐止派出所,,121.6527,25.058342
大樓,米蘭社區,D501000183,信望里,新北市汐止區信望里大同2段508號,1,313.0,汐止派出所,,121.631,25.054991
大樓,甲山林天廈,D501000184,智慧里,新北市汐止區智慧里大同2段231號,1,3863.0,汐止派出所,,121.6535,25.065355
大樓,大樓,D501000185,城中里,新北市汐止區城中里大同2段653號,1,141.0,汐止派出所,,121.6647,25.071642
大樓,早安清境社區,D501000186,文化里,新北市汐止區文化里南興62號,4,2504.0,汐止派出所,,121.6523,25.05926
大樓,禾乾建設公司,D501000187,白雲里,新北市汐止區白雲里水源2段283巷1之1號,1,157.0,汐止派出所,,121.6606,25.049822
大樓,大樓,D501000188,信望里,新北市汐止區信望里大同路2段551巷2號,1,285.0,汐止派出所,,121.6624,25.069968
大樓,一翔如意大廈,D501000189,新昌里,新北市汐止區新昌里新台五路2段77號,3,478.0,汐止派出所,,121.6641,25.066832
大樓,大樓,D501000190,大同里,新北市汐止區大同里大同2段184巷1-1號,1,128.0,汐止派出所,,121.6537,25.063524
大樓,寰宇首席大廈,D501000191,大同里,新北市汐止區大同里大同2段226號,1,990.0,汐止派出所,,121.6538,25.065323
大樓,大樓,D501000192,城中里,新北市汐止區城中里建成路23巷32號,1,134.0,汐止派出所,,121.6642,25.071887
大樓,遠雄百貨,D501000193,復興里,新北市汐止區復興里新台五路1段99號,1,21540.0,汐止派出所,,121.6482,25.06162
大樓,雲天綠第,D501000194,秀峰里,新北市汐止區秀峰里新台五路1段270號,2,521.0,汐止派出所,,121.6591,25.064409
大樓,蘭亭序大廈,D501000195,江北里,新北市汐止區江北里汐萬路1段193號,1,1094.0,汐止派出所,,121.6524,25.071691
大樓,大樓,D501000196,復興里,新北市汐止區復興里新台五路1段137號,1,534.0,汐止派出所,,121.6528,25.062118
大樓,汐止分局,D501000197,義民里,新北市汐止區義民里大同路2段459號,1,1117.0,汐止派出所,,,
大樓,名城社區,D501000198,新昌里,新北市汐止區新昌里新昌路37號,1,998.0,汐止派出所,,121.6624,25.068113
大樓,矽科國際大樓,D501000199,文化里,新北市汐止區文化里南興路58號,1,479.0,汐止派出所,,121.6526,25.059556
大樓,國揚雲端科技中心,D501000200,文化里,新北市汐止區文化里南興路51號,3,2521.0,汐止派出所,,121.6525,25.060629
大樓,大樓,D501000201,文化里,新北市汐止區文化里南興81號,1,123.0,汐止派出所,,121.6529,25.059278
公寓,綠意皇邑社區,D501000202,橋東里,新北市汐止區橋東里忠孝東路490號,3,895.0,汐止派出所,,121.6664,25.074072
公寓,恆美學社區,D501000203,文化里,新北市汐止區文化里南興96號,1,107.0,汐止派出所,,121.6533,25.058689
大樓,康郡社區,D501000204,秀山里,新北市汐止區秀山里仁愛路106巷23號,1,431.0,汐止派出所,,121.6628,25.063
公寓,香帥蛋糕公司,D501000205,江北里,新北市汐止區江北里汐萬路1段211巷26號,1,228.0,汐止派出所,,121.6511,25.071759
大樓,春田吉事社區,D501000206,仁德里,新北市汐止區仁德里中正路36號,1,345.0,汐止派出所,,121.6623,25.070319
大樓,北歐情社區,D501000207,禮門里,新北市汐止區禮門里中正路296號,1,341.0,汐止派出所,,121.6566,25.068325
大樓,麗園社區,D501000208,禮門里,新北市汐止區禮門里大同路2段446號,1,452.0,汐止派出所,,121.6596,25.067273
大樓,合康雲極社區,D501000209,自強里,新北市汐止區自強里新興路121號,1,3482.0,汐止派出所,,121.6583,25.061097
大樓,閱泰然社區,D501000210,自強里,新北市汐止區自強里水源路1段168巷6號,1,437.0,汐止派出所,,121.6552,25.06225
大樓,品美學社區,D501000211,文化里,新北市汐止區文化里南興路89號,1,344.0,汐止派出所,,121.6532,25.058851
大樓,翠御社區,D501000212,文化里,新北市汐止區文化里汐碇1號,2,770.0,汐止派出所,,121.6535,25.058611
大樓,汐寶之星,D501000213,秀峰里,新北市汐止區秀峰里仁愛路43號,1,168.0,汐止派出所,,121.6597,25.063375
大樓,大同硯,D501000214,仁德里,新北市汐止區仁德里和平街5號,1,184.0,汐止派出所,,121.6633,25.070638
大樓,仁愛綠多B區,D501000215,福安里,新北市汐止區福安里仁愛路162號6,1,945.0,汐止派出所,,121.6647,25.064778
大樓,聖方濟天主堂,D501000216,城中里,新北市汐止區城中里大同路2段637號,1,698.0,汐止派出所,,121.6643,25.07141
大樓,忠孝大院,D501000217,橋東里,新北市汐止區橋東里忠孝東路415號,1,972.0,汐止派出所,,121.6658,25.071393
大樓,敦美苑,D501000218,福安里,新北市汐止區福安里仁愛路152巷45號,1,1206.0,汐止派出所,,121.6652,25.063531
大樓,大樓,D501000220,新昌里,新北市汐止區新昌里忠孝東路258巷16弄8號,1,156.0,汐止派出所,,121.6635,25.067299
大樓,優陞學,D501000221,秀山里,新北市汐止區秀山里仁愛路106巷2號,3、4,1177.0,汐止派出所,,121.6625,25.063417
大樓,萬達一品,D501000222,新昌里,新北市汐止區新昌里35鄰仁愛路329號,3,857.0,汐止派出所,,121.664,25.068283
大樓,忠孝誠藝,D501000223,橋東里,新北市汐止區橋東里20鄰忠孝東路506號,2,970.0,汐止派出所,,121.6666,25.075189
大樓,君勻社區,D501000224,橋東里,新北市汐止區橋東里14鄰忠孝東路496號,2,1165.0,汐止派出所,,121.6665,25.074372
大樓,兆鼎建設,D501000225,禮門里,新北市汐止區禮門里10鄰中正路281號,1,217.0,汐止派出所,,121.6566,25.068353
大樓,鉌田建設公司,D501000226,大同里,新北市汐止區大同里22鄰大同路2段184巷1之6號,1,368.0,汐止派出所,,121.6534,25.064571
大樓,大樓,D501000227,白雲里,新北市汐止區白雲里水源路2段125巷8弄1號,1,5829.0,汐止派出所,,121.6602,25.056821
大樓,大樓,D501000228,江北里,新北市汐止區江北里10鄰汐萬路1段168號2樓,1,221.0,汐止派出所,,121.653,25.071
大樓,江山萬里社區,D502000001,崇德里,新北市汐止區崇德里新台五路2段170號,3,2343.0,長安派出所,,121.6629,25.06703
公寓,公寓,D502000002,保長里,新北市汐止區保長里保一街9巷14號,4,135.0,長安派出所,,121.6744,25.081079
公寓,公寓,D502000003,保長里,新北市汐止區保長里保一街9巷8弄15號,1,763.0,長安派出所,,121.6741,25.080489
公寓,公寓,D502000004,保長里,新北市汐止區保長里長興街2段4巷11-23號,1,140.0,長安派出所,,121.6722,25.080174
大樓,大樓,D502000005,保長里,新北市汐止區保長里保一街35巷4號,2,661.0,長安派出所,,121.6748,25.080515
大樓,大樓,D502000006,保長里,新北市汐止區保長里保一街9巷8弄2號,1,214.0,長安派出所,,121.6739,25.080982
公寓,台北新天地A區,D502000007,保長里,新北市汐止區保長里保一街9巷19號,1,909.0,長安派出所,,121.6743,25.081179
大樓,大樓,D502000008,茄苳里,新北市汐止區茄苳里茄苳路267號,1,30.0,長安派出所,,121.6722,25.06818
大樓,大樓,D502000009,茄苳里,新北市汐止區茄苳里茄苳路269號,1,60.0,長安派出所,,121.6723,25.068161
大樓,大樓,D502000012,茄苳里,新北市汐止區茄苳里茄苳路274號27,1,268.0,長安派出所,,121.6718,25.06918
大樓,大樓,D502000013,茄苳里,新北市汐止區茄苳里茄苳路256號,1,147.0,長安派出所,,121.6717,25.068244
大樓,大樓,D502000014,茄苳里,新北市汐止區茄苳里茄苳路241號24,1,118.0,長安派出所,,121.6709,25.069875
公寓,龍璽大廈,D502000015,保安里,新北市汐止區保安里大同路3段392號39,1,1474.0,長安派出所,,121.6549,25.065146
大樓,天池社區,D502000017,鄉長里,新北市汐止區鄉長里鄉長路8號,1,2180.0,長安派出所,,121.6689,25.080824
大樓,摩登生活社區,D502000018,鄉長里,新北市汐止區鄉長里吉祥街11巷5-15號,2,786.0,長安派出所,,121.6673,25.080366
大樓,大樓,D502000019,鄉長里,新北市汐止區鄉長里長江街239號25,3,3698.0,長安派出所,,121.6625,25.079673
公寓,電器檢驗科技大樓,D502000020,崇德里,新北市汐止區崇德里茄苳路157號,1,1586.0,長安派出所,,121.6697,25.069764
大樓,大樓,D502000021,崇德里,新北市汐止區崇德里茄苳路90號,1,95.0,長安派出所,,121.6728,25.067483
公寓,公寓,D502000022,崇德里,新北市汐止區崇德里招商街21號,1,1529.0,長安派出所,,121.6669,25.068348
公寓,公寓,D502000024,茄苳里,新北市汐止區茄苳里忠孝東路382巷1弄14號,1,274.0,長安派出所,,121.6661,25.070225
大樓,大樓,D502000025,崇德里,新北市汐止區崇德里茄苳路66號之1,1,121.0,長安派出所,,121.6702,25.068638
大樓,大樓,D502000026,崇德里,新北市汐止區崇德里招商街11巷1號,1,708.0,長安派出所,,121.6666,25.068833
大樓,大樓,D502000027,崇德里,新北市汐止區崇德里中華街49號,2,329.0,長安派出所,,121.6676,25.071672
大樓,大樓,D502000028,崇德里,新北市汐止區崇德里茄苳路84號,1,368.0,長安派出所,,121.6724,25.067815
大樓,大樓,D502000029,保安里,新北市汐止區保安里汐平路1段28號,1,240.0,長安派出所,,121.682,25.070571
公寓,元康精神護理之家,D502000030,保安里,新北市汐止區保安里大同路3段369巷26號,1,1406.0,長安派出所,,121.6767,25.073561
公寓,公寓,D502000034,茄苳里,新北市汐止區茄苳里茄興街1號,1,296.0,長安派出所,,121.6733,25.067722
公寓,公寓,D502000035,茄苳里,新北市汐止區茄苳里茄安路16號,1,296.0,長安派出所,,121.6732,25.067884
大樓,大樓,D502000036,茄苳里,新北市汐止區茄苳里新台五路2段246號25,3,3290.0,長安派出所,,121.6747,25.065287
公寓,公寓,D502000037,保安里,新北市汐止區保安里大安街52巷4號10,1,1925.0,長安派出所,,121.6786,25.073083
公寓,公寓,D502000038,保長里,新北市汐止區保長里保長路35巷40號,1,124.0,長安派出所,,121.6738,25.080226
大樓,大樓,D502000039,茄苳里,新北市汐止區茄苳里茄苳路262號27,1,247.0,長安派出所,,121.6718,25.06918
公寓,TOYOTA保養廠,D502000040,長安里,新北市汐止區長安里大同路3段110號,1,93.0,長安派出所,,121.671,25.077029
大樓,安敦凱旋社區,D502000041,長安里,新北市汐止區長安里大同路3段66號,3,940.0,長安派出所,,121.6678,25.077034
大樓,大樓,D502000043,保長里,新北市汐止區保長里保一街25巷1號,2,777.0,長安派出所,,121.6742,25.080379
公寓,保長國小,D502000044,保安里,新北市汐止區保安里大同路3段553號,1,146.0,長安派出所,,121.6812,25.071863
大樓,茄冬華城,D502000045,崇德里,新北市汐止區崇德里茄苳路83號,2,4032.0,長安派出所,,121.6702,25.069573
大樓,大樓,D502000046,茄苳里,新北市汐止區茄苳里茄苳路259號,1,132.0,長安派出所,,121.672,25.068275
大樓,大樓,D502000048,保新里,新北市汐止區保新里大同路3段609號,4,965.0,長安派出所,,121.683,25.074505
大樓,大樓,D502000049,保新里,新北市汐止區保新里大同路3段611號,5,3154.0,長安派出所,,121.683,25.075195
大樓,青松市社區,D502000050,保長里,新北市汐止區保長里保一街49號,2,238.0,長安派出所,,121.6744,25.079921
大樓,大樓,D502000051,長安里,新北市汐止區長安里長興街1段16號,1,73.0,長安派出所,,121.6697,25.078851
大樓,茄苳之祿,D502000052,茄苳里,新北市汐止區茄苳里茄苳路206號,2,1839.0,長安派出所,,121.6703,25.068608
大樓,大樓,D502000053,保長里,新北市汐止區保長里保一街39號,2,616.0,長安派出所,,121.6742,25.080172
公寓,公寓,D502000054,長安里,新北市汐止區長安里長興街80號,1,248.0,長安派出所,,121.6707,25.079384
公寓,公寓,D502000055,長安里,新北市汐止區長安里長安路179號,1,364.0,長安派出所,,121.6719,25.077299
公寓,公寓,D502000056,長安里,新北市汐止區長安里長興街50號,1,129.0,長安派出所,,121.6706,25.079097
公寓,崇德國小,D502000057,崇德里,新北市汐止區崇德里茄苳路158號,1,358.0,長安派出所,,121.669,25.069433
公寓,公寓,D502000058,茄苳里,新北市汐止區茄苳里茄苳路225巷11弄18號,1,134.0,長安派出所,,121.671,25.069787
大樓,活力DOUBLE01,D502000059,茄苳里,新北市汐止區茄苳里新台五路2段242號,3,159.0,長安派出所,,121.6723,25.065749
大樓,活力DOUBLE02,D502000061,茄苳里,新北市汐止區茄苳里新台五路2段240號,4,290.0,長安派出所,,121.6722,25.065982
大樓,翠堤花園,D502000062,保長里,新北市汐止區保長里長興街2段50巷43號,2,1095.0,長安派出所,,121.6752,25.080988
大樓,微風小鎮,D502000063,保長里,新北市汐止區保長里保一街105號,4,1115.0,長安派出所,,121.675,25.080275
大樓,觀止社區,D502000064,崇德里,新北市汐止區崇德里茄苳路130號,5,1586.0,長安派出所,,121.6711,25.068586
大樓,森泉灣社區,D502000065,保長里,新北市汐止區保長里保長路102號,3,1989.0,長安派出所,,121.6748,25.078553
大樓,森泉灣社區,D502000066,保長里,新北市汐止區保長里保長路83號2,3,1211.0,長安派出所,,121.6747,25.07857
大樓,富美堂,D502000067,保安里,新北市汐止區保安里汐平路1段8號,3,331.0,長安派出所,,121.6808,25.070952
大樓,初韻社區,D502000068,保長里,新北市汐止區保長里保一街1號,2,167.0,長安派出所,,121.6737,25.081589
大樓,寶藏社區,D502000069,保長里,新北市汐止區保長里保長51巷18號,3,326.0,長安派出所,,121.6742,25.07889
大樓,大樓,D502000070,保長里,新北市汐止區保長里長興街2段60號,3,317.0,長安派出所,,121.6746,25.081794
大樓,合謙好境美境社區,D502000071,保長里,新北市汐止區保長里長興街2段56號3,3,705.0,長安派出所,,121.6744,25.081865
大樓,合謙富境社區,D502000072,保長里,新北市汐止區保長里長興街2段62號,3,531.0,長安派出所,,121.6746,25.081916
大樓,大樓,D502000073,長安里,新北市汐止區長安里長興街1段29號,2,211.0,長安派出所,,121.6698,25.079051
大樓,大樓,D502000074,保長里,新北市汐止區保長里保長路53號,3,499.0,長安派出所,,121.6736,25.078817
大樓,富貴名邸,D502000075,保安里,新北市汐止區保安里汐平路1段18號,3,211.0,長安派出所,,121.6814,25.070711
大樓,大樓,D502000076,茄苳里,新北市汐止區茄苳里茄苳路286號,2,206.0,長安派出所,,121.6724,25.067784
大樓,大樓,D502000077,保新里,新北市汐止區保新里保長路422號,2,1200.0,長安派出所,,121.6841,25.072236
大樓,大樓,D502000078,保新里,新北市汐止區保新里保長路428號,2,1190.0,長安派出所,,121.6843,25.072144
大樓,大樓,D502000079,長安里,新北市汐止區長安里忠孝東路520號,1,352.0,長安派出所,,121.6673,25.076212
大樓,大樓,D502000080,保新里,新北市汐止區保新里保長路431號,2,2837.0,長安派出所,,121.6832,25.073233
大樓,長安居,D502000081,長安里,新北市汐止區長安里長興街一段53號,1,195.0,長安派出所,,121.6704,25.079578
大樓,聯合科技中心A棟,D502000082,保新里,新北市汐止區保新里2鄰保長路427號,2,2858.0,長安派出所,,121.6833,25.073281
公寓,公寓,D502000083,保新里,新北市汐止區保新里2鄰保長路475號,1,3136.0,長安派出所,,121.6868,25.070717
大樓,大樓,D502000084,保長里,新北市汐止區保長里007鄰保一街9巷2號,1,101.0,長安派出所,,121.6738,25.081142
大樓,大樓,D502000085,茄苳里,新北市汐止區茄苳里24鄰新台五路2段238巷80號,1、2,1229.0,長安派出所,112,,
大樓,樺瑩科技股份有限公司,D502000086,長安里,新北市汐止區長安里14鄰大同路3段148號,1,805.0,長安派出所,,121.673,25.076183
公寓,山林溪社區,D503000002,烘內里,新北市汐止區烘內里汐萬路3段252巷7號,1,468.0,烘內派出所,,121.6441,25.104776
大樓,瑞松山莊,D503000003,烘內里,新北市汐止區烘內里瑞松街150巷20號,1,1037.0,烘內派出所,,121.6477,25.108986
大樓,雙璽帝寶社區,D503000004,拱北里,新北市汐止區拱北里汐萬路2段228巷31弄1號,1,1880.0,烘內派出所,,121.6475,25.091176
大樓,青山綠築社區,D503000005,拱北里,新北市汐止區拱北里汐萬路2段228巷18弄11號,1,2290.0,烘內派出所,,121.6491,25.090149
大樓,金龍特區社區,D503000006,拱北里,新北市汐止區拱北里汐萬路2段228巷31弄13號,1,1804.0,烘內派出所,,121.6472,25.091452
大樓,金龍特區社區,D503000007,拱北里,新北市汐止區拱北里汐萬路2段228巷31弄58號,1,3894.0,烘內派出所,,121.647,25.091969
公寓,伊頓飛瑞慕品公司,D503000008,拱北里,新北市汐止區拱北里汐萬路2段114號,1,709.0,烘內派出所,,121.6483,25.084841
大樓,金龍特區社區,D503000009,拱北里,新北市汐止區拱北里汐萬路2段228巷31弄10號,1,1226.0,烘內派出所,,121.6479,25.091291
大樓,金龍特區社區,D503000010,拱北里,新北市汐止區拱北里汐萬路2段228巷31弄5號,1,3139.0,烘內派出所,,121.6471,25.091652
大樓,金龍特區社區,D503000011,拱北里,新北市汐止區拱北里汐萬路2段228巷31弄141號,1,3744.0,烘內派出所,,121.6466,25.091933
公寓,北港國小,D503000013,拱北里,新北市汐止區拱北里汐萬路2段279號,1,154.0,烘內派出所,,121.6451,25.089142
公寓,基泰都鐸薔薇大廈,D503000014,烘內里,新北市汐止區烘內里汐萬路3段217巷1號,1,1883.0,烘內派出所,,121.6435,25.103184
大樓,雅典王朝C社區,D504000001,北山里,新北市汐止區北山里康寧街309號,3,686.0,社后派出所,,121.6273,25.067531
大樓,雅典王朝B社區,D504000002,北山里,新北市汐止區北山里康寧街301號,3,1768.0,社后派出所,,121.6267,25.067429
大樓,大樓,D504000003,北山里,新北市汐止區北山里明峰街29號,2,250.0,社后派出所,,121.6341,25.071336
大樓,大樓,D504000004,湖光里,新北市汐止區湖光里康寧街505號,2,210.0,社后派出所,,121.6329,25.068637
大樓,桃李天廈,D504000005,厚德里,新北市汐止區厚德里樟樹一路222號,2,543.0,社后派出所,,121.6424,25.066398
大樓,大湖翠亨村B區,D504000006,北山里,新北市汐止區北山里康寧街61巷25弄1號,2,803.0,社后派出所,,121.6192,25.067582
大樓,大湖翠亨村A區,D504000007,北山里,新北市汐止區北山里康寧街61巷51號,2,845.0,社后派出所,,121.6199,25.06771
大樓,東方巴黎社區,D504000008,福德里,新北市汐止區福德里福德一路201巷1號,3,4189.0,社后派出所,,121.6356,25.065498
大樓,大樓,D504000009,北山里,新北市汐止區北山里康寧街332號,2,801.0,社后派出所,,121.6276,25.067372
公寓,公寓,D504000010,湖光里,新北市汐止區湖光里明峰街12號之7,1,250.0,社后派出所,,121.6351,25.071528
大樓,大樓,D504000011,湖光里,新北市汐止區湖光里明峰街15號,1,78.0,社后派出所,,121.6348,25.071398
公寓,公寓,D504000012,北山里,新北市汐止區北山里明峰街297巷5弄1號,1,167.0,社后派出所,,121.6258,25.067614
公寓,公寓,D504000013,北山里,新北市汐止區北山里康寧街304號,1,218.0,社后派出所,,121.6263,25.067142
大樓,東方皇第,D504000014,中興里,新北市汐止區中興里福德二路181巷165號,2,766.0,社后派出所,,121.6305,25.064879
公寓,公寓,D504000015,樟樹里,新北市汐止區樟樹里中興路72號,1,179.0,社后派出所,,121.6352,25.061699
大樓,雅典王朝A社區,D504000016,北山里,新北市汐止區北山里明峰街307弄283號,2,2459.0,社后派出所,,121.6264,25.068364
公寓,生活大國,D504000017,康福里,新北市汐止區康福里福德一路83號,1,194.0,社后派出所,,121.6357,25.065865
公寓,公寓,D504000018,湖光里,新北市汐止區湖光里民族一街19號,1,67.0,社后派出所,,121.6341,25.070804
公寓,凱歌世界,D504000019,山光里,新北市汐止區山光里樟樹二路325號,2,1083.0,社后派出所,,121.6413,25.070212
大樓,大湖國家三期社區,D504000020,北山里,新北市汐止區北山里康寧街133號,2,1229.0,社后派出所,,121.621,25.066652
大樓,中興大道,D504000021,樟樹里,新北市汐止區樟樹里中興路96巷2號,2,1631.0,社后派出所,,121.6351,25.062397
大樓,大樓,D504000022,湖光里,新北市汐止區湖光里康寧街589號,2,589.0,社后派出所,,121.6351,25.070199
大樓,康寧郡社區,D504000023,北山里,新北市汐止區北山里康寧街281號,2,876.0,社后派出所,,121.6261,25.067256
公寓,公寓,D504000024,樟樹里,新北市汐止區樟樹里大同路一段336號,1,31.0,社后派出所,,121.6379,25.058901
公寓,公寓,D504000025,湖光里,新北市汐止區湖光里明峰街20號,1,147.0,社后派出所,,121.6346,25.071559
公寓,公寓,D504000026,湖光里,新北市汐止區湖光里明峰街28號,1,133.0,社后派出所,,121.6341,25.07151
大樓,情趣家社區,D504000027,興福里,新北市汐止區興福里福德一路152號,2,656.0,社后派出所,,121.6365,25.066827
大樓,康寧科技園區,D504000028,北山里,新北市汐止區北山里康寧街147號,2,1871.0,社后派出所,,121.6218,25.067162
公寓,公寓,D504000029,北峰里,新北市汐止區北峰里明峰街190號,1,462.0,社后派出所,,121.6281,25.069749
大樓,生產力大樓,D504000030,環河里,新北市汐止區環河里福德一路381巷25號,2,526.0,社后派出所,,121.6288,25.059762
公寓,人情味小鎮B區,D504000031,康福里,新北市汐止區康福里福德一路1號,1,126.0,社后派出所,,121.6357,25.066024
公寓,財團法人生物技術開發中心(A),D504000032,北山里,新北市汐止區北山里康寧街169巷101號,2,388.0,社后派出所,,121.6227,25.070097
大樓,經緯大樓,D504000033,樟樹里,新北市汐止區樟樹里大同路一段175號,3,2411.0,社后派出所,,121.6329,25.056973
大樓,北峰國小,D504000034,中興里,新北市汐止區中興里環河街1號,1,331.0,社后派出所,,121.6294,25.059377
公寓,濱湖雅士A社區,D504000035,金龍里,新北市汐止區金龍里湖前街77巷5弄2號,1,201.0,社后派出所,,121.6312,25.070272
公寓,公寓,D504000036,湖光里,新北市汐止區湖光里明峰街4號,1,112.0,社后派出所,,121.6356,25.071257
大樓,大樓,D504000037,湖光里,新北市汐止區湖光里明峰街84號,2,342.0,社后派出所,,121.6314,25.071221
公寓,公寓,D504000038,北山里,新北市汐止區北山里明峰293號之29,1,104.0,社后派出所,,121.6256,25.067407
大樓,新生大樓,D504000039,樟樹里,新北市汐止區樟樹里中興路86號,2,820.0,社后派出所,,121.6349,25.06207
大樓,陳光青年城,D504000040,興福里,新北市汐止區興福里福德二路18號,2,421.0,社后派出所,,121.635,25.068129
公寓,公寓,D504000041,中興里,新北市汐止區中興里福德一路233號,1,129.0,社后派出所,,121.6341,25.064851
大樓,楊桄有限公司,D504000042,環河里,新北市汐止區環河里南陽街117號,1,208.0,社后派出所,,121.6242,25.060705
公寓,公寓,D504000043,樟樹里,新北市汐止區樟樹里大同路1段235號,1,47.0,社后派出所,,121.6348,25.057974
大樓,大樓,D504000044,忠孝里,新北市汐止區忠孝里樟樹一路126號,2,620.0,社后派出所,,121.6422,25.064416
大樓,東之星大廈,D504000045,中興里,新北市汐止區中興里中興路150巷11號,2,567.0,社后派出所,,121.6328,25.064898
公寓,公寓,D504000046,福德里,新北市汐止區福德里福德一路179號,1,84.0,社后派出所,,121.6358,25.065945
公寓,百吉鮮花店,D504000047,福德里,新北市汐止區福德里福德路一段183號,1,75.0,社后派出所,,121.6357,25.065865
