類別,建築物名稱,電腦編號,村里別,地址,地下樓層數,可容納人數,派出所,備註,經度,緯度
大樓,山林海社區,D807000042,八勢里,新北市淡水區八勢里中正東路二段71-1號,1.0,761.0,竹圍派出所,,121.459832,25.154412
大樓,麗園社區,D807000044,福德里,新北市淡水區福德里自強路182號,2.0,388.0,竹圍派出所,,121.466248,25.133666
大樓,台北山水社區,D807000046,竹圍里,新北市淡水區竹圍里民族路33巷16號,1.0,1946.0,竹圍派出所,,121.463275,25.135913
大樓,關渡站前社區,D807000048,民權里,新北市淡水區民權里民族路112巷68號,2.0,950.0,竹圍派出所,,121.461731,25.134014
大樓,SUNDAY社區,D807000052,八勢里,新北市淡水區八勢里八勢一街51號,1.0,521.0,竹圍派出所,,121.462032,25.155703
大樓,關渡名軒社區,D807000054,福德里,新北市淡水區福德里自立路32號,1.0,526.0,竹圍派出所,,121.464132,25.127942
大樓,富升關渡社區,D807000055,福德里,新北市淡水區福德里自立路1巷3號,1.0,1341.0,竹圍派出所,,121.463271,25.128783
公寓,南加州社區,D807000058,民生里,新北市淡水區民生里民權路19號,1.0,296.0,竹圍派出所,,121.459956,25.14165
大樓,藝術學苑社區,D807000065,福德里,新北市淡水區福德里自立路50號,1.0,955.0,竹圍派出所,,121.464313,25.127445
大樓,淡水區公所民生里活動中心,D807000066,民生里,新北市淡水區民生里民生路27號,1.0,364.0,竹圍派出所,,121.461355,25.13802
公寓,淡水馬偕紀念醫院,D807000067,民生里,新北市淡水區民生里民生路45號,1.0,1236.0,竹圍派出所,,,
大樓,淡水馬偕紀念醫院,D807000071,民生里,新北市淡水區民生里民生路45號,1.0,895.0,竹圍派出所,,,
大樓,淡水馬偕紀念醫院,D807000072,民生里,新北市淡水區民生里民生路45號,1.0,2731.0,竹圍派出所,,,
大樓,金麗髮廊,D807000074,民生里,新北市淡水區民生里民生路49號,1.0,124.0,竹圍派出所,,121.462543,25.138217
大樓,淡水馬偕紀念醫院,D807000075,民生里,新北市淡水區民生里民生路45號,2.0,1369.0,竹圍派出所,,,
大樓,海悅社區,D807000077,八勢里,新北市淡水區八勢里中正東路二段85號,1.0,1923.0,竹圍派出所,,121.45961,25.153234
大樓,頂客雅築社區,D807000078,福德里,新北市淡水區福德里自立路10號,1.0,2903.0,竹圍派出所,,121.462942,25.129568
大樓,來富天廈社區,D807000079,福德里,新北市淡水區福德里自立路15巷1號,1.0,2334.0,竹圍派出所,,121.462652,25.130267
大樓,華碩雲端股份公司,D807000080,八勢里,新北市淡水區八勢里中正東路二段177號,1.0,1061.0,竹圍派出所,,121.460077,25.144366
大樓,觀渡大廈社區,D807000085,民權里,新北市淡水區民權里民族路10號,1.0,791.0,竹圍派出所,,121.460483,25.13671
大樓,理想家社區,D807000086,民權里,新北市淡水區民權里民族路30巷1號,1.0,2169.0,竹圍派出所,,121.460964,25.136149
大樓,觀邸社區,D807000087,民權里,新北市淡水區民權里民族路12號,1.0,396.0,竹圍派出所,,121.460678,25.13664
公寓,新天母大庭園社區,D807000092,福德里,新北市淡水區福德里自強路415巷34弄1號,1.0,2585.0,竹圍派出所,,121.464538,25.134251
大樓,薇閣社區,D807000093,民生里,新北市淡水區民生里民生路152號,2.0,4495.0,竹圍派出所,,121.464794,25.1385
公寓,海誓山盟社區,D807000094,坪頂里,新北市淡水區坪頂里小坪頂100巷56號,1.0,525.0,竹圍派出所,,121.489666,25.159948
大樓,麗池高苑社區,D807000097,坪頂里,新北市淡水區坪頂里坪頂路280號,1.0,1486.0,竹圍派出所,,121.47224,25.16116
大樓,麗池高苑社區,D807000098,坪頂里,新北市淡水區坪頂里坪頂路281號,1.0,1233.0,竹圍派出所,,121.471783,25.162326
大樓,菓嶺山莊社區,D807000102,坪頂里,新北市淡水區坪頂里小坪頂66巷1號,1.0,1067.0,竹圍派出所,,121.485881,25.158451
大樓,觀海極品社區,D807000103,竹圍里,新北市淡水區竹圍里民族路31號,1.0,10055.0,竹圍派出所,,121.461097,25.13681
大樓,觀海極品社區,D807000107,竹圍里,新北市淡水區竹圍里民族路31號,1.0,6599.0,竹圍派出所,,121.461097,25.13681
大樓,關渡站前B區,D807000108,民權里,新北市淡水區民權里民族路112巷68號,2.0,950.0,竹圍派出所,,121.461731,25.134014
大樓,關渡大街社區,D807000109,民權里,新北市淡水區民權里民族路112巷28號,2.0,702.0,竹圍派出所,,121.461988,25.134682
大樓,摩登家庭大廈,D807000110,竹圍里,新北市淡水區竹圍里民族路112巷1號,1.0,1360.0,竹圍派出所,,121.461863,25.133871
大樓,關渡昇陽社區,D807000112,福德里,新北市淡水區福德里自強路285號,1.0,1838.0,竹圍派出所,,121.462092,25.128684
大樓,河畔皇宮A棟社區,D807000113,福德里,新北市淡水區福德里自強路289號,1.0,2051.0,竹圍派出所,,121.461913,25.129052
大樓,山水御庭社區,D807000114,民生里,新北市淡水區民生里民生路117巷33號,1.0,273.0,竹圍派出所,,121.464812,25.139674
大樓,城市田莊社區,D807000115,民生里,新北市淡水區民生里民生路117巷42號,1.0,285.0,竹圍派出所,,121.464971,25.139812
大樓,關渡海悅大廈,D807000123,福德里,新北市淡水區福德里自強路343號,1.0,1756.0,竹圍派出所,,121.463876,25.132918
大樓,國家藝術庭園社區,D807000125,福德里,新北市淡水區福德里自強路128巷21號,1.0,960.0,竹圍派出所,,121.46602,25.133172
大樓,宏國海天社區,D807000128,福德里,新北市淡水區福德里自強路277號,1.0,1065.0,竹圍派出所,,121.462391,25.128342
大樓,關渡大國社區,D807000129,竹圍里,新北市淡水區竹圍里民族路31巷6號,1.0,2922.0,竹圍派出所,,121.462524,25.136216
大樓,晴川大樓,D807000130,福德里,新北市淡水區福德里自強路110號,1.0,93.0,竹圍派出所,,121.461756,25.131364
大樓,閱讀山水社區,D807000131,八勢里,新北市淡水區八勢里八勢路一段98號,1.0,421.0,竹圍派出所,,121.467613,25.155867
大樓,名峰天下社區,D807000135,福德里,新北市淡水區福德里自強路128巷1號,1.0,2326.0,竹圍派出所,,121.465943,25.133555
大樓,大廈,D807000137,福德里,新北市淡水區福德里自強路124巷26號,2.0,1805.0,竹圍派出所,,121.465791,25.132589
大樓,台灣綜合研究院,D807000140,八勢里,新北市淡水區八勢里中正東路二段27號,1.0,7102.0,竹圍派出所,,121.459453,25.156786
大樓,涵碧樓社區,D807000144,福德里,新北市淡水區福德里自強路116號6,1.0,330.0,竹圍派出所,,121.463481,25.132324
大樓,關渡山水社區,D807000147,民生里,新北市淡水區民生里民權路65號,1.0,2683.0,竹圍派出所,,121.460274,25.139056
大樓,山舉目社區,D807000152,八勢里,新北市淡水區八勢里八勢路50巷2號,1.0,1288.0,竹圍派出所,,121.462646,25.153002
大樓,莫扎特社區,D807000153,八勢里,新北市淡水區八勢里八勢路50巷6號,2.0,968.0,竹圍派出所,,121.463128,25.15091
大樓,詠青田社區,D807000154,竹圍里,新北市淡水區竹圍里民族路150號,1.0,101.0,竹圍派出所,,121.462647,25.133959
大樓,豐悅城社區,D807000155,八勢里,新北市淡水區八勢里紅樹林路151號,1.0,2209.0,竹圍派出所,,121.460846,25.157547
大樓,達麗世界灣,D807000156,八勢里,新北市淡水區八勢里中正東路二段143巷8號,2.0,783.0,竹圍派出所,,121.462133,25.147462
大樓,新北市立竹圍高級中學,D807000157,八勢里,新北市淡水區八勢里竹林路35號,1.0,824.0,竹圍派出所,,121.461718,25.146035
大樓,鄉林山海匯-海匯特區,D807000158,八勢里,新北市淡水區八勢里八勢路50巷51號,3.0,1579.0,竹圍派出所,,121.464018,25.151993
大樓,水仙富御社區,D807000159,八勢里,新北市淡水區八勢里八勢路50巷5弄10號,1.0,290.0,竹圍派出所,,121.464289,25.151534
大樓,長磊雨青社區,D807000161,福德里,新北市淡水區福德里自立路46號,2.0,145.0,竹圍派出所,,121.463901,25.127539
大樓,新北市政府交通局民生停車場,D807000162,民生里,新北市淡水區民生里民生路27號1,1.0,703.0,竹圍派出所,,121.461554,25.138047
大樓,馥人灣-二樹區社區,D807000163,八勢里,新北市淡水區八勢里八勢路2巷6號,3.0,874.0,竹圍派出所,,121.461297,25.153508
大樓,宝寶社區,D807000164,八勢里,新北市淡水區八勢里八勢路13號,1.0,634.0,竹圍派出所,,121.460931,25.153719
大樓,鄉林山海匯-山匯特區,D807000165,八勢里,新北市淡水區八勢里八勢路50巷71號,1.0,1956.0,竹圍派出所,,121.463456,25.149761
大樓,馥人灣-一山區社區,D807000166,八勢里,新北市淡水區八勢里八勢路2巷17號,3.0,1083.0,竹圍派出所,,121.461946,25.152725
大樓,漢皇丰川社區,D807000167,民權里,新北市淡水區民權里民權路187巷2號,3.0,3069.0,竹圍派出所,,121.460077,25.133414
大樓,豐盈海社區,D807000168,八勢里,新北市淡水區八勢里中正東路二段51號,1.0,1256.0,竹圍派出所,,121.459971,25.155574
大樓,馥人灣-三水區社區,D807000169,八勢里,新北市淡水區八勢里八勢路2巷5號,3.0,947.0,竹圍派出所,,121.461296,25.153105
大樓,湯泉如意社區,D807000170,民權里,新北市淡水區民權里民族路112巷59號,2.0,929.0,竹圍派出所,,121.461921,25.133914
大樓,迎曦莊園社區,D807000171,福德里,新北市淡水區福德里自強路421號,1.0,419.0,竹圍派出所,,121.465514,25.134362
大樓,山海觀社區,D807000172,八勢里,新北市淡水區八勢里八勢路1段157號,1.0,400.0,竹圍派出所,,121.4682098,25.15659934
大樓,香草莊園C區,D807000173,民生里,新北市淡水區民生里民權路3巷12弄1號,3.0,382.0,竹圍派出所,,121.4615858,25.14210214
大樓,台億建築經理股份有限公司,D807000174,八勢里,新北市淡水區八勢里1鄰中正東路2段143巷2弄3號,3.0,2709.0,竹圍派出所,,121.4608803,25.14718161
大樓,,D807000175,八勢里,新北市淡水區八勢里9鄰中正東路2段107巷1-3號,3.0,434.0,竹圍派出所,,121.4600557,25.15192392
公寓,新北市三芝區三芝國民小學,D808000001,埔頭里,新北市三芝區埔頭里育英街22號,1.0,1070.0,三芝分駐所,,121.5016,25.25788
公寓,明星自動控制有限公司,D808000003,埔頭里,新北市三芝區埔頭里中山路二段48號1,1.0,1138.0,三芝分駐所,,121.503127,25.254657
大樓,山水雅筑社區,D808000004,埔坪里,新北市三芝區埔坪里淡金路二段87巷1號1,1.0,2173.0,三芝分駐所,,121.504423,25.26064
大樓,大廈,D808000005,埔坪里,新北市三芝區埔坪里三民街41號,1.0,2619.0,三芝分駐所,,121.505175,25.258635
公寓,新北市三芝區公所,D808000006,埔頭里,新北市三芝區埔頭里中山路一段32號,1.0,372.0,三芝分駐所,,121.5011,25.25784
大樓,大廈,D808000008,埔坪里,新北市三芝區埔坪里三民街1號,1.0,414.0,三芝分駐所,,121.50412,25.257705
大樓,大廈,D808000011,埔頭里,新北市三芝區埔頭里長勤街48號1,1.0,234.0,三芝分駐所,,121.50032,25.255292
大樓,美樂星國際實業有限公司,D808000012,埔坪里,新北市三芝區埔坪里智成街5號,1.0,286.0,三芝分駐所,,121.502805,25.256626
大樓,爵士城堡B棟社區,D808000014,埔頭里,新北市三芝區埔頭里長勤街9巷9弄3號,1.0,278.0,三芝分駐所,,121.501854,25.255184
大樓,大廈,D808000015,埔頭里,新北市三芝區埔頭里中正路三段1號,1.0,592.0,三芝分駐所,,121.5029,25.25438
大樓,龍大地1期社區,D808000016,埔頭里,新北市三芝區埔頭里中興街一段30號1,1.0,554.0,三芝分駐所,,121.4979,25.25785
大樓,金地主社區,D808000017,埔頭里,新北市三芝區埔頭里公正街25號,1.0,981.0,三芝分駐所,,121.499836,25.258264
大樓,統帥花都社區,D808000019,埔頭里,新北市三芝區埔頭里公正街三段9號,1.0,1041.0,三芝分駐所,,121.498543,25.256933
大樓,龍大地2期社區,D808000020,埔頭里,新北市三芝區埔頭里中興街一段31號,1.0,1931.0,三芝分駐所,,121.4974,25.25808
大樓,大廈,D808000022,埔頭里,新北市三芝區埔頭里中正路三段15號,1.0,838.0,三芝分駐所,,121.502693,25.253601
大樓,富貴人生社區,D808000024,埔頭里,新北市三芝區埔頭里中興街二段2號,1.0,324.0,三芝分駐所,,121.49846,25.256689
大樓,御都大樓,D808000025,埔坪里,新北市三芝區埔坪里中正路二段18號,1.0,926.0,三芝分駐所,,121.5045,25.25523
大樓,麗景特區,D808000026,埔頭里,新北市三芝區埔頭里長安街109號,1.0,944.0,三芝分駐所,,121.497877,25.259259
大樓,好運來社區,D808000027,埔頭里,新北市三芝區埔頭里中興街二段109號,1.0,1545.0,三芝分駐所,,121.499274,25.254994
大樓,聯邦薪願社區,D808000028,埔頭里,新北市三芝區埔頭里中興街二段42巷12號,1.0,845.0,三芝分駐所,,121.499632,25.255709
大樓,大廈,D808000029,埔坪里,新北市三芝區埔坪里三民街1號,2.0,5470.0,三芝分駐所,,121.50412,25.257705
大樓,牽手社區,D808000030,埔坪里,新北市三芝區埔坪里忠孝街116號,2.0,6984.0,三芝分駐所,,121.505786,25.25742
大樓,大廈,D808000031,埔頭里,新北市三芝區埔頭里長春街2號,1.0,864.0,三芝分駐所,,121.500053,25.257138
大樓,薪水居易特區,D808000032,埔坪里,新北市三芝區埔坪里淡金路二段43號,1.0,3722.0,三芝分駐所,,121.503548,25.260336
公寓,天主教會三芝幼兒園,D808000033,埔頭里,新北市三芝區埔頭里長安街59號,1.0,226.0,三芝分駐所,,121.500862,25.256676
大樓,圓興居社區,D808000034,埔坪里,新北市三芝區埔坪里忠孝街51號,1.0,478.0,三芝分駐所,,121.506139,25.256105
大樓,三芝熱帶嶼社區A棟,D808000035,古庄里,新北市三芝區古庄里樂全街2號,1.0,1498.0,三芝分駐所,,121.486933,25.258818
大樓,三芝熱帶嶼社區B棟,D808000036,古庄里,新北市三芝區古庄里樂全街3號,2.0,1768.0,三芝分駐所,,121.487725,25.258874
大樓,三芝熱帶嶼社區C1棟,D808000037,古庄里,新北市三芝區古庄里樂全街26號,1.0,4473.0,三芝分駐所,,121.487406,25.257737
大樓,三芝熱帶嶼社區D棟,D808000038,古庄里,新北市三芝區古庄里樂全街88號,1.0,1510.0,三芝分駐所,,121.487649,25.25784
大樓,大廈,D808000039,埔頭里,新北市三芝區埔頭里中興街二段260號,2.0,1373.0,三芝分駐所,,121.501963,25.252996
大樓,富貴人生社區,D808000040,埔頭里,新北市三芝區埔頭里公正街6號,1.0,1576.0,三芝分駐所,,121.499603,25.258186
大樓,聯邦薪願社區,D808000041,埔頭里,新北市三芝區埔頭里中興街二段46號,2.0,2629.0,三芝分駐所,,121.499529,25.255068
大樓,大廈,D808000042,埔坪里,新北市三芝區埔坪里中正路一段18巷54號,2.0,4891.0,三芝分駐所,,121.5043,25.25879
大樓,摩登家庭社區,D808000043,埔坪里,新北市三芝區埔坪里忠孝街1號11,1.0,1104.0,三芝分駐所,,121.505613,25.254225
公寓,新北市三芝區三芝國民小學,D808000044,埔頭里,新北市三芝區埔頭里育英街22號,1.0,827.0,三芝分駐所,,121.501635,25.257878
大樓,淺水灣山莊A區,D809000001,後厝里,新北市三芝區後厝里芝麻五街2號,1.0,760.0,後厝派出所,,121.475312,25.245455
大樓,佛朗明哥社區I棟,D809000002,後厝里,新北市三芝區後厝里淺水灣街12號,1.0,2434.0,後厝派出所,,121.47256,25.250888
大樓,佛朗明哥社區E棟,D809000003,後厝里,新北市三芝區後厝里淺水灣街11號,1.0,2334.0,後厝派出所,,121.472076,25.248449
大樓,佛朗明哥社區G棟,D809000004,後厝里,新北市三芝區後厝里淺水灣街8號,1.0,1866.0,後厝派出所,,121.472614,25.25059
大樓,佛朗明哥社區A棟,D809000006,後厝里,新北市三芝區後厝里淺水灣街3號,1.0,731.0,後厝派出所,,121.473093,25.250348
大樓,佛朗明哥社區K棟,D809000007,後厝里,新北市三芝區後厝里淺水灣街2號,1.0,1146.0,後厝派出所,,121.472202,25.249943
大樓,雙連安養中心,D809000008,後厝里,新北市三芝區後厝里後厝里北勢子22之16號,1.0,1766.0,後厝派出所,,121.473021,25.253183
大樓,佛朗明哥社區B棟,D809000011,後厝里,新北市三芝區後厝里淺水灣街5號,1.0,1902.0,後厝派出所,,121.472856,25.249905
大樓,淺水灣山莊B棟,D809000012,後厝里,新北市三芝區後厝里芝麻三街1號,1.0,1137.0,後厝派出所,,121.474949,25.245062
大樓,龍巖墓園,D80B000001,圓山里,新北市三芝區圓山里木屐寮38號2,1.0,4162.0,興華派出所,,121.537699,25.231722
大樓,萬代福墓園,D80B000002,福德里,新北市三芝區福德里大湖8號8,1.0,534.0,興華派出所,,121.508121,25.222305
大樓,懷恩墓園,D80B000003,圓山里,新北市三芝區圓山里大水堀32號,1.0,1947.0,興華派出所,,121.511015,25.215359
大樓,拾翠山莊,D80B000004,福德里,新北市三芝區福德里埔尾9之67號,1.0,161.0,興華派出所,,121.502459,25.243131
大樓,拾翠山莊,D80B000005,福德里,新北市三芝區福德里埔尾9號,1.0,843.0,興華派出所,,121.502955,25.244145
大樓,拾翠山莊,D80B000006,福德里,新北市三芝區福德里埔尾9號12,1.0,616.0,興華派出所,,121.501055,25.24254
公寓,敦峰工業公司,D80B000009,興華里,新北市三芝區興華里田心子17號1,1.0,2274.0,興華派出所,,121.493185,25.203603
公寓,秀明宮,D80B000010,興華里,新北市三芝區興華里車埕68號1,1.0,218.0,興華派出所,,121.493674,25.193323
