類別,建築物名稱,電腦編號,村里別,地址,地下樓層數,可容納人數,派出所,備註,經度,緯度
大樓,夢想家社區,D803000090,新春里,新北市淡水區新春里新春街103號10,1.0,1614.0,水碓派出所,,121.440481,25.181997
大樓,新月社區,D803000091,北投里,新北市淡水區北投里新市一路三段101巷170號,1.0,1298.0,水碓派出所,,121.445581,25.18708
大樓,和丰社區,D803000092,崁頂里,新北市淡水區崁頂里新市二路二段52號,1.0,2300.0,水碓派出所,,121.427271,25.19531
大樓,涵月社區,D803000093,崁頂里,新北市淡水區崁頂里新市二路三段152號,1.0,1077.0,水碓派出所,,121.436592,25.193123
大樓,美麗境社區,D803000094,崁頂里,新北市淡水區崁頂里濱海路一段306巷18號1,1.0,767.0,水碓派出所,,121.440889,25.190457
大樓,琴境社區,D803000096,崁頂里,新北市淡水區崁頂里義山路一段200號,1.0,972.0,水碓派出所,,121.438279,25.190524
大樓,躍淡水社區,D803000098,崁頂里,新北市淡水區崁頂里義山路一段1號,1.0,1350.0,水碓派出所,,121.437295,25.187143
大樓,福樂家社區,D803000099,崁頂里,新北市淡水區崁頂里崁頂五路301號,1.0,518.0,水碓派出所,,121.424593,25.199448
大樓,領海社區,D803000100,崁頂里,新北市淡水區崁頂里新市五路一段128號,1.0,1737.0,水碓派出所,,121.427588,25.200176
大樓,謙樹社區,D803000101,崁頂里,新北市淡水區崁頂里新市三路一段308號,1.0,1706.0,水碓派出所,,121.429889,25.197099
大樓,真耶穌教會台灣總會淡水教會,D803000102,新春里,新北市淡水區新春里新民街320號,1.0,356.0,水碓派出所,,121.435409,25.183217
大樓,新北市政府淡水區公所,D803000103,崁頂里,新北市淡水區崁頂里中山北路二段375號,1.0,2015.0,水碓派出所,,121.443938,25.187069
大樓,和康嘉年華社區,D803000106,崁頂里,新北市淡水區崁頂里新市一路一段345號,1.0,3925.0,水碓派出所,,121.436149,25.187015
大樓,佳順有囍社區,D803000107,崁頂里,新北市淡水區崁頂里新市二路二段2號,1.0,1626.0,水碓派出所,,121.426596,25.195707
大樓,原石雅苑社區,D803000108,新春里,新北市淡水區新春里新春街85巷25弄15號,1.0,1432.0,水碓派出所,,121.438271,25.183644
大樓,邀月社區,D803000109,崁頂里,新北市淡水區崁頂里新市二路三段172巷27弄1號,1.0,854.0,水碓派出所,,121.437083,25.191836
大樓,花見社區,D803000110,新春里,新北市淡水區新春里新春街65巷37號,1.0,1617.0,水碓派出所,,121.436966,25.182876
大樓,遊川風社區,D803000111,崁頂里,新北市淡水區崁頂里濱海路一段306巷9弄57號,1.0,791.0,水碓派出所,,121.439012,25.190844
大樓,川普G3社區,D803000112,北投里,新北市淡水區北投里淡金路一段551號,1.0,1991.0,水碓派出所,,121.453237,25.180051
大樓,天駿社區,D803000113,崁頂里,新北市淡水區崁頂里濱海路二段172號,1.0,861.0,水碓派出所,,121.435616,25.190512
大樓,凱旋世紀社區,D803000114,崁頂里,新北市淡水區崁頂里義山路一段216號,1.0,576.0,水碓派出所,,121.438275,25.190849
大樓,心居易社區,D803000115,新春里,新北市淡水區新春里新春街103號11,1.0,3374.0,水碓派出所,,121.440713,25.181955
大樓,和光理想家社區,D803000116,崁頂里,新北市淡水區崁頂里新市二路二段90號,1.0,4164.0,水碓派出所,,121.427715,25.195151
大樓,首鼎社區,D803000117,新春里,新北市淡水區新春里新春街85巷17號,1.0,1116.0,水碓派出所,,121.438431,25.183079
大樓,鑽石双星社區,D803000118,北投里,新北市淡水區北投里淡金路二段201號,1.0,1288.0,水碓派出所,,121.447872,25.183573
大樓,勤家捷奏社區,D803000119,崁頂里,新北市淡水區崁頂里崁頂三路167號,1.0,1355.0,水碓派出所,,121.430405,25.2012
大樓,首鼎社區,D803000120,新春里,新北市淡水區新春里新春街85巷19弄8號1,1.0,77.0,水碓派出所,,121.438214,25.183249
大樓,西雅圖社區,D803000121,北投里,新北市淡水區北投里新市一路三段101巷16弄8號,1.0,1846.0,水碓派出所,,121.446907,25.184251
大樓,聖地牙哥社區,D803000122,新興里,新北市淡水區新興里新興街25號1,2.0,703.0,水碓派出所,,121.442724,25.179878
大樓,普羅旺斯社區,D803000124,北投里,新北市淡水區北投里新市一路三段158號,3.0,2246.0,水碓派出所,,121.447394,25.182626
大樓,蒙地卡羅社區,D803000125,北投里,新北市淡水區北投里新市一路三段90號,3.0,1976.0,水碓派出所,,121.446198,25.182543
大樓,大廈,D803000129,新民里,新北市淡水區新民里新民街120巷5號,1.0,915.0,水碓派出所,,121.437929,25.177998
公寓,新北市立淡水高級商工職業學校,D803000136,埤島里,新北市淡水區埤島里商工路307號,1.0,591.0,水碓派出所,,121.454026,25.18676
公寓,新北市立淡水高級商工職業學校,D803000140,埤島里,新北市淡水區埤島里商工路307號,1.0,451.0,水碓派出所,,121.454026,25.18676
公寓,新北市立淡水高級商工職業學校,D803000141,埤島里,新北市淡水區埤島里商工路307號,1.0,462.0,水碓派出所,,121.454026,25.18676
大樓,摩天31社區,D803000142,新興里,新北市淡水區新興里新春街180號,1.0,6549.0,水碓派出所,,121.443337,25.180922
大樓,大廈,D803000144,北新里,新北市淡水區北新里北新路182巷43號,1.0,901.0,水碓派出所,,121.448181,25.177294
公寓,新北市立淡水高級商工職業學校,D803000145,埤島里,新北市淡水區埤島里商工路307號,1.0,1415.0,水碓派出所,,121.454026,25.18676
大樓,獅子林社區,D803000146,新興里,新北市淡水區新興里中山北路一段225號,1.0,1983.0,水碓派出所,,121.444218,25.179548
公寓,新北市立淡水高級商工職業學校,D803000147,埤島里,新北市淡水區埤島里商工路307號,1.0,704.0,水碓派出所,,121.454026,25.18676
大樓,淡江風華社區,D803000163,正德里,新北市淡水區正德里北新路169巷69弄2號,1.0,1391.0,水碓派出所,,121.447756,25.180372
大樓,書香大第社區,D803000166,新興里,新北市淡水區新興里新興街85號,1.0,3738.0,水碓派出所,,121.441381,25.180357
大樓,大廈,D803000167,水碓里,新北市淡水區水碓里北新路1號,1.0,647.0,水碓派出所,,121.447327,25.178284
大樓,大旭地社區,D803000168,正德里,新北市淡水區正德里北新路169巷12號,1.0,4254.0,水碓派出所,,121.449734,25.180336
大樓,淡水加州社區,D803000169,新興里,新北市淡水區新興里新春街134號,1.0,5219.0,水碓派出所,,121.441281,25.18162
大樓,長頸鹿公園社區,D803000171,新春里,新北市淡水區新春里新春街85巷27弄18號,1.0,1335.0,水碓派出所,,121.437664,25.18352
大樓,大廈,D803000178,北新里,新北市淡水區北新里大忠街113巷21號,1.0,797.0,水碓派出所,,121.447644,25.177879
公寓,公寓,D803000179,正德里,新北市淡水區正德里北新路109號,1.0,1977.0,水碓派出所,,121.446853,25.178483
大樓,夏戀社區,D803000192,新民里,新北市淡水區新民里新民街222巷16弄22號,1.0,3052.0,水碓派出所,,121.437597,25.180198
大樓,觀海高爾夫山莊,D803000196,新春里,新北市淡水區新春里新民街322巷1弄1號,1.0,1401.0,水碓派出所,,121.436503,25.183647
大樓,好望角社區,D803000198,新民里,新北市淡水區新民里新民街120巷25號,1.0,1192.0,水碓派出所,,121.438638,25.178924
大樓,凱悅來來社區,D803000199,新民里,新北市淡水區新民里新民街222巷2號,1.0,1756.0,水碓派出所,,121.43635,25.180379
大樓,大廈,D803000203,新民里,新北市淡水區新民里新民街28號,1.0,6257.0,水碓派出所,,121.439175,25.177259
大樓,孟子社區,D803000206,正德里,新北市淡水區正德里北新路125號,1.0,392.0,水碓派出所,,121.44906,25.178844
大樓,大廈,D803000212,北新里,新北市淡水區北新里北新路186號,1.0,1458.0,水碓派出所,,121.449802,25.17875
大樓,書香大第社區,D803000213,新興里,新北市淡水區新興里新興街66號,1.0,341.0,水碓派出所,,121.441918,25.18029
大樓,書香大第社區,D803000214,新興里,新北市淡水區新興里新興街76號,1.0,409.0,水碓派出所,,121.441588,25.180546
大樓,海濶天空大廈,D803000218,新民里,新北市淡水區新民里新民街222巷11號,1.0,2100.0,水碓派出所,,121.437388,25.18039
大樓,青海青社區,D803000225,正德里,新北市淡水區正德里北新路141巷60弄11號,1.0,1236.0,水碓派出所,,121.448195,25.180014
公寓,正德國中,D803000228,正德里,新北市淡水區正德里北新路109號,1.0,1167.0,水碓派出所,,121.446853,25.178483
大樓,寶鏵江山社區,D803000232,正德里,新北市淡水區正德里北新路141巷38弄2號,1.0,1956.0,水碓派出所,,121.448889,25.179654
大樓,大廈,D803000233,水碓里,新北市淡水區水碓里大忠街68號,1.0,3741.0,水碓派出所,,121.444969,25.175979
公寓,新北市立淡水高級商工職業學校,D803000234,埤島里,新北市淡水區埤島里商工路307號,1.0,864.0,水碓派出所,,121.454026,25.18676
大樓,香格里拉社區,D803000236,正德里,新北市淡水區正德里北新路141巷6號,1.0,6971.0,水碓派出所,,121.449211,25.179414
大樓,觀之林社區,D803000237,新春里,新北市淡水區新春里新春街65巷6號,1.0,1119.0,水碓派出所,,121.437041,25.182616
大樓,孟子社區,D803000238,正德里,新北市淡水區正德里北新路121號,1.0,2769.0,水碓派出所,,121.448943,25.17879
大樓,狀元地社區,D803000240,水碓里,新北市淡水區水碓里中山北路一段212巷16號,1.0,1537.0,水碓派出所,,121.445572,25.179444
大樓,大旭地社區,D803000242,正德里,新北市淡水區正德里北新路169巷20號,1.0,2807.0,水碓派出所,,121.449981,25.180549
大樓,常春籐社區,D803000243,新民里,新北市淡水區新民里新民街120巷46號,1.0,574.0,水碓派出所,,121.438679,25.178092
大樓,大廈,D803000244,正德里,新北市淡水區正德里北新路141巷52號,1.0,386.0,水碓派出所,,121.44846,25.179578
大樓,新市168社區,D803000245,崁頂里,新北市淡水區崁頂里濱海路二段202巷65弄56號,4.0,704.0,水碓派出所,,121.433784,25.192706
大樓,蘋果樹社區,D803000246,崁頂里,新北市淡水區崁頂里新市一路二段255號,1.0,254.0,水碓派出所,,121.444065,25.183115
大樓,川普寬庭社區,D803000247,崁頂里,新北市淡水區崁頂里中山北路二段189巷17號,1.0,1822.0,水碓派出所,,121.442947,25.185147
大樓,新潤峰采海灣區,D803000248,崁頂里,新北市淡水區崁頂里崁頂五路165巷11號,1.0,692.0,水碓派出所,,121.422853,25.196167
大樓,映月社區,D803000249,崁頂里,新北市淡水區崁頂里濱海路二段218號,1.0,425.0,水碓派出所,,121.433862,25.19049
大樓,富樂恬社區,D803000250,埤島里,新北市淡水區埤島里新市二路四段230巷50號,1.0,438.0,水碓派出所,,121.445347,25.191061
大樓,馥樂社區,D803000251,崁頂里,新北市淡水區崁頂里中山北路二段211號,1.0,716.0,水碓派出所,,121.444005,25.186
大樓,捷運匯境社區,D803000252,埤島里,新北市淡水區埤島里中山北路三段16巷20號,1.0,316.0,水碓派出所,,121.444663,25.190056
大樓,和合和韻社區,D803000253,崁頂里,新北市淡水區崁頂里崁頂三路85號,1.0,901.0,水碓派出所,,121.430126,25.196376
大樓,新潤峰采社區,D803000254,崁頂里,新北市淡水區崁頂里濱海路二段202巷60號,4.0,1195.0,水碓派出所,,121.435306,25.192713
大樓,綠富綠社區,D803000255,崁頂里,新北市淡水區崁頂里濱海路二段202巷26號,1.0,918.0,水碓派出所,,121.43501,25.191811
大樓,綠水階社區,D803000256,北投里,新北市淡水區北投里新市一路三段156巷1號,1.0,513.0,水碓派出所,,121.447388,25.182513
大樓,和合富貴社區,D803000257,崁頂里,新北市淡水區崁頂里濱海路一段306巷60弄51號,1.0,374.0,水碓派出所,,121.442623,25.1916
大樓,聿盛首馥社區,D803000258,崁頂里,新北市淡水區崁頂里新市二路三段80號,1.0,837.0,水碓派出所,,121.434465,25.19335
大樓,宏普有逸天社區,D803000259,崁頂里,新北市淡水區崁頂里新市二路一段76號,2.0,2488.0,水碓派出所,,121.424756,25.196428
大樓,海洋都心第一期社區,D803000260,崁頂里,新北市淡水區崁頂里新市五路三段152號,2.0,5113.0,水碓派出所,,121.436752,25.197852
大樓,九泰社區,D803000261,崁頂里,新北市淡水區崁頂里中山北路二段5號,1.0,1095.0,水碓派出所,,121.444306,25.183443
大樓,捷運儷境社區,D803000262,崁頂里,新北市淡水區崁頂里新市二路二段22號,1.0,2409.0,水碓派出所,,121.426747,25.195556
大樓,美麗新影城,D803000263,崁頂里,新北市淡水區崁頂里義山路二段301號,1.0,7400.0,水碓派出所,,121.43895,25.198086
大樓,海洋都心二期社區,D803000264,崁頂里,新北市淡水區崁頂里新市三路二段181號,2.0,4805.0,水碓派出所,,121.436922,25.196682
大樓,上水社區,D803000265,崁頂里,新北市淡水區崁頂里義山路一段381號,1.0,882.0,水碓派出所,,121.437649,25.190556
大樓,歐樂市社區,D803000266,崁頂里,新北市淡水區崁頂里新市二路三段172巷18號,1.0,635.0,水碓派出所,,121.436891,25.192087
大樓,吉美雲品社區,D803000267,崁頂里,新北市淡水區崁頂里崁頂三路99號1,1.0,1193.0,水碓派出所,,121.430362,25.196839
大樓,富鼎軒社區,D803000268,崁頂里,新北市淡水區崁頂里濱海路一段121號,3.0,218.0,水碓派出所,,121.440149,25.189081
大樓,和合晶站社區,D803000269,埤島里,新北市淡水區埤島里新市二路四段230巷61號,1.0,443.0,水碓派出所,,121.446181,25.190652
大樓,優寶產後護理之家,D803000270,新義里,新北市淡水區新義里中山北路一段193號,1.0,156.0,水碓派出所,,121.444087,25.178693
大樓,宏盛水悅社區,D803000271,崁頂里,新北市淡水區崁頂里新市三路一段50號,1.0,9512.0,水碓派出所,,121.42465,25.198323
大樓,輕時代社區,D803000272,北投里,新北市淡水區北投里淡金路二段213號,3.0,1215.0,水碓派出所,,121.447353,25.184111
大樓,海洋都心三期社區,D803000273,崁頂里,新北市淡水區崁頂里新市五路三段350號,1.0,8868.0,水碓派出所,,121.438616,25.19727
大樓,臥月社區,D803000274,新義里,新北市淡水區新義里大信街68號,2.0,1089.0,水碓派出所,,121.440592,25.177285
大樓,晴空23社區,D803000275,崁頂里,新北市淡水區崁頂里崁頂里濱海路2段202巷67號,1.0,726.0,水碓派出所,,121.43498,25.19261075
大樓,台灣基督徒見證協會,D803000276,崁頂里,新北市淡水區崁頂里崁頂五路155號,1.0,706.0,水碓派出所,,121.4234053,25.19612664
大樓,大廈,D803000277,北新里,新北市淡水區北新里北新路184巷22號,1.0,613.0,水碓派出所,,121.4497736,25.17800329
大樓,悠森學社區,D803000278,新春里,新北市淡水區新春里新春街110號,3.0,1139.0,水碓派出所,,121.4396165,25.18265931
大樓,和光同塵社區,D803000279,崁頂里,新北市淡水區崁頂里崁頂里新市二路3段172巷3弄10號,1.0,799.0,水碓派出所,,121.43766,25.192518
大樓,PARK188社區,D803000280,崁頂里,新北市淡水區崁頂里新市二路3段36巷37弄28號,1.0,976.0,水碓派出所,,121.4339055,25.19226664
大樓,頤昌耘萃社區,D803000281,崁頂里,新北市淡水區崁頂里崁頂里濱海路2段202巷1弄2號,1.0,1168.0,水碓派出所,,121.4342996,25.19102238
大樓,興格宜家社區,D803000282,崁頂里,新北市淡水區崁頂里新市二路1段28號,1.0,439.0,水碓派出所,,121.42475,25.196427
公寓,公寓,D803000283,新義里,新北市淡水區新義里5鄰中山北路1段75號,1.0,126.0,水碓派出所,,121.44203,25.176
大樓,囍悅MRT社區,D803000284,埤島里,新北市淡水區埤島里2鄰新市二路4段230巷51號,1.0,1216.0,水碓派出所,,121.4454407,25.19123448
大樓,天境360管委會,D804000001,樹興里,新北市淡水區樹興里興福寮100號,1.0,3498.0,水源派出所,,121.486892,25.164659
大樓,半山匯社區,D804000002,樹興里,新北市淡水區樹興里興福寮77巷121號,1.0,609.0,水源派出所,,121.484734,25.163688
大樓,萬通台北101社區,D804000003,樹興里,新北市淡水區樹興里興福寮88巷1號,1.0,3240.0,水源派出所,,121.485355,25.164546
大樓,半山匯社區,D804000004,樹興里,新北市淡水區樹興里興福寮77巷57號,1.0,464.0,水源派出所,,121.487295,25.163174
大樓,半山匯社區,D804000005,樹興里,新北市淡水區樹興里興福寮77巷127號,1.0,555.0,水源派出所,,121.484619,25.164128
大樓,環遊郡社區,D804000006,樹興里,新北市淡水區樹興里興福寮66巷1號,1.0,2149.0,水源派出所,,121.483757,25.161727
大樓,翠山居社區,D804000007,樹興里,新北市淡水區樹興里興福寮88巷80號,1.0,1531.0,水源派出所,,121.484839,25.165362
大樓,翠山居社區,D804000008,樹興里,新北市淡水區樹興里興福寮88巷81號,1.0,1124.0,水源派出所,,121.484515,25.165363
大樓,翠山居社區,D804000009,樹興里,新北市淡水區樹興里興福寮88巷117號,1.0,4413.0,水源派出所,,121.484659,25.166058
大樓,香格里拉社區,D804000010,水源里,新北市淡水區水源里南勢埔32巷7號,1.0,45.0,水源派出所,,121.484807,25.180163
大樓,養生樹社區,D804000011,水源里,新北市淡水區水源里山子邊3號1,2.0,1226.0,水源派出所,,121.483612,25.184447
大樓,櫻花村社區,D804000012,水源里,新北市淡水區水源里北新路三段2號,1.0,87.0,水源派出所,,121.482626,25.185115
大樓,半山匯社區,D804000014,樹興里,新北市淡水區樹興里興福寮77巷117號,1.0,390.0,水源派出所,,121.484862,25.163473
大樓,半山匯社區,D804000015,樹興里,新北市淡水區樹興里興福寮77巷81號,1.0,315.0,水源派出所,,121.486354,25.162988
大樓,松下品泉社區,D804000016,水源里,新北市淡水區水源里北新路二段151號,1.0,899.0,水源派出所,,121.482838,25.185625
大樓,大廈,D804000018,水源里,新北市淡水區水源里北新路三段16號7,1.0,105.0,水源派出所,,121.483633,25.186013
公寓,元鼎耐火,D804000020,水源里,新北市淡水區水源里鄒厝崙1號11,1.0,37.0,水源派出所,,121.472007,25.187396
公寓,新北市淡水區水源國民小學,D804000023,水源里,新北市淡水區水源里水梘頭45號,1.0,60.0,水源派出所,,121.48242,25.177473
大樓,香格里拉社區,D804000024,水源里,新北市淡水區水源里南勢埔32巷3號,1.0,428.0,水源派出所,,121.485069,25.180626
大樓,半山匯社區,D804000025,樹興里,新北市淡水區樹興里興福寮77巷113號,1.0,308.0,水源派出所,,121.48494,25.163342
大樓,半山匯社區,D804000026,樹興里,新北市淡水區樹興里興福寮77巷69號,1.0,587.0,水源派出所,,121.486948,25.16304
大樓,中國建築經理股份有限公司,D804000027,樹興里,新北市淡水區樹興里興福寮77巷75號,1.0,545.0,水源派出所,,121.486729,25.163019
大樓,半山匯社區,D804000028,樹興里,新北市淡水區樹興里興福寮77巷91號,1.0,572.0,水源派出所,,121.485898,25.163024
大樓,半山匯社區,D804000029,樹興里,新北市淡水區樹興里興福寮77巷101號,1.0,510.0,水源派出所,,121.485656,25.163073
公寓,公寓,D804000030,水源里,新北市淡水區水源里山子頂28號,1.0,84.0,水源派出所,,121.491572,25.190266
公寓,金山鐵線股份有限公司,D805000001,興仁里,新北市淡水區興仁里興仁路159號,1.0,1424.0,興仁派出所,,121.451399,25.219403
公寓,金山鐵線股份有限公司,D805000003,興仁里,新北市淡水區興仁里興仁路161號,1.0,2274.0,興仁派出所,,121.451425,25.219666
公寓,新北市淡水區興仁國民小學,D805000007,興仁里,新北市淡水區興仁里興仁路101巷10號,1.0,407.0,興仁派出所,,121.451097,25.21748
公寓,新北市淡水區興仁國民小學,D805000020,興仁里,新北市淡水區興仁里興仁路101巷10號,1.0,19.0,興仁派出所,,121.451097,25.21748
公寓,新北市淡水區屯山國民小學,D806000001,賢孝里,新北市淡水區賢孝里淡金路五段111號,1.0,327.0,賢孝派出所,,121.456364,25.237342
公寓,新北市淡水區屯山國民小學,D806000002,賢孝里,新北市淡水區賢孝里淡金路五段111號,1.0,274.0,賢孝派出所,,121.456364,25.237342
公寓,聖約翰科技大學,D806000003,賢孝里,新北市淡水區賢孝里淡金路四段499號,1.0,424.0,賢孝派出所,,121.451673,25.226984
大樓,聖約翰科技大學,D806000004,賢孝里,新北市淡水區賢孝里淡金路四段499號,1.0,1532.0,賢孝派出所,,121.451673,25.226984
公寓,聖約翰科技大學,D806000005,賢孝里,新北市淡水區賢孝里淡金路四段499號,1.0,750.0,賢孝派出所,,121.451673,25.226984
大樓,山菱山水社區,D806000006,賢孝里,新北市淡水區賢孝里番子田120號,1.0,3093.0,賢孝派出所,,121.463752,25.227849
大樓,海納川社區,D807000002,八勢里,新北市淡水區八勢里中正東路二段115號,2.0,2654.0,竹圍派出所,,121.459795,25.150803
大樓,香草天空迷迭香社區,D807000003,民生里,新北市淡水區民生里民富路121號,1.0,647.0,竹圍派出所,,121.462171,25.140958
大樓,香草天空薰衣草社區,D807000004,民生里,新北市淡水區民生里民權路3巷12弄30號,1.0,1282.0,竹圍派出所,,121.461275,25.142129
大樓,海中金鑽社區,D807000005,八勢里,新北市淡水區八勢里八勢二街18號,2.0,379.0,竹圍派出所,,121.460313,25.149419
大樓,秀山莊社區,D807000006,八勢里,新北市淡水區八勢里中正東路二段143巷12弄9號,1.0,1604.0,竹圍派出所,,121.462961,25.147887
大樓,藍海社區,D807000007,八勢里,新北市淡水區八勢里中正東路二段111號,3.0,6835.0,竹圍派出所,,121.459674,25.151171
大樓,采風公寓大廈,D807000008,八勢里,新北市淡水區八勢里八勢二街20號,1.0,254.0,竹圍派出所,,121.460253,25.149574
大樓,海天溫泉社區,D807000009,八勢里,新北市淡水區八勢里八勢一街63巷21號,1.0,2104.0,竹圍派出所,,121.462506,25.155309
大樓,涵碧園社區,D807000010,八勢里,新北市淡水區八勢里八勢路50巷19弄15號,2.0,828.0,竹圍派出所,,121.463554,25.150685
大樓,南加州社區,D807000011,民生里,新北市淡水區民生里民權路19號,3.0,8718.0,竹圍派出所,,121.459956,25.14165
大樓,藝大MUCH社區,D807000015,福德里,新北市淡水區福德里自強路8號,1.0,751.0,竹圍派出所,,121.464611,25.125138
大樓,水紀元社區,D807000016,民權里,新北市淡水區民權里民權路193號,5.0,2028.0,竹圍派出所,,121.459356,25.133276
大樓,玄泰樂社區,D807000017,八勢里,新北市淡水區八勢里紅樹林路223號,2.0,191.0,竹圍派出所,,121.46133,25.155412
公寓,新北市淡水區竹圍國民小學,D807000018,八勢里,新北市淡水區八勢里中正東路二段145號,1.0,93.0,竹圍派出所,,121.460248,25.147533
大樓,馥品水季社區,D807000019,八勢里,新北市淡水區八勢里中正東路二段143巷6弄3號,1.0,349.0,竹圍派出所,,121.461303,25.147205
大樓,雲水社區,D807000020,八勢里,新北市淡水區八勢里八勢路50巷74號,1.0,987.0,竹圍派出所,,121.461828,25.149409
大樓,璟苑社區,D807000023,八勢里,新北市淡水區八勢里八勢路50巷5弄8號8,1.0,622.0,竹圍派出所,,121.464086,25.151238
大樓,海闊天高社區,D807000024,八勢里,新北市淡水區八勢里中正東路二段25巷2號,1.0,816.0,竹圍派出所,,121.45927,25.158104
大樓,幸福捷境社區,D807000025,八勢里,新北市淡水區八勢里八勢一街63巷8號,1.0,615.0,竹圍派出所,,121.462745,25.15488
大樓,舒伯特社區,D807000026,八勢里,新北市淡水區八勢里中正東路二段107巷1號,1.0,211.0,竹圍派出所,,121.459914,25.151713
大樓,沐川社區,D807000027,八勢里,新北市淡水區八勢里八勢路50巷82號,1.0,423.0,竹圍派出所,,121.461823,25.149116
大樓,璞鼎社區,D807000028,福德里,新北市淡水區福德里自強路309巷12號,1.0,84.0,竹圍派出所,,121.462334,25.132563
大樓,海天山莊社區,D807000029,八勢里,新北市淡水區八勢里八勢一街31巷9弄5號,1.0,182.0,竹圍派出所,,121.462124,25.15798
大樓,大廈,D807000030,福德里,新北市淡水區福德里自強路110號1,1.0,102.0,竹圍派出所,,121.46216,25.131617
大樓,河美社區,D807000031,八勢里,新北市淡水區八勢里中正東路二段88巷37號23,1.0,322.0,竹圍派出所,,121.459185,25.143409
大樓,水景匯社區,D807000032,民權里,新北市淡水區民權里民權路207號,1.0,466.0,竹圍派出所,,121.45895,25.132298
大樓,泊山石社區,D807000033,八勢里,新北市淡水區八勢里八勢一街65號,1.0,404.0,竹圍派出所,,121.461987,25.155185
大樓,海頓社區,D807000034,八勢里,新北市淡水區八勢里中正東路二段105巷3號,1.0,394.0,竹圍派出所,,121.460415,25.15211
大樓,香草天空社區,D807000035,民生里,新北市淡水區民生里竹林路152號,1.0,173.0,竹圍派出所,,121.462725,25.142256
大樓,香草天空大江詠,D807000036,民生里,新北市淡水區民生里民權路3巷12弄32號,1.0,191.0,竹圍派出所,,121.461381,25.141729
大樓,頤海大院社區,D807000037,八勢里,新北市淡水區八勢里中正東路二段165號,1.0,1620.0,竹圍派出所,,121.460007,25.145071
大樓,大謙社區,D807000038,八勢里,新北市淡水區八勢里八勢路50巷8弄26號,1.0,451.0,竹圍派出所,,121.461601,25.151848
大樓,海天山莊社區,D807000039,八勢里,新北市淡水區八勢里八勢一街31巷3弄1-1號,1.0,181.0,竹圍派出所,,121.46136,25.156973
大樓,18樂社區,D807000040,八勢里,新北市淡水區八勢里八勢一街39巷18號,1.0,524.0,竹圍派出所,,121.463558,25.157736
大樓,藝樹殿堂社區,D807000041,福德里,新北市淡水區福德里自強路118巷19號,2.0,521.0,竹圍派出所,,121.464501,25.132006
