區公所,EOA00109,桃園市復興區中正路20號,2.0,"809 ",大溪分局,
大樓,EOA00163,桃園市大溪區南興里9鄰仁和路二段365號,1.0,"972 ",大溪分局,
其它,EPA00001,明德里,中壢區8鄰衡陽街85號,1,253.0
公寓,EPA00002,普強里,中壢區利民路42號,1,981.0
大樓,EPA00007,仁義里,中壢區中華路二段330號,1、2,4730.0
教育機構,EPA00009,明德里,中壢區21鄰廣州路25號,1,1597.0
公寓,EPA00010,龍昌里,中壢區27鄰龍昌路232號,1,560.0
公寓,EPA00011,龍昌里,中壢區8鄰龍昌路254號,1,693.0
公寓,EPA00014,龍興里,中壢區13鄰龍岡路二段407號,1,800.0
其它,EPA00016,龍東里,中壢區1鄰龍東路445巷309號,1,266.0
大樓,EPA00017,龍昌里,中壢區27鄰龍昌路238巷50號,1,1120.0
其它,EPA00020,普強里,中壢區國泰街131號,1,240.0
大樓,EPA00021,明德里,中壢區內江路18號,1,5202.0
大樓,EPA00022,中興里,中壢區6鄰永福路780號,1、2,1093.0
大樓,EPA00025,普仁里,中壢區新中北路36號,1,1533.0
其它,EPA00029,普義里,中壢區17鄰四維路16號,1,194.0
大樓,EPA00031,明德里,中壢區惠州街80號,1,1272.0
其它,EPA00034,仁義里,中壢區10鄰延平路24號,1,213.0
其它,EPA00035,仁義里,中壢區10鄰延平路22號,1,210.0
其它,EPA00037,龍興里,中壢區20鄰龍岡路三段133號,1,37.0
其它,EPA00038,信義里,中壢區福州路125號,1,38.0
其它,EPA00039,明德里,中壢區龍岡路二段109號,1,32.0
其它,EPA00041,明德里,中壢區南雄街25號,1,34.0
大樓,EPA00042,信義里,中壢區廣州路222號,1,1269.0
公寓,EPA00043,普忠里,中壢區新中一街12號,1,608.0
其它,EPA00044,普強里,中壢區中山東路二段10號,1,297.0
公寓,EPA00045,普強里,中壢區民享街5號,1,796.0
其它,EPA00047,信義里,中壢區20鄰衡陽街30號,1,356.0
其它,EPA00048,信義里,中壢區17鄰成都路56號,1,318.0
其它,EPA00052,正義里,中壢區新興北街31號,1,26.0
其它,EPA00053,普仁里,中壢區新中北路34巷4號,1,80.0
其它,EPA00056,仁義里,中壢區普義路180號,1,80.0
其它,EPA00057,正義里,中壢區中北路二段357號,1,21.0
其它,EPA00059,普強里,中壢區19鄰中山東路二段116號,1,53.0
其它,EPA00060,普強里,中壢區19鄰中山東路二段152號,1,53.0
其它,EPA00061,普強里,中壢區19鄰中山東路二段156號,1,54.0
其它,EPA00062,普仁里,中壢區環中東路912號,1,106.0
其它,EPA00065,龍東里,中壢區22鄰龍東路29巷120弄29號,1,26.0
其它,EPA00068,明德里,中壢區桂林街23號,1,70.0
其它,EPA00073,普仁里,中壢區弘揚路29號,1,93.0
其它,EPA00074,正義里,中壢區中北路二段373巷5弄10號,1,18.0
其它,EPA00077,信義里,中壢區廣州路211號,1,126.0
其它,EPA00078,信義里,中壢區廣州路209號,1,133.0
其它,EPA00080,正義里,中壢區中北路二段416號,1,53.0
其它,EPA00081,正義里,中壢區中北路二段402號,1,40.0
其它,EPA00085,信義里,中壢區中北路二段402號之1,1,32.0
其它,EPA00086,正義里,中壢區中北路二段326號,1,30.0
其它,EPA00089,正義里,中壢區中北路二段369號,1,21.0
其它,EPA00095,正義里,中壢區中北路二段432號,1,36.0
其它,EPA00097,德義里,中壢區4鄰中山東路一段7號,1,30.0
公寓,EPA00098,德義里,中壢區15鄰永康三街13號,1,446.0
其它,EPA00100,正義里,中壢區金山一街33號,1,40.0
其它,EPA00101,信義里,中壢區廣州路202號,1,32.0
其它,EPA00102,信義里,中壢區嘉善街14號,1,17.0
其它,EPA00104,明德里,中壢區昆明街31號,1,64.0
其它,EPA00105,信義里,中壢區廈門路213號,1,40.0
其它,EPA00107,普仁里,中壢區日新路39號,1,33.0
其它,EPA00109,普強里,中壢區莒光路58號,1,45.0
其它,EPA00111,普忠里,中壢區實踐路108號,1,160.0
其它,EPA00112,後寮里,中壢區後興路二段270巷11號,1,82.0
其它,EPA00123,正義里,中壢區中北路二段345號,1,22.0
其它,EPA00124,正義里,中壢區中北路二段359號,1,22.0
其它,EPA00127,健行里,中壢區龍岡路一段133號,1,181.0
其它,EPA00128,普仁里,中壢區日新路86號,1,166.0
公寓,EPA00129,普義里,中壢區溪洲三路71號,1,400.0
其它,EPA00130,信義里,中壢區廈門路73號,1,34.0
其它,EPA00132,信義里,中壢區廣州路143號,1,32.0
其它,EPA00134,普忠里,中壢區大仁二街8號,1,77.0
其它,EPA00135,明德里,中壢區龍山街11號,1,60.0
其它,EPA00136,普仁里,中壢區協同街51號,1,136.0
其它,EPA00138,正義里,中壢區蘭州二街22號,1,98.0
其它,EPA00141,普仁里,中壢區實踐路25號,1,153.0
其它,EPA00142,信義里,中壢區福州路75號,1,38.0
其它,EPA00143,普仁里,中壢區環中東路850號之4,1,160.0
其它,EPA00149,龍平里,中壢區18鄰前龍路11號,1,25.0
其它,EPA00151,普仁里,中壢區力行北街35號,1,86.0
其它,EPA00152,普仁里,中壢區實踐路105號,1,80.0
其它,EPA00153,普忠里,中壢區大仁四街11號,1,120.0
其它,EPA00154,明德里,中壢區環中東路二段362號,1,49.0
其它,EPA00155,普義里,中壢區八德路56號,1,82.0
其它,EPA00156,明德里,中壢區苑平路3號,1,46.0
其它,EPA00158,正義里,中壢區寶慶路54號,1,34.0
其它,EPA00159,信義里,中壢區廈門路65號,1,58.0
其它,EPA00160,普仁里,中壢區三和二街17號,1,133.0
其它,EPA00162,信義里,中壢區甘肅一路29號,1,32.0
其它,EPA00163,仁義里,中壢區中山東路一段223巷129弄2號,1,113.0
公寓,EPA00164,普強里,中壢區民享街38號,1,889.0
公寓,EPA00165,普仁里,中壢區力行北路53號,1,740.0
其它,EPA00166,普仁里,中壢區力行北路47號,1,113.0
其它,EPA00168,明德里,中壢區環中東路二段650號,1,37.0
其它,EPA00170,仁義里,中壢區普義路130號,1,42.0
其它,EPA00171,後寮里,中壢區後興路一段52巷7號,1,133.0
公寓,EPA00172,明德里,中壢區吉長二街190號,1,400.0
其它,EPA00173,信義里,中壢區福州路121號,1,34.0
其它,EPA00176,龍興里,中壢區12鄰龍岡路三段295號,1,26.0
其它,EPA00177,龍興里,中壢區20鄰龍岡路三段301號,1,53.0
其它,EPA00179,普強里,中壢區莒光路94號,1,26.0
其它,EPA00180,普忠里,中壢區大仁一街49號,1,306.0
其它,EPA00182,普忠里,中壢區大仁二街8號,1,80.0
其它,EPA00184,龍興里,中壢區20鄰龍岡路三段291號,1,26.0
其它,EPA00185,龍興里,中壢區12鄰龍岡路三段299號,1,70.0
其它,EPA00186,龍興里,中壢區12鄰龍岡路三段297號,1,24.0
其它,EPA00187,龍興里,中壢區20鄰龍岡路三段293號,1,25.0
其它,EPA00189,龍平里,中壢區17鄰龍東路220號,1,48.0
其它,EPA00190,正義里,中壢區中北路二段378號,1,34.0
其它,EPA00193,明德里,中壢區20鄰衡陽街28號,1,41.0
其它,EPA00194,明德里,中壢區環中東路二段648號,1,33.0
其它,EPA00197,明德里,中壢區衡陽街28號,1,30.0
教育機構,EPA00198,明德里,中壢區廣州路25號,1,474.0
其它,EPA00200,普仁里,中壢區新中北路34巷2弄9號,1,106.0
大樓,EPA00201,普仁里,中壢區弘揚路50號,1,1360.0
其它,EPA00203,普強里,中壢區國泰街105號,1,37.0
其它,EPA00206,信義里,中壢區杭州路33號,1,202.0
其它,EPA00207,普仁里,中壢區治平街51號,1,73.0
其它,EPA00208,普強里,中壢區民享街8號,1,44.0
其它,EPA00209,普仁里,中壢區協同街12及14號,1,73.0
其它,EPA00210,普強里,中壢區中山東路二段12號,1,32.0
其它,EPA00211,仁義里,中壢區延平路24號,1,202.0
其它,EPA00213,普仁里,中壢區治平街11號,1,56.0
其它,EPA00215,普仁里,中壢區治平街7號,1,53.0
其它,EPA00217,普強里,中壢區中山東路二段14號,1,30.0
其它,EPA00219,普忠里,中壢區大仁五街13號,1,60.0
其它,EPA00221,普強里,中壢區民有街25號,1,41.0
其它,EPA00222,普強里,中壢區民有街27號,1,34.0
其它,EPA00224,信義里,中壢區福州路74號,1,133.0
其它,EPA00225,正義里,中壢區中北路二段330號,1,44.0
其它,EPA00226,正義里,中壢區東明街84號,1,32.0
其它,EPA00228,信義里,中壢區潮州街16號,1,72.0
其它,EPA00229,信義里,中壢區廣州路199號,1,32.0
其它,EPA00235,明德里,中壢區桂林街2號,1,45.0
其它,EPA00237,龍平里,中壢區19鄰龍東路82號,1,34.0
其它,EPA00239,信義里,中壢區嘉興二街20號,1,57.0
其它,EPA00240,信義里,中壢區廣州路160號,1,33.0
大樓,EPA00241,德義里,中壢區中山東路一段149號,1,1333.0
其它,EPA00246,普仁里,中壢區三和三街15號,1,60.0
其它,EPA00248,普仁里,中壢區三和三路7號,1,113.0
其它,EPA00253,普仁里,中壢區環中東路908號,1,46.0
其它,EPA00254,普仁里,中壢區環中東路898號,1,42.0
其它,EPA00255,普強里,中壢區民有街25號,1,44.0
其它,EPA00258,普仁里,中壢區力行北街11號,1,46.0
其它,EPA00259,正義里,中壢區中北路二段377號,1,77.0
其它,EPA00264,信義里,中壢區廣州路144號,1,40.0
其它,EPA00267,正義里,中壢區寶慶路56號,1,45.0
大樓,EPA00271,龍平里,中壢區7鄰龍江路54號,1,2080.0
其它,EPA00272,里,中壢區金山街16號,1,146.0
公家機構,EPA00275,至善里,中壢區11鄰中山東路三段372號,1,1734.0
教育機構,EPA00283,普忠里,中壢區中北路200號,1,2658.0
其它,EPA00287,明德里,中壢區桂林街74號,1,117.0
其它,EPA00288,明德里,中壢區五華路53號,1,80.0
其它,EPA00294,明德里,中壢區惠州路120號,1,53.0
其它,EPA00295,新興里,中壢區15鄰金山街9號,1,36.0
其它,EPA00296,信義里,中壢區福州路143號,1,32.0
其它,EPA00298,明德里,中壢區惠州路54號,1,54.0
其它,EPA00300,德義里,中壢區永康二路36號,1,178.0
其它,EPA00303,普仁里,中壢區環中東路900號,1,33.0
公寓,EPA00307,德義里,中壢區26鄰永康路26號,1,544.0
其它,EPA00309,明德里,中壢區桂林街85號,1,96.0
其它,EPA00310,明德里,中壢區桂林街83號,1,42.0
其它,EPA00311,正義里,中壢區東明街84號,1,34.0
其它,EPA00312,正義里,中壢區中北路二段330號,1,46.0
其它,EPA00315,普忠里,中壢區新中一街10巷11號,1,46.0
其它,EPA00319,正義里,中壢區廣州路199號,1,30.0
其它,EPA00323,仁義里,中壢區中山東路一段223巷129弄10號,1,153.0
其它,EPA00326,仁義里,中壢區中山東路一段223巷129弄4號,1,52.0
其它,EPA00327,仁義里,中壢區中山東路一段223巷129弄4號之2,1,101.0
其它,EPA00328,仁義里,中壢區中山東路一段223巷129弄4號之6,1,101.0
其它,EPA00329,仁義里,中壢區中山東路一段223巷129弄4號之8,1,146.0
其它,EPA00331,仁義里,中壢區中山東路一段223巷129弄6號之4,1,101.0
其它,EPA00332,仁義里,中壢區中山東路一段223巷129弄6號之6,1,101.0
其它,EPA00333,仁義里,中壢區中山東路一段223巷129弄12號之6,1,101.0
其它,EPA00335,正義里,中壢區中北路二段437巷9弄6號,1,66.0
其它,EPA00336,信義里,中壢區20鄰潮州街20號,1,78.0
其它,EPA00342,信義里,中壢區20鄰衡陽街8號,1,37.0
其它,EPA00345,正義里,中壢區漢口路47號,1,42.0
其它,EPA00346,普慶里,中壢區14鄰金鋒二路65巷2號,1,266.0
其它,EPA00352,信義里,中壢區甘肅一路31號,1,61.0
其它,EPA00353,普強里,中壢區環中東路二段2號,1,40.0
其它,EPA00357,普強里,中壢區20鄰國泰街12號,1,40.0
其它,EPA00361,正義里,中壢區中北路二段446號,1,240.0
其它,EPA00362,信義里,中壢區廣州路149號,1,45.0
其它,EPA00363,信義里,中壢區福州路71號,1,62.0
其它,EPA00364,正義里,中壢區寶慶路48號,1,41.0
公寓,EPA00367,正義里,中壢區中北路二段437巷8號,1,400.0
教育機構,EPA00373,內定里,中壢區1鄰安寧路31號,1,669.0
公寓,EPA00374,內定里,中壢區1鄰高邊路1號,1,453.0
其它,EPA00377,復興里,中壢區18鄰自強四路9號,1,365.0
大樓,EPA00378,文化里,中壢區13鄰合江路2號,1,5465.0
公寓,EPA00379,內定里,中壢區1鄰合定路26號之1,1,413.0
其它,EPA00381,內定里,中壢區1鄰合定路4號,1,246.0
公寓,EPA00382,復興里,中壢區6鄰自強一路4號,1,952.0
其它,EPA00383,信義里,中壢區福州路132號,1,25.0
其它,EPA00384,信義里,中壢區廈門路159號,1,32.0
其它,EPA00391,後寮里,中壢區中山東路二段510號,1,25.0
其它,EPA00392,中建里,中壢區8鄰大同路154號,1,58.0
其它,EPA00396,中建里,中壢區8鄰大同路158號,1,69.0
其它,EPA00397,中建里,中壢區9鄰中平路208號,1,56.0
其它,EPA00398,中建里,中壢區8鄰大同路166號,1,64.0
其它,EPA00400,中建里,中壢區8鄰大同路162號,1,205.0
其它,EPA00404,中建里,中壢區9鄰中平路204號,1,56.0
其它,EPA00405,中建里,中壢區9鄰中平路200號,1,65.0
其它,EPA00406,振興里,中壢區10鄰龍岡路三段154號,1,226.0
公寓,EPA00407,振興里,中壢區10鄰龍岡路三段8號,1、2,413.0
公家機構,EPA00411,中央里,中壢區22鄰延平路499號,1,1565.0
公寓,EPA00412,石頭里,中壢區14鄰興建街12號,1、2,457.0
公寓,EPA00414,興南里,中壢區5鄰延平路466號,1、2,616.0
大樓,EPA00415,普義里,中壢區普義路173號,1、2,1896.0
大樓,EPA00416,普仁里,中壢區新中北路151號,1,1785.0
公寓,EPA00417,仁福里,中壢區25鄰仁福五街13號(4386037),1,588.0
其它,EPA00418,新興里,中壢區21鄰林森路160號,1,381.0
其它,EPA00419,東興里,中壢區7鄰東興路76號,1,177.0
大樓,EPA00420,新興里,中壢區逢甲一路7號,1、2,1624.0
公寓,EPA00421,中建里,中壢區8鄰大同路136號,1,769.0
其它,EPA00422,中建里,中壢區2鄰中山路222號,1,192.0
其它,EPA00423,中建里,中壢區2鄰中山路228巷20號,1,162.0
教育機構,EPA00425,普慶里,中壢區中山東路二段425號,1、2,1057.0
大樓,EPA00426,至善里,中壢區後寮一路138號,1,6849.0
其它,EPA00428,信義里,中壢區甘肅三街60號,1、2,392.0
公寓,EPA00429,中興里,中壢區13鄰榮安九街6號,1、2,956.0
大樓,EPA00430,中原里,中壢區2鄰興農路125號,1,1732.0
大樓,EPA00431,莊敬里,中壢區18鄰莊敬路146號,1,2309.0
其它,EPA00433,內定里,中壢區1鄰新北園路14號,1,148.0
其它,EPA00434,內定里,中壢區1鄰合定路23號,1,118.0
大樓,EPA00435,山東里,中壢區4鄰中正路四段598號,1、2,1593.0
大樓,EPA00437,中央里,中壢區22鄰延平路429號,1,1222.0
大樓,EPA00438,新興里,中壢區21鄰林森路122號,1,1622.0
大樓,EPA00440,普仁里,中壢區中北路200號(中原大學),1,2925.0
其它,EPA00441,忠孝里,中壢區1鄰忠孝路162號,1,324.0
其它,EPA00442,內定里,中壢區1鄰安定路1號,1、2,118.0
其它,EPA00443,中榮里,中壢區3鄰中正路141號,1、2,349.0
公寓,EPA00444,石頭里,中壢區3鄰中山路119號,1,608.0
公寓,EPA00445,信義里,中壢區福州路201號,1,488.0
其它,EPA00446,龍德里,中壢區1鄰龍岡路三段19號,1、2,133.0
大樓,EPA00447,後寮里,中壢區中山東路二段510號,1,26776.0
大樓,EPA00449,文化里,中壢區13鄰北園路24號,1,2268.0
大樓,EPA00450,文化里,中壢區25鄰自強一路121號,1,1845.0
大樓,EPA00451,興平里,中壢區12鄰中豐北路63號,1,1101.0
公家機構,EPA00452,五權里,中壢區3鄰民族路三段260號,1,8741.0
教育機構,EPA00453,五權里,中壢區7鄰中大路38號,1、2,2756.0
大樓,EPA00454,自強里,中壢區13鄰莊敬路127號,1、2,4906.0
大樓,EPA00455,成功里,中壢區9鄰成章三街143巷3號,1,6325.0
其它,EPA00456,過嶺里,中壢區高鐵南路四段998號,1、2,146.0
大樓,EPA00457,水尾里,中壢區33鄰元化路357號,1、2,7416.0
大樓,EPA00458,興南里,中壢區11鄰中美路一段18號,1,3480.0
教育機構,EPA00459,光明里,中壢區三光路115號,1,1853.0
其它,EPA00460,永光里,中壢區16鄰民權路三段334巷52號,1,272.0
教育機構,EPA00461,光明里,中壢區20鄰中央西路二段97號,1,2796.0
公寓,EPA00462,光明里,中壢區24鄰王子街1號,1、2,718.0
大樓,EPA00463,三民里,中壢區16鄰三光路58號,1,1102.0
其它,EPA00464,舊明里,中壢區22鄰民族路55號,1,385.0
教育機構,EPA00465,永福里,中壢區9鄰西園路447號,1、2,2373.0
大樓,EPA00466,忠福里,中壢區28鄰福安二街50號,1,1860.0
其它,EPA00467,永光里,中壢區7鄰民權路二段17號,1,129.0
其它,EPA00468,永光里,中壢區7鄰環西路二段328號,1,120.0
大樓,EPA00470,永光里,中壢區18鄰三光路317號,1,3000.0
公寓,EPA00472,新明里,中壢區11鄰中央西路二段270號,1,618.0
教育機構,EPA00473,光明里,中壢區20鄰中央西路二段97號,1,477.0
大樓,EPA00475,光明里,中壢區光輝二路17巷1號,1,1021.0
其它,EPA00476,永光里,中壢區18鄰環北路39號,1,68.0
其它,EPA00477,光明里,中壢區13鄰三光路126號,1,49.0
教育機構,EPA00479,五權里,中壢區3鄰中大路38號,1,954.0
教育機構,EPA00482,五權里,中壢區3鄰中大路38號,1,2022.0
其它,EPA00486,五福里,中壢區8鄰民族路310巷10號,1,56.0
其它,EPA00491,五福里,中壢區5鄰環西路28號,1,53.0
其它,EPA00492,五福里,中壢區5鄰環西路20號,1,44.0
其它,EPA00508,五福里,中壢區5鄰民族路310巷7號,1,36.0
其它,EPA00509,五福里,中壢區5鄰民族路310巷9號,1,36.0
其它,EPA00511,五福里,中壢區5鄰民族路310巷15號,1,48.0
其它,EPA00513,五權里,中壢區21鄰環西路81號,1,224.0
其它,EPA00514,五福里,中壢區8鄰民族路310巷28號,1,74.0
其它,EPA00518,光明里,中壢區38鄰王子街52號,1,126.0
大樓,EPA00519,光明里,中壢區35鄰白馬莊路120號,1,4057.0
公寓,EPA00525,光明里,中壢區37鄰王子街74號,1,741.0
公寓,EPA00526,光明里,中壢區36鄰王子街76號,1,748.0
其它,EPA00528,光明里,中壢區33鄰白馬莊路92號,1,52.0
公寓,EPA00529,光明里,中壢區26鄰中央西路二段231號,1,801.0
其它,EPA00532,光明里,中壢區29鄰三光路128號,1,53.0
其它,EPA00533,興平里,中壢區2鄰新生路273號,1,36.0
其它,EPA00534,五權里,中壢區正明街10號,1,65.0
其它,EPA00537,五權里,中壢區16鄰正光街84號,1,180.0
其它,EPA00540,仁義里,中壢區普義路176號,1,66.0
其它,EPA00541,正義里,中壢區新興北路22號,1,277.0
公寓,EPA00543,普仁里,中壢區實踐路91巷11號,1,560.0
其它,EPA00545,普仁里,中壢區日新路33號,1,53.0
其它,EPA00546,普仁里,中壢區日新路35號,1,53.0
其它,EPA00548,普仁里,中壢區弘揚路81號,1,93.0
其它,EPA00549,普仁里,中壢區日新路74號,1,160.0
其它,EPA00551,信義里,中壢區長沙路123號,1,38.0
教育機構,EPA00552,明德里,中壢區龍岡路二段29號,1,18.0
其它,EPA00563,明德里,中壢區龍岡路二段75號,1,168.0
公寓,EPA00573,後寮里,中壢區龍和二街360號,1,780.0
大樓,EPA00574,後寮里,中壢區龍興路590號,1,4685.0
大樓,EPA00577,德義里,中壢區永康三街37號,1,1240.0
大樓,EPA00578,信義里,中壢區甘肅一路14號,1,4284.0
公寓,EPA00579,普義里,中壢區八德路59號,1,650.0
大樓,EPA00582,信義里,中壢區廈門路17號,1,1158.0
其它,EPA00583,普強里,中壢區國泰街97號,1,146.0
公寓,EPA00584,明德里,中壢區吉長路51號,1,613.0
大樓,EPA00589,普義里,中壢區普義路171號,1,1040.0
其它,EPA00591,後寮里,中壢區龍興路403號,1,234.0
其它,EPA00594,仁義里,中壢區中山東路一段223巷129弄43號,1,53.0
其它,EPA00596,仁義里,中壢區中山東路一段223巷131號,1,132.0
大樓,EPA00599,普仁里,中壢區協同街112號,1,2000.0
其它,EPA00601,仁義里,中壢區中山東路一段223巷129弄39號之2,1,100.0
其它,EPA00602,仁義里,中壢區中山東路一段223巷129弄37號,1,52.0
其它,EPA00603,仁義里,中壢區中山東路一段223巷129弄41號之4,1,120.0
其它,EPA00604,仁義里,中壢區中山東路一段223巷129弄41號,1,52.0
其它,EPA00607,仁義里,中壢區中山東路一段223巷129弄43號之4,1,100.0
其它,EPA00608,仁義里,中壢區中山東路一段223巷129弄43號之2,1,106.0
其它,EPA00610,仁義里,中壢區中山東路一段223巷129弄18號之8,1,196.0
其它,EPA00611,仁義里,中壢區中山東路一段223巷129弄18號之6,1,106.0
其它,EPA00612,仁義里,中壢區中山東路一段223巷129弄18號之4,1,108.0
其它,EPA00614,普仁里,中壢區中北路34巷4號,1,80.0
其它,EPA00615,正義里,中壢區新興北路31號,1,26.0
其它,EPA00619,信義里,中壢區17鄰成都路56號,1,318.0
其它,EPA00620,信義里,中壢區20鄰衡陽街30號,1,356.0
公寓,EPA00622,普強里,中壢區民享街5號,1,796.0
其它,EPA00623,普強里,中壢區中山東路二段10號,1,297.0
公寓,EPA00624,普忠里,中壢區新中一街12號,1,608.0
大樓,EPA00625,信義里,中壢區廣州路222號,1,1269.0
其它,EPA00626,明德里,中壢區南雄街25號,1,34.0
其它,EPA00628,明德里,中壢區南雄街21號,1,86.0
公寓,EPA00629,正義里,中壢區中北路二段316號,1,713.0
其它,EPA00630,信義里,中壢區福州路179號,1,312.0
公寓,EPA00631,信義里,中壢區甘肅二街30號,1,420.0
其它,EPA00632,仁義里,中壢區普義路124號,1,38.0
其它,EPA00636,普強里,中壢區莒光路48號,1、2,390.0
公寓,EPA00637,普強里,中壢區新中北路404號,1,534.0
其它,EPA00638,普忠里,中壢區大仁街35巷31號,1,80.0
其它,EPA00640,正義里,中壢區福州路24號,1,22.0
其它,EPA00641,正義里,中壢區福州路26號,1,22.0
其它,EPA00642,正義里,中壢區新興北路19號,1,25.0
其它,EPA00643,正義里,中壢區新興北路23號,1,24.0
其它,EPA00645,普強里,中壢區和祥路6號,1,72.0
大樓,EPA00650,德義里,中壢區中山東路一段151號,1,1276.0
其它,EPA00652,普仁里,中壢區幸福街37號,1,46.0
其它,EPA00653,普仁里,中壢區日新路104號,1,46.0
其它,EPA00654,普仁里,中壢區新中北路34巷4號,1,80.0
其它,EPA00656,信義里,中壢區潮州街5號,1,58.0
其它,EPA00657,普仁里,中壢區協同二路9巷1號,1,66.0
其它,EPA00662,普強里,中壢區和祥路84號,1,26.0
其它,EPA00664,信義里,中壢區福州路151號,1,44.0
其它,EPA00665,正義里,中壢區中北路二段347號,1,21.0
其它,EPA00666,正義里,中壢區中北路二段349號,1,21.0
其它,EPA00670,興平里,中壢區10鄰中豐路204號,1,20.0
其它,EPA00671,興國里,中壢區3鄰中美路二段120號,1,49.0
其它,EPA00672,興國里,中壢區5鄰中豐路21號,1,52.0
其它,EPA00673,興平里,中壢區10鄰中豐路216號,1,56.0
其它,EPA00676,舊明里,中壢區5鄰民權路52號,1,73.0
其它,EPA00678,舊明里,中壢區7鄰長安路11號,1,33.0
其它,EPA00680,舊明里,中壢區9鄰義民路40號,1,68.0
其它,EPA00682,五福里,中壢區4鄰民族路306號,1,88.0
其它,EPA00685,五福里,中壢區4鄰民族路174號,1,302.0
其它,EPA00686,五福里,中壢區4鄰民族路268號,1,114.0
其它,EPA00689,五權里,中壢區19鄰民族路二段158號,1,33.0
其它,EPA00690,五權里,中壢區19鄰民族路二段162號,1,77.0
公寓,EPA00691,光明里,中壢區4鄰民權路362號,1,472.0
公寓,EPA00694,光明里,中壢區19鄰明德路280號,1,737.0
其它,EPA00695,光明里,中壢區17鄰中央西路二段61號,1,65.0
公寓,EPA00698,光明里,中壢區17鄰民權路157號,1,689.0
公寓,EPA00701,光明里,中壢區20鄰新明路117號,1、2,509.0
大樓,EPA00702,光明里,中壢區13鄰民權路226號,1,1344.0
其它,EPA00703,三民里,中壢區12鄰環西路二段71巷10號,1,82.0
其它,EPA00707,三民里,中壢區15鄰中正路712號,1,100.0
其它,EPA00708,三民里,中壢區17鄰環西路二段15號,1,53.0
大樓,EPA00711,永光里,中壢區18鄰環北路73號,1,4014.0
其它,EPA00712,永光里,中壢區6鄰環北路86號,1,40.0
其它,EPA00716,三民里,中壢區16鄰中正路624號,1,86.0
教育機構,EPA00718,三民里,中壢區13鄰中央西路二段300號,1,1938.0
教育機構,EPA00720,三民里,中壢區13鄰中央西路二段300號,1,4782.0
教育機構,EPA00721,三民里,中壢區13鄰中央西路二段300號,1,769.0
教育機構,EPA00722,三民里,中壢區13鄰中央西路二段300號,1,693.0
其它,EPA00724,三民里,中壢區11鄰環西路二段247號,1,129.0
其它,EPA00726,興平里,中壢區5鄰中豐路49巷11號,1,46.0
其它,EPA00727,興平里,中壢區7鄰中豐路70號,1,105.0
其它,EPA00728,興平里,中壢區14鄰環北路168巷2弄11號,1,138.0
其它,EPA00729,興平里,中壢區7鄰中豐路72號,1,81.0
公寓,EPA00732,興平里,中壢區5鄰中豐路49巷17號,1,557.0
其它,EPA00737,新明里,中壢區5鄰中明路16號,1,197.0
公寓,EPA00738,新明里,中壢區6鄰中山路438號,1,437.0
大樓,EPA00739,新明里,中壢區4鄰中明東路9號,1,1034.0
其它,EPA00740,新明里,中壢區6鄰中山路452號,1,102.0
其它,EPA00741,新明里,中壢區4鄰民權路96號,1,40.0
其它,EPA00742,新明里,中壢區2鄰中明東路17號,1,48.0
其它,EPA00744,新明里,中壢區1鄰中央西路二段26號,1,44.0
其它,EPA00746,新明里,中壢區1鄰中央西路二段2號,1,58.0
其它,EPA00749,新明里,中壢區17鄰新榮街28號,1、2,77.0
大樓,EPA00750,新明里,中壢區14鄰中央西路二段152號,1,1438.0
其它,EPA00752,新明里,中壢區11鄰三樂二街28號,1,156.0
其它,EPA00753,新明里,中壢區15鄰中正路586號,1,165.0
其它,EPA00754,新明里,中壢區11鄰中央西路二段282號,1,366.0
其它,EPA00756,五福里,中壢區3鄰五族街197號,1,148.0
大樓,EPA00761,五權里,中壢區12鄰五光三街53號,1,1220.0
大樓,EPA00762,五福里,中壢區10鄰志廣路71號,1,1056.0
公寓,EPA00767,新明里,中壢區13鄰中山路465號,1,872.0
其它,EPA00768,新明里,中壢區10鄰中山路580號,1,28.0
其它,EPA00769,新明里,中壢區9鄰新明路39號,1,45.0
其它,EPA00771,新明里,中壢區7鄰中央西路二段100號,1,22.0
其它,EPA00773,新明里,中壢區7鄰中新路30號,1,80.0
其它,EPA00775,新明里,中壢區8鄰新明路18號,1,30.0
其它,EPA00776,新明里,中壢區9鄰新明路37號,1、2,45.0
其它,EPA00779,新明里,中壢區13鄰新明路7號,1,205.0
其它,EPA00780,中正里,中壢區15鄰榮民路253號,1,268.0
其它,EPA00781,中原里,中壢區11鄰忠孝路43號,1,209.0
教育機構,EPA00782,自強里,中壢區9鄰榮民路80號,1,318.0
