大樓,汴洲里,桃園區汴洲里14鄰健行路112號,1、2、3,1864.0,桃園分局,
公寓,西埔里,桃園區西埔里1鄰富國路437號,1,3296.0,桃園分局,
大樓,永安里,桃園區永安里15鄰中正三街146巷30號,1、2,205.0,桃園分局,
大樓,同安里,桃園區同安里同德六街77號,1、2、3、4,4873.0,桃園分局,
大樓,建國里,桃園區建國里10鄰桃鶯路62-2號,1、2、3,3938.0,桃園分局,
公寓,文中里,桃園區文中里文中路159號,1,265.0,桃園分局,
大樓,龍安里,桃園區龍安里國強11街63號,1、2、3,1928.0,桃園分局,
大樓,龍祥里,桃園區龍祥里中山路1306號,1、2、3,4785.0,桃園分局,
大樓,大樹里,桃園區興隆路7號,1、2,2373.0,桃園分局,
大樓,永興里,桃園區永興里5鄰北新街83號,1、2,225.0,桃園分局,
大樓,建國里,桃園區建國里14鄰大林路5號,1、2,727.0,桃園分局,
大樓,汴洲里,桃園區汴洲里3鄰水汴一路131號,1、2、3,1226.0,桃園分局,
大樓,東山里,桃園區東山里春日路85號,1、2,264.0,桃園分局,
大樓,汴洲里,桃園區汴洲里13鄰大有路945巷27號,1、2,1922.0,桃園分局,
大樓,龍祥里,桃園區龍祥里中山路1308-3號,1、2,2544.0,桃園分局,
大樓,中平里,桃園區中平里20鄰壽昌街66號,1、2,1275.0,桃園分局,
大樓,瑞慶里,桃園區瑞慶里6鄰同德十二街358號,1、2、3,4832.0,桃園分局,
大樓,南埔里,桃園區溫州街28號,1、2、3,1429.0,桃園分局,
大樓,長安里,桃園區長安里8鄰中正五街129號,1、2、3,923.0,桃園分局,
大樓,中正里,桃園區中正里2鄰廈門街97號,1、2、3,3079.0,桃園分局,
大樓,寶慶里,桃園區寶慶里5鄰中埔二街216號,1、2、3,986.0,桃園分局,
大樓,新埔里,桃園區新埔里20鄰經國路200號,1、2、3,947.0,桃園分局,
大樓,新埔里,桃園區新埔里20鄰經國路192號,1、2、3,1126.0,桃園分局,
大樓,中山里,桃園區中山里13鄰泰昌九街46號,1、2,2635.0,桃園分局,
大樓,長德里,桃園區長德里16鄰愛二街182巷21號,1、2,1033.0,桃園分局,
大樓,同安里,桃園區同安里6鄰大興西路一段218號,1、2、3、4,2872.0,桃園分局,
大樓,福林里,桃園區福林里27鄰樹林一街10號,1、2,3080.0,桃園分局,
大樓,三民里,桃園區三民里17鄰成功路二段207號,1、2、3,2023.0,桃園分局,
大樓,南埔里,桃園區永安路810-1巷38號,1、2、3,2235.0,桃園分局,
大樓,南門里,桃園區南門里8鄰建國路348巷28-1號,1、2,1161.0,桃園分局,
公寓,龍安里,桃園區龍安里8鄰國強十一街96巷28號,1,235.0,桃園分局,
大樓,泰山里,桃園區泰山里4鄰中山路507巷27號,1、2,513.0,桃園分局,
大樓,中平里,桃園區中平里12鄰壽昌街22號,1、2、3,1752.0,桃園分局,
大樓,中山里,桃園區中山里29鄰中山路791號,1、2、3,3987.0,桃園分局,
大樓,慈文里,桃園區慈文里22鄰慈文路330號,1、2、3,1983.0,桃園分局,
公寓,青溪里,桃園區青溪里10鄰三民路二段51號,1,197.0,桃園分局,
大樓,文化里,桃園區文化里3鄰復興路166號,1、2、3、4,1640.0,桃園分局,
大樓,春日里,桃園區春日里18鄰大興路110號,1、2、3,1271.0,桃園分局,
公寓,大林里,桃園區大林里15鄰樹仁三街26號,1,723.0,桃園分局,
大樓,信光里,桃園區信光里3鄰民生路852號,1、2、3,833.0,桃園分局,
公寓,中德里,桃園區中德里15鄰國際路一段246號,1,94.0,桃園分局,
大樓,龍岡里,桃園區龍岡里20鄰文中路495號,1、2,904.0,桃園分局,
大樓,大林里,桃園區大林里6鄰大仁路50巷15號,1、2,1022.0,桃園分局,
大樓,新埔里,桃園區新埔里1鄰慈文路30號,1、2、3,3117.0,桃園分局,
大樓,龍鳳里,桃園區龍鳳里11鄰國豐三街106號,1、2、3,3484.0,桃園分局,
公寓,大林里,桃園區大林里6鄰大仁路50巷66號,1,692.0,桃園分局,
大樓,青溪里,桃園區青溪里3鄰鎮二街35號,1、2,1195.0,桃園分局,
大樓,同安里,桃園區同安里9鄰同德五街61號,1、2、3、4,4012.0,桃園分局,
大樓,中信里,桃園區中信里12鄰中山路956巷156號,1、2、3,2067.0,桃園分局,
大樓,同安里,桃園區同安里6鄰大興西路一段260號,1、2、3、4,1789.0,桃園分局,
大樓,同安里,桃園區同安里16鄰同德二街38號,1、2、3,4208.0,桃園分局,
大樓,新埔里,桃園區新埔里20鄰經國路208巷16號,1、2、3,1888.0,桃園分局,
大樓,會稽里,桃園區會稽里9鄰大有路726號,1、2、3,1936.0,桃園分局,
大樓,同安里,桃園區同安里6鄰大興西路一段266號,1、2、3、4,1873.0,桃園分局,
公寓,龍安里,桃園區龍安里8鄰龍安街157號,1,354.0,桃園分局,
大樓,同安里,桃園區同安里18鄰慈文路192號,1、2,1325.0,桃園分局,
公寓,大林里,桃園區大林里14鄰樹仁三街133號,1,1185.0,桃園分局,
大樓,會稽里,桃園區會稽里7鄰大興路290巷33號,1、2、3,5372.0,桃園分局,
大樓,三民里,桃園區三民里17鄰成功路二段169號,1、2、3,2716.0,桃園分局,
大樓,龍壽里,桃園區龍壽里4鄰龍泉二街49號,1、2、3、4,5952.0,桃園分局,
公寓,青溪里,桃園區青溪里4鄰鎮四街46號,1,572.0,桃園分局,
大樓,南埔里,桃園區大興西路二段293號,1、2、3,2426.0,桃園分局,
大樓,莊敬里,桃園區莊敬里22鄰中正路1398-1號,1、2、3,7275.0,桃園分局,
大樓,大林里,桃園區大林里11鄰樹仁三街15巷2號,1、2、3,4408.0,桃園分局,
大樓,信光里,桃園區信光里8鄰大連二街166號,1、2、3,1750.0,桃園分局,
大樓,大有里,桃園區大有里10鄰民富十三街25號,1、2、3,5098.0,桃園分局,
大樓,同安里,桃園區同安里9鄰中正路1066號,1、2,2276.0,桃園分局,
大樓,長美里,桃園區長美里1鄰民族路183號,1、2、3,1595.0,桃園分局,
大樓,東埔里,桃園區東埔里9鄰正康二街66號,1、2、3,2063.0,桃園分局,
大樓,莊敬里,桃園區莊敬里21鄰同安街568號,1、2、3,3440.0,桃園分局,
大樓,大有里,桃園區大有里11鄰大有路348號,1、2、3,8886.0,桃園分局,
大樓,自強里,桃園區自強里11鄰經國路741-8號,1、2、3,5188.0,桃園分局,
大樓,同安里,桃園區同安里3鄰同德一街9號,1、2、3,3384.0,桃園分局,
大樓,大業里,桃園區大業里16鄰民有十二街12號,1、2、3,2490.0,桃園分局,
大樓,大業里,桃園區大業里16鄰民有十二街11號,1、2、3,2331.0,桃園分局,
大樓,東山里,桃園區東山里15鄰春日路21號,1、2,268.0,桃園分局,
公寓,福林里,桃園區福林里10鄰陽明三街33號,1,939.0,桃園分局,
大樓,同安里,桃園區同安里9鄰同德六街89號,1、2、3,1412.0,桃園分局,
大樓,永興里,桃園區永興里4鄰中正路273-1號,1、2、3、4,2293.0,桃園分局,
大樓,中信里,桃園區中信里12鄰國強一街170-1號,1、2、3,2350.0,桃園分局,
公寓,大豐里,桃園區大豐里4鄰金門三街7號,1,232.0,桃園分局,
大樓,春日里,桃園區春日里7鄰大興路120巷21號,1、2、3,2476.0,桃園分局,
公寓,大豐里,桃園區大豐里4鄰金門三街7號,1,232.0,桃園分局,
大樓,北埔里,桃園區北埔里莊敬路二段122號二樓,1、2、3,2565.0,桃園分局,
大樓,東山里,桃園區東山里14鄰安東街32-1號,1、2,434.0,桃園分局,
大樓,青溪里,桃園區青溪里2鄰鎮二街32號,1、2,362.0,桃園分局,
大樓,南埔里,桃園區永順街113-1巷11號,1、2、3,1880.0,桃園分局,
大樓,中正里,桃園區中正里11鄰中山路706號,1、2,753.0,桃園分局,
公寓,大林里,桃園區大林里15鄰榮華街33巷7號,1,158.0,桃園分局,
大樓,北門里,桃園區北門里6鄰民生路495號,1、2、3,1626.0,桃園分局,
大樓,大林里,桃園區大林里15鄰樹仁三街56號,1、2,1710.0,桃園分局,
公寓,自強里,桃園區自強里1鄰經國路272號,1,171.0,桃園分局,
公寓,武陵里,桃園區武陵里1鄰復興路115號,1,181.0,桃園分局,
大樓,南埔里,桃園區永順街99巷1號,1、2、3,2056.0,桃園分局,
大樓,龍安里,桃園區龍安里6鄰國強十三街75號,1、2、3,875.0,桃園分局,
大樓,龍壽里,桃園區龍壽里15鄰龍泉六街8號,1、2、3,4074.0,桃園分局,
大樓,寶慶里,桃園區寶慶里2鄰中埔二街137號,1、2,2418.0,桃園分局,
大樓,大有里,桃園區大有里10鄰大有路458-2號,1、2、3,4646.0,桃園分局,
公寓,文中里,桃園區文中里7鄰文中路157號,1,265.0,桃園分局,
公寓,中和里,桃園區中和里2鄰桃源街30號,1,75.0,桃園分局,
大樓,永興里,桃園區永興里2鄰和平路106號,1、2,462.0,桃園分局,
公寓,瑞慶里,桃園區瑞慶里8鄰莊敬路二段151號,1,159.0,桃園分局,
大樓,同安里,桃園區同安里9鄰中正路1118號,1、2、3、4,12960.0,桃園分局,
大樓,中德里,桃園區中德里5鄰國際一路156號,1、2、3,1590.0,桃園分局,
大樓,會稽里,桃園區會稽里8鄰大興路292號,1、2、3,1319.0,桃園分局,
大樓,龍安里,桃園區龍安里4鄰文中路623-1號,1、2、3,2993.0,桃園分局,
公寓,大樹里,桃園區興華路2-1號,1,340.0,桃園分局,
大樓,大樹里,桃園區大原路3號,1、2,2731.0,桃園分局,
大樓,寶慶里,桃園區寶慶里1鄰同德三街27號,1、2、3,961.0,桃園分局,
大樓,中寧里,桃園區中寧里2鄰同德二街130號,1、2、3、4,5178.0,桃園分局,
大樓,寶山里,桃園區寶山里14鄰民有三街471號,1、2,5184.0,桃園分局,
公寓,三民里,桃園區三民里1鄰自強路26號,1,199.0,桃園分局,
大樓,大林里,桃園區大林里18鄰大智路88號,1、2、3、4,16369.0,桃園分局,
公寓,中原里,桃園區中原里1鄰宏昌十二街88號,1,470.0,桃園分局,
大樓,龍壽里,桃園區龍壽里1鄰龍泉一街19號,1、2、3,5326.0,桃園分局,
大樓,大林里,桃園區大林里5鄰樹仁三街15巷101號,1、2、3,2031.0,桃園分局,
大樓,信光里,桃園區信光里12鄰大連一街81號,1、2、3,6387.0,桃園分局,
大樓,泰山里,桃園區泰山里17鄰宏昌六街16號,1、2,3479.0,桃園分局,
大樓,中聖里,桃園區中聖里6鄰中山路881號,1、2、3,1193.0,桃園分局,
大樓,光興里,桃園區光興里36鄰中山路382號,1、2、3,577.0,桃園分局,
大樓,雲林里,桃園區雲林里21鄰桃鶯路249巷16號,1、2,1064.0,桃園分局,
大樓,龍壽里,桃園區龍壽里7鄰龍泉六街200號,1、2、3,3031.0,桃園分局,
大樓,中德里,桃園區中德里9鄰桃智路6號,1、2,2046.0,桃園分局,
大樓,莊敬里,桃園區莊敬里11鄰新埔八街25號,1、2、3,10662.0,桃園分局,
大樓,大業里,桃園區大業里4鄰大業路一段277號,1、2,627.0,桃園分局,
大樓,同安里,桃園區同安里19鄰天祥一街81號,1、2,4401.0,桃園分局,
大樓,中正里,桃園區中正里2鄰廈門街75號,1、2、3,1705.0,桃園分局,
公寓,大有里,桃園區大有里10鄰民富十三街6號,1,617.0,桃園分局,
大樓,中信里,桃園區中信里13鄰國強一街168-1號,1、2,1361.0,桃園分局,
大樓,同安里,桃園區同安里9鄰藝文二街80號,1、2、3、4,5051.0,桃園分局,
大樓,大業里,桃園區大業里15鄰民富十一街108號,1、2,1048.0,桃園分局,
大樓,寶安里,桃園區寶安里24鄰南平路588號,1、2,3514.0,桃園分局,
大樓,南埔里,桃園區永順街88巷10號,1、2、3,3123.0,桃園分局,
公寓,大樹里,桃園區大明街56巷1號,1,1299.0,桃園分局,
大樓,永安里,桃園區永安里15鄰永光街97號,1、2,2525.0,桃園分局,
大樓,長德里,桃園區長德里17鄰愛二街75號,1、2、3,1926.0,桃園分局,
大樓,南埔里,桃園區永安路776號,1、2,4241.0,桃園分局,
大樓,中路里,桃園區中路里4鄰延壽街97巷2號,1、2,810.0,桃園分局,
大樓,大林里,桃園區大林里18鄰大智路88號,1、2、3、4,16396.0,桃園分局,
大樓,北埔里,桃園區北埔里12鄰莊二街230號,1、2,1063.0,桃園分局,
大樓,新埔里,桃園區新埔里30鄰經國路251巷88號,1、2,3249.0,桃園分局,
大樓,大林里,桃園區大林里3鄰樹仁三街15巷7號,1、2、3,1411.0,桃園分局,
大樓,武陵里,桃園區武陵里1鄰民生路137號,1、2、3,1154.0,桃園分局,
大樓,大林里,桃園區大林里18鄰大智路88號,1、2、3、4,16406.0,桃園分局,
大樓,中信里,桃園區中信里11鄰福信街15號,1、2、3,2150.0,桃園分局,
大樓,同安里,桃園區同安里6鄰大興西路一段208號,1、2、3,1183.0,桃園分局,
大樓,中德里,桃園區中德里2鄰中路街11號,1、2,7917.0,桃園分局,
大樓,青溪里,桃園區青溪里33鄰三民路一段195號,1、2,607.0,桃園分局,
大樓,龍壽里,桃園區龍壽里1鄰龍泉一街1號,1、2、3,5326.0,桃園分局,
大樓,大林里,桃園區大林里12鄰樹仁三街67號,1、2、3,5168.0,桃園分局,
大樓,長德里,桃園區長德里13鄰中正三街389號,1、2、3,3301.0,桃園分局,
大樓,大林里,桃園區大林里10鄰樹仁三街131巷26弄12號,1、2,4890.0,桃園分局,
大樓,莊敬里,桃園區莊敬里15鄰中正路1452號,1、2、3,6958.0,桃園分局,
大樓,大有里,桃園區大有里10鄰民富十三街28號,1、2,1485.0,桃園分局,
大樓,中德里,桃園區中德里9鄰桃智路9號,1、2、3,5229.0,桃園分局,
公寓,忠義里,桃園區忠義里5鄰大業路一段19巷70號,1,1415.0,桃園分局,
大樓,玉山里,桃園區玉山里11鄰大同西路75巷1號,1、2,1003.0,桃園分局,
大樓,同德里,桃園區同德里6鄰同德六街169號,1、2、3,8720.0,桃園分局,
大樓,瑞慶里,桃園區瑞慶里10鄰中正路1351號,1、2、3、4,2624.0,桃園分局,
大樓,永安里,桃園區永安里20鄰中正三街153號,1、2、3,1433.0,桃園分局,
公寓,建國里,桃園區建國里15鄰大林路20-2號,1,699.0,桃園分局,
大樓,中寧里,桃園區中寧里17鄰大興西路二段69巷118號,1、2、3,7705.0,桃園分局,
公寓,中德里,桃園區中德里8鄰國際路一段136號,1,506.0,桃園分局,
大樓,新埔里,桃園區新埔里1鄰慈文路14號,1、2、3,2948.0,桃園分局,
大樓,春日里,桃園區春日里5鄰大業路二段208號,1、2、3,3894.0,桃園分局,
公寓,龍鳳里,桃園區龍鳳里國豐三街72號1樓,1,1642.0,桃園分局,
公寓,龍安里,桃園區龍安里5鄰國豐十街252號,1,99.0,桃園分局,
大樓,大有里,桃園區大有里4鄰民有東路1巷1號,1、2、3,531.0,桃園分局,
公寓,大樹里,桃園區桃鶯路437號,1,6650.0,桃園分局,
大樓,西埔里,桃園區西埔里9鄰永安路1208號,1、2,2406.0,桃園分局,
大樓,龍岡里,桃園區龍岡里21鄰國強一街176號,1、2,1155.0,桃園分局,
大樓,大林里,桃園區大林里13鄰樹仁三街127號,1、2,1210.0,桃園分局,
公寓,慈文里,桃園區慈文里3鄰蓮埔街13號,1,195.0,桃園分局,
公寓,大樹里,桃園區興隆路18號,1,8876.0,桃園分局,
公寓,大樹里,桃園區興隆路18號,1,8876.0,桃園分局,
公寓,福林里,桃園區福林里21鄰介壽路459巷8弄29號,1,181.0,桃園分局,
大樓,瑞慶里,桃園區瑞慶里敬三街1號,1、2,1616.0,桃園分局,
大樓,福元里,桃園區大業路一段121巷8號,1、2,4269.0,桃園分局,
大樓,大林里,桃園區大林里5鄰樹仁三街87巷16號,1、2,1190.0,桃園分局,
公寓,大有里,桃園區大有里7鄰民有東路1號,1,1308.0,桃園分局,
公寓,永興里,桃園區永興里2鄰民權路150號,1,489.0,桃園分局,
大樓,玉山里,桃園區玉山里3鄰南豐二街132號,1、2,7362.0,桃園分局,
大樓,福元里,桃園區大業路一段113號,1、2,9026.0,桃園分局,
大樓,大林里,桃園區大林里22鄰桃鶯路382-8號,1、2、3,7404.0,桃園分局,
公寓,泰山里,桃園區泰山里7鄰金山街37巷6號,1,147.0,桃園分局,
公寓,同德里,桃園區同德里10鄰南平路419號,1,1001.0,桃園分局,
公寓,永興里,桃園區永興里民權路116號,1,45.0,桃園分局,
公寓,永興里,桃園區永興里民權路197號,1,256.0,桃園分局,
公寓,永興里,桃園區永興里民權路117號,1,37.0,桃園分局,
公寓,永興里,桃園區永興里新興街5號,1,650.0,桃園分局,
公寓,永興里,桃園區永興里新興街25號,1,89.0,桃園分局,
公寓,永興里,桃園區永興里新興街15號,1,68.0,桃園分局,
公寓,永興里,桃園區永興里民權路144號,1,81.0,桃園分局,
公寓,永興里,桃園區永興里民權路146號,1,68.0,桃園分局,
公寓,永興里,桃園區永興里民權路142號,1,109.0,桃園分局,
公寓,永興里,桃園區永興里和平路124號,1,69.0,桃園分局,
公寓,永興里,桃園區永興里永安路37號,1,189.0,桃園分局,
公寓,永興里,桃園區永興里和平路104號之5,1,28.0,桃園分局,
公寓,永興里,桃園區永興里三民路三段26號,1,114.0,桃園分局,
公寓,永興里,桃園區永興里和平路104號之6,1,33.0,桃園分局,
公寓,文昌里,桃園區文昌里民權路71巷16號,1,52.0,桃園分局,
公寓,文昌里,桃園區文昌里中山路165號,1,120.0,桃園分局,
大樓,文昌里,桃園區文昌里中山路203號,1、2,388.0,桃園分局,
公寓,文昌里,桃園區文昌里中山路163號,1,97.0,桃園分局,
公寓,文昌里,桃園區文昌里民權路75號,1,68.0,桃園分局,
公寓,文昌里,桃園區文昌里民權路71巷20號,1,53.0,桃園分局,
公寓,西湖里,桃園區西湖里四維街90號,1,46.0,桃園分局,
公寓,中和里,桃園區中和里中正路246號,1,21.0,桃園分局,
公寓,中和里,桃園區中和里和平路80號,1,21.0,桃園分局,
公寓,中和里,桃園區中和里中山路70號,1,32.0,桃園分局,
公寓,中和里,桃園區中和里永樂街29號,1,32.0,桃園分局,
公寓,中和里,桃園區中和里永樂街33號,1,21.0,桃園分局,
公寓,中和里,桃園區中和里桃源街50號,1,30.0,桃園分局,
公寓,中和里,桃園區中和里中山路32號,1,30.0,桃園分局,
公寓,中和里,桃園區中和里和平路66號,1,26.0,桃園分局,
公寓,中和里,桃園區中和里和平路82號,1,29.0,桃園分局,
公寓,中和里,桃園區中和里中正路224號,1,30.0,桃園分局,
公寓,中和里,桃園區中和里桃源街9號,1,33.0,桃園分局,
公寓,中和里,桃園區中和里中山路52號,1,21.0,桃園分局,
公寓,中和里,桃園區中和里永安路8號,1,30.0,桃園分局,
公寓,中和里,桃園區中和里博愛路52號,1,30.0,桃園分局,
公寓,中和里,桃園區中和里民生路219巷5號,1,29.0,桃園分局,
公寓,中和里,桃園區中和里永樂街31號,1,40.0,桃園分局,
公寓,中和里,桃園區中和里永樂街41號,1,70.0,桃園分局,
公寓,中和里,桃園區中和里三民路二段255號,1,45.0,桃園分局,
公寓,中和里,桃園區中和里和平路84巷36號,1,34.0,桃園分局,
公寓,中和里,桃園區中和里和平路84巷34號,1,30.0,桃園分局,
公寓,中和里,桃園區中和里新生路33號,1,38.0,桃園分局,
大樓,民生里,桃園區民生里民生路208號,1、2,154.0,桃園分局,
公寓,民生里,桃園區民生里民生路232號,1,16.0,桃園分局,
公寓,民生里,桃園區民生里民生路242號,1,28.0,桃園分局,
公寓,民生里,桃園區民生里民生路226號,1,44.0,桃園分局,
公寓,文昌里,桃園區文昌里新民街75號,1,21.0,桃園分局,
公寓,文昌里,桃園區文昌里新民街78號,1,57.0,桃園分局,
公寓,西門里,桃園區西門里三民路三段67號,1,60.0,桃園分局,
公寓,北門里,桃園區北門里民生路349號,1,200.0,桃園分局,
公寓,北門里,桃園區北門里民生路303號,1,80.0,桃園分局,
公寓,北門里,桃園區北門里民生路339號,1,20.0,桃園分局,
公寓,北門里,桃園區北門里永樂街112號,1,40.0,桃園分局,
公寓,北門里,桃園區北門里桃源街10號,1,22.0,桃園分局,
公寓,北門里,桃園區北門里桃源街8號,1,25.0,桃園分局,
公寓,北門里,桃園區北門里新生路15、17號,1,66.0,桃園分局,
公寓,北門里,桃園區北門里民生路299號,1,48.0,桃園分局,
公寓,北門里,桃園區北門里民生路283號,1,112.0,桃園分局,
公寓,北門里,桃園區北門里桃源街12號,1,20.0,桃園分局,
公寓,北門里,桃園區北門里桃源街22號,1,48.0,桃園分局,
公寓,北門里,桃園區北門里北興街18號,1,433.0,桃園分局,
公寓,北門里,桃園區北門里民生路411號,1,54.0,桃園分局,
公寓,北門里,桃園區北門里三民路二段195號,1,333.0,桃園分局,
公寓,北門里,桃園區北門里三民路二段223號,1,181.0,桃園分局,
公寓,北門里,桃園區北門里民生路401號,1,77.0,桃園分局,
公寓,北門里,桃園區北門里民生路425號,1,84.0,桃園分局,
公寓,北門里,桃園區北門里民生路413號,1,1073.0,桃園分局,
公寓,北門里,桃園區北門里北華街20號,1,88.0,桃園分局,
公寓,北門里,桃園區北門里民生路391號,1,222.0,桃園分局,
公寓,西門里,桃園區西門里和平路169號,1,84.0,桃園分局,
公寓,西門里,桃園區西門里和平路126號,1,64.0,桃園分局,
大樓,西門里,桃園區西門里新生路165號,1、2,545.0,桃園分局,
公寓,西門里,桃園區西門里三民路三段69號,1,80.0,桃園分局,
公寓,西門里,桃園區西門里和平路132號,1,48.0,桃園分局,
公寓,西門里,桃園區西門里民族路199號,1,1133.0,桃園分局,
公寓,西門里,桃園區西門里民族路239號,1,66.0,桃園分局,
大樓,西門里,桃園區西門里金華街12號,1、2,600.0,桃園分局,
公寓,西門里,桃園區西門里民族路212號,1,120.0,桃園分局,
公寓,西門里,桃園區西門里和平路148號,1,106.0,桃園分局,
大樓,西湖里,桃園區西湖里三民路三段245號,1、2,1046.0,桃園分局,
大樓,民生里,桃園區民生里福昌街8號,1、2,660.0,桃園分局,
公寓,西湖里,桃園區西湖里博愛西路6號,1,202.0,桃園分局,
大樓,西湖里,桃園區西湖里三民路三段301號,1、2,857.0,桃園分局,
公寓,永興里,桃園區永興里北新街91號,1,402.0,桃園分局,
大樓,民生里,桃園區民生里民生路310-3號,1、2、3,1441.0,桃園分局,
大樓,永興里,桃園區永興里三民路三段55號,1、2,1157.0,桃園分局,
公寓,西門里,桃園區西門里民族路250號,1,196.0,桃園分局,
大樓,西門里,桃園區西門里和興街27號,1、2,3629.0,桃園分局,
大樓,中和里,桃園區中和里民生路231號,1、2,1001.0,桃園分局,
公寓,南門里,桃園區南門里南豐一街40號,1,374.0,桃園分局,
公寓,南門里,桃園區南門里復興路283號,1,550.0,桃園分局,
公寓,南門里,桃園區南門里復興路299號,1,13.0,桃園分局,
公寓,文化里,桃園區文化里復興路161號,1,16.0,桃園分局,
公寓,文化里,桃園區文化里大同路60號之1,1,13.0,桃園分局,
公寓,文化里,桃園區文化里大同路60號之1,1,89.0,桃園分局,
公寓,南門里,桃園區南門里育樂街18號,1,29.0,桃園分局,
公寓,武陵里,桃園區武陵里民生路58號,1,872.0,桃園分局,
公寓,文化里,桃園區文化里復興路151號,1,69.0,桃園分局,
公寓,東門里,桃園區東門里春日路229號,1,60.0,桃園分局,
公寓,東門里,桃園區東門里春日路231號,1,66.0,桃園分局,
公寓,東門里,桃園區東門里春日路233號,1,92.0,桃園分局,
公寓,東門里,桃園區東門里朝陽街一段75號,1,25.0,桃園分局,
公寓,文明里,桃園區文明里大同路157號,1,20.0,桃園分局,
公寓,文明里,桃園區文明里大同路112號之1,1,693.0,桃園分局,
公寓,武陵里,桃園區武陵里大同路111號,1,442.0,桃園分局,
公寓,南華里,桃園區南華里南海街45號,1,260.0,桃園分局,
公寓,南華里,桃園區南華里南海街54號,1,256.0,桃園分局,
公寓,南華里,桃園區南華里南華街57號,1,38.0,桃園分局,
公寓,文明里,桃園區文明里南華街60號,1,412.0,桃園分局,
大樓,南華里,桃園區南華里南華街66號,1、2,1265.0,桃園分局,
公寓,南華里,桃園區南華里南華街67號,1,42.0,桃園分局,
大樓,南華里,桃園區南華里南華街77號,1、2,796.0,桃園分局,
公寓,南華里,桃園區南華里南華街78號,1,28.0,桃園分局,
公寓,南華里,桃園區南華里南華街80號,1,182.0,桃園分局,
公寓,南華里,桃園區南華里鎮南街26號,1,28.0,桃園分局,
公寓,南華里,桃園區南華里鎮南街59號,1,44.0,桃園分局,
公寓,南華里,桃園區南華里鎮南街77號,1,249.0,桃園分局,
公寓,南門里,桃園區南門里大同路219號,1,126.0,桃園分局,
公寓,南門里,桃園區南門里三民路三段278號,1,42.0,桃園分局,
公寓,南門里,桃園區南門里復興路303號,1,620.0,桃園分局,
公寓,南門里,桃園區南門里復興路305號,1,641.0,桃園分局,
公寓,南門里,桃園區南門里復興路314號,1,28.0,桃園分局,
大樓,文化里,桃園區文化里中華路16號,1、2,1272.0,桃園分局,
公寓,南門里,桃園區南門里南山街2號,1,36.0,桃園分局,
公寓,南門里,桃園區南門里南山街3號,1,245.0,桃園分局,
大樓,萬壽里,桃園區萬壽里復興路25號,1、2,64.0,桃園分局,
公寓,萬壽里,桃園區萬壽里復興路43號,1,52.0,桃園分局,
公寓,武陵里,桃園區武陵里復興路51號,1,324.0,桃園分局,
大樓,武陵里,桃園區武陵里復興路51號,1、2,677.0,桃園分局,
公寓,萬壽里,桃園區萬壽里成功路二段144號,1,1052.0,桃園分局,
公寓,萬壽里,桃園區萬壽里成功路二段144號,1,720.0,桃園分局,
大樓,文明里,桃園區文明里三民路三段413號,1、2,250.0,桃園分局,
公寓,東門里,桃園區東門里成功路二段7號,1,16.0,桃園分局,
公寓,東門里,桃園區東門里成功路二段9號,1,14.0,桃園分局,
大樓,西湖里,桃園區西湖里三民路三段303號,1、2、3,573.0,桃園分局,
大樓,西湖里,桃園區西湖里三民路三段305號,1、2,516.0,桃園分局,
大樓,東門里,桃園區東門里朝陽街一段91號,1、2,778.0,桃園分局,
公寓,東門里,桃園區東門里忠孝街4號,1,30.0,桃園分局,
