編號,地址,經度,緯度,里別,避難所在之地下樓層數,可容納人數,轄管分局,"unnamed (1)","unnamed (2)"
1.0,臺中市北區中達里育德路185號,120.672319,24.157138,中達里,1.0,"  178 ",第二分局,,
2.0,臺中市北區五常里學士路6號,120.682536,24.153808,五常里,3.0,"  1,807 ",第二分局,,
3.0,臺中市北區五常里學士路2號,120.682759,24.153392,五常里,2.0,"  5,194 ",第二分局,,
4.0,臺中市北區文莊里文化街69號," 120.67486",24.152083,文莊里,1.0,"  296 ",第二分局,,
5.0,臺中市北區中達里篤行路321號," 120.67323",24.155125,中達里,1.0,"  217 ",第二分局,,
6.0,臺中市北區中達里篤行路321號," 120.67323",24.155125,中達里,1.0,"  832 ",第二分局,,
7.0,臺中市北區中達里篤行路321號," 120.67323",24.155125,中達里,1.0,"  531 ",第二分局,,
8.0,臺中市北區中達里篤行路321號," 120.67323",24.155125,中達里,1.0,"  266 ",第二分局,,
9.0,臺中市北區五常里五權路375號,120.680519,24.152865,五常里,1.0,"  947 ",第二分局,,
10.0,臺中市北區五常里五權路379號,120.680899,24.152867,五常里,1.0,"  781 ",第二分局,,
11.0,臺中市北區錦平里三民路三段129號,120.6814945,24.1496435,錦平里,1.0,"  3,896 ",第二分局,,
12.0,臺中市北區文莊里英士路109號,120.6752,24.153185,文莊里,1.0,"  1,719 ",第二分局,,
13.0,臺中市北區中正里臺灣大道一段635號,120.675248,24.14593,中正里,1.0,"  211 ",第二分局,,
14.0,臺中市北區金龍里三民路三段289號,120.688077,24.156604,金龍里,1.0,"  208 ",第二分局,,
15.0,臺中市北區金龍里三民路三段289號,120.688077,24.156604,金龍里,1.0,"  617 ",第二分局,,
16.0,臺中市北區金龍里三民路三段289號,120.688077,24.156604,金龍里,1.0,"  952 ",第二分局,,
17.0,臺中市北區金龍里三民路三段289號,120.688077,24.156604,金龍里,1.0,"  1,562 ",第二分局,,
18.0,臺中市北區金龍里三民路三段289號,120.688077,24.156604,金龍里,1.0,"  83 ",第二分局,,
19.0,臺中市北區金龍里三民路三段289號,120.688077,24.156604,金龍里,1.0,"  125 ",第二分局,,
20.0,臺中市北區金龍里三民路三段289號,120.688077,24.156604,金龍里,1.0,"  833 ",第二分局,,
21.0,臺中市北區金龍里三民路三段289號,120.688077,24.156604,金龍里,1.0,"  1,562 ",第二分局,,
22.0,臺中市北區金龍里三民路三段289號,120.688077,24.156604,金龍里,1.0,"  1,415 ",第二分局,,
23.0,臺中市北區金龍里三民路三段289號,120.688077,24.156604,金龍里,1.0,"  83 ",第二分局,,
24.0,臺中市北區金龍里三民路三段289號,120.688077,24.156604,金龍里,1.0,"  375 ",第二分局,,
25.0,臺中市北區錦平里五權路370之3號,120.681282,24.152443,錦平里,1.0,"  1,431 ",第二分局,,
26.0,臺中市北區光大里五權路317號,120.678741,24.152145,光大里,1.0,"  456 ",第二分局,,
27.0,臺中市北區頂厝里太原路二段228號,120.682503,24.164954,頂厝里,1.0,"  718 ",第二分局,,
28.0,臺中市北區中正里民權路220號,120.6740607,24.14375739,中正里,1.0,"  838 ",第二分局,,
29.0,臺中市北區健行里健行路666號,120.672764,24.159372,健行里,1.0,"  1,874 ",第二分局,,
30.0,臺中市北區健行里健行路666號,120.672764,24.159372,健行里,1.0,"  2,119 ",第二分局,,
31.0,臺中市北區健行里健行路666號,120.672764,24.159372,健行里,1.0,"  944 ",第二分局,,
32.0,臺中市北區六合里成功路430巷21號,120.67677,24.14703,六合里,1.0,"  220 ",第二分局,,
33.0,臺中市北區五常里五義街167號,120.680429,24.153756,五常里,1.0,"  197 ",第二分局,,
34.0,臺中市北區淡溝里館前路1號,120.66616,24.155802,淡溝里,3.0,"  4,244 ",第二分局,,
35.0,臺中市北區淡溝里館前路1號,120.66616,24.155802,淡溝里,2.0,"  22,139 ",第二分局,,
36.0,臺中市北區六合里成功路439號,120.6755,24.147044,六合里,1.0,"  520 ",第二分局,,
37.0,臺中市北區光大里原子街127巷21之2號,120.675588,24.147846,光大里,1.0,"  302 ",第二分局,,
38.0,臺中市北區光大里五權路276號,120.678119,24.151395,光大里,1.0,"  312 ",第二分局,,
39.0,臺中市北區光大里五權路178號,120.676242,24.14966,光大里,1.0,"  250 ",第二分局,,
40.0,臺中市北區賴厝里永興街301號,120.682233,24.166042,賴厝里,2.0,"  1,856 ",第二分局,,
41.0,臺中市北區光大里公園路188號,120.677563,24.1511,光大里,2.0,"  496 ",第二分局,,
42.0,"臺中市北區賴興里北平路二段135號 "," 120.67743",24.171686,賴興里,1.0,"  1,247 ",第二分局,,
43.0,"臺中市北區賴旺里青島東街100號 "," 120.67504",24.170733,賴旺里,1.0,"  540 ",第二分局,,
44.0,臺中市北區金龍里北屯路77號,120.691703,24.16166,金龍里,1.0,"  782 ",第二分局,,
45.0,臺中市北區金龍里德化街41號,120.690661,24.161294,金龍里,1.0,"  372 ",第二分局,,
46.0,臺中市北區金龍里北屯路49之1號,120.691586,24.16066,金龍里,2.0,"  275 ",第二分局,,
47.0,臺中市北區賴厝里漢口路四段52號,120.674869,24.166837,賴厝里,1.0,"  1,326 ",第二分局,,
48.0,臺中市北區賴厝里太原路二段11號,120.675264,24.165579,賴厝里,3.0,"  667 ",第二分局,,
49.0,"臺中市北區賴厝里漢口路四段102號 "," 120.67779",24.167097,賴厝里,3.0,"  363 ",第二分局,,
50.0,臺中市北區賴厝里漢口路四段208號,120.680345,24.166879,賴厝里,1.0,"  385 ",第二分局,,
51.0,臺中市北區賴厝里綏遠路1號,120.680386,24.165479,賴厝里,1.0,"  906 ",第二分局,,
52.0,臺中市北區賴厝里永興街281號,120.682303,24.165479,賴厝里,1.0,"  378 ",第二分局,,
53.0,臺中市北區賴厝里梅川西路三段66號,120.676913,24.165545,賴厝里,2.0,"  200 ",第二分局,,
54.0,臺中市北區賴福里大德街253號,120.678223,24.164406,賴福里,1.0,"  178 ",第二分局,,
55.0,臺中市北區建興里梅亭街196號,120.684214,24.160568,建興里,1.0,"  1,162 ",第二分局,,
56.0,臺中市北區頂厝里進化北路261號,120.683556,24.16286,頂厝里,2.0,"  623 ",第二分局,,
57.0,"臺中市北區崇德里太原路三段30號 "," 120.68634",24.164985,崇德里,1.0,"  346 ",第二分局,,
58.0,臺中市北區崇德里太原路三段78號,120.687839,24.164881,崇德里,2.0,"  906 ",第二分局,,
59.0,臺中市北區崇德里北興街166號," 120.68640",24.164219,崇德里,1.0,"  1,026 ",第二分局,,
60.0,臺中市北區頂厝里北興街336號," 120.68185",24.164293,頂厝里,2.0,"  473 ",第二分局,,
61.0,臺中市北區賴明里青島路一段429號," 120.67445",24.169336,賴明里,1.0,"  364 ",第二分局,,
62.0,臺中市北區賴村里進化北路367號,120.681558,24.154553,賴村里,2.0,"  957 ",第二分局,,
63.0,臺中市北區明新里太原八街126號," 120.67264",24.165653,明新里,1.0,"  296 ",第二分局,,
64.0,臺中市北區梅川里天津路二段192號,120.678422,24.169685,梅川里,1.0,"  358 ",第二分局,,
65.0,臺中市北區梅川里梅川西路四段149號,120.6787579,24.16918017,梅川里,3.0,"  2,827 ",第二分局,,
66.0,臺中市北區梅川里永興街367號," 120.68276",24.168333,梅川里,1.0,"  2,036 ",第二分局,,
67.0,臺中市北區頂厝里漢口路四段367號," 120.68282",24.167456,頂厝里,2.0,"  1,012 ",第二分局,,
68.0,臺中市北區金龍里益華街109號,120.689549,24.161117,金龍里,1.0,"  265 ",第二分局,,
69.0,臺中市北區金龍里梅亭街21號,120.690504,24.15996,金龍里,1.0,"  166 ",第二分局,,
70.0,臺中市北區金龍里北屯路45號,120.691647,24.160473,金龍里,1.0,"  104 ",第二分局,,
71.0,臺中市北區育德里篤行路398號,120.673759,24.157985,育德里,1.0,"  651 ",第二分局,,
72.0,臺中市北區邱厝里學士路151號,120.680775,24.158294,邱厝里,1.0,"  364 ",第二分局,,
73.0,臺中市北區邱厝里美德街48號,120.683381,24.157768,邱厝里,1.0,"  416 ",第二分局,,
74.0,臺中市北區邱厝里大義街29巷37號,120.682682,24.158618,邱厝里,1.0,"  923 ",第二分局,,
75.0,"臺中市北區邱厝里崇德路168巷6號 ",120.6851609,24.15877195,邱厝里,1.0,"  216 ",第二分局,,
76.0,臺中市北區邱厝里崇德路一段106號,120.685399,24.157382,邱厝里,1.0,"  333 ",第二分局,,
77.0,臺中市北區邱厝里健行路321號,120.684306,24.15889,邱厝里,1.0,"  500 ",第二分局,,
78.0,臺中市北區邱厝里健行路371號," 120.68272",24.159194,邱厝里,2.0,"  989 ",第二分局,,
79.0,臺中市北區邱厝里健行路431號,120.681296,24.158956,邱厝里,1.0,"  468 ",第二分局,,
80.0,臺中市北區邱厝里美德街42號,120.683522,24.157788,邱厝里,1.0,"  183 ",第二分局,,
81.0,臺中市北區邱厝里美德街68巷8號,120.68342,24.157831,邱厝里,1.0,"  571 ",第二分局,,
82.0,臺中市北區邱厝里大義街22號之5,120.683831,24.158420,邱厝里,1.0,"  861 ",第二分局,,
83.0,臺中市北區賴村里梅亭街281號,120.680696,24.160499,賴村里,1.0,"  3,102 ",第二分局,,
84.0,臺中市北區崇德里太原路三段30號,120.68633,24.164909,崇德里,1.0,"  345 ",第二分局,,
85.0,臺中市北區賴村里德化街435號,120.677538,24.161598,賴村里,1.0,"  223 ",第二分局,,
86.0,臺中市北區賴村里進化北路435號,120.676012,24.162973,賴村里,1.0,"  586 ",第二分局,,
87.0,臺中市北區頂厝里青島路三段180號,120.683478,24.168706,頂厝里,3.0,"  2,790 ",第二分局,,
88.0,臺中市北區頂厝里北興街322號,120.682005,24.164133,頂厝里,2.0,"  473 ",第二分局,,
89.0,臺中市北區賴村里德化街439號,120.677083,24.161608,賴村里,1.0,"  254 ",第二分局,,
90.0,臺中市北區賴厝里太原路二段1號,120.674257,24.165334,賴厝里,2.0,"  667 ",第二分局,,
91.0,臺中市北區賴福里大德街253號,120.678223,24.164406,賴福里,1.0,"  285 ",第二分局,,
92.0,臺中市北區建興里健行路354號,120.682933,24.159392,建興里,2.0,"  1,093 ",第二分局,,
93.0,臺中市北區賴村里進化北路369號,120.678521,24.162927,賴村里,1.0,"  520 ",第二分局,,
94.0,臺中市北區賴村里進化北路365號,120.679325,24.162846,賴村里,1.0,"  2,119 ",第二分局,,
95.0,臺中市北區賴村里尚德街110號,120.677561,24.160875,賴村里,1.0,"  221 ",第二分局,,
96.0,臺中市北區賴厝里太原路11號,120.675264,24.165579,賴厝里,2.0,"  667 ",第二分局,,
97.0,臺中市北區賴福里進化北路416號,120.675661,24.163336,賴福里,1.0,"  141 ",第二分局,,
98.0,臺中市北區建興里梅亭街238號,120.68271,24.160628,建興里,1.0,"  944 ",第二分局,,
99.0,臺中市北區建興里衛道路89之2號," 120.68578",24.162881,建興里,1.0,"  604 ",第二分局,,
100.0,臺中市北區頂厝里永興街165號,120.681985,24.15941,頂厝里,2.0,"  668 ",第二分局,,
101.0,臺中市北區金龍里榮華街26號,120.686777,24.159834,金龍里,1.0,"  217 ",第二分局,,
102.0,臺中市北區金龍里榮華街11號,120.691353,24.159738,金龍里,1.0,"  497 ",第二分局,,
103.0,臺中市北區崇德里榮華街201之9號," 120.68661",24.166559,崇德里,1.0,"  258 ",第二分局,,
104.0,臺中市北區金龍里梅亭街47號,120.690192,24.159988,金龍里,1.0,"  200 ",第二分局,,
105.0,臺中市北區金龍里梅亭街7號,120.690777,24.159893,金龍里,1.0,"  125 ",第二分局,,
106.0,臺中市北區育德里健行路585號,120.677072,24.158982,育德里,2.0,"  289 ",第二分局,,
107.0,臺中市北區育德里梅川東路三段169號,120.676554,24.158508,育德里,1.0,"  781 ",第二分局,,
108.0,臺中市北區邱厝里健行路359號,120.6810245,24.1588792,邱厝里,1.0,"  90 ",第二分局,,
109.0,臺中市北區育德里健行路443號,120.680376,24.158467,育德里,1.0,"  2,319 ",第二分局,,
110.0,臺中市北區育德里美德街177號,120.680269,24.158059,育德里,1.0,"  500 ",第二分局,,
111.0,臺中市北區育德里美德街189號之4,120.679600,24.158314,育德里,1.0,"  176 ",第二分局,,
112.0,臺中市北區育德里美德街187號,120.680269,24.158059,育德里,1.0,"  666 ",第二分局,,
113.0,臺中市北區育德里篤行路408號,120.6715104,24.158315,育德里,1.0,"  445 ",第二分局,,
114.0,臺中市北區育德里公園路225號,120.677335,24.150896,育德里,1.0,"  367 ",第二分局,,
115.0,臺中市北區邱厝里健行路359號,120.6810245,24.1588792,邱厝里,2.0,"  1,094 ",第二分局,,
116.0,臺中市北區賴厝里太原路二段199號,120.681163,24.165478,賴厝里,4.0,"  2,382 ",第二分局,,
117.0,臺中市北區頂厝里漢口路四段326號,120.684399,24.166834,頂厝里,2.0,"  552 ",第二分局,,
118.0,臺中市北區育德里篤行路377號,120.673545,24.158003,育德里,3.0,"  990 ",第二分局,,
119.0,臺中市北區崇德里崇德路一段462號,120.6829817,24.1635376,崇德里,2.0,"  725 ",第二分局,,
120.0,臺中市北區育德里健行路485號,120.677902,24.159037,育德里,2.0,"  498 ",第二分局,,
121.0,臺中市北區邱厝里育德路1號,120.6783071,24.1571781,邱厝里,4.0,"  1,342 ",第二分局,,
122.0,臺中市北區賴厝里山西路一段53號,120.675072,24.165642,賴厝里,2.0,"  1,046 ",第二分局,,
123.0,臺中市北區賴厝里綏遠路一段28號,120.68084,24.166264,賴厝里,2.0,"  1,946 ",第二分局,,
124.0,臺中市北區賴厝里漢口路四段82號,120.676141,24.166843,賴厝里,3.0,"  1,783 ",第二分局,,
125.0,臺中市北區頂厝里進化北路227號,120.684549,24.162814,頂厝里,1.0,"  280 ",第二分局,,
126.0,臺中市北區建興里崇德路一段268號,120.6852283,24.16204935,建興里,2.0,"  1,335 ",第二分局,,
127.0,臺中市北區邱厝里學士路91號," 120.68164",24.156668,邱厝里,1.0,"  1,235 ",第二分局,,
128.0,臺中市北區賴旺里青島路12號,120.673786,24.173261,賴旺里,1.0,"  1,419 ",第二分局,,
129.0,臺中市北區建興里衛道路155之1號,120.682924,24.162299,建興里,1.0,"  264 ",第二分局,,
130.0,臺中市北區頂厝里學士路312號,120.6837,24.166834,頂厝里,1.0,"  1,064 ",第二分局,,
131.0,臺中市北區梅川里綏遠路一段72號," 120.68119",24.168617,梅川里,1.0,"  2,246 ",第二分局,,
132.0,臺中市北區梅川里漢口路四段345巷18號,120.6771179,24.1670854,梅川里,1.0,"  723 ",第二分局,,
133.0,臺中市北區賴村里大德街221號," 120.67850",24.162944,賴村里,1.0,"  248 ",第二分局,,
134.0,臺中市北區頂厝里進化北路259號,120.683826,24.162818,頂厝里,1.0,"  781 ",第二分局,,
135.0,臺中市北區賴福里太原路二段182號,120.680384,24.164971,賴福里,1.0,"  2,258 ",第二分局,,
136.0,臺中市北區賴福里太原路二段88號之3," 120.67847",24.165137,賴福里,1.0,"  2,331 ",第二分局,,
137.0,臺中市北區賴村里學士路275之1號,120.680574,24.162837,賴村里,1.0,"  1,429 ",第二分局,,
138.0,臺中市北區育德里育德路100號,120.674278,24.157841,育德里,1.0,"  1,754 ",第二分局,,
139.0,臺中市北區賴福里太原路二段90號,120.6798997,24.16503797,賴福里,3.0,"  1,895 ",第二分局,,
140.0,臺中市北區育德里育德路88號,120.675544,24.157689,育德里,3.0,"  1,071 ",第二分局,,
141.0,臺中市北區崇德里北興街77號2樓之2,120.687988,24.163986,崇德里,1.0,"  627 ",第二分局,,
142.0,臺中市北區賴福里太原路二段86號,120.6778619,24.16515435,賴福里,1.0,"  699 ",第二分局,,
143.0,臺中市北區賴村里五常街263號,120.679897,24.161272,賴村里,1.0,"  683 ",第二分局,,
144.0,臺中市北區賴福里中清路一段490號,120.674306,24.164394,賴福里,1.0,"  768 ",第二分局,,
145.0,臺中市北區邱厝里中清路一段167號,120.676339,24.156849,邱厝里,1.0,"  623 ",第二分局,,
146.0,臺中市北區梅川里文昌東一街109號,120.676863,24.167646,梅川里,2.0,"  1,742 ",第二分局,,
147.0,臺中市北區賴厝里東漢街3號,120.679491,24.166354,賴厝里,1.0,"  495 ",第二分局,,
148.0,臺中市北區金龍里益華街115號,120.68968,24.161304,金龍里,1.0,"  249 ",第二分局,,
149.0,臺中市北區金龍里榮華街7號,120.686535,24.159395,金龍里,1.0,"  413 ",第二分局,,
150.0,臺中市北區建興里健行路198巷16號2樓之1,120.6860217,24.16001082,建興里,1.0,"  227 ",第二分局,,
151.0,臺中市北區賴村里學士路267號,120.6808234,24.16239246,賴村里,1.0,"  499 ",第二分局,,
152.0,臺中市北區金龍里學士路106號," 120.68135",24.157736,金龍里,2.0,"  11,492 ",第二分局,,
153.0,臺中市北區崇德里太原路三段8號,120.685445,24.164904,崇德里,1.0,"  1,705 ",第二分局,,
154.0,臺中市北區崇德里太原路三段63號,120.687551,24.16533,崇德里,1.0,"  557 ",第二分局,,
155.0,臺中市北區賴厝里東漢街7號,120.6794873,24.16626487,賴厝里,1.0,"  1,184 ",第二分局,,
156.0,臺中市北區邱厝里大德街47號,120.6788077,24.15723711,邱厝里,1.0,"  1,297 ",第二分局,,
157.0,臺中市北區建興里崇德路一段256巷2號," 120.68610",24.161186,建興里,1.0,"  1,158 ",第二分局,,
158.0,臺中市北區賴厝里漢口路四段168號," 120.67849",24.166268,賴厝里,1.0,"  991 ",第二分局,,
159.0,臺中市北區金龍里金龍街112號,120.6877528,24.15866946,金龍里,1.0,"  1,472 ",第二分局,,
160.0,臺中市北區賴村里五常街193號,120.679847,24.159965,賴村里,1.0,"  383 ",第二分局,,
161.0,臺中市北區金龍里益華街79號,120.6890547,24.16015207,金龍里,1.0,"  332 ",第二分局,,
162.0,臺中市北區育德里育德路98號,120.674768,24.157935,育德里,1.0,"  3,131 ",第二分局,,
163.0,臺中市北區金龍里三民路三段315巷17號,120.6882585,24.15754192,金龍里,1.0,"  262 ",第二分局,,
164.0,臺中市北區賴厝里山西路一段50號," 120.67552",24.165946,賴厝里,1.0,"  1,957 ",第二分局,,
165.0,臺中市北區梅川里文昌東二街146號,120.6778224,24.16949415,梅川里,1.0,"  263 ",第二分局,,
166.0,臺中市北區賴村里學士路181號,120.6808286,24.15980613,賴村里,1.0,"  418 ",第二分局,,
167.0,臺中市北區頂厝里崇德路一段625號," 120.68491",24.167497,頂厝里,3.0,"  577 ",第二分局,,
168.0,臺中市北區金龍里三民路三段315巷33號,120.6880904,24.15759264,金龍里,1.0,"  510 ",第二分局,,
169.0,臺中市北區金龍里三民路三段329號,120.6888082,24.15772927,金龍里,1.0,"  927 ",第二分局,,
170.0,臺中市北區健行里忠太西路32號," 120.66768",24.161747,健行里,1.0,"  126 ",第二分局,,
171.0,臺中市北區健行里德化街607號,120.666844,24.161453,健行里,1.0,"  470 ",第二分局,,
172.0,臺中市北區淡溝里博館路1號,120.669337,24.158953,淡溝里,1.0,"  1,415 ",第二分局,,
173.0,臺中市北區明德里漢口路三段76號," 120.66829",24.167042,明德里,1.0,"  246 ",第二分局,,
174.0,臺中市北區淡溝里博館東街21號,120.666443,24.15483,淡溝里,1.0,"  306 ",第二分局,,
175.0,臺中市北區淡溝里博館一街12號," 120.66724",24.155001,淡溝里,1.0,"  78 ",第二分局,,
176.0,臺中市北區淡溝里博館路87號,120.666853,24.155204,淡溝里,3.0,"  540 ",第二分局,,
177.0,臺中市北區淡溝里博館二街32號,120.666721,24.154391,淡溝里,2.0,"  567 ",第二分局,,
178.0,臺中市北區淡溝里博館路26號,120.669527,24.157882,淡溝里,2.0,"  1,135 ",第二分局,,
179.0,臺中市北區淡溝里美德街395號,120.671165,24.158620,淡溝里,1.0,"  414 ",第二分局,,
180.0,臺中市北區淡溝里美德街486號," 120.67149",24.158714,淡溝里,12.0,"  1,977 ",第二分局,,
181.0,臺中市北區大湖里公園路128號,120.678203,24.149242,大湖里,1.0,"  518 ",第二分局,,
182.0,臺中市北區大湖里湖北街36號,120.679136,24.148924,大湖里,1.0,"  471 ",第二分局,,
183.0,臺中市北區大湖里文祥街2號,120.6797,24.148734,大湖里,1.0,"  210 ",第二分局,,
184.0,臺中市北區文莊里五權路231號,120.675725,24.150107,文莊里,1.0,"  216 ",第二分局,,
185.0,臺中市北區文莊里文化街46號,120.675529,24.152294,文莊里,1.0,"  246 ",第二分局,,
186.0,臺中市北區大湖里湖北街66號,120.679157,24.151102,大湖里,1.0,"  250 ",第二分局,,
187.0,臺中市北區文莊里日進街3號,120.675124,24.151396,文莊里,1.0,"  127 ",第二分局,,
188.0,臺中市北區文莊里日進街1號,120.675161,24.151401,文莊里,2.0,"  645 ",第二分局,,
189.0,臺中市北區中達里英才路286號," 120.67129",24.156113,中達里,1.0,"  302 ",第二分局,,
190.0,臺中市北區五常里英才路1號,120.678332,24.155387,五常里,1.0,"  1,239 ",第二分局,,
191.0,臺中市北區五常里五義街132號,120.681611,24.154805,五常里,1.0,"  260 ",第二分局,,
192.0,臺中市北區五常里學士路87號,120.6806625,24.15514844,五常里,1.0,"  324 ",第二分局,,
193.0,臺中市北區五常里五義街141號,120.681436,24.154247,五常里,1.0,"  244 ",第二分局,,
194.0,臺中市北區六合里成功路490號,120.675799,24.147252,六合里,1.0,"  893 ",第二分局,,
195.0,臺中市北區六合里臺灣大道一段632號,120.675625,24.146087,六合里,1.0,"  216 ",第二分局,,
196.0,臺中市北區六合里福龍街99號,120.674561,24.147732,六合里,1.0,"  536 ",第二分局,,
197.0,臺中市北區六合里臺灣大道一段700號,120.674657,24.146993,六合里,1.0,"  343 ",第二分局,,
198.0,臺中市北區光大里湖北街124號,120.677713,24.152778,光大里,1.0,"  1,302 ",第二分局,,
199.0,臺中市北區健行里德化街607號,120.666844,24.161453,健行里,1.0,"  293 ",第二分局,,
200.0,臺中市北區淡溝里博館二街45巷1號,120.667272,24.154333,淡溝里,1.0,"  763 ",第二分局,,
201.0,臺中市北區明德里太原五街13號,120.669908,24.165859,明德里,1.0,"  150 ",第二分局,,
202.0,臺中市北區淡溝里西屯路一段250巷1號,120.668873,24.155912,淡溝里,1.0,"  204 ",第二分局,,
203.0,臺中市北區淡溝里博館二街45巷1號,120.667272,24.154333,淡溝里,1.0,"  449 ",第二分局,,
204.0,臺中市北區中正里民權路222號,120.672343,24.1448,中正里,1.0,"  286 ",第二分局,,
205.0,臺中市北區淡溝里民權路472之9號," 120.67065",24.158790,淡溝里,12.0,"  3,559 ",第二分局,,
206.0,臺中市北區大湖里太平路100號,120.680172,24.149854,大湖里,2.0,"  948 ",第二分局,,
207.0,臺中市北區中正里原子街59號,120.673962,24.14627,中正里,2.0,"  208 ",第二分局,,
208.0,臺中市北區中正里原子街69號,120.67419,24.146419,中正里,2.0,"  489 ",第二分局,,
209.0,臺中市北區中正里臺灣大道一段601號,120.6758833,24.14544693,中正里,1.0,"  323 ",第二分局,,
210.0,臺中市北區中正里中山路391號,120.674578,24.145102,中正里,1.0,"  228 ",第二分局,,
211.0,臺中市北區中正里中山路371號,120.674814,24.144943,中正里,1.0,"  472 ",第二分局,,
212.0,臺中市北區光大里五順街257號,120.678624,24.152463,光大里,1.0,"  260 ",第二分局,,
213.0,臺中市北區光大里五順街269號,120.678365,24.152342,光大里,1.0,"  520 ",第二分局,,
214.0,臺中市北區光大里原子街127巷2弄18號,120.676469,24.149268,光大里,1.0,"  286 ",第二分局,,
215.0,臺中市北區六合里原子街125號,120.675656,24.148164,六合里,2.0,"  469 ",第二分局,,
216.0,臺中市北區中達里英才路236號,120.673081,24.155929,中達里,1.0,"  422 ",第二分局,,
217.0,臺中市北區中達里華中街27號," 120.67203",24.157104,中達里,1.0,"  341 ",第二分局,,
218.0,臺中市北區光大里原子街158號,120.677128,24.148965,光大里,1.0,"  375 ",第二分局,,
219.0,臺中市北區光大里原子街127巷21-2號,120.676305,24.149324,光大里,1.0,"  302 ",第二分局,,
220.0,臺中市北區光大里公園路182號,120.677717,24.150804,光大里,1.0,"  496 ",第二分局,,
221.0,臺中市北區光大里公園路186號,120.677635,24.151022,光大里,1.0,"  291 ",第二分局,,
222.0,臺中市北區大湖里太平路167號,120.679788,24.149432,大湖里,1.0,"  660 ",第二分局,,
223.0,臺中市北區六合里臺灣大道一段640號," 120.67557",24.146390,六合里,1.0,"  180 ",第二分局,,
224.0,臺中市北區五常里五順街158號,120.680846,24.153696,五常里,1.0,"  250 ",第二分局,,
225.0,臺中市北區五常里五義街160號,120.680964,24.154318,五常里,1.0,"  317 ",第二分局,,
226.0,臺中市北區五常里五義街169號,120.680333,24.153715,五常里,1.0,"  324 ",第二分局,,
227.0,臺中市北區淡溝里博館路10號,120.669284,24.15855,淡溝里,3.0,"  800 ",第二分局,,
228.0,臺中市北區錦平里中華路二段120號,120.682311,24.152107,錦平里,1.0,"  219 ",第二分局,,
229.0,臺中市北區淡溝里博館二街62號,120.667101,24.15407,淡溝里,3.0,"  513 ",第二分局,,
230.0,臺中市北區淡溝里育德路170號,120.671459,24.157606,淡溝里,1.0,"  276 ",第二分局,,
231.0,臺中市北區淡溝里大仁街70號,120.669425,24.153949,淡溝里,1.0,"  525 ",第二分局,,
232.0,臺中市北區五常里五權路499號,120.68467,24.154257,五常里,1.0,"  1,819 ",第二分局,,
233.0,臺中市北區邱厝里英才路98號," 120.67812",24.156138,邱厝里,1.0,"  1,544 ",第二分局,,
234.0,臺中市北區光大里英士路29號,120.677053,24.149417,光大里,1.0,"  702 ",第二分局,,
235.0,臺中市北區光大里英士路28號,120.677036,24.149605,光大里,1.0,"  1,268 ",第二分局,,
236.0,臺中市北區六合里五權路166號,120.674903,24.148695,六合里,1.0,"  1,182 ",第二分局,,
237.0,臺中市北區淡溝里英才路386之1號,120.668132,24.154820,淡溝里,1.0,"  1,608 ",第二分局,,
238.0,臺中市北區淡溝里英才路380之1號," 120.66883",24.155505,淡溝里,1.0,"  1,536 ",第二分局,,
239.0,臺中市北區淡溝里英才路390號之5,120.667821,24.154379,淡溝里,1.0,"  694 ",第二分局,,
240.0,臺中市北區大湖里柳川西路四段37號,120.6773291,24.151276,大湖里,1.0,"  100 ",第二分局,,
