726.0,建成里,臺中市北區建成里東光一街7之1號,1,"500 ",第二分局,120.6972083,24.1524169
727.0,梅川里,臺中市北區梅川里漢口路四段345巷18號,1,"723 ",第二分局,120.6771179,24.1670854
728.0,崇德里,臺中市北區崇德里崇德路一段462號,2,"725 ",第二分局,120.6829817,24.1635376
729.0,健行里,臺中市北區健行里民權路586號,1,"236 ",第二分局,"120.670643 ","24.162735 "
730.0,健行里,臺中市北區健行里華興街55號,2,"536 ",第二分局,120.6667943,24.1600139
731.0,健行里,臺中市北區健行里華興街47巷10號,2,"549 ",第二分局,"120.668689 ","24.160050 "
732.0,健行里,臺中市北區健行里華興街49號,3,"536 ",第二分局,"120.666938 ","24.159863 "
733.0,健行里,臺中市北區健行里忠明路5025號,1,"3122 ",第二分局,120.6713625,24.1627074
734.0,健行里,臺中市北區健行里民權路586號,1,"236 ",第二分局,"120.670543 ","24.162751 "
735.0,健行里,臺中市北區健行里健行路906巷2號,1,"190 ",第二分局,"120.665304 ","24.159611 "
736.0,金華里,臺中市北區金華里進化路351巷6號,1,"133 ",第二分局,120.6918149,24.1539934
737.0,金華里,臺中市北區金華里進德北路156之1號,1,"869 ",第二分局,"120.690916 ","24.154695 "
738.0,邱厝里,臺中市北區邱厝里育德路一段63號,1,"129 ",第二分局,120.6748735,24.1570883
739.0,邱厝里,臺中市北區邱厝里育德路一段61號,1,"129 ",第二分局,120.6748735,24.1570883
740.0,邱厝里,臺中市北區邱厝里育德路1號,4,"1342 ",第二分局,120.6783071,24.1571781
741.0,邱厝里,臺中市北區邱厝里大德街45號,1,"2490 ",第二分局,120.6766516,24.1569309
742.0,邱厝里,臺中市北區邱厝里大德街49號6樓之2,1,"2491 ",第二分局,120.6766489,24.1570721
743.0,邱厝里,臺中市北區邱厝里健行路359號,1,"90 ",第二分局,120.6810245,24.1588792
744.0,邱厝里,臺中市北區邱厝里中清路一段167號,1,"623 ",第二分局,120.6742613,24.1567562
745.0,明德里,臺中市北區明德里忠明七街13號,1,"140 ",第二分局,120.6671379,24.1643512
746.0,明德里,臺中市北區明德里太原路5號,1,"120 ",第二分局,120.6832923,"24.165554 "
747.0,明德里,臺中市北區明德里漢口路三段52巷巷34弄10號,1,"132 ",第二分局,120.665385,24.1668176
748.0,明德里,臺中市北區明德里太原四街15之1號,1,"189 ",第二分局,120.6671416,"24.165725 "
749.0,明德里,臺中市北區明德里太原南二路155-157號,1,"790 ",第二分局,120.6662363,24.1641179
750.0,明德里,臺中市北區明德里太原南二街155之15號,2,"412 ",第二分局,120.6662363,24.1641179
751.0,明德里,臺中市北區明德里太原路一段478巷1號,1,"997 ",第二分局,120.6671483,24.1647532
752.0,明新里,臺中市北區明新里忠明路501巷17-22號,1,"140 ",第二分局,120.6704569,24.1642535
753.0,育德里,臺中市北區育德里篤行路385巷15號,1,"500 ",第二分局,"120.671492 ","24.158595 "
754.0,育德里,臺中市北區育德里大德街85巷25.27號,1,"120 ",第二分局,120.6765376,24.1585474
755.0,育德里,臺中市北區育德里育德路32號,1,"166 ",第二分局,"120.676453 ","24.157669 "
756.0,育德里,臺中市北區育德里美德街190號,1,"100 ",第二分局,120.6779007,24.1582715
757.0,育德里,臺中市北區育德里美德街185巷68弄10號,1,"160 ",第二分局,120.6777668,24.1581793
758.0,育德里,臺中市北區育德里美德街185弄62號,1,"200 ",第二分局,120.6777668,24.1581793
759.0,育德里,臺中市北區育德里美德街185巷61號,1,"500 ",第二分局,120.6777668,24.1581793
760.0,育德里,臺中市北區育德里篤行路408號,1,"445 ",第二分局,"120.671510 ","24.158315 "
761.0,育德里,臺中市北區育德里美德街281號,1,"156 ",第二分局,120.6747515,24.1581847
762.0,育德里,臺中市北區育德里中清路一段150巷10弄2號,1,"560 ",第二分局,"120.677741 ","24.154873 "
763.0,立人里,臺中市北區立人里北平四街201號,1,"94 ",第二分局,"120.671067 ","24.172567 "
764.0,六合里,臺中市北區六合里成功路457號之1,1,"180 ",第二分局,"120.674972 ","24.147609 "
765.0,六合里,臺中市北區六合里原子街90巷2號之1,1,"208 ",第二分局,"120.675956 ",24.1473181
766.0,五常里,臺中市北區五常里五義街132-136號,1,"500 ",第二分局,120.679438,24.1545368
767.0,五常里,臺中市北區五常里五義街235號之1,1,"200 ",第二分局,120.6761363,24.1531876
768.0,五常里,臺中市北區五常里崇德路一段50號,1,"170 ",第二分局,120.68338,24.1560245
769.0,中達里,臺中市北區中達里篤行路301巷29弄20號,1,"120 ",第二分局,"120.671358 ","24.153669 "
770.0,中達里,臺中市北區中達里篤行路241巷80弄8號,1,"173 ",第二分局,120.673644,24.1523355
771.0,中達里,臺中市北區中達里英才路286-304號,1,"581 ",第二分局,120.669051,24.1558839
772.0,中達里,臺中市北區中達里英才路170巷6號,1,"133 ",第二分局,"120.674912 ","24.156322 "
773.0,中達里,臺中市北區中達里英才路170巷4號,1,"133 ",第二分局,"120.675004 ","24.156324 "
774.0,中達里,臺中市北區中達里育德路187號,1,"285 ",第二分局,120.6697136,24.1571675
775.0,大湖里,臺中市北區大湖里湖北街64巷1號之14,1,"364 ",第二分局,120.6773154,24.1508984
776.0,大湖里,臺中市北區大湖里湖北街66號之70,1,"300 ",第二分局,120.6769427,24.1508738
777.0,中正里,臺中市北區中正里民權路220號,1,"166 ",第二分局,"120.674061 ","24.143757 "
778.0,金龍里,臺中市北區金龍里三民路326巷3號,1,"264 ",第二分局,"120.684647 ","24.155639 "
779.0,長青里,臺中市北區長青里陝西東街78號,1,"224 ",第二分局,"120.665416 ","24.169126 "
780.0,長青里,臺中市北區長青里陝西五街32號,1,"479 ",第二分局,"120.665416 ","24.169126 "
781.0,長青里,臺中市北區長青里華美街190號,1,"131 ",第二分局,"120.665416 ","24.169126 "
782.0,錦平里,臺中市北區錦平里中華路二段193號,1,"345 ",第二分局,"120.681734 ","24.151503 "
783.0,淡溝里,臺中市北區淡溝里民權路411號,"2,3","3914 ",第二分局,"120.670461 ","24.158542 "
784.0,淡溝里,臺中市北區淡溝里臺灣大道二段362號,1,"966 ",第二分局,"120.671248 ","24.159064 "
785.0,光大里,臺中市北區光大里五權路216號,1,"995 ",第二分局,"120.676738 ","24.150710 "
786.0,五常里,臺中市北區五常里英才路1號,1,"143 ",第二分局,120.678332,"24.155387 "
787.0,賴村里,臺中市北區賴村里學士路267號,2,"499 ",第二分局,"120.680823 ","24.162392 "
788.0,邱厝里,臺中市北區邱厝里學士路106號,2,"22065 ",第二分局,"120.681141 ","24.157859 "
789.0,育德里,臺中市北區育德里美德街275號,1,"183 ",第二分局,"120.677073 ","24.158317 "
790.0,崇德里,臺中市北區崇德里太原路三段8號,1,"1705 ",第二分局,"120.685298 ","24.165178 "
791.0,崇德里,臺中市北區崇德里太原路三段63號,1,"557 ",第二分局,"120.687603 ","24.165533 "
792.0,賴厝里,臺中市北區賴厝里東漢街7號,1,"1184 ",第二分局,"120.679487 ","24.166265 "
793.0,邱厝里,臺中市北區邱厝里大德街47號,1,"1297 ",第二分局,"120.678808 ","24.157237 "
794.0,淡溝里,臺中市北區淡溝里育德路187之1號,1,"800 ",第二分局,"120.671897 ","24.157393 "
795.0,崇德里,臺中市北區崇德里崇德路一段256巷2號,1,"1900 ",第二分局,"120.686096 ","24.161234 "
796.0,金龍里,臺中市北區金龍里金龍街112號,2,"1472 ",第二分局,"120.687753 ","24.158669 "
797.0,樂英里,臺中市北區樂英里錦南街46號,1,"1000 ",第二分局,"120.687105 ","24.154482 "
798.0,中達里,臺中市北區中達里日盛街59號,1,"369 ",第二分局,"120.671651 ","24.153113 "
799.0,賴旺里,臺中市北區賴旺里青島路1段6之1號,2,"2726 ",第二分局,"120.673829 ","24.173728 "
800.0,賴村里,臺中市北區錦村里五常街193號,1,"737 ",第二分局,"120.679532 ","24.159623 "
801.0,長青里,臺中市北區長青里陜西路62號,2,"942 ",第二分局,"120.668348 ","24.169083 "
802.0,立人里,臺中市北區立人里北平路一段10號,1,"864 ",第二分局,"120.667991 ","24.171634 "
803.0,明德里,臺中市北區明德里太原北路86號,1,"918 ",第二分局,"120.669045 ","24.165259 "
804.0,新北里,台中市北區新北里錦南街19之18號,1,"7723 ",第二分局,"120.686709 ","24.154362 "
805.0,新北里,台中市北區新北里錦南街17號,1,"6727 ",第二分局,"120.688108 ","24.153902 "
806.0,錦平里,臺中市北區錦平里錦平街40號,1,"1261 ",第二分局,"120.683916 ","24.152057 "
807.0,明德里,臺中市北區明德里忠明七街30號,1,"325 ",第二分局,120.6691853,24.16318156
808.0,立人里,臺中市北區立人里中清路一段637號,1,"1509 ",第二分局,120.6712015,24.17065739
809.0,錦祥里,臺中市北區錦祥里育樂街39號,1,"1326 ",第二分局,120.6926651,24.15692413
810.0,金龍里,臺中市北區金龍里益華街79號,1,"332 ",第二分局,120.6890547,24.16015207
811.0,淡溝里,臺中市北區淡溝里西屯路一段226之3號,1,"999 ",第二分局,120.6694749,24.15494268
812.0,金華里,臺中市北區金華里雙十路二段97號,1,"984 ",第二分局,120.6899854,24.15574859
813.0,錦平里,臺中市北區錦平里育德路98號,1,"6013 ",第二分局,120.674892,24.1575698
814.0,中達里,臺中市北區中達里英才路258號,1,"459 ",第二分局,120.6724326,24.15574779
815.0,明德里,臺中市北區明德里太原北路2號,1,"1431 ",第二分局,120.666225,24.16530425
816.0,金龍里,臺中市北區金龍里三民路三段315巷17號,1,"262 ",第二分局,120.6882585,24.15754192
817.0,長青里,臺中市北區長青里漢口路三段80號,1,"1926 ",第二分局,120.6684378,24.1668112
818.0,賴興里,臺中市北區賴興里文昌東二街116巷1號,1,"1812 ",第二分局,120.6781632,24.17099722
819.0,文莊里,臺中市北區文莊里五權路255號,1,"9184 ",第二分局,120.675923,24.15051615
820.0,梅川里,臺中市北區梅川里文昌東一街111號,1,"804 ",第二分局,120.6766621,24.16743915
821.0,錦洲里,臺中市北區錦洲里進化路580號,1,"501 ",第二分局,120.6944742,24.15963126
822.0,建成里,臺中市北區建成里東成路22號,1,"293 ",第二分局,120.7014686,24.15683795
823.0,淡溝里,臺中市北區淡溝里健行路803號,1,"351 ",第二分局,120.6713741,24.1591918
824.0,長青里,臺中市北區長青里天津路二段61號,1,"2994 ",第二分局,120.673666,24.17013764
825.0,賴福里,臺中市北區賴福里山西路一段50號,2,"3759 ",第二分局,120.6757297,24.16617002
826.0,建成里,臺中市北區建成里天祥街228之11號,1,"2949 ",第二分局,120.7025935,24.15982634
827.0,錦祥里,臺中市北區錦祥里錦祥街47號,1,"228 ",第二分局,120.6910801,24.15707218
828.0,錦祥里,臺中市北區錦祥里進化路581號,1,"1459 ",第二分局,120.6942837,24.16024252
829.0,賴明里,臺中市北區賴明里山西路二段90之2號,1,"2174 ",第二分局,120.6757487,24.16950768
830.0,梅川里,臺中市北區梅川里文昌東二街146號,1,"263 ",第二分局,120.6778224,24.16949415
831.0,賴村里,臺中市北區賴村里學士路181號,1,"418 ",第二分局,120.6808286,24.15980613
832.0,長青里,臺中市北區長青里天津路一段130號,1,"585 ",第二分局,120.6709778,24.17020337
833.0,賴明里,臺中市北區賴明里漢口路4段5號之1,1,"1288 ",第二分局,120.6738157,24.16810858
834.0,崇德里,臺中市北區崇德里崇德路一段625號,3,"1108 ",第二分局,120.6849107,24.16752652
835.0,長青里,臺中市北區長青里陜西路24號,1,"646 ",第二分局,120.6683553,24.168064
836.0,金華里,臺中市北區金華里興進路228號,1,"914 ",第二分局,120.6916726,24.1564899
837.0,淡溝里,臺中市北區淡溝里育德路178號,1,"594 ",第二分局,120.6712482,24.15784084
838.0,新北里,臺中市北區新北里雙十路二段29號,2,"790 ",第二分局,120.6886616,24.15274253
839.0,長青里,臺中市北區長青里陝西五街8號,1,"751 ",第二分局,120.6671194,24.16933868
840.0,立人里,臺中市北區立人里華美街二段258號,2,"792 ",第二分局,120.6670464,24.17114412
841.0,金龍里,臺中市北區金龍里三民路三段315巷33號,1,"510 ",第二分局,120.6880904,24.15759264
842.0,明德里,臺中市北區明德里忠明路429號,1,"1031 ",第二分局,120.6697783,24.16347502
843.0,樂英里,臺中市北區樂英里雙十路一段12巷,1,"1244 ",第二分局,120.6872594,24.14844691
