地址,可容納人數,經度,緯度,避難所在之地下樓層數,編號,村里別,轄區分局
臺中市太平區長億里3鄰長億路1號,81.0,"120.720933 ","24.119185 ",B01,LA00001,長億里,太平分局
臺中市太平區永成里3鄰長億路4號,33.0,120.720724,24.119274,B01,LA00002,永成里,太平分局
臺中市太平區永成里3鄰長億路6號,100.0,120.720676,24.119237,B01,LA00003,永成里,太平分局
臺中市太平區永成里3鄰長億路8號,132.0,120.720656,24.119209,B01,LA00004,永成里,太平分局
臺中市太平區長億里3鄰長億路19號,245.0,120.720404,24.118742,B01,LA00005,長億里,太平分局
臺中市太平區永成里3鄰長億路24號,37.0,120.720182,24.118802,B01,LA00006,永成里,太平分局
臺中市太平區長億里9鄰長億路65號,10.0,120.719083,24.117619,B01,LA00007,長億里,太平分局
臺中市太平區長億里9鄰長億路67號,10.0,120.71906,24.117599,B01,LA00008,長億里,太平分局
臺中市太平區長億里9鄰長億路69號,10.0,120.719026,24.117569,B01,LA00009,長億里,太平分局
臺中市太平區長億里9鄰長億路75號,10.0,120.718991,24.117543,B01,LA00010,長億里,太平分局
臺中市太平區長億里9鄰長億路77號,10.0,120.718958,24.117510,B01,LA00011,長億里,太平分局
臺中市太平區長億里9鄰長億路79號,10.0,120.718923,24.117482,B01,LA00012,長億里,太平分局
臺中市太平區長億里9鄰長億路81號,10.0,120.718886,24.117451,B01,LA00013,長億里,太平分局
臺中市太平區長億里9鄰長億路83號,10.0,120.718856,24.117423,B01,LA00014,長億里,太平分局
臺中市太平區長億里9鄰長億路85號,10.0,120.718824,24.117399,B01,LA00015,長億里,太平分局
臺中市太平區長億里9鄰長億路87號,10.0,120.718797,24.117380,B01,LA00016,長億里,太平分局
臺中市太平區長億里9鄰長億路89號,10.0,120.718778,24.117353,B01,LA00017,長億里,太平分局
臺中市太平區長億里9鄰長億路91號,10.0,120.718729,24.117322,B01,LA00018,長億里,太平分局
臺中市太平區中興里2鄰東平路669號,77.0,120.714699,24.133186,B01,LA00019,中興里,太平分局
臺中市太平區中興里2鄰東平路715巷6號,58.0,120.713667,24.132910,B01,LA00020,中興里,太平分局
臺中市太平區太平里28鄰永義路235巷2號,64.0,120.710964,24.125696,B01,LA00021,太平里,太平分局
臺中市太平區太平里17鄰太平路529號,16.0,120.713486,24.125179,B01,LA00024,太平里,太平分局
臺中市太平區太平里30鄰太平路751號,14.0,120.708709,24.128075,B01,LA00025,太平里,太平分局
臺中市太平區太平里30鄰太平路753號,14.0,120.708668,24.128098,B01,LA00026,太平里,太平分局
臺中市太平區太平里30鄰太平路755號,14.0,120.708636,24.128122,B01,LA00027,太平里,太平分局
臺中市太平區太平里30鄰太平路757號,14.0,120.708603,24.128143,B01,LA00028,太平里,太平分局
臺中市太平區太平里30鄰太平路759號,14.0,120.708562,24.128164 ,B01,LA00029,太平里,太平分局
臺中市太平區太平里30鄰太平路761號,14.0,120.708525,24.128192,B01,LA00030,太平里,太平分局
臺中市太平區太平里30鄰太平路763號,14.0,120.708489,24.128211,B01,LA00031,太平里,太平分局
臺中市太平區太平里21鄰永平路3段1號,18.0,120.708323,24.128049,B01,LA00032,太平里,太平分局
臺中市太平區太平里21鄰永平路3段3號,14.0,120.708294,24.128006,B01,LA00033,太平里,太平分局
臺中市太平區中興里11鄰中興路78號,110.0,120.716402,24.127868,B01,LA00034,中興里,太平分局
臺中市太平區中興里11鄰中興路118號之1,13.0,120.715126,24.127026,B01,LA00035,中興里,太平分局
臺中市太平區中興里11鄰中興路118號之2,13.0,120.715093,24.127005,B01,LA00036,中興里,太平分局
臺中市太平區中興里13鄰太平路570號,25.0,120.713151,24.125765,B01,LA00037,中興里,太平分局
臺中市太平區中興里13鄰太平路572號,21.0,120.713103,24.125762,B01,LA00038,中興里,太平分局
臺中市太平區中興里13鄰太平路576號,16.0,120.713071,24.125768,B01,LA00039,中興里,太平分局
臺中市太平區中興里14鄰太平路658號,44.0,120.711962,24.127063,B01,LA00040,中興里,太平分局
臺中市太平區中興里15鄰太平路676號,150.0,120.711167,24.127915,B01,LA00041,中興里,太平分局
臺中市太平區中興里19鄰永平路2段535巷46號,24.0,120.709663,24.128585,B01,LA00042,中興里,太平分局
臺中市太平區中興里15鄰太平路766號,68.0,120.709741,24.127687,B01,LA00043,中興里,太平分局
臺中市太平區中興里15鄰太平路772號,45.0,120.709641,24.127747,B01,LA00044,中興里,太平分局
臺中市太平區中興里15鄰太平路850號,16.0,120.70815,24.128657,B01,LA00045,中興里,太平分局
臺中市太平區成功里7鄰中興東路328號,14.0,120.725664,24.133283,B01,LA00046,成功里,太平分局
臺中市太平區永平里5鄰中興東路27號,418.0,120.719997,24.130159,B01,LA00047,永平里,太平分局
臺中市太平區永平里5鄰中興東路35號,25.0,120.720226,24.130291,B01,LA00048,永平里,太平分局
臺中市太平區永平里4鄰中興東路185號,54.0,120.722850,24.131866,B01,LA00049,永平里,太平分局
臺中市太平區永平里5鄰中平路75號,516.0,120.719210,24.130627,B01,LA00050,永平里,太平分局
臺中市太平區成功里12鄰成功東路213號,12.0,120.722963,24.129760,B01,LA00051,成功里,太平分局
臺中市太平區永平里5鄰中平路112號,27.0,120.718466,24.129342,B01,LA00053,永平里,太平分局
臺中市太平區太平里27鄰新仁路1段86號,28.0,120.705273,24.111693,B01,LA00054,太平里,太平分局
臺中市太平區太平里27鄰新仁路1段22巷9號,100.0,120.707986,24.112388,B01,LA00055,太平里,太平分局
臺中市太平區太平里16鄰永成路112號,78.0,120.710397,24.115459,B01,LA00056,太平里,太平分局
臺中市太平區中政里10鄰中平路144號,378.0,120.718380,24.126553,B01,LA00057,中政里,太平分局
臺中市太平區中政里4鄰中興路53號,46.0,120.716709,24.127810,B01,LA00058,中政里,太平分局
臺中市太平區中平里16鄰中平七街27巷9號,1063.0,120.719428,24.126235,B01,LA00059,中平里,太平分局
臺中市太平區中平里16鄰中平七街27巷23號,417.0,120.719528,24.126302,B01,LA00060,中平里,太平分局
臺中市太平區東平里14鄰中和街93號,14.0,120.722590,24.135590,B01,LA00061,東平里,太平分局
臺中市太平區東平里14鄰中和街95號,14.0,120.722619,24.135619,B01,LA00062,東平里,太平分局
臺中市太平區東平里14鄰中和街97號,14.0,120.722644,24.135653,B01,LA00063,東平里,太平分局
臺中市太平區東平里14鄰中和街99號,14.0,120.722671,24.135692,B01,LA00064,東平里,太平分局
臺中市太平區東平里14鄰中和街101號,13.0,120.722701,24.135719,B01,LA00065,東平里,太平分局
臺中市太平區東平里14鄰中和街103號,13.0,120.722730,24.135751,B01,LA00066,東平里,太平分局
臺中市太平區太平里5鄰永豐路51號,70.0,120.712807,24.123928,B01,LA00067,太平里,太平分局
臺中市太平區太平里8鄰太平路397號,22.0,120.716564,24.124259,B01,LA00068,太平里,太平分局
臺中市太平區太平里8鄰太平路405號,20.0,120.716411,24.124316,B01,LA00069,太平里,太平分局
臺中市太平區太平里8鄰太平路399號,22.0,120.716526,24.124268,B01,LA00070,太平里,太平分局
臺中市太平區太平里8鄰太平路395號,22.0,120.716590,24.124238,B01,LA00071,太平里,太平分局
臺中市太平區太平里8鄰太平路411號,23.0,120.716301,24.124365,B01,LA00073,太平里,太平分局
臺中市太平區太平里8鄰太平路413號,22.0,120.716259,24.124386,B01,LA00074,太平里,太平分局
臺中市太平區太平里8鄰太平路415號,22.0,120.716221,24.124402,B01,LA00075,太平里,太平分局
臺中市太平區太平里8鄰太平路417號,23.0,120.716180,24.124413,B01,LA00076,太平里,太平分局
臺中市太平區太平里8鄰太平路401號,22.0,120.716482,24.124295,B01,LA00078,太平里,太平分局
臺中市太平區太平里8鄰太平路403號,20.0,120.716453,24.124301,B01,LA00079,太平里,太平分局
臺中市太平區太平里15鄰永豐路209巷9號,34.0,120.709122,24.119616,B01,LA00080,太平里,太平分局
臺中市太平區太平里15鄰永豐路195巷3號,47.0,120.709436,24.120435,B01,LA00081,太平里,太平分局
臺中市太平區太平里15鄰永豐路195巷1號,28.0,120.708971,24.120435,B01,LA00082,太平里,太平分局
臺中市太平區太平里5鄰中南路27號,29.0,120.714797,24.124162,B01,LA00083,太平里,太平分局
臺中市太平區太平里14鄰合利街13號,71.0,120.706717,24.124248,B01,LA00084,太平里,太平分局
臺中市太平區太平里12鄰永豐路87號,716.0,120.711704,24.123257,B01,LA00085,太平里,太平分局
臺中市太平區建興里8鄰鵬儀路368號,82.0,120.730539,24.127802,B01,LA00087,建興里,太平分局
臺中市太平區建國里14鄰鵬儀路294號,70.0,120.726503,24.124061,B01,LA00088,建國里,太平分局
臺中市太平區建國里11鄰鵬儀路287號,70.0,120.726891,24.124645,B01,LA00089,建國里,太平分局
臺中市太平區建國里11鄰鵬儀路289號,40.0,120.727070,24.124871,B01,LA00090,建國里,太平分局
臺中市太平區建興里20鄰鵬儀路342巷2號,41.0,120.729495,24.126379,B01,LA00091,建興里,太平分局
臺中市太平區建國里11鄰鵬儀路305巷2號,51.0,120.727169,24.125497,B01,LA00092,建國里,太平分局
臺中市太平區東平里9鄰東村路150號,1713.0,120.724367,24.136699,B01,LA00094,東平里,太平分局
臺中市太平區太平里29鄰太平路741號,88.0,120.709098,24.127758,B01,LA00095,太平里,太平分局
臺中市太平區中政里14鄰永平南路40巷1號,1574.0,120.721535,24.129383,B01,LA00096,中政里,太平分局
臺中市太平區建國里14鄰鵬儀路296巷6弄12號,94.0,120.726704,24.122449,B01,LA00097,建國里,太平分局
臺中市太平區中平里8鄰太平路300號,433.0,120.718271,24.123069,B01,LA00098,中平里,太平分局
臺中市太平區太平里16鄰永成路78號,542.0,120.708940,24.115942,B01,LA00099,太平里,太平分局
臺中市太平區太平里30鄰永平路3段85號,1239.0,120.707408,24.126279,B01,LA00100,太平里,太平分局
臺中市太平區中政里4鄰中興路35號,1239.0,120.717652,24.127823,B01,LA00101,中政里,太平分局
臺中市太平區太平里17鄰太平路483號,1131.0,120.714717,24.124583,B01,LA00102,太平里,太平分局
臺中市太平區中興里2鄰東平路769號,513.0,120.711553,24.133959,B01,LA00103,中興里,太平分局
臺中市太平區長億里17鄰太平三街295號,762.0,120.716082,24.113005,B01,LA00105,長億里,太平分局
臺中市太平區中平里8鄰太平路300號,159.0,120.718273,24.123067,B01,LA00106,中平里,太平分局
臺中市太平區東和里1鄰東平路18號,218.0,120.736949,24.137626,B01,LA00107,東和里,太平分局
臺中市太平區東和里1鄰東平路18號,1158.0,120.736949,24.137626,B01,LA00108,東和里,太平分局
臺中市太平區永平里5鄰永平路1段9號,1871.0,120.719725,24.131145,B01,LA00109,永平里,太平分局
臺中市太平區永平里5鄰大仁街7號,713.0,120.718676,24.130745,B01,LA00110,永平里,太平分局
臺中市太平區中興里11鄰中興路100號,360.0,120.715400,24.127276,B01,LA00111,中興里,太平分局
臺中市太平區中平里8鄰太平路300號,124.0,120.718271,24.123068,B01,LA00112,中平里,太平分局
臺中市太平區太平里12鄰永豐路133號,127.0,120.710264,24.122040,B01,LA00113,太平里,太平分局
臺中市太平區太平里12鄰永豐路90號,734.0,120.709995,24.122405,B01,LA00114,太平里,太平分局
臺中市太平區太平里16鄰永成路78號,2375.0,120.708938,24.115939,B01,LA00115,太平里,太平分局
臺中市太平區太平里12鄰永豐路78號,3743.0,120.710842,24.123026,B01,LA00116,太平里,太平分局
臺中市太平區永平里12鄰大仁街17號,264.0,120.718359,24.130756,B01,LA00117,永平里,太平分局
臺中市太平區中政里20鄰中興東路46號,170.0,120.719545,24.129614,B01,LA00118,中政里,太平分局
臺中市太平區太平里14鄰合利街24巷13號,1067.0,120.705585,24.123155,B02,LA00119,太平里,太平分局
臺中市太平區新福里14鄰中山路4段212巷12號,2971.0,120.702021,24.149654,B01,LB00001,新福里,太平分局
臺中市太平區新福里1鄰樹德路23號,18.0,120.710495,24.150148,B01,LB00002,新福里,太平分局
臺中市太平區新福里1鄰樹德路21號,18.0,120.710483,24.150109,B01,LB00003,新福里,太平分局
臺中市太平區新福里1鄰樹德路19號,18.0,120.710478,24.150068,B01,LB00004,新福里,太平分局
臺中市太平區新福里1鄰樹德路17號,18.0,120.710466,24.150029,B01,LB00005,新福里,太平分局
臺中市太平區新福里1鄰樹德路15號,18.0,120.710456,24.149994,B01,LB00006,新福里,太平分局
臺中市太平區新福里1鄰樹德路13號,36.0,120.710448,24.149952,B01,LB00007,新福里,太平分局
臺中市太平區新福里1鄰樹德路11號,18.0,120.710435,24.149912,B01,LB00008,新福里,太平分局
臺中市太平區新福里1鄰樹德路9號,18.0,120.710422,24.149871,B01,LB00009,新福里,太平分局
臺中市太平區新福里1鄰樹德路7號,18.0,120.710413,24.149827,B01,LB00010,新福里,太平分局
臺中市太平區新福里1鄰樹德路5號,18.0,120.710404,24.149794,B01,LB00011,新福里,太平分局
臺中市太平區新福里1鄰樹德路3號,18.0,120.710390,24.149756,B01,LB00012,新福里,太平分局
臺中市太平區新福里1鄰樹德路1號,34.0,120.710400,24.149733,B01,LB00013,新福里,太平分局
臺中市太平區新光里15鄰樹德一街136巷30號,88.0,120.706557,24.152354,B01,LB00014,新光里,太平分局
臺中市太平區新光里20鄰振英街15號,33.0,120.706578,24.153429,B01,LB00015,新光里,太平分局
臺中市太平區新光里20鄰振英街13號,33.0,120.706577,24.153390,B01,LB00016,新光里,太平分局
臺中市太平區新光里20鄰振英街11號,33.0,120.706579,24.153345,B01,LB00017,新光里,太平分局
臺中市太平區新光里20鄰振英街9號,33.0,120.706575,24.153295,B01,LB00018,新光里,太平分局
臺中市太平區宜佳里14鄰宜仁路19號,974.0,120.7144767,24.13780647,B01,LB00019,宜佳里,太平分局
臺中市太平區宜佳里24鄰市民大道一段49號,36.0,"120.714246 ","24.137470 ",B01,LB00020,宜佳里,太平分局
臺中市太平區宜佳里24鄰市民大道一段45號,36.0,"120.714257 ","24.137391 ",B01,LB00021,宜佳里,太平分局
臺中市太平區宜佳里14鄰新平路2段35號,22.0,120.715265,24.136969,B01,LB00022,宜佳里,太平分局
臺中市太平區新吉里8鄰新平路3段72號,71.0,120.720315,24.150469,B01,LB00023,新吉里,太平分局
臺中市太平區新高里16鄰中山路4段42號,171.0,120.711804,24.150038,B01,LB00024,新高里,太平分局
臺中市太平區新高里5鄰立德街78號,632.0,120.713644,24.153291,B01,LB00025,新高里,太平分局
臺中市太平區宜昌里6鄰中山路3段55號,21.0,120.718132,24.148703,B01,LB00026,宜昌里,太平分局
臺中市太平區宜昌里6鄰中山路3段57號,21.0,120.718060,24.148704,B01,LB00027,宜昌里,太平分局
臺中市太平區宜昌里6鄰中山路3段59號,21.0,120.718014,24.148701,B01,LB00028,宜昌里,太平分局
臺中市太平區宜昌里6鄰中山路3段61號,20.0,120.717962,24.148699,B01,LB00029,宜昌里,太平分局
臺中市太平區宜昌里6鄰中山路3段63號,20.0,120.717918,24.148698,B01,LB00030,宜昌里,太平分局
臺中市太平區宜昌里6鄰中山路3段67號,20.0,120.717832,24.148687,B01,LB00031,宜昌里,太平分局
臺中市太平區宜昌里6鄰中山路3段69號,36.0,120.717679,24.148661,B01,LB00032,宜昌里,太平分局
臺中市太平區宜欣里13鄰宜昌東路45號,227.0,120.718867,24.142048,B01,LB00033,宜欣里,太平分局
臺中市太平區宜欣里9鄰宜欣10街50號,2050.0,120.716197,24.14317,B01B02,LB00034,宜欣里,太平分局
臺中市太平區宜欣里14鄰溪州路120號,44.0,120.719754,24.142399,B01,LB00035,宜欣里,太平分局
臺中市太平區新興里6鄰新光路10號之7,19.0,120.709958,24.155848,B01,LB00036,新興里,太平分局
臺中市太平區新光里11鄰振福路445號,14.0,120.709089,24.154412,B01,LB00037,新光里,太平分局
臺中市太平區新光里11鄰振福路449號,14.0,120.709169,24.154438,B01,LB00038,新光里,太平分局
臺中市太平區新光里11鄰振福路451號,14.0,120.709207,24.154450 ,B01,LB00039,新光里,太平分局
臺中市太平區新光里11鄰振福路453號,14.0,120.709250,24.154461,B01,LB00040,新光里,太平分局
臺中市太平區新光里11鄰振福路457號,14.0,120.709332,24.154492,B01,LB00041,新光里,太平分局
臺中市太平區新興里2鄰怡林街2號,1052.0,120.711898,24.157844,B01,LB00042,新興里,太平分局
臺中市太平區新城里18鄰樹孝路274巷5號,21.0,120.718749,24.153636,B01,LB00043,新城里,太平分局
臺中市太平區新城里18鄰樹孝路274巷3號,21.0,120.718717,24.153663,B01,LB00044,新城里,太平分局
臺中市太平區新城里18鄰樹孝路274巷1號,21.0,120.718680,24.153673,B01,LB00045,新城里,太平分局
臺中市太平區新城里19鄰樹孝路304號,1131.0,120.718839,24.154319,B01,LB00046,新城里,太平分局
臺中市太平區新城里18鄰樹孝路274巷9弄3號,22.0,120.718928,24.153822,B01,LB00047,新城里,太平分局
臺中市太平區新城里18鄰樹孝路274巷9弄5號,22.0,120.718952,24.153862,B01,LB00048,新城里,太平分局
臺中市太平區新城里18鄰樹孝路288號,22.0,120.718636,24.154008,B01,LB00049,新城里,太平分局
臺中市太平區新城里18鄰樹孝路292號,22.0,120.718688,24.154088,B01,LB00050,新城里,太平分局
臺中市太平區新城里18鄰樹孝路296號,22.0,120.718729,24.154152,B01,LB00051,新城里,太平分局
臺中市太平區新城里18鄰樹孝路298號,22.0,120.718753,24.154195,B01,LB00052,新城里,太平分局
臺中市太平區新城里18鄰樹孝路300號,22.0,120.718779,24.154224,B01,LB00053,新城里,太平分局
臺中市太平區新城里18鄰樹孝路276號,22.0,120.718521,24.153767,B01,LB00054,新城里,太平分局
臺中市太平區新城里18鄰樹孝路278號,22.0,120.718532,24.153821,B01,LB00055,新城里,太平分局
臺中市太平區新城里18鄰樹孝路280號,22.0,120.718558,24.153860,B01,LB00056,新城里,太平分局
臺中市太平區新城里18鄰樹孝路282號,22.0,120.718576,24.153892,B01,LB00057,新城里,太平分局
臺中市太平區新城里18鄰樹孝路284號,22.0,120.718605,24.153926,B01,LB00058,新城里,太平分局
臺中市太平區新城里18鄰樹孝路388號,22.0,120.719831,24.155912,B01,LB00059,新城里,太平分局
臺中市太平區新城里18鄰樹孝路368號,22.0,120.719622,24.155558,B01,LB00060,新城里,太平分局
臺中市太平區新城里18鄰樹孝路366號,22.0,120.719598,24.155519,B01,LB00061,新城里,太平分局
臺中市太平區新城里18鄰樹孝路370號,22.0,120.719648,24.155595,B01,LB00062,新城里,太平分局
臺中市太平區新城里18鄰樹孝路350號,22.0,120.719421,24.155249,B01,LB00063,新城里,太平分局
臺中市太平區新城里18鄰樹孝路348號,22.0,120.719388,24.155212,B01,LB00064,新城里,太平分局
臺中市太平區新城里18鄰樹孝路346號,22.0,120.719375,24.155177,B01,LB00065,新城里,太平分局
臺中市太平區新城里18鄰樹孝路342號之1,22.0,120.719348,24.155151,B01,LB00066,新城里,太平分局
臺中市太平區新城里18鄰樹孝路342號,22.0,120.719323,24.155106,B01,LB00067,新城里,太平分局
臺中市太平區新城里18鄰樹孝路340號,22.0,120.719308,24.155070,B01,LB00068,新城里,太平分局
臺中市太平區新城里18鄰樹孝路354號,22.0,120.719460,24.155321,B01,LB00069,新城里,太平分局
臺中市太平區新城里18鄰樹孝路362號,21.0,120.719564,24.155449,B01,LB00070,新城里,太平分局
臺中市太平區新城里18鄰樹孝路360號,22.0,120.719539,24.155407,B01,LB00071,新城里,太平分局
臺中市太平區新城里18鄰樹孝路358號,22.0,120.719516,24.155380,B01,LB00072,新城里,太平分局
臺中市太平區新城里18鄰樹孝路384號,22.0,120.719795,24.155844,B01,LB00073,新城里,太平分局
臺中市太平區新城里18鄰樹孝路380號,22.0,120.719751,24.155772,B01,LB00074,新城里,太平分局
臺中市太平區新城里18鄰樹孝路378號,22.0,120.719727,24.155735,B01,LB00075,新城里,太平分局
臺中市太平區新城里18鄰樹孝路376號,22.0,120.719708,24.155701,B01,LB00076,新城里,太平分局
臺中市太平區新城里18鄰樹孝路372號,22.0,120.719668,24.155626,B01,LB00077,新城里,太平分局
臺中市太平區新城里21鄰樹孝路357號,22.0,120.719287,24.155440,B01,LB00078,新城里,太平分局
臺中市太平區新坪里21鄰樹孝路355號,22.0,120.719263,24.155404,B01,LB00079,新坪里,太平分局
臺中市太平區新城里21鄰樹孝路353號,22.0,120.719220,24.155352,B01,LB00080,新城里,太平分局
臺中市太平區新城里21鄰樹孝路349號,22.0,120.719164,24.155256,B01,LB00081,新城里,太平分局
臺中市太平區新城里21鄰樹孝路347號,22.0,120.719148,24.155216,B01,LB00082,新城里,太平分局
臺中市太平區新城里21鄰樹孝路345號,22.0,120.719120,24.155185,B01,LB00083,新城里,太平分局
臺中市太平區新城里18鄰樹孝路338號,29.0,120.719277,24.155028,B01,LB00084,新城里,太平分局
臺中市太平區新城里18鄰樹孝路336巷5號,21.0,120.719484,24.154860,B01,LB00087,新城里,太平分局
臺中市太平區新城里21鄰樹孝路363號,21.0,120.719361,24.155561,B01,LB00088,新城里,太平分局
臺中市太平區新坪里26鄰育德路12號,3374.0,120.722285,24.157195,B01,LB00089,新坪里,太平分局
臺中市太平區新坪里20鄰樹孝路336巷9號,1044.0,120.720120,24.154728,B01,LB00090,新坪里,太平分局
臺中市太平區新光里18鄰新福十六街53號,3347.0,120.705401,24.153177,B01,LB00091,新光里,太平分局
臺中市太平區宜昌里12鄰宜昌路420號,763.0,120.714083,24.145096,B01,LB00092,宜昌里,太平分局
臺中市太平區新坪里20鄰樹孝路336巷9號,838.0,120.720119,24.154717,B01,LB00093,新坪里,太平分局
臺中市太平區新城里5鄰樹孝路25號,1074.0,120.715997,24.149592,B01,LB00094,新城里,太平分局
臺中市太平區新坪里20鄰樹孝路336巷9號,1156.0,120.720118,24.154721,B01,LB00095,新坪里,太平分局
臺中市太平區新高里17鄰中山路4段27號,1112.0,120.712548,24.149757,B01,LB00096,新高里,太平分局
臺中市太平區新興里5鄰樹德九街139號,458.0,120.709321,24.157907,B01,LB00097,新興里,太平分局
臺中市太平區新光里15鄰樹德一街136巷30號,974.0,120.706562,24.152353,B01,LB00098,新光里,太平分局
臺中市太平區宜昌里12鄰宜昌路420號,733.0,120.714083,24.145097,B01,LB00099,宜昌里,太平分局
臺中市太平區新城里2鄰樹孝路36號,1318.0,120.717007,24.150853,B01,LB00100,新城里,太平分局
臺中市太平區宜佳里市民大道一段51號,36.0,"120.714236 ","24.137504 ",B01,LB00102,宜佳里,太平分局
臺中市太平區宜佳里市民大道一段47號,36.0,"120.714254 ","24.137426 ",B01,LB00103,宜佳里,太平分局
臺中市太平區宜昌里16鄰中山路3段131號,1303.0,120.715626,24.148689,B01,LB00104,宜昌里,太平分局
臺中市太平區新城里21鄰樹孝路361號,22.0,120.719341,24.155525,B01,LB00105,新城里,太平分局
臺中市太平區新城里21鄰樹孝路365號,21.0,120.719386,24.155602,B01,LB00106,新城里,太平分局
臺中市太平區新坪里31鄰樹孝路505號,1709.0,120.720361,24.158803,B01,LB00107,新坪里,太平分局
臺中市太平區新高里20鄰立智街100號,953.0,120.714637,24.158188,B01,LB00108,新高里,太平分局
臺中市太平區新興里5鄰樹德九街139號,381.0,120.709321,24.157904,B01,LB00109,新興里,太平分局
臺中市太平區新興里14鄰新興路168號,1396.0,120.708169,24.159454,B01,LB00110,新興里,太平分局
臺中市太平區新興里15鄰太興路18號,1709.0,120.705477,24.162660,B01,LB00111,新興里,太平分局
臺中市太平區新興里8鄰旱溪東路2段326號,1466.0,120.705162,24.160368,B01,LB00112,新興里,太平分局
臺中市太平區新高里19鄰育賢路286號,1193.0,120.716280,24.158560,B01,LB00113,新高里,太平分局
臺中市太平區新高里22鄰育賢路321號,788.0,120.715098,24.159206,B01,LB00114,新高里,太平分局
臺中市太平區新吉里18鄰育德路163號,3430.0,120.720966,24.153523,B02,LB00115,新吉里,太平分局
臺中市太平區新光里17鄰旱溪東路2段101號,2048.0,120.702139,24.151989,B01,LB00116,新光里,太平分局
臺中市太平區新興里8鄰新興路200號,485.0,120.706861,24.159719,B01,LB00117,新興里,太平分局
臺中市太平區新高里16鄰中山路4段2號,353.0,120.714108,24.149575,B01,LB00118,新高里,太平分局
臺中市太平區新城里1鄰樹孝路2之17號,629.0,120.716427,24.149900,B01,LB00119,新城里,太平分局
臺中市太平區新興里11鄰新安街111號之18,2061.0,120.710592,24.159780,B01,LB00120,新興里,太平分局
臺中市太平區宜昌里1鄰中山路3段25巷1號,603.0,120.719876,24.148702,B01,LB00121,宜昌里,太平分局
臺中市太平區新福里17鄰旱溪西路2段260號,2646.0,120.703427,24.156595,B01,LB00122,新福里,太平分局
臺中市太平區新高里16鄰環中東路3段788號,1590.0,120.714948,24.151958,B01,LB00123,新高里,太平分局
臺中市太平區新城里1鄰樹孝路2之7號,1007.0,120.716338,24.149453,B01,LB00124,新城里,太平分局
臺中市太平區新高里22鄰育賢路275號,1680.0,120.716286,24.158888,B01,LB00125,新高里,太平分局
臺中市太平區新高里22鄰育賢路348號,2125.0,120.715075,24.158762,B01,LB00126,新高里,太平分局
