類別,電腦編號,里別,地址,地下樓層數,可容納人數,備註
一般住宅,CNA01041,南美里,臺南市中西區南美里1鄰中正路53巷9號,1.0,10人,"22.991387,120.201838"
一般住宅,CNA01042,南美里,臺南市中西區南美里2鄰永福路二段48號,1.0,12人,"22.991671,120.200785"
一般住宅,CNA01043,南美里,臺南市中西區南美里2鄰永福路二段50號,1.0,24人,"22.991713,120.200794"
一般住宅,CNA01044,南美里,臺南市中西區南美里2鄰永福路二段52號,1.0,32人,"22.991752,120.200804"
一般住宅,CNA01045,南美里,臺南市中西區南美里2鄰永福路二段68號,1.0,30人,"22.992035,120.200874"
一般住宅,CNA01046,南美里,臺南市中西區南美里1鄰忠義路二段45號,1.0,1800人,"22.991147,120.202484"
帝匠商業公寓大廈,CNA01047,南美里,臺南市中西區南美里1鄰忠義路二段47號,1.0,1480人,"22.991244,120.202501"
一般住宅,CNA01048,南美里,臺南市中西區南美里2鄰友愛街34號,1.0,21人,"22.991123,120.201502"
一般住宅,CNA01049,南美里,臺南市中西區南美里2鄰友愛街36號,1.0,21人,"22.991133,120.201455"
一般住宅,CNA01050,南美里,臺南市中西區南美里2鄰友愛街46號,1.0,29人,"22.99119,120.201212"
一般住宅,CNA01051,南美里,臺南市中西區南美里2鄰友愛街54號,1.0,29人,"22.991305,120.200756"
一般住宅,CNA01052,南美里,臺南市中西區南美里2鄰友愛街40巷8號,1.0,29人,"22.991415,120.20146"
一般住宅,CNA01053,南美里,臺南市中西區南美里2鄰友愛街40巷16號,1.0,29人,"22.991516,120.201249"
一般住宅,CNA01054,南美里,臺南市中西區南美里2鄰永福路二段54巷1號,1.0,32人,"22.991796,120.201006"
一般住宅,CNA01055,南美里,臺南市中西區南美里2鄰永福路二段54巷6號,1.0,20人,"22.991655,120.201077"
一般住宅,CNA01056,南美里,臺南市中西區南美里2鄰永福路二段54巷24號,1.0,13人,"22.99154,120.201517"
一般住宅,CNA01057,南美里,臺南市中西區南美里2鄰永福路二段54巷35號,1.0,13人,"22.991589,120.201526"
一般住宅,CNA01059,南美里,臺南市中西區南美里2鄰友愛街50號,1.0,40人,"22.991261,120.201069"
一般住宅,CNA01060,南美里,臺南市中西區南美里2鄰友愛街52號,1.0,44人,"22.991257,120.200878"
一般住宅,CNA01061,南美里,臺南市中西區南美里2鄰友愛街32號,1.0,40人,"22.991112,120.201545"
一般住宅,CNA01062,南美里,臺南市中西區南美里2鄰永福路二段54巷2號,1.0,22人,"22.991675,120.201019"
一般住宅,CNA01063,南美里,臺南市中西區南美里2鄰永福路二段54巷31號,1.0,24人,"22.991602,120.201447"
一般住宅,CNA01064,南美里,臺南市中西區南美里2鄰永福路二段54巷33號,1.0,26人,"22.991589,120.201486"
一般住宅,CNA01065,南美里,臺南市中西區南美里1鄰中正路53巷11號,1.0,26人,"22.991378,120.201886"
一般住宅,CNA01066,南美里,臺南市中西區南美里2鄰永福路二段36號,1.0,29人,"22.991484,120.200743"
一般住宅,CNA01067,南美里,臺南市中西區南美里1鄰中正路53巷1號,1.0,72人,"22.991728,120.201804"
一般住宅,CNA01068,南美里,臺南市中西區南美里2鄰永福路二段46號,1.0,72人,"22.991627,120.200782"
一般住宅,CNA01069,南美里,臺南市中西區南美里2鄰友愛街50號,1.0,18人,"22.991261,120.201069"
一般住宅,CNA01070,南美里,臺南市中西區南美里2鄰友愛街48號,1.0,17人,"22.991253,120.201117"
一般住宅,CNA01071,南美里,臺南市中西區南美里2鄰永福路二段40號,1.0,30人,"22.991548,120.200757"
一般住宅,CNA01072,南美里,臺南市中西區南美里2鄰永福路二段38號,1.0,32人,"22.991523,120.20075"
一般住宅,CNA01073,南美里,臺南市中西區南美里1鄰忠義路二段41號,1.0,113人,"22.99105,120.202457"
一般住宅,CNA01074,南美里,臺南市中西區南美里3鄰忠義路二段75號,1.0,17人,"22.992464,120.202763"
一般住宅,CNA01075,南美里,臺南市中西區南美里3鄰忠義路二段83號,1.0,14人,"22.992647,120.202811"
一般住宅,CNA01076,南美里,臺南市中西區南美里3鄰忠義路二段81號,1.0,28人,"22.992598,120.202794"
一般住宅,CNA01077,南美里,臺南市中西區南美里3鄰忠義路二段99號,1.0,453人,"22.992978,120.202884"
一般住宅,CNA01078,南美里,臺南市中西區南美里4鄰永福路二段124號,1.0,12人,"22.993601,120.201278"
一般住宅,CNA01079,南美里,臺南市中西區南美里4鄰民生路一段109號,1.0,45人,"22.993534,120.201812"
一般住宅,CNA01080,南美里,臺南市中西區南美里4鄰民生路一段111號,1.0,86人,"22.993566,120.20173"
一般住宅,CNA01081,南美里,臺南市中西區南美里3鄰忠義路二段101號,1.0,24人,"22.99304,120.202894"
一般住宅,CNA01083,南美里,臺南市中西區南美里3鄰永福路二段104號,1.0,30人,"22.993231,120.201175"
一般住宅,CNA01084,南美里,臺南市中西區南美里3鄰永福路二段100號,1.0,68人,"22.993102,120.201145"
一般住宅,CNA01085,南美里,臺南市中西區南美里3鄰忠義路二段81號,1.0,30人,"22.992598,120.202794"
一般住宅,CNA01086,南美里,臺南市中西區南美里4鄰民生路一段115號,1.0,30人,"22.993583,120.201668"
一般住宅,CNA01087,南美里,臺南市中西區南美里3鄰民生路一段87號,1.0,28人,"22.993351,120.202405"
一般住宅,CNA01088,南美里,臺南市中西區南美里4鄰永福路二段116號,1.0,178人,"22.993448,120.201237"
一般住宅,CNA01089,南美里,臺南市中西區南美里3鄰忠義路二段97號,1.0,52人,"22.992933,120.202875"
一般住宅,CNA01090,南美里,臺南市中西區南美里4鄰民生路一段105號,1.0,60人,"22.993501,120.20191"
一般住宅,CNA01092,南美里,臺南市中西區南美里3鄰忠義路二段91號,1.0,104人,"22.992813,120.202845"
一般住宅,CNA01093,南美里,臺南市中西區南美里3鄰忠義路二段69號,1.0,560人,"22.992332,120.20273"
一般住宅,CNA01094,南美里,臺南市中西區南美里3鄰忠義路二段89號,1.0,49人,"22.992781,120.202839"
一般住宅,CNA01098,南美里,臺南市中西區南美里5鄰民權路二段149號,1.0,30人,"22.994835,120.203314"
一般住宅,CNA01099,南美里,臺南市中西區南美里5鄰民權路二段173號,1.0,45人,"22.994994,120.202793"
一般住宅,CNA01100,南美里,臺南市中西區南美里5鄰民權路二段175號,1.0,45人,"22.995004,120.202764"
一般住宅,CNA01101,南美里,臺南市中西區南美里5鄰民權路二段177號,1.0,38人,"22.995023,120.202727"
一般住宅,CNA01102,南美里,臺南市中西區南美里5鄰民權路二段179號,1.0,60人,"22.995044,120.202661"
一般住宅,CNA01103,南美里,臺南市中西區南美里5鄰民權路二段185號,1.0,60人,"22.995083,120.202529"
一般住宅,CNA01104,南美里,臺南市中西區南美里5鄰民權路二段197號,1.0,48人,"22.995152,120.202288"
一般住宅,CNA01105,南美里,臺南市中西區南美里5鄰民權路二段201號,1.0,16人,"22.995176,120.20222"
一般住宅,CNA01106,南美里,臺南市中西區南美里5鄰民權路二段215號,1.0,16人,"22.995272,120.201925"
一般住宅,CNA01107,南美里,臺南市中西區南美里5鄰永福路二段160號,1.0,13人,"22.994976,120.201728"
一般住宅,CNA01108,南美里,臺南市中西區南美里5鄰永福路二段160號,1.0,30人,"22.994976,120.201728"
一般住宅,CNA01109,南美里,臺南市中西區南美里5鄰忠義路二段113號,1.0,60人,"22.994167,120.203205"
一般住宅,CNA01110,南美里,臺南市中西區南美里4鄰永福路二段146號,1.0,62人,"22.994368,120.20153"
一般住宅,CNA01111,南美里,臺南市中西區南美里5鄰永福路二段152巷26號,1.0,146人,"22.994257,120.202513"
一般住宅,CNA01112,南美里,臺南市中西區南美里5鄰永福路二段152巷1號,1.0,146人,"22.994482,120.202139"
一般住宅,CNA01113,南美里,臺南市中西區南美里5鄰民權路二段169號,1.0,54人,"22.994959,120.202914"
一般住宅,CNA01114,南美里,臺南市中西區南美里5鄰民權路二段167號,1.0,30人,"22.994959,120.202914"
一般住宅,CNA01115,南美里,臺南市中西區南美里5鄰民權路二段181號,1.0,74人,"22.995062,120.2026"
一般住宅,CNA01117,南美里,臺南市中西區南美里19鄰永福路二段7號,1.0,45人,"22.990291,120.200296"
一般住宅,CNA01118,南美里,臺南市中西區南美里5鄰永福路二段162號,1.0,60人,"22.995062,120.201762"
一般住宅,CNA01120,南美里,臺南市中西區南美里4鄰民生路一段80號,1.0,60人,"22.993663,120.202179"
一般住宅,CNA01122,南美里,臺南市中西區南美里5鄰忠義路二段121號,1.0,100人,"22.99435,120.203247"
一般住宅,CNA01123,南美里,臺南市中西區南美里5鄰忠義路二段119號,1.0,220人,"22.994306,120.203241"
一般住宅,CNA01124,南美里,臺南市中西區南美里5鄰民權路二段197號,1.0,60人,"22.995152,120.202288"
一般住宅,CNA01125,南美里,臺南市中西區南美里4鄰永福路二段148號,1.0,89人,"22.994401,120.201539"
一般住宅,CNA01127,南美里,臺南市中西區南美里5鄰民權路二段159號,1.0,74人,"22.994896,120.203101"
一般住宅,CNA01128,赤嵌里,臺南市中西區赤嵌里5鄰成功路169號,1.0,57人,"22.998025,120.2063"
臺南聖教會,CNA01135,赤嵌里,臺南市中西區赤嵌里5鄰公園路129號,1.0,58人,"22.99764,120.206512"
一般住宅,CNA01138,赤嵌里,臺南市中西區赤嵌里5鄰成功路191號,1.0,60人,"22.998173,120.205551"
一般住宅,CNA01139,赤嵌里,臺南市中西區赤嵌里4鄰民族路二段130號,1.0,89人,"22.996196,120.205063"
一般住宅,CNA01142,赤嵌里,臺南市中西區赤嵌里5鄰成功路195號,1.0,90人,"22.998035,120.205388"
一般住宅,CNA01143,赤嵌里,臺南市中西區赤嵌里4鄰公園路109號,1.0,104人,"22.996307,120.205894"
一般住宅,CNA01145,赤嵌里,臺南市中西區赤嵌里4鄰民族路二段130號,1.0,160人,"22.996196,120.205063"
賓士KTV,CNA01148,赤嵌里,臺南市中西區赤嵌里4鄰中成路18號,1.0,1600人,"22.996721,120.20544"
一般住宅,CNA01149,赤嵌里,臺南市中西區赤嵌里6鄰忠義路二段202巷16號,1.0,41人,"22.996925,120.204804"
一般住宅,CNA01150,赤嵌里,臺南市中西區赤嵌里6鄰忠義路二段222號,1.0,45人,"22.997463,120.20464"
一般住宅,CNA01151,赤嵌里,臺南市中西區赤嵌里6鄰忠義路二段198號,1.0,14人,"22.996986,120.20447"
一般住宅,CNA01152,赤嵌里,臺南市中西區赤嵌里6鄰忠義路二段204號,1.0,57人,"22.997081,120.204496"
一般住宅,CNA01153,赤嵌里,臺南市中西區赤嵌里6鄰忠義路二段180號,1.0,146人,"22.996601,120.204339"
一般住宅,CNA01154,赤嵌里,臺南市中西區赤嵌里8鄰忠義路二段217號,1.0,32人,"22.997575,120.204412"
一般住宅,CNA01155,赤嵌里,臺南市中西區赤嵌里8鄰忠義路二段227號,1.0,42人,"22.997885,120.204499"
一般住宅,CNA01156,赤嵌里,臺南市中西區赤嵌里7鄰民族路二段172號,1.0,60人,"22.996544,120.203698"
一般住宅,CNA01157,赤嵌里,臺南市中西區赤嵌里7鄰忠義路二段177號,1.0,101人,"22.996692,120.204066"
星光大樓,CNA01158,赤嵌里,臺南市中西區赤嵌里7鄰忠義路二段185號,1.0,1600人,"22.996953,120.204125"
一般住宅,CNA01160,赤嵌里,臺南市中西區赤嵌里7鄰民族路二段208巷7號,1.0,43人,"22.99696,120.203112"
一般住宅,CNA01161,赤嵌里,臺南市中西區赤嵌里7鄰民族路二段208巷13號,1.0,14人,"22.997416,120.203351"
一般住宅,CNA01162,赤嵌里,臺南市中西區赤嵌里8鄰成功路221號,1.0,89人,"22.998584,120.204058"
一般住宅,CNA01163,赤嵌里,臺南市中西區赤嵌里8鄰忠義路二段233巷24號,1.0,69人,"22.997865,120.203897"
一般住宅,CNA01164,赤嵌里,臺南市中西區赤嵌里7鄰民族路二段190號,1.0,30人,"22.996721,120.203263"
一般住宅,CNA01166,赤嵌里,臺南市中西區赤嵌里8鄰忠義路二段233巷26號,1.0,164人,"22.997762,120.20388"
一般住宅,CNA01167,赤嵌里,臺南市中西區赤嵌里8鄰忠義路二段225號,1.0,205人,"22.997803,120.204509"
一般住宅,CNA01168,赤嵌里,臺南市中西區赤嵌里7鄰忠義路二段173號,1.0,312人,"22.996618,120.204046"
一般住宅,CNA01169,赤嵌里,臺南市中西區赤嵌里8鄰忠義路二段205號,1.0,88人,"22.99737,120.204365"
一般住宅,CNA01170,赤嵌里,臺南市中西區赤嵌里7鄰民族路二段194號,1.0,45人,"22.996741,120.203185"
一般住宅,CNA01171,赤嵌里,臺南市中西區赤嵌里7鄰民族路二段184號,1.0,89人,"22.996686,120.203363"
一般住宅,CNA01172,赤嵌里,臺南市中西區赤嵌里12鄰赤嵌街17號,1.0,10人,"22.997737,120.202144"
一般住宅,CNA01173,赤嵌里,臺南市中西區赤嵌里12鄰赤嵌街17號之1,1.0,12人,"22.997768,120.202161"
一般住宅,CNA01174,赤嵌里,臺南市中西區赤嵌里12鄰赤嵌街23號,1.0,26人,"22.997902,120.202232"
一般住宅,CNA01175,赤嵌里,臺南市中西區赤嵌里9鄰赤嵌街41號,1.0,160人,"22.998356,120.202394"
一般住宅,CNA01176,赤嵌里,臺南市中西區赤嵌里9鄰赤嵌街63號,1.0,21人,"22.998932,120.202556"
一般住宅,CNA01177,赤嵌里,臺南市中西區赤嵌里9鄰成功路245號,1.0,114人,"22.999094,120.202423"
一般住宅,CNA01178,赤嵌里,臺南市中西區赤嵌里9鄰成功路251號,1.0,14人,"22.999133,120.202287"
一般住宅,CNA01179,赤嵌里,臺南市中西區赤嵌里9鄰成功路253號,1.0,14人,"22.999148,120.202241"
一般住宅,CNA01180,赤嵌里,臺南市中西區赤嵌里9鄰成功路255號,1.0,14人,"22.999191,120.202212"
一般住宅,CNA01181,赤嵌里,臺南市中西區赤嵌里9鄰新美街334號,1.0,10人,"22.999033,120.201984"
一般住宅,CNA01182,赤嵌里,臺南市中西區赤嵌里9鄰成功路249號,1.0,12人,"22.999115,120.202333"
一般住宅,CNA01183,赤嵌里,臺南市中西區赤嵌里9鄰赤嵌街33號,1.0,30人,"22.998106,120.202292"
一般住宅,CNA01184,赤嵌里,臺南市中西區赤嵌里10鄰郡緯街6號,1.0,500人,"22.99812,120.202125"
一般住宅,CNA01185,赤嵌里,臺南市中西區赤嵌里9鄰新美街330號,1.0,21人,"22.998946,120.201967"
一般住宅,CNA01186,赤嵌里,臺南市中西區赤嵌里12鄰民族路二段220號,1.0,29人,"22.997191,120.201958"
一般住宅,CNA01187,赤嵌里,臺南市中西區赤嵌里12鄰赤嵌街19號,1.0,44人,"22.997805,120.202191"
一般住宅,CNA01188,赤嵌里,臺南市中西區赤嵌里9鄰赤嵌街47號,1.0,193人,"22.998514,120.202462"
一般住宅,CNA01189,赤嵌里,臺南市中西區赤嵌里12鄰赤嵌街13號,1.0,118人,"22.997672,120.202111"
一般住宅,CNA01190,赤嵌里,臺南市中西區赤嵌里6鄰民族路二段154號,1.0,42人,"22.996352,120.204186"
一般住宅,CNA01191,永華里,臺南市中西區永華里17鄰忠義路二段54號,1.0,221人,"22.993061,120.203209"
一般住宅,CNA01192,赤嵌里,臺南市中西區赤嵌里18鄰公園路52號,1.0,270人,"22.994962,120.20569"
一般住宅,CNA01192,赤嵌里,臺南市中西區赤嵌里18鄰公園路52號,1.0,270人,"22.994962,120.20569"
一般住宅,CNA01193,赤嵌里,臺南市中西區赤嵌里11鄰成功路283號,1.0,26人,"22.999354,120.201627"
一般住宅,CNA01195,赤嵌里,臺南市中西區赤嵌里11鄰成功路285巷5號之2,1.0,13人,"22.999146,120.20149"
一般住宅,CNA01196,赤嵌里,臺南市中西區赤嵌里11鄰成功路285巷5號之3,1.0,13人,"22.999116,120.20155"
一般住宅,CNA01197,赤嵌里,臺南市中西區赤嵌里16鄰西門路二段274號,1.0,26人,"22.996262,120.199768"
一般住宅,CNA01198,赤嵌里,臺南市中西區赤嵌里11鄰西門路二段386號,1.0,53人,"22.998577,120.200771"
大樓,CNA01199,赤嵌里,臺南市中西區赤嵌里11鄰西門路二段398號,1.0,986人,"22.998818,120.200914"
一般住宅,CNA01200,赤嵌里,臺南市中西區赤嵌里13鄰西門路二段372巷6號,1.0,133人,"22.998139,120.200871"
一般住宅,CNA01202,赤嵌里,臺南市中西區赤嵌里11鄰成功路277號,1.0,60人,"22.999307,120.201745"
一般住宅,CNA01203,赤嵌里,臺南市中西區赤嵌里13鄰新美街157號,1.0,13人,"22.997942,120.201243"
一般住宅,CNA01204,赤嵌里,臺南市中西區赤嵌里13鄰西門路二段368號,1.0,13人,"22.998289,120.20064"
一般住宅,CNA01205,赤嵌里,臺南市中西區赤嵌里11鄰西門路二段390號,1.0,20人,"22.998654,120.200819"
一般住宅,CNA01206,赤嵌里,臺南市中西區赤嵌里11鄰新美街195號,1.0,12人,"22.998622,120.201583"
一般住宅,CNA01207,赤嵌里,臺南市中西區赤嵌里11鄰新美街205號,1.0,18人,"22.998812,120.201706"
一般住宅,CNA01208,赤嵌里,臺南市中西區赤嵌里13鄰西門路二段354號,1.0,57人,"22.998071,120.200463"
一般住宅,CNA01209,赤嵌里,臺南市中西區赤嵌里11鄰新美街219號,1.0,26人,"22.999092,120.201794"
一般住宅,CNA01210,赤嵌里,臺南市中西區赤嵌里11鄰新美街221號,1.0,26人,"22.999134,120.201815"
一般住宅,CNA01211,赤嵌里,臺南市中西區赤嵌里11鄰郡緯街18巷8號,1.0,41人,"22.998522,120.201317"
一般住宅,CNA01212,赤嵌里,臺南市中西區赤嵌里11鄰西門路二段372巷27號,1.0,40人,"22.998232,120.201147"
一般住宅,CNA01213,赤嵌里,臺南市中西區赤嵌里11鄰西門路二段402巷5號,1.0,164人,"22.99898,120.201268"
一般住宅,CNA01214,赤嵌里,臺南市中西區赤嵌里11鄰成功路289號,1.0,33人,"22.999417,120.201482"
一般住宅,CNA01215,赤嵌里,臺南市中西區赤嵌里11鄰成功路293號,1.0,72人,"22.999448,120.20142"
一般住宅,CNA01216,赤嵌里,臺南市中西區赤嵌里11鄰新美街211號,1.0,104人,"22.998934,120.201742"
一般住宅,CNA01217,赤嵌里,臺南市中西區赤嵌里13鄰新美街147號,1.0,54人,"22.997748,120.201161"
一般住宅,CNA01218,赤嵌里,臺南市中西區赤嵌里13鄰新美街145號,1.0,74人,"22.99771,120.201148"
一般住宅,CNA01219,南美里,臺南市中西區南美里7鄰民族路二段299號,1.0,26人,"22.996482,120.203239"
一般住宅,CNA01220,南美里,臺南市中西區南美里6鄰永福路二段222號,1.0,26人,"22.996559,120.202445"
一般住宅,CNA01221,南美里,臺南市中西區南美里6鄰永福路二段218號,1.0,18人,"22.996504,120.202423"
一般住宅,CNA01222,南美里,臺南市中西區南美里7鄰忠義路二段163號,1.0,29人,"22.996058,120.203881"
一般住宅,CNA01223,南美里,臺南市中西區南美里6鄰永福路二段220號,1.0,29人,"22.996524,120.202434"
一般住宅,CNA01224,南美里,臺南市中西區南美里6鄰永福路二段206號,1.0,26人,"22.996262,120.202329"
一般住宅,CNA01225,南美里,臺南市中西區南美里6鄰民族路二段319號,1.0,21人,"22.996628,120.202839"
一般住宅,CNA01226,南美里,臺南市中西區南美里7鄰民族路二段301號,1.0,22人,"22.996506,120.203187"
一般住宅,CNA01227,南美里,臺南市中西區南美里6鄰民族路二段333號,1.0,26人,"22.996701,120.202612"
一般住宅,CNA01229,南美里,臺南市中西區南美里7鄰民族路二段313號,1.0,100人,"22.996586,120.202939"
一般住宅,CNA01230,南美里,臺南市中西區南美里7鄰民族路二段287號,1.0,30人,"22.99641,120.203456"
一般住宅,CNA01231,南美里,臺南市中西區南美里7鄰民族路二段289號,1.0,150人,"22.996424,120.203379"
一般住宅,CNA01232,南美里,臺南市中西區南美里6鄰民族路二段321號,1.0,13人,"22.996635,120.202804"
一般住宅,CNA01233,南美里,臺南市中西區南美里6鄰民族路二段325號,1.0,40人,"22.996658,120.202734"
一般住宅,CNA01234,南美里,臺南市中西區南美里6鄰民族路二段327號,1.0,45人,"22.996669,120.202704"
一般住宅,CNA01235,南美里,臺南市中西區南美里6鄰民族路二段323號,1.0,40人,"22.996646,120.202765"
一般住宅,CNA01236,南美里,臺南市中西區南美里6鄰民族路二段329號,1.0,26人,"22.99668,120.202674"
一般住宅,CNA01238,南美里,臺南市中西區南美里7鄰民族路二段297號,1.0,53人,"22.996466,120.203272"
一般住宅,CNA01240,南美里,臺南市中西區南美里7鄰忠義路二段159號,1.0,60人,"22.995978,120.203858"
一般住宅,CNA01241,南美里,臺南市中西區南美里7鄰民族路二段303號,1.0,60人,"22.996523,120.203135"
一般住宅,CNA01242,南美里,臺南市中西區南美里7鄰民族路二段305號,1.0,128人,"22.996548,120.203058"
一般住宅,CNA01243,南美里,臺南市中西區南美里6鄰民權路二段146號,1.0,74人,"22.995106,120.202993"
一般住宅,CNA01244,南美里,臺南市中西區南美里6鄰民權路二段148號,1.0,14人,"22.995117,120.202963"
一般住宅,CNA01245,南美里,臺南市中西區南美里6鄰民權路二段156號,1.0,13人,"22.995173,120.202789"
一般住宅,CNA01246,南美里,臺南市中西區南美里6鄰民權路二段158號,1.0,104人,"22.995193,120.202732"
一般住宅,CNA01247,南美里,臺南市中西區南美里6鄰民權路二段160號,1.0,12人,"22.995214,120.202687"
一般住宅,CNA01248,南美里,臺南市中西區南美里6鄰民權路二段168號,1.0,60人,"22.995253,120.202541"
一般住宅,CNA01249,南美里,臺南市中西區南美里6鄰民權路二段166號,1.0,60人,"22.995246,120.202575"
一般住宅,CNA01250,南美里,臺南市中西區南美里6鄰民權路二段178號,1.0,16人,"22.995315,120.202338"
一般住宅,CNA01251,南美里,臺南市中西區南美里6鄰民權路二段180號,1.0,21人,"22.995332,120.202299"
一般住宅,CNA01252,南美里,臺南市中西區南美里6鄰民權路二段182號,1.0,30人,"22.995343,120.202257"
一般住宅,CNA01253,南美里,臺南市中西區南美里6鄰民權路二段186號,1.0,30人,"22.995369,120.202187"
一般住宅,CNA01254,南美里,臺南市中西區南美里6鄰民權路二段190號,1.0,30人,"22.99539,120.202112"
一般住宅,CNA01255,南美里,臺南市中西區南美里6鄰民權路二段192號,1.0,13人,"22.995408,120.202063"
一般住宅,CNA01256,南美里,臺南市中西區南美里6鄰民權路二段194號,1.0,14人,"22.995414,120.20204"
一般住宅,CNA01257,南美里,臺南市中西區南美里6鄰永福路二段178號,1.0,28人,"22.995646,120.201944"
一般住宅,CNA01258,南美里,臺南市中西區南美里6鄰民權路二段162號,1.0,89人,"22.995221,120.202647"
一般住宅,CNA01259,南美里,臺南市中西區南美里6鄰民權路二段154號,1.0,29人,"22.995162,120.202828"
一般住宅,CNA01260,南美里,臺南市中西區南美里6鄰永福路二段180號,1.0,13人,"22.995681,120.201956"
一般住宅,CNA01261,南美里,臺南市中西區南美里6鄰永福路二段182號,1.0,14人,"22.995719,120.201973"
一般住宅,CNA01262,南美里,臺南市中西區南美里6鄰永福路二段184號,1.0,16人,"22.995749,120.201984"
一般住宅,CNA01263,南美里,臺南市中西區南美里6鄰民權路二段152號,1.0,140人,"22.995149,120.202875"
一般住宅,CNA01264,赤嵌里,臺南市中西區赤嵌里16鄰西門路二段312號,1.0,74人,"22.997004,120.200275"
一般住宅,CNA01265,赤嵌里,臺南市中西區赤嵌里16鄰西門路二段314號,1.0,74人,"22.997022,120.200349"
一般住宅,CNA01266,赤嵌里,臺南市中西區赤嵌里16鄰西門路二段308號,1.0,21人,"22.996984,120.200156"
一般住宅,CNA01267,赤嵌里,臺南市中西區赤嵌里16鄰西門路二段304號,1.0,29人,"22.996865,120.200018"
一般住宅,CNA01268,赤嵌里,臺南市中西區赤嵌里16鄰西門路二段302號,1.0,45人,"22.996813,120.199995"
一般住宅,CNA01269,赤嵌里,臺南市中西區赤嵌里16鄰新美街107號,1.0,16人,"22.996656,120.200768"
一般住宅,CNA01270,赤嵌里,臺南市中西區赤嵌里14鄰民族路二段399號,1.0,60人,"22.997133,120.201159"
一般住宅,CNA01271,赤嵌里,臺南市中西區赤嵌里16鄰民族路二段417號,1.0,102人,"22.99733,120.200605"
一般住宅,CNA01272,赤嵌里,臺南市中西區赤嵌里16鄰新美街103號,1.0,32人,"22.996566,120.200751"
一般住宅,CNA01273,赤嵌里,臺南市中西區赤嵌里15鄰民權路二段220號,1.0,16人,"22.995763,120.201211"
一般住宅,CNA01274,赤嵌里,臺南市中西區赤嵌里15鄰民權路二段222號,1.0,30人,"22.995767,120.201151"
一般住宅,CNA01275,赤嵌里,臺南市中西區赤嵌里15鄰民權路二段232號,1.0,16人,"22.995849,120.200933"
一般住宅,CNA01276,赤嵌里,臺南市中西區赤嵌里15鄰民權路二段236號,1.0,16人,"22.995871,120.200868"
一般住宅,CNA01277,赤嵌里,臺南市中西區赤嵌里15鄰民權路二段248號,1.0,30人,"22.995944,120.200641"
一般住宅,CNA01278,赤嵌里,臺南市中西區赤嵌里16鄰民權路二段256號,1.0,16人,"22.99604,120.200351"
一般住宅,CNA01279,赤嵌里,臺南市中西區赤嵌里16鄰民權路二段266號,1.0,30人,"22.996088,120.200121"
一般住宅,CNA01280,赤嵌里,臺南市中西區赤嵌里16鄰民權路二段272號,1.0,30人,"22.996129,120.200003"
一般住宅,CNA01281,赤嵌里,臺南市中西區赤嵌里16鄰民權路二段278號,1.0,16人,"22.996167,120.199837"
一般住宅,CNA01282,赤嵌里,臺南市中西區赤嵌里15鄰新美街112號,1.0,16人,"22.996331,120.200768"
一般住宅,CNA01283,赤嵌里,臺南市中西區赤嵌里15鄰永福路二段197巷1號,1.0,160人,"22.995857,120.201618"
一般住宅,CNA01284,赤嵌里,臺南市中西區赤嵌里16鄰西門路二段298號,1.0,30人,"22.996728,120.199965"
一般住宅,CNA01285,赤嵌里,臺南市中西區赤嵌里16鄰西門路二段278號,1.0,16人,"22.996319,120.199788"
一般住宅,CNA01286,赤嵌里,臺南市中西區赤嵌里15鄰永福路二段227巷51號,1.0,16人,"22.996531,120.201133"
一般住宅,CNA01287,赤嵌里,臺南市中西區赤嵌里15鄰永福路二段195號,1.0,60人,"22.995721,120.201707"
一般住宅,CNA01288,赤嵌里,臺南市中西區赤嵌里15鄰民權路二段202號,1.0,30人,"22.995571,120.201671"
一般住宅,CNA01289,赤嵌里,臺南市中西區赤嵌里15鄰新美街108號,1.0,16人,"22.996251,120.200745"
一般住宅,CNA01290,赤嵌里,臺南市中西區赤嵌里16鄰民權路二段274號,1.0,60人,"22.996151,120.199918"
