類別,建築物名稱,電腦編號,村里別,地址,緯經度,地下樓層數,可容納人數,備註
一般建築,,LY2529,安祥里,高雄市苓雅區安祥里和平一路256之1號,"22.632286,120.317372",1,381,
一般建築,,LY4193,英明里,高雄市苓雅區英明里二聖一路16號,"22.612003,120.326159",1,388,
一般建築,,LY3786,林富里,高雄市苓雅區林富里光華一路129號,"22.621763,120.316199",1,393,
一般建築,,LY4012,人和里,高雄市苓雅區人和里仁義街166號,"22.619313,120.301706",2,394,
一般建築,,LY3995,林圍里,高雄市苓雅區林圍里泉州街81號,"22.624265,120.312715",1,394,
一般建築,,LY1882,中正里,高雄市苓雅區中正里廣州一街141之8號,"22.624364,120.316858",1,397,
一般建築,,LY3960,五福里,高雄市苓雅區五福里福德二路260號,"22.634808,120.328456",1,402,
一般建築,,LY3843,城西里,高雄市苓雅區城西里興中二路69號,"22.61436,120.300866",2,403,
一般建築,,LY4073,正言里,高雄市苓雅區正言里建民路171號,"22.629762,120.328976",1,407,
一般建築,,LY1702,林華里,高雄市苓雅區林華里三多二路249號,"22.619098,120.320795",1,407,
一般建築,,LY3974,普天里,高雄市苓雅區普天里三多二路348號,"22.618112,120.316287",1,408,
醫院照護,,LY0570,鼓中里,高雄市苓雅區鼓中里成功一路162號,"22.615583,120.297377",1,415,
一般建築,,LY3721,福南里,高雄市苓雅區福南里中正一路305號,"22.629535,120.324448",2,419,
一般建築,,LY3812,五福里,高雄市苓雅區五福里福德二路271號,"22.635456,120.328226",1,427,
一般建築,,LY3392,林富里,高雄市苓雅區林富里四維二路118號,"22.621597,120.31619",1,430,
一般建築,,LY3557,林榮里,高雄市苓雅區林榮里英義街160號,"22.615552,120.326217",1,431,
一般建築,,LY1484,廣澤里,高雄市苓雅區廣澤里三多三路222之2號,"22.614847,120.306595",1,431,
一般建築,,LY3813,苓洲里,高雄市苓雅區苓洲里青年二路212號,"22.617861,120.294977",1,440,
一般建築,,LY3859,林榮里,高雄市苓雅區林榮里英義街328號,"22.618196,120.325483",1,450,
一般建築,,LY3899,普照里,高雄市苓雅區普照里民權一路53號,"22.61882,120.313469",2,450,
一般建築,,LY3861,正文里,高雄市苓雅區正文里建國一路171號,"22.632642,120.326752",1,456,
一般建築,,LY3750,人和里,高雄市苓雅區人和里中華四路256號,"22.618808,120.300208",2,458,
一般建築,,LY0357,仁政里,高雄市苓雅區仁政里中山二路410號,"22.618489,120.30309",1,460,
一般建築,,LY2814,尚義里,高雄市苓雅區尚義里中正二路101號,"22.630123,120.316416",1,467,
一般建築,,LY3425,林圍里,高雄市苓雅區林圍里民權一路90之1號,"22.624866,120.311868",2,469,
一般建築,,LY1616,普天里,高雄市苓雅區普天里四維二路365號,"22.620152,120.313919",1,469,
一般建築,,LY3556,林西里,高雄市苓雅區林西里五權街121號,"22.620275,120.319464",1,470,
一般建築,,LY3698,正大里,高雄市苓雅區正大里建民路76號,"22.629657,120.329921",1,471,
一般建築,,LY3736,福隆里,高雄市苓雅區福隆里漢陽街116號,"22.619112,120.329026",1,471,
一般建築,,LY1963,正文里,高雄市苓雅區正文里褔德二路61號,"22.63182729,120.327928696183",1,472,
一般建築,,LY3211,林西里,高雄市苓雅區林西里五權街65號,"22.62074,120.320856",1,475,
一般建築,,LY3671,普天里,高雄市苓雅區普天里永富街27號,"22.618535,120.316021",1,476,
一般建築,,LY3284,林南里,高雄市苓雅區林南里光華一路148之38號,"22.623241,120.31613",1,482,
一般建築,,LY3574,安祥里,高雄市苓雅區安祥里中正二路22號,"22.630251,120.320974",1,485,
一般建築,,LY1995,廣澤里,高雄市苓雅區廣澤里中山二路272號,"22.61463,120.304813",1,488,
一般建築,,LY4212,正心里,高雄市苓雅區正心里正大路117號,"22.63322,120.332609",3,490,
一般建築,,LY3798,林貴里,高雄市苓雅區林貴里三多二路171號,"22.619861,120.323329",2,494,
一般建築,,LY2488,尚義里,高雄市苓雅區尚義里尚志街8號,"22.628717,120.314908",1,498,
一般建築,,LY3702,尚義里,高雄市苓雅區尚義里光華一路226號,"22.629507,120.31366",2,500,
一般建築,,LY4003,人和里,高雄市苓雅區人和里中山二路483號,"22.619108,120.302105",2,501,
一般建築,,LY2542,林中里,高雄市苓雅區林中里和平一路131號,"22.622375,120.320847",1,503,
一般建築,,LY3967,民主里,高雄市苓雅區民主里憲昌路53巷1之1號,"22.637163,120.324123",1,504,
一般建築,,LY3894,林德里,高雄市苓雅區林德里五權街30號,"22.622028,120.323908",1,507,
一般建築,,LY0721,林德里,高雄市苓雅區林德里四維二路29號,"22.623477,120.322989",1,507,
一般建築,,LY3048,和煦里,高雄市苓雅區和煦里復興二路91號,"22.622011,120.309316",1,509,
一般建築,,LY3846,福西里,高雄市苓雅區福西里三多一路146號,"22.623034,120.331378",1,515,
一般建築,,LY2553,晴朗里,高雄市苓雅區晴朗里永裕街29號,"22.622119,120.311435",1,525,
一般建築,,LY2831,林泉里,高雄市苓雅區林泉里林泉街65號,"22.622952,120.318161",1,533,
一般建築,,LY1793,城西里,高雄市苓雅區城西里中華四路55號,"22.613931,120.301576",1,535,
一般建築,,LY1666,苓洲里,高雄市苓雅區苓洲里光明街87號,"22.61993,120.294608",1,539,
一般建築,,LY1964,正言里,高雄市苓雅區正言里武廟路129號,"22.630955,120.327262",1,541,
一般建築,,LY4001,普照里,高雄市苓雅區普照里民權一路39巷40號,"22.618003,120.312568",1,543,
一般建築,,LY1983,尚義里,高雄市苓雅區尚義里中正二路89號,"22.630089,120.316693",1,546,
一般建築,,LY3704,福東里,高雄市苓雅區福東里武嶺街92號,"22.622812,120.333153",1,546,
一般建築,,LY4063,正義里,高雄市苓雅區正義里建國一路55號,"22.629477,120.339014",1,554,
一般建築,,LY3907,田西里,高雄市苓雅區田西里中華四路159號,"22.618041,120.299958",1,557,
一般建築,,LY3976,永康里,高雄市苓雅區永康里四維一路92號,"22.626052,120.329896",1,558,
一般建築,,LY2417,林泉里,高雄市苓雅區林泉里四維二路96之4號,"22.62253,120.319066",1,559,
一般建築,,LY3629,城東里,高雄市苓雅區城東里仁義街2之4號,"22.614355,120.303549",2,571,
一般建築,,LY3380,苓東里,高雄市苓雅區苓東里四維四路177號,"22.613773,120.294612",1,572,
一般建築,,LY3891,正義里,高雄市苓雅區正義里正義路17號,"22.628136,120.337694",1,575,
一般建築,,LY4082,正大里,高雄市苓雅區正大里中正一路230號,"22.629197,120.32955",2,576,
一般建築,,LY1978,正大里,高雄市苓雅區正大里武廟路73號,"22.630407,120.330327",1,582,
一般建築,,LY3788,林西里,高雄市苓雅區林西里光華一路12號,"22.618632,120.317839",2,583,
一般建築,,LY3658,林華里,高雄市苓雅區林華里和平二路431號,"22.61853799,120.322304067346",1,584,
一般建築,,LY3878,正言里,高雄市苓雅區正言里武廟路83之1號,"22.63055,120.329617",1,586,
一般建築,,LY4148,苓昇里,高雄市苓雅區苓昇里青年二路169號,"22.617507,120.295141",1,590,
一般建築,,LY3963,苓昇里,高雄市苓雅區苓昇里昇平街104號,"22.617101,120.295822",1,594,
一般建築,,LY3866,林榮里,高雄市苓雅區林榮里英義街306號,"22.617826,120.325632",1,607,
一般建築,,LY4045,田西里,高雄市苓雅區田西里青年二路101號,"22.618486,120.298244",1,611,
一般建築,,LY2393,林泉里,高雄市苓雅區林泉里四維二路94之1號,"22.622942,120.320283",1,612,
一般建築,,LY2220,林德里,高雄市苓雅區林德里五權街59號,"22.621068,120.321943",1,612,
一般建築,,LY3577,林華里,高雄市苓雅區林華里廣東二街83號,"22.617505,120.321003",1,619,
一般建築,,LY2001,日中里,高雄市苓雅區日中里興中一路212號,"22.617139,120.308285",1,620,
一般建築,,LY3952,人和里,高雄市苓雅區人和里青年二路29號,"22.619364,120.30089",3,623,
一般建築,,LY2508,林南里,高雄市苓雅區林南里和平一路149之6號,"22.624116,120.320168",2,626,
一般建築,,LY3767,苓雅里,高雄市苓雅區苓雅里四維四路172之6號,"22.61500039,120.296692796182",1,629,
一般建築,,LY2794,中正里,高雄市苓雅區中正里青年一路1之5號,"22.624606,120.316528",1,637,
一般建築,,LY3549,華堂里,高雄市苓雅區華堂里林森二路23號,"22.617397,120.307518",1,644,
一般建築,,LY3871,安祥里,高雄市苓雅區安祥里中正二路56巷5號,"22.630704,120.319357",2,650,
一般建築,,LY2107,正大里,高雄市苓雅區正大里建國一路121之2號,"22.631661,120.332176",1,651,
一般建築,,LY3825,苓中里,高雄市苓雅區苓中里四維四路216號,"22.614149,120.293852",2,656,
一般建築,,LY3532,普天里,高雄市苓雅區普天里福建街24號,"22.618918,120.316779",1,663,
一般建築,,LY3742,美田里,高雄市苓雅區美田里青年一路191號,"22.621321,120.306713",2,669,
醫院照護,,LY1485,苓雅里,高雄市苓雅區苓雅里華新街86號,"22.613969,120.296421",1,669,
一般建築,,LY3607,正大里,高雄市苓雅區正大里中正一路284號,"22.629694,120.328081",1,674,
一般建築,,LY3701,苓東里,高雄市苓雅區苓東里四維四路167號,"22.613948,120.295118",2,681,
一般建築,,LY4141,城西里,高雄市苓雅區城西里中華四路71號,"22.614252,120.301449",1,683,
一般建築,,LY3880,永康里,高雄市苓雅區永康里四維一路57之1號,"22.625702,120.329615",1,685,
一般建築,,LY3858,福東里,高雄市苓雅區福東里三多一路69號,"22.623488,120.3342",2,685,
一般建築,,LY3881,林華里,高雄市苓雅區林華里和平二路305號,"22.615835,120.322391",1,704,
一般建築,,LY3842,正大里,高雄市苓雅區正大里建國一路109號,"22.630949,120.334427",1,707,
一般建築,,LY4094,普天里,高雄市苓雅區普天里四維二路329號,"22.620861,120.316039",1,709,
一般建築,,LY4120,田西里,高雄市苓雅區田西里自強三路177號,"22.618048,120.29798",1,710,
商場,,LY3330,仁政里,高雄市苓雅區仁政里文橫二路113號,"22.620094,120.304685",1,718,
一般建築,,LY3708,苓洲里,高雄市苓雅區苓洲里青年二路210號,"22.617864,120.294996",2,726,
宗教設施,,LY2168,博仁里,高雄市苓雅區博仁里五福三路149之1號,"22.620507,120.291745",1,728,
一般建築,,LY3502,仁政里,高雄市苓雅區仁政里中山二路412號,"22.618732,120.303044",2,731,
一般建築,,LY4011,普照里,高雄市苓雅區普照里復興二路22號,"22.617099,120.311738",1,732,
一般建築,,LY4060,正大里,高雄市苓雅區正大里中正一路188號,"22.628691,120.331078",2,746,
學校,,LY3808,林富里,高雄市苓雅區林富里青年一路103號,"22.62324808674026, 120.31361173991134",1,746,
一般建築,,LY3809,普照里,高雄市苓雅區普照里復興二路9號,"22.616952,120.311346",2,747,
一般建築,,LY3747,尚義里,高雄市苓雅區尚義里光華一路232號,"22.62975,120.313585",2,748,
一般建築,,LY4013,普照里,高雄市苓雅區普照里民權一路39巷11號,"22.618082,120.313261",1,754,
一般建築,,LY1590,林西里,高雄市苓雅區林西里三多二路224號,"22.618865,120.319074",1,760,
一般建築,,LY3841,林德里,高雄市苓雅區林德里和平一路72號,"22.621779,120.32138",1,761,
一般建築,,LY3576,林富里,高雄市苓雅區林富里福建街223巷4號,"22.622233,120.315059",1,776,
一般建築,,LY3802,福南里,高雄市苓雅區福南里中正一路249號,"22.629425,120.326311",2,784,
一般建築,,LY3620,福南里,高雄市苓雅區福南里中正一路263號,"22.629441,120.325743",2,788,
一般建築,,LY3644,普照里,高雄市苓雅區普照里民權一路59號,"22.619138,120.313289",1,791,
一般建築,,LY3376,仁政里,高雄市苓雅區仁政里青年一路261號,"22.620508,120.304376",1,796,
一般建築,,LY0772,五福里,高雄市苓雅區五福里大順三路218號,"22.634293,120.326449",1,797,
一般建築,,LY3799,正言里,高雄市苓雅區正言里中正一路372號,"22.629928,120.32566",1,812,
一般建築,,LY4016,城北里,高雄市苓雅區城北里興中二路146號,"22.613821,120.298603",1,817,
宗教設施,,LY4179,林華里,高雄市苓雅區林華里和平二路437號,"22.61890829,120.322186767346",1,827,
一般建築,,LY4227,晴朗里,高雄市苓雅區晴朗里復興二路142號,"22.620397446040823, 120.31036530370994",1.2.3,829,
一般建築,,LY3934,苓中里,高雄市苓雅區苓中里苓中路153號,"22.614505,120.294563",1,833,
一般建築,,LY3849,正道里,高雄市苓雅區正道里福德一路63巷2號,"22.633877,120.335051",1,835,
學校,,LY3176,城西里,高雄市苓雅區城西里四維四路61號,"22.614522,120.300464",1,836,
一般建築,,LY2267,人和里,高雄市苓雅區人和里四維四路2號,"22.617087,120.302823",2,840,
一般建築,,LY3446,仁政里,高雄市苓雅區仁政里四維三路198之5號,"22.617526,120.303811",1,845,
一般建築,,LY3951,正大里,高雄市苓雅區正大里建民路26號,"22.629158,120.331479",2,845,
一般建築,,LY4185,普照里,高雄市苓雅區普照里復興二路8號,"22.616871,120.311825",1,847,
一般建築,,LY3242,林中里,高雄市苓雅區林中里廣東一街70號,"22.621406,120.319864",1,857,
一般建築,,LY1415,衛武里,高雄市苓雅區衛武里澄清路9巷2號,"22.62688,120.344199",1,857,
一般建築,,LY4048,晴朗里,高雄市苓雅區晴朗里復興二路128號,"22.620114,120.310543",2,861,
一般建築,,LY3066,林富里,高雄市苓雅區林富里四維二路124號,"22.621478,120.315893",1,862,
一般建築,,LY2964,普天里,高雄市苓雅區普天里民權一路30號,"22.619122,120.31411",1,862,
一般建築,,LY0244,人和里,高雄市苓雅區人和里四維四路22之1號,"22.616803,120.301812",1,863,
一般建築,,LY2606,中正里,高雄市苓雅區中正里林南街22號,"22.62583,120.315417",1,870,
一般建築,,LY3852,城西里,高雄市苓雅區城西里中華四路51號,"22.613714,120.301642",2,870,
一般建築,,LY3603,正文里,高雄市苓雅區正文里褔德二路20之4號,"22.63069059,120.328068596182",2,877,
一般建築,,LY4051,正道里,高雄市苓雅區正道里建國一路64巷56號,"22.634287,120.336175",1,882,
一般建築,,LY3307,林富里,高雄市苓雅區林富里苓雅一路27號,"22.622378,120.314864",1,898,
一般建築,,LY4008,普天里,高雄市苓雅區普天里四維二路331號,"22.62078,120.315827",1,900,
一般建築,,LY3914,苓東里,高雄市苓雅區苓東里苓南路7號,"22.613453,120.293505",1,903,
一般建築,,LY3179,安祥里,高雄市苓雅區安祥里中正二路56巷4號,"22.630572,120.319856",1,907,
一般建築,,LY1228,林圍里,高雄市苓雅區林圍里青年一路8之4號,"22.624572,120.314896",1,909,
一般建築,,LY4041,人和里,高雄市苓雅區人和里仁義街151號,"22.619042,120.30145",1,914,
一般建築,,LY3628,尚義里,高雄市苓雅區尚義里中正二路91號,"22.630106,120.316585",1,933,
一般建築,,LY3686,安祥里,高雄市苓雅區安祥里中正二路72號,"22.630466,120.31849",1,935,
一般建築,,LY2966,中正里,高雄市苓雅區中正里林南街31號,"22.625513,120.315431",1,939,
一般建築,,LY3815,博仁里,高雄市苓雅區博仁里海邊路65號,"22.61985,120.29212",2,940,
一般建築,,LY3982,林安里,高雄市苓雅區林安里惠安街48號,"22.62628,120.312862",1,942,
一般建築,,LY3806,安祥里,高雄市苓雅區安祥里中正二路58號,"22.630389,120.31941",2,944,
一般建築,,LY3999,日中里,高雄市苓雅區日中里忠孝二路18號,"22.616728,120.309603",2,946,
一般建築,,LY2912,人和里,高雄市苓雅區人和里苓雅二路40號,"22.618183,120.30144",2,955,
學校,,LY3068,福隆里,高雄市苓雅區福隆里漢陽街17號,"22.618957,120.32935",1,962,
一般建築,,LY3517,普天里,高雄市苓雅區普天里福建街31號,"22.619078,120.316464",1,971,
一般建築,,LY1931,苓洲里,高雄市苓雅區苓洲里海邊路48號,"22.618179,120.293728",1,972,
一般建築,,LY3781,安祥里,高雄市苓雅區安祥里中正二路20號,"22.630243,120.321111",2,982,
一般建築,,LY2835,苓雅里,高雄市苓雅區苓雅里四維四路176號,"22.614819,120.296066",1,987,
一般建築,,LY3917,林榮里,高雄市苓雅區林榮里英祥街24號,"22.616886,120.325464",1,994,
一般建築,,LY3722,苓中里,高雄市苓雅區苓中里四維四路190之1號,"22.614453,120.295006",1,1003,
一般建築,,LY4236,鼓中里,高雄市苓雅區鼓中里永昌街2號,"22.6167726863301, 120.29949856396402",4,1011,
一般建築,,LY0058,博仁里,高雄市苓雅區博仁里五福三路101號,"22.620729,120.294832",1,1017,
一般建築,,LY3177,城北里,高雄市苓雅區城北里興中二路106號,"22.614107,120.299471",1,1035,
一般建築,,LY0187,意誠里,高雄市苓雅區意誠里三多四路123號,"22.612015,120.299271",1,1044,
一般建築,,LY3906,林榮里,高雄市苓雅區林榮里英義街301號,"22.617654,120.32547",1,1050,
學校,,LY3969,苓東里,高雄市苓雅區苓東里華新街59號,"22.613721,120.297098",1,1050,
一般建築,,LY3874,人和里,高雄市苓雅區人和里四維四路8號,"22.616959,120.302228",3,1065,
一般建築,,LY3928,苓中里,高雄市苓雅區苓中里苓中路159號,"22.614712,120.294479",1,1077,
一般建築,,LY4046,福東里,高雄市苓雅區福東里三多一路35號,"22.623654,120.335205",3,1079,
一般建築,,LY3863,文昌里,高雄市苓雅區文昌里正義路247號,"22.632925,120.34056",1,1090,
一般建築,,LY4005,美田里,高雄市苓雅區美田里青年一路193號,"22.62124,120.306472",2,1094,
一般建築,,LY4100,普天里,高雄市苓雅區普天里三多二路308號,"22.618307,120.317027",1,1100,
一般建築,,LY3612,尚義里,高雄市苓雅區尚義里中正二路105號之1,"22.63018479,120.316111725019",1,1102,
一般建築,,LY4109,苓洲里,高雄市苓雅區苓洲里光明街83號,"22.620082,120.294901",1,1108,
一般建築,,LY3918,安祥里,高雄市苓雅區安祥里中正二路56巷8號,"22.630697,120.31981",1,1110,
一般建築,,LY3822,正言里,高雄市苓雅區正言里中正一路304號,"22.629818,120.327281",2,1123,
一般建築,,LY3919,正義里,高雄市苓雅區正義里建國一路19號之1,"22.62912,120.339828",1,1135,
一般建築,,LY1724,正言里,高雄市苓雅區正言里中正一路326號,"22.62986,120.326651",1,1139,
一般建築,,LY3302,鼓中里,高雄市苓雅區鼓中里四維四路166號,"22.615466,120.297811",2,1143,
一般建築,,LY1749,林華里,高雄市苓雅區林華里和平二路307號,"22.616033,120.322389",1,1148,
一般建築,,LY3520,普照里,高雄市苓雅區普照里興中一路110號,"22.617999,120.310981",1,1151,
一般建築,,LY4009,正大里,高雄市苓雅區正大里建國一路113之2號,"22.631322,120.33324",2,1160,
一般建築,,LY4074,意誠里,高雄市苓雅區意誠里中華四路2號,"22.612038,120.302977",2,1165,
一般建築,,LY3803,和煦里,高雄市苓雅區和煦里四維三路80號,"22.619494,120.309963",2,1167,
一般建築,,LY2528,中正里,高雄市苓雅區中正里廣州一街149之3號,"22.626329,120.316106",1,1178,
一般建築,,LY3109,林富里,高雄市苓雅區林富里苓雅一路29號,"22.622367,120.31482",1,1180,
一般建築,,LY3981,正仁里,高雄市苓雅區正仁里文昌路62號,"22.63161279,120.338170267346",1,1183,
一般建築,,LY1737,苓中里,高雄市苓雅區苓中里苓中路179號,"22.614946,120.294137",1,1184,
一般建築,,LY3209,普天里,高雄市苓雅區普天里興中一路52號之1,"22.619306,120.314899",1,1210,
一般建築,,LY3850,日中里,高雄市苓雅區日中里林森二路10號,"22.615938,120.308471",1,1230,
一般建築,,LY4105,中正里,高雄市苓雅區中正里林南街27巷20號,"22.624836,120.315796",4,1231,
一般建築,,LY3966,意誠里,高雄市苓雅區意誠里新光路142號,"22.610721,120.299377",2,1231,
一般建築,,LY4130,田西里,高雄市苓雅區田西里青年二路75號,"22.618891,120.299286",1,1236,
學校,,LY4044,同慶里,高雄市苓雅區同慶里凱旋二路89號,"22.626515,120.322109",1,1268,
一般建築,,LY4050,苓洲里,高雄市苓雅區苓洲里新田路391號,"22.618922,120.294216",3,1273,
一般建築,,LY4214,同慶里,高雄市苓雅區同慶里和平一路144巷21號,"22.627907,120.320156",3,1277,
一般建築,,LY3630,正言里,高雄市苓雅區正言里武廟路129號之1,"22.630963,120.327219",1,1280,
一般建築,,LY3214,普天里,高雄市苓雅區普天里興中一路22號,"22.61971,120.316151",1,1304,
一般建築,,LY0512,普照里,高雄市苓雅區普照里永定街85號,"22.618777,120.311583",1,1328,
一般建築,,LY4158,城北里,高雄市苓雅區城北里興中二路125號,"22.613734,120.298961",1,1331,
一般建築,,LY3684,美田里,高雄市苓雅區美田里林森二路89號,"22.621054,120.306093",1.2,1340,
一般建築,,LY3561,林泉里,高雄市苓雅區林泉里林泉街179號,"22.622412,120.316522",2,1343,
一般建築,,LY3977,苓雅里,高雄市苓雅區苓雅里四維四路178號,"22.614699,120.295846",2,1364,
一般建築,,LY4066,廣澤里,高雄市苓雅區廣澤里四維三路251號,"22.616861,120.304156",2,1365,
一般建築,,LY2397,林南里,高雄市苓雅區林南里和平一路149之15號,"22.624797,120.319892",1,1366,
一般建築,,LY3980,城東里,高雄市苓雅區城東里中華四路140號,"22.615735,120.301415",1,1371,
一般建築,,LY4225,苓洲里,高雄市苓雅區苓洲里允文街120號,"22.618740143309317, 120.29528522157784",1.2,1372,
一般建築,,LY3955,普照里,高雄市苓雅區普照里民權一路11號,"22.61769,120.313905",1,1373,
一般建築,,LY2173,普天里,高雄市苓雅區普天里永靖街113號,"22.619529,120.31392",1,1380,
學校,,LY3444,民主里,高雄市苓雅區民主里建國一路354號,"22.633375,120.323099",1,1395,
一般建築,,LY4039,正大里,高雄市苓雅區正大里中正一路192號,"22.628785,120.330869",2,1421,
一般建築,,LY4107,苓洲里,高雄市苓雅區苓洲里光明街89號,"22.619899,120.294466",1,1436,
一般建築,,LY3882,文昌里,高雄市苓雅區文昌里正義路261號,"22.633368,120.340942",1,1444,
學校,,LY1327,林靖里,高雄市苓雅區林靖里三多二路84號,"22.62125449,120.326301996182",1,1453,
一般建築,,LY0773,人和里,高雄市苓雅區人和里中山二路489號,"22.619351,120.30201",1,1460,
一般建築,,LY3925,福東里,高雄市苓雅區福東里武營路693號,"22.623557,120.335528",1,1466,
一般建築,,LY3903,城西里,高雄市苓雅區城西里中華四路45號,"22.613305,120.301793",3,1472,
一般建築,,LY4020,人和里,高雄市苓雅區人和里中山二路455號,"22.617277,120.302829",1,1473,
一般建築,,LY3973,福東里,高雄市苓雅區福東里武嶺街50巷36號,"22.622586,120.334686",1,1476,
一般建築,,LY2073,普照里,高雄市苓雅區普照里復興二路3號,"22.616854,120.311376",1,1485,
一般建築,,LY3912,正大里,高雄市苓雅區正大里武廟路69之1號,"22.630372,120.330419",2,1489,
一般建築,,LY4028,正道里,高雄市苓雅區正道里福德一路48巷1號,"22.634491,120.33498",1,1492,
一般建築,,LY4145,林圍里,高雄市苓雅區林圍里福建街308號,"22.625139,120.314346",1,1506,
一般建築,,LY0823,人和里,高雄市苓雅區人和里中山二路463號,"22.618188,120.302463",1,1514,
一般建築,,LY2469,林泉里,高雄市苓雅區林泉里林泉街57號,"22.623006,120.318305",1,1514,
一般建築,,LY1410,意誠里,高雄市苓雅區意誠里新光路126號,"22.610907,120.299924",1,1520,
一般建築,,LY3609,正言里,高雄市苓雅區正言里正言路37號,"22.630406,120.329708",1,1532,
一般建築,,LY4238,田西里,高雄市苓雅區田西里成功一路232號,"22.617690283570223, 120.29651594695",3,1537,
一般建築,,LY3968,正大里,高雄市苓雅區正大里輔仁路128號,"22.631022,120.33365",1,1550,
一般建築,,LY4092,正文里,高雄市苓雅區正文里建國一路167之2號,"22.632764,120.327408",3,1578,
一般建築,,LY4231,城北里,高雄市苓雅區城北里成功一路6號,"22.612731533289548, 120.29867567789253",4,1587,
一般建築,,LY3979,永康里,高雄市苓雅區永康里福安路33號,"22.625326,120.330762",2,1664,
一般建築,,LY4224,普天里,高雄市苓雅區普天里永靖街85號,"22.619844,120.314854",4,1665,
一般建築,,LY2029,福西里,高雄市苓雅區福西里明德街23號,"22.62522879,120.333109825019",1,1667,
一般建築,,LY4190,仁政里,高雄市苓雅區仁政里苓雅一路365號,"22.618707,120.303852",1,1694,
學校,,LY3821,林德里,高雄市苓雅區林德里三多二路100號,"22.620619,120.324166",1,1695,
一般建築,,LY3942,普天里,高雄市苓雅區普天里福建街61號,"22.620035,120.316101",1,1736,
一般建築,,LY2058,日中里,高雄市苓雅區日中里林森二路48號,"22.617182,120.307937",1,1738,
一般建築,,LY3814,正大里,高雄市苓雅區正大里中正一路120號,"22.62816,120.332641",2,1757,
一般建築,,LY1163,苓洲里,高雄市苓雅區苓洲里海邊路46號,"22.618041,120.293772",1,1817,
一般建築,,LY3948,城東里,高雄市苓雅區城東里中華四路100號,"22.614402,120.301916",2,1821,
一般建築,,LY4143,建軍里,高雄市苓雅區建軍里至誠路73號,"22.631808,120.340633",1,1821,
一般建築,,LY3606,林榮里,高雄市苓雅區林榮里英義街113號,"22.6151,120.326026",1,1829,
一般建築,,LY4232,苓雅里,高雄市苓雅區苓雅里四維四路170號,"22.61516547899162, 120.29714218927727",1.2.3.4,1859,
一般建築,,LY4085,城東里,高雄市苓雅區城東里仁義街23號,"22.614878,120.302933",2,1861,
一般建築,,LY4147,正大里,高雄市苓雅區正大里中正一路226之2號,"22.629114,120.329803",1,1879,
一般建築,,LY3699,正大里,高雄市苓雅區正大里中正一路134號,"22.628419,120.331898",1.2,1894,
