類別,電腦編號,村里別,地址,緯經度,地下樓層數,可容納人數,備註
一般建築,LU0173,五福里,高雄市林園區五福里林園工業區工業三路9號,"22.496392,120.414889",1,501.0,
一般建築,DL0083,大寮里,高雄市大寮區大寮里興業路11號,"22.590852,120.431072",1,502.0,
一般建築,LU0049,五福里,高雄市林園區東林里鳳林路1段1號,"22.50088481,120.397664267343",1,515.0,
一般建築,DL0228,過溪里,高雄市大寮區過溪里華中路22號,"22.578371,120.429102",1,517.0,
一般建築,DL0478,中庄里,高雄市大寮區中庄里中庄路162之31號,"22.63417999,120.399009928106",1,519.0,
一般建築,DL0519,永芳里,高雄市大寮區永芳里進學路151號,"22.602574832925942, 120.38980876156107",1,523.0,
一般建築,LU0022,溪州里,高雄市林園區溪州里石化一路1號,"22.507275947696073, 120.4128021657362",1,528.0,
一般建築,DL0147,江山里,高雄市大寮區江山里江山路80號,"22.637506,120.405404",1,543.0,
一般建築,LU0030,東林里,高雄市林園區東林里福興街106號,"22.505196,120.394658",1,559.0,
一般建築,LU0192,北汕里,高雄市林園區北汕里石化三路9號,"22.487627,120.405758",1,574.0,
一般建築,DL0475,中庄里,高雄市大寮區中庄里鳳屏一路106號,"22.63134269,120.386002225019",1,575.0,
一般建築,DL0525,昭明里,高雄市大寮區昭明里鳳林一路300巷80號,"22.54239,120.408514",1,582.0,
一般建築,DL0529,過溪里,高雄市大寮區過溪里華西路8之1號,"22.574812,120.425675",1,586.0,
一般建築,LU0045,溪州里,高雄市林園區溪洲里工業二路1號,"22.499009,120.414456",1,590.0,
一般建築,LU0161,北汕里,高雄市林園區北汕里石化四路1號,"22.486052,120.408555",1,599.0,
一般建築,DL0200,大寮里,高雄市大寮區大寮里興業路9號,"22.590845,120.431802",1,613.0,
一般建築,DL0504,大寮里,高雄市大寮區大寮里大寮路740號,"22.590861,120.416445",1,616.0,
一般建築,LU0165,五福里,高雄市林園區五福里工業三路1號,"22.489415,120.415068",1,617.0,
一般建築,LU0187,林園里,高雄市林園區林園里文化街164之1號,"22.50614622,120.393708467343",1,627.0,
一般建築,LU0195,廣應里,高雄市林園區廣應里東林西路298巷78號,"22.5061536,120.388327925015",1,643.0,
一般建築,DL0450,江山里,高雄市大寮區江山里江山路73之27號,"22.637663,120.410497",1,653.0,
一般建築,DL0451,江山里,高雄市大寮區江山里江山路73之28號,"22.637623,120.410535",1,653.0,
一般建築,DL0483,山頂里,高雄市大寮區山頂里山頂路162之6號,"22.6084518,120.389443467346",1,719.0,
學校,LU0191,王公里,高雄市林園區王公里林園北路481號,"22.513749,120.39492",1,733.0,
一般建築,DL0474,後庄里,高雄市大寮區後庄里鳳屏一路7之2號,"22.63053199,120.383614296183",1,741.0,
一般建築,DL0122,過溪里,高雄市大寮區過溪里莒光三街2號,"22.577328,120.428268",1,792.0,
一般建築,DL0463,義和里,高雄市大寮區義和里義和路123之39號,"22.640059,120.420094",1,793.0,
一般建築,DL0510,潮寮里,高雄市大寮區潮寮里建業路29號,"22.570563,120.421535",1,799.0,
一般建築,LU0178,中門里,高雄市林園區中門里中門路159號,"22.506532,120.368964",1,819.0,
學校,LU0196,中厝里,高雄市林園區中厝里金潭路40號,"22.528089,120.396063",2,836.0,
一般建築,DL0231,潮寮里,高雄市大寮區大寮里大業街19號,"22.58368249,120.430469167345",1,842.0,
一般建築,DL0008,江山里,高雄市大寮區江山里鳳屏二路16號,"22.637827,120.403221",1,847.0,
一般建築,LU0179,王公里,高雄市林園區王公里王公路21號,"22.51306412,120.393831025016",1,862.0,
一般建築,LU0168,東林里,高雄市林園區東林里沿海路3段186號,"22.50017261,120.388040238506",1,868.0,
一般建築,DL0477,山頂里,高雄市大寮區山頂里鳳林三路667號,"22.609895,120.393373",1,889.0,
一般建築,LU0198,溪州里,高雄市林園區溪州里工業一路2號,"22.501664,120.406249",1,913.0,
學校,DL0533,潮寮里,高雄市大寮區潮寮里潮寮路61號,"22.565715,120.425144",1,923.0,
一般建築,LU0188,仁愛里,高雄市林園區仁愛里仁愛路67巷20號,"22.505289,120.391943",1,928.0,
一般建築,DL0081,大寮里,高雄市大寮區大寮里華東路57號,"22.589722,120.432312",1,932.0,
一般建築,DL0152,後庄里,高雄市大寮區後庄里鳳屏一路149號,"22.63251497739418, 120.38696712136523",1,955.0,
一般建築,DL0060,山頂里,高雄市大寮區山頂里山頂路172號,"22.608332,120.389231",1,956.0,
一般建築,DL0444,中庄里,高雄市大寮區中庄里中庄路57之7號,"22.63444299,120.397558796183",1,978.0,
一般建築,DL0053,大寮里,高雄市大寮區大寮里華中路18號,"22.589517,120.428313",1,982.0,
一般建築,LU0186,西溪里,高雄市林園區西溪里半?路31之1號,"22.48957384,120.388114270321",1,992.0,
一般建築,DL0464,過溪里,高雄市大寮區大寮里華西路26號,"22.579388,120.42321",1,996.0,
學校,D0927,林園里,高雄市林園區林園里忠孝西路20號,"22.50741529,120.393216825015",1,1007.0,
一般建築,LU0174,林園里,高雄市林園區林園里忠孝東路65號,"22.507217,120.396994",1,1012.0,
一般建築,LU0197,五福里,高雄市林園區五福里工業三路9號,"22.496392,120.414889",1,1013.0,
一般建築,LU0191,林園里,高雄市林園區王公里林園北路481號,"22.513766449046607, 120.39483661112156",1,1019.0,
一般建築,LU0010,林園里,高雄市林園區林園里林園北路249號,"22.50976361,120.394524167343",1,1021.0,
一般建築,DL0520,會社里,高雄市大寮區會社里正氣路79號,"22.60035341332938, 120.39315681787173",1,1022.0,
一般建築,LU0105,仁愛里,高雄市林園區仁愛里文賢北路29號,"22.504372,120.391518",1,1041.0,
一般建築,LU0106,仁愛里,高雄市林園區仁愛里忠義二街44號,"22.503883,120.391253",1,1041.0,
一般建築,DL0523,琉球里,高雄市大寮區琉球里農場路1之10號,"22.60412176180413, 120.43185096541607",1,1047.0,
一般建築,DL0469,內坑里,高雄市大寮區內坑里內坑路108之67號,"22.594653,120.388157",1,1066.0,
一般建築,LU0167,東林里,高雄市林園區東林里林園南路92巷46號,"22.501304,120.397167",1,1071.0,
一般建築,DL0522,潮寮里,高雄市大寮區潮寮里華東路28號,"22.579488,120.433719",1,1074.0,
一般建築,DL0059,江山里,高雄市大寮區江山里鳳屏二路180巷87號,"22.640166,120.414229",1,1090.0,
一般建築,LU0177,文賢里,高雄市林園區文賢里東林西路249巷30號,"22.502147,120.389822",1,1092.0,
一般建築,DL0502,會社里,高雄市大寮區會社里正氣路79號,"22.600131869805516, 120.3933826731798",1,1123.0,
一般建築,DL0435,中庄里,高雄市大寮區中庄里中庄路133之11號,"22.63438319,120.399059318168",1,1139.0,
一般建築,LU0199,王公里,高雄市林園區王公里王公路1號,"22.51291,120.394441",1,1152.0,
一般建築,LU0193,林園里,高雄市林園區王公里林園北路481號,"22.513749,120.39492",1,1155.0,
一般建築,DL0532,中庄里,高雄市大寮區中庄里四維路296號,"22.636997,120.397304",1,1159.0,
一般建築,DL0274,潮寮里,高雄市大寮區潮寮里大有一街20號,"22.588911,120.427446",1,1160.0,
一般建築,DL0437,中興里,高雄市大寮區中興里明德路16號,"22.616903,120.388234",1,1175.0,
學校,DL0504,"大寮里  ",高雄市大寮區大寮里大寮路740號,"22.590861,120.416445",1,1176.0,
一般建築,DL0530,過溪里,高雄市大寮區過溪里光華路5之3號,"22.582574,120.430384",1,1176.0,
一般建築,DL0521,永芳里,高雄市大寮區永芳里進學路151號,"22.602810588953833, 120.3894930307675",1,1243.0,
一般建築,LU0163,文賢里,高雄市林園區文賢里文賢南路107號,"22.501384,120.393278",1,1248.0,
一般建築,DL0484,會社里,高雄市大寮區會社里正氣路73之7號,"22.601438,120.394312",1,1286.0,
學校,D1008,溪寮里,高雄市大寮區溪寮里溪寮路68號,"22.62915529,120.419563725019",2,1289.0,
一般建築,DL0462,過溪里,高雄市大寮區過溪里過溪路5之11號,"22.57553659,120.417163767345",1,1289.0,
一般建築,DL0517,翁園里,高雄市大寮區翁園里翁園路79號,"22.623246,120.408663",1,1332.0,
一般建築,DL0436,後庄里,高雄市大寮區後庄里民族路73巷72號,"22.63529909,120.386978167346",1,1333.0,
一般建築,DL0470,前庄里,高雄市大寮區前庄里前庄路6之20號,"22.621959,120.397649",1,1334.0,
工廠宿舍,DL0539,上寮里,高雄市大寮區上寮里上發五路9號,"22.59446648326237, 120.42576865613051",1,1335.0,
一般建築,DL0488,永芳里,高雄市大寮區永芳里進學路151號,"22.60222050818328, 120.38958379926878",1,1343.0,
一般建築,DL0472,新厝里,高雄市大寮區新厝里新厝路56之3號,"22.5615054,120.409938425017",1,1346.0,
一般建築,DL0535,過溪里,高雄市大寮區過溪里莒光二街22號,"22.578962919644216, 120.4240543138479",1,1434.0,
一般建築,DL0069,大寮里,高雄市大寮區大寮里華西路41號,"22.58519,120.421663",2,1508.0,
一般建築,DL0134,大寮里,高雄市大寮區大寮里華西路45號,"22.588396,120.422192",1,1516.0,
學校,D0815,山頂里,高雄市大寮區山頂里山頂路211號,"22.60768416,120.388765877732",2,1539.0,
學校,LU0190,中芸里,高雄市林園區中芸里中芸路1號,"22.487112,120.396711",1,1542.0,
一般建築,DL0487,上寮里,高雄市大寮區上寮里上寮路103之19號,"22.59972,120.424536",1,1625.0,
一般建築,DL0426,後庄里,高雄市大寮區後庄里鳳屏一路295號,"22.636499,120.392356",1,1783.0,
一般建築,DL0427,後庄里,高雄市大寮區後庄里民族路42號之1,"22.63417069,120.384868096183",1,1887.0,
學校,DL0512,後庄里,高雄市大寮區後庄里民揚街28號,"22.637822,120.389503",2,2109.0,
一般建築,DL0465,後庄里,高雄市大寮區後庄里民族路107號,"22.63521489,120.388160625019",1,2122.0,
一般建築,DL0327,過溪里,高雄市大寮區過溪里華西路31號,"22.579014,120.422292",1,2137.0,
一般建築,LU0184,王公里,高雄市林園區王公里王公路64之1號,"22.512319,120.392",2,2173.0,
一般建築,DL0512,後庄里,高雄市大寮區後庄里民揚路28號,"22.637822,120.389503",1,2212.0,
一般建築,DL0486,後庄里,高雄市大寮區後庄里鳳屏一路461巷39之1號,"22.6382857,120.395842961955",1,2254.0,
一般建築,DL0496,過溪里,高雄市大寮區過溪里大發工業區華西路33號,"22.580207,120.422343",1,2283.0,
一般建築,DL0481,永芳里,高雄市大寮區永芳里進學路46之6號,"22.606242,120.393987",1,2297.0,
一般建築,DL0516,永芳里,高雄市大寮區永芳里進學路151號,"22.602207648718867, 120.39040098485216",1,2305.0,
一般建築,LU0180,王公里,高雄市林園區王公里王公路58巷8號,"22.512777,120.392004",2,2313.0,
學校,D0906,永芳里,高雄市大寮區永芳里鳳林三路501號,"22.60599429,120.395250967346",2,2338.0,
一般建築,DL0431,中庄里,高雄市大寮區中庄里仁愛路58巷46號,"22.63583971,120.39506541066",1,2373.0,
一般建築,DL0498,內坑里,高雄市大寮區內坑里內坑路161之21號,"22.589047,120.38012",2,2522.0,
一般建築,LU0153,溪州里,高雄市林園區溪州里石化一路1號,"22.50768562740417, 120.41253955924843",1,2525.0,
一般建築,DL0413,後庄里,高雄市大寮區後庄里鳳屏一路459號,"22.63827879,120.395817867346",1,2620.0,
一般建築,DL0459,後庄里,高雄市大寮區後庄里成功路58巷7號,"22.63733621,120.391417062388",2,2630.0,
一般建築,DL0506,大寮里,高雄市大寮區大寮里大發工業區華東路39號,"22.586738,120.43225",1,2643.0,
一般建築,DL0489,內坑里,高雄市大寮區內坑里六和路2之39號,"22.589528,120.371244",2,2740.0,
一般建築,DL0443,會社里,高雄市大寮區會社里鳳林三路105巷24弄47號,"22.596508,120.398458",1,2768.0,
一般建築,DL0476,後庄里,高雄市大寮區後庄里鳳屏一路67號,"22.63212859,120.385944267346",1,2774.0,
一般建築,DL0480,中庄里,高雄市大寮區中庄里中庄路162之87號,"22.63418041,120.399009697342",1,2797.0,
一般建築,DL0497,永芳里,高雄市大寮區永芳里永芳路28之31號,"22.614018,120.404618",2,2807.0,
一般建築,DL0468,永芳里,高雄市大寮區永芳里永芳路44之12號,"22.610156,120.405662",1,2911.0,
一般建築,DL0467,中興里,高雄市大寮區中興里中正路3之8號,"22.617667,120.386258",2,2939.0,
一般建築,DL0456,中庄里,高雄市大寮區中庄里中庄路58之21號,"22.63446999,120.396839625019",2,2963.0,
一般建築,DL0460,拷潭里,高雄市大寮區拷潭里拷潭路163之1號,"22.584752,120.380306",2,3110.0,
一般建築,LU0176,頂厝里,高雄市林園區頂厝里校前路6巷23號,"22.504379,120.379405",2,3144.0,
一般建築,DL0439,中興里,高雄市大寮區中興里明德路12巷4號,"22.616505,120.388932",2,3163.0,
一般建築,DL0533,中庄里,高雄市大寮區中庄里四維路286號,"22.637120756097033, 120.39690769563546",1.2,3176.0,
一般建築,DL0527,永芳里,高雄市大寮區永芳里進學路151號,"22.603884,120.391256",1,3198.0,
一般建築,LU0181,王公里,高雄市林園區王公里王公路100巷25號之1,"22.51131081,120.390777025015",2,3200.0,
一般建築,DL0428,中庄里,高雄市大寮區中庄里鳳屏一路100巷1號,"22.63121601,120.385078074811",1,3238.0,
一般建築,DL0511,過溪里,高雄市大寮區過溪里大業街18號,"22.581603,120.43118",1,3286.0,
一般建築,DL0534,過溪里,高雄市大寮區過溪里莒光二街22號,"22.579039,120.424017",4,3344.0,
一般建築,LU0182,頂厝里,高雄市林園區頂厝里頂厝路50巷91號,"22.500164,120.379937",2,3580.0,
一般建築,DL0473,內坑里,高雄市大寮區內坑里內坑路108之66號,"22.594778,120.388974",2,3587.0,
學校,DL0503,永芳里,高雄市大寮區永芳里進學路150號,"22.602926,120.39266",1.2,3840.0,
一般建築,DL0538,上寮里,高雄市大寮區上寮里上發六街29號,"22.595043,120.428833",3,4243.0,
一般建築,DL0499,中庄里,高雄市大寮區中庄里信義路40號,"22.633962,120.391585",3,4361.0,
一般建築,DL0500,中庄里,高雄市大寮區中庄里信義路40號,"22.63378859054479, 120.3916133902939",3,4508.0,
一般建築,DL0514,潮寮里,高雄市大寮區潮寮里大業街5號,"22.580589,120.430063",2,5586.0,
一般建築,DL0524,琉球里,高雄市大寮區琉球里農場路1之10號,"22.60417209,120.431857896458",1,5760.0,
一般建築,FS4719,新強里,高雄市鳳山區新強里新富路210號,"22.612646051336174, 120.33973138617374",1.2.,13468.0,
一般建築,FS474,老爺里,高雄市鳳山區老爺里五甲一路612號,"22.6102616349978, 120.3487232904981",3,1944.0,
一般建築,FS4721,新強里,高雄市鳳山區新強里新強路201號,"22.611418,120.339395",1.2.,2404.0,
政府機關,FS473,忠孝里,高雄市鳳山區忠孝里光復路二段120號,"22.63027982613502, 120.34745606480428",1,3002.0,
一般建築,QJ3998,明孝里,高雄市前鎮區明孝里新生路248之5號,"22.576879,120.318167",1,40597.0,
商場,QJ4198,興邦里,高雄市前鎮區興邦里中華五路789號,"22.595526,120.30819",5,50180.0,
一般建築,DL0526,中庄里,高雄市大寮區中庄里鳳屏一路288號,"22.633451,120.389257",3,5911.0,
一般建築,DL0461,後庄里,高雄市大寮區後庄里成功路58巷26號,"22.63733621,120.391417062388",3,6121.0,
一般建築,FS472,新泰里,高雄市鳳山區新泰里新強路13號,"22.610905404924274, 120.34391545244719",2,3128.0,
一般建築,FS3870,國隆里,高雄市鳳山區國隆里南京路393巷28號,"22.615041,120.344352",1.2.,3491.0,
一般建築,FS476,新甲里,高雄市鳳山區新甲里新樂街111號,"22.608646631631835, 120.3427963244637",2,3609.0,
一般建築,FS471,海洋里,高雄市鳳山區海洋里新富路450號,"22.613016488495273, 120.34601916414023",3,4067.0,
一般建築,FS3867,國隆里,高雄市鳳山區國隆里南京路136號,"22.609538,120.345761",1.2.3,4667.0,
一般建築,FS6377,鎮西里,高雄市鳳山區鎮西里中山西路111號,"22.626902,120.352157",1.2.,5537.0,
一般建築,FS470,新樂里,高雄市鳳山區新樂里大明路183號,"22.610538805429872, 120.34139844057525",2,6299.0,
一般建築,FS3316,武漢里,高雄市鳳山區武漢里武慶二路56巷2號之2,"22.61117,120.333274",1.2.,8000.0,
藝文設施,FS468,新強里,高雄市鳳山區新強里三多一路1號,"22.623017198280998, 120.342434893618",1.2.,85251.0,
一般建築,QJ4327,明禮里,高雄市前鎮區明禮里漁港路311號,"22.583286073149118, 120.32453701255639",1.2.,3240.0,
一般建築,FS0477,南成里,高雄市鳳山區南成里海涵路386號,"22.590996425017245, 120.3462285101155",1.2.3,15674.0,
一般建築,FS0478,鎮東里,高雄市鳳山區鎮東里光遠路15號,"22.623188415228963, 120.36733486546456",1.2.3,4516.0,
一般建築,FS0479,鎮北里,高雄市鳳山區鎮北里北賢街395號,"22.64789343642184, 120.3697902217452",1.2.,3772.0,
工廠,XG0690,鳳宮里,高雄市小港區鳳宮里台機路3號,"22.5608,120.34754",1,443.0,
一般建築,XG0895,港南里,高雄市小港區港南里平和路46號,"22.564836,120.334014",1,444.0,
一般建築,XG2785,濟南里,高雄市小港區濟南里宏平路362號,"22.57008,120.359087",1,455.0,
一般建築,XG2881,山明里,高雄市小港區山明里19鄰宏光街511號,"22.567364,120.368641",1,457.0,
一般建築,XG1046,宏亮里,高雄市小港區宏亮里山明路541巷1號,"22.569035,120.361763",1,459.0,
一般建築,XG2742,順苓里,高雄市小港區順苓里平治街70號,"22.56743,120.355565",1,462.0,
醫院照護,XG2811,山東里,高雄市小港區山東里鄰宏平路636號,"22.570073,120.352557",1.2,463.0,
一般建築,XG2539,大苓里,高雄市小港區大苓里民益路133巷51號,"22.568065,120.3475",1,465.0,
一般建築,XG2745,宏亮里,高雄市小港區宏亮里大鵬路162號,"22.569447,120.358591",1,467.0,
一般建築,XG2357,港墘里,高雄市小港區港墘里達德街51號,"22.566817,120.333691",1,470.0,
工廠,XG2856,小港里,高雄市小港區小港里1鄰台糖路1號,"22.565062,120.34495",1,471.0,
工廠,XG2772,鳳宮里,高雄市小港區鳳宮里中林路16號,"22.538343,120.367921",1,476.0,
工廠,XG1327,山明里,高雄市小港區山明里1鄰中林路11號,"22.537337094751564, 120.36808838899616",1,482.0,
工廠,XG2850,鳳宮里,高雄市小港區鳳宮里中鋼路1號,"22.557011438689212, 120.35697044874829",1,483.0,
一般建築,XG1045,港正里,高雄市小港區港正里平和十路5巷1弄7號,"22.563655,120.33351",1,485.0,
一般建築,XG2501,店鎮里,高雄市小港區店鎮里立群路45號,"22.563354,120.352777",1,488.0,
一般建築,XG2265,正苓里,高雄市小港區正苓里漢民路258號,"22.566526,120.353212",1,499.0,
一般建築,XG2660,店鎮里,高雄市小港區店鎮里中鋼路80號,"22.560212,120.355217",1,499.0,
工廠,XG2016,鳳森里,高雄市小港區鳳森里1鄰中智街25號,"22.532727,120.362779",1,499.0,
一般建築,XG2738,松金里,高雄市小港區松金里13鄰宏林街59號,"22.570929,120.365802",1,505.0,
一般建築,XG2162,港南里,高雄市小港區港南里福利路48巷16號,"22.565228,120.336014",1,509.0,
工廠,XG1640,鳳鳴里,高雄市小港區鳳鳴里17鄰沿海三路36號,"22.523204,120.36675",1,513.0,
工廠,XG2757,山明里,高雄市小港區山明里1鄰北林路8號,"22.55666924820061, 120.37113443178768",1,515.0,
一般建築,XG2810,山明里,高雄市小港區山明里20鄰山明路66號,"22.565812,120.366646",1,531.0,
一般建築,XG2728,青島里,高雄市小港區青島里宏平路500號,"22.570094,120.355718",1,535.0,
政府機關,XG2011,鳳森里,高雄市小港區鳳森里鳳林路116號,"22.52707,120.346013",1,535.0,
一般建築,XG2895,店鎮里,高雄市小港區店鎮里17鄰中鋼路62號,"22.560434,120.355484",1.2,547.0,
一般建築,XG2896,店鎮里,高雄市小港區店鎮里17鄰中鋼路62號,"22.560343026372845, 120.35546875610851",1.2,547.0,
一般建築,XG2926,正苓里,高雄市小港區正苓里12鄰永順街155-1號,"22.568811,120.352971",1.2,548.0,
一般建築,XG2651,店鎮里,高雄市小港區店鎮里江山街6號,"22.562117,120.357314",1,550.0,
一般建築,XG2310,二苓里,高雄市小港區二苓里大業北路350號,"22.564191,120.347492",1,551.0,
工廠,XG2536,鳳宮里,高雄市小港區鳳宮里中鋼路1號,"22.552023462635297, 120.35862878158758",1,556.0,
一般建築,XG2654,大苓里,高雄市小港區大苓里沿海一路182號,"22.567554,120.350787",1,559.0,
工廠,XG0762,山明里,高雄市小港區山明里1鄰沿海三路20號,"22.529575,120.370104",1,567.0,
工廠,XG2533,山明里,高雄市小港區山明里1鄰沿海三路20之3號,"22.533169,120.372794",1,568.0,
一般建築,XG1164,順苓里,高雄市小港區順苓里平治街86號,"22.567454,120.354986",1,575.0,
工廠,XG2774,山明里,高雄市小港區山明里1鄰大業南路55號,"22.535461,120.369643",1,581.0,
一般建築,XG2705,中厝里,高雄市小港區中厝里18鄰明聖街54號,"22.582211,120.348113",1,584.0,
一般建築,XG2516,廈莊里,高雄市小港區廈莊里3鄰廈莊六街53號,"22.584187,120.361271",1,587.0,
工廠,XG1533,山明里,高雄市小港區山明里1鄰大業南路50號,"22.534666,120.36959",1,606.0,
工廠,XG1554,山明里,高雄市小港區山明里1鄰大業南路50號,"22.533809871703205, 120.36920324460601",1,606.0,
一般建築,XG1986,順苓里,高雄市小港區順苓里平治街6巷14號,"22.56714,120.357979",1,615.0,
一般建築,XG2369,正苓里,高雄市小港區正苓里永順街220號,"22.568981,120.350761",1,617.0,
一般建築,XG2309,二苓里,高雄市小港區二苓里大業北路348號,"22.564146,120.347532",1,624.0,
一般建築,XG2653,山東里,高雄市小港區山東里宏平路662號,"22.570139,120.352009",1,626.0,
一般建築,XG2770,青島里,高雄市小港區青島里中光街21號,"22.571369,120.355945",1,632.0,
一般建築,XG2210,順苓里,高雄市小港區順苓里漢民路409號,"22.56701,120.357668",1,642.0,
工廠,XG2662,山明里,高雄市小港區山明里1鄰世全路5號,"22.546233,120.369266",1,652.0,
工廠,XG1620,店鎮里,高雄市小港區店鎮里嘉興街6號,"22.560725,120.361427",1,653.0,
一般建築,XG2690,桂林里,高雄市小港區桂林里11鄰桂陽路257巷9號,"22.58141,120.353565",1,660.0,
政府機關,XG2858,山明里,高雄市小港區山明里15鄰博學路369號,"22.56238,120.370665",1,662.0,
一般建築,XG2689,桂林里,高雄市小港區桂林里11鄰桂陽路257巷5號,"22.581572,120.35354",1,664.0,
一般建築,XG2694,鳳宮里,高雄市小港區鳳宮里店北路58號,"22.560139,120.352727",1,670.0,
一般建築,XG2900,山明里,高雄市小港區山明里28鄰松華路50號,"22.559774,120.373929",1,674.0,
一般建築,XG2918,小港里,高雄市小港區小港里9鄰港美街72號,"22.562747199683894, 120.33818626237375",1.2,675.0,
一般建築,XG2917,小港里,高雄市小港區小港里9鄰港美街72號,"22.562788,120.338577",1.2,682.0,
一般建築,XG2801,青島里,高雄市小港區青島里廠橫路28之8號,"22.570936,120.356037",1,683.0,
一般建築,XG2704,店鎮里,高雄市小港區店鎮里江山街61號,"22.562609,120.358498",1,685.0,
一般建築,XG2765,泰山里,高雄市小港區泰山里宏信街21號,"22.570114,120.362969",1,687.0,
一般建築,XG1522,順苓里,高雄市小港區順苓里永順街102號,"22.56913,120.35504",1,692.0,
工廠,XG1096,山明里,高雄市小港區山明里1鄰北林路10號,"22.55713,120.370588",1,693.0,
工廠,XG2712,山明里,高雄市小港區山明里1鄰永春街2號,"22.543786,120.378643",1,693.0,
一般建築,XG2647,泰山里,高雄市小港區泰山里飛機路2號,"22.573434043429327, 120.3620342698788",1,698.0,
一般建築,XG0725,山明里,高雄市小港區山明里23鄰泰興街7號,"22.564627,120.368144",1,706.0,
一般建築,XG2686,店鎮里,高雄市小港區店鎮里店陽街10號,"22.561605,120.355602",1,718.0,
一般建築,XG2680,桂林里,高雄市小港區桂林里28鄰桂仁街1號,"22.582808,120.355185",1,719.0,
一般建築,XG2670,二苓里,高雄市小港區二苓里漢民路188巷1弄29號,"22.56542,120.352019",1,720.0,
工廠,XG0765,鳳鳴里,高雄市小港區鳳鳴里1鄰中利街8號,"22.522791,120.363189",1,720.0,
一般建築,XG2798,桂林里,高雄市小港區桂林里1鄰桂忠街63號,"22.583957,120.35809",1,724.0,
一般建築,XG2532,大苓里,高雄市小港區大苓里民益路64巷10號,"22.567916,120.348412",1,730.0,
交通設施,XG2807,山東里,高雄市小港區山東里鄰山東里中山四路2號,"22.569794,120.346789",1,733.0,
工廠,XG2055,小港里,高雄市小港區小港里1鄰台機路1號,"22.561364,120.348169",1,735.0,
一般建築,XG0724,山明里,高雄市小港區山明里11鄰華山路79號,"22.565151,120.36864",1,735.0,
一般建築,XG2913,正苓里,高雄市小港區正苓里永順街168號,"22.569241,120.352695667345",1.2.3.4,735.0,
一般建築,XG2914,正苓里,高雄市小港區正苓里永順街168號,"22.56921349893045, 120.352685208595",1,735.0,
一般建築,XG2915,正苓里,高雄市小港區正苓里永順街168號,"22.569180217555026, 120.35275511429464",1,735.0,
一般建築,XG2916,正苓里,高雄市小港區正苓里永順街168號,"22.569261741574465, 120.35258737239378",1,735.0,
一般建築,XG2684,山東里,高雄市小港區山東里民治路32號,"22.570694,120.349924",1,736.0,
一般建築,XG2685,鳳宮里,高雄市小港區鳳宮里店北路61之1號,"22.560341,120.352169",1,745.0,
一般建築,XG2658,大苓里,高雄市小港區大苓里民益路133巷27號,"22.568536,120.347724",1,750.0,
一般建築,XG2708,店鎮里,高雄市小港區店鎮里店陽街33號,"22.561525,120.355969",1,752.0,
一般建築,XG2747,中厝里,高雄市小港區中厝里20鄰德仁路87號,"22.584437,120.349449",1,766.0,
一般建築,XG1838,正苓里,高雄市小港區正苓里漢民路292號,"22.566673,120.353931",1,771.0,
