類別,建築物名稱,電腦編號,村里別,地址,緯經度,地下樓層數,可容納人數,備註
一般建築,,QJ0624,文東里,高雄市前金區文東里仁義街281號,"22.621794,120.300408",1.2,662,
一般建築,,QJ0198,東金里,高雄市前金區東金里文武一街18號,"22.62995,120.294912",1,665,
一般建築,,QJ0549,復元里,高雄市前金區復元里中華三路77之1號,"22.627085,120.296477",1.2,666,
旅館,,XX0188,中東里,高雄市新興區中東里六合一路92號,"22.632708,120.308496",1.2,671,
一般建築,,QJ0217,社西里,高雄市前金區社西里民生二路227號,"22.623529,120.291192",1,675,
辦公室,,XX1247,黎明里,高雄市新興區黎明里六合一路158號,"22.633129,120.303209",1.2,675,
一般建築,,QJ0614,新生里,高雄市前金區新生里七賢二路366號,"22.631435,120.289779",1.2,676,
一般建築,,QJ0199,東金里,高雄市前金區東金里七賢二路203號,"22.632375,120.293983",1,678,
一般建築,,XX1069,大明里,高雄市新興區大明里自立二路4號,"22.628969,120.299944",1,680,
一般建築,,QJ0297,長生里,高雄市前金區長生里五福三路50號,"22.622185,120.297563",1,680,
一般建築,,XX0257,振成里,高雄市新興區振成里文化路53號,"22.623327,120.304696",1,680,
辦公室,,XX0607,文昌里,高雄市新興區文昌里中正二路192號,"22.630728,120.316153",1,683,
一般建築,,QJ0018,長城里,高雄市前金區長城里新盛一街9號,"22.63027735,120.296477899769",1.2,684,
辦公室,,QJ0361,草江里,高雄市前金區草江里七賢二路189號,"22.632988,120.295911",1,685,
一般建築,,QJ0413,青山里,高雄市前金區青山里新盛二街73號,"22.628442,120.297102",1,686,
一般建築,,QJ0544,文西里,高雄市前金區文西里中華四路293號,"22.619862,120.299289",1,697,
一般建築,,XX0502,德生里,高雄市新興區德生里民生一路23號,"22.628076,120.313025",1,698,
一般建築,,XX1000,文昌里,高雄市新興區文昌里中正二路220號,"22.630714,120.315122",1,699,
旅館,,QJ0692,東金里,高雄市前金區東金里六合二路161號,"22.630428,120.294787",1.2.3,699,
辦公室,,QJ0629,草江里,高雄市前金區草江里新盛一街57號,"22.631921,120.295807",1.2,699,
一般建築,,QJ0435,長城里,高雄市前金區長城里自立二路89號,"22.631374,120.298698",1,700,
一般建築,,QJ0393,國民里,高雄市前金區國民里民生二路163號,"22.624199,120.293244",1,702,
一般建築,,XX1463,振成里,高雄市新興區振成里林森一路41號,"22.623968,120.304993",1.2.3.4,708,
醫院照護,,QJ0662,長城里,高雄市前金區長城里中正四路100號,"22.630474,120.298292",1,709,
一般建築,,QJ0178,新生里,高雄市前金區新生里市中一路272號,"22.632289,120.288921",1,712,
一般建築,,XX0425,南港里,高雄市新興區南港里八德一路194號,"22.635742,120.308181",1,714,
旅館,,XX1279,光耀里,高雄市新興區光耀里民族二路35號,"22.62980119,120.312920396182",1.2,715,
一般建築,,QJ0276,長城里,高雄市前金區長城里中華三路232號,"22.633956,120.294354",1.2,715,
辦公室,,XX0792,南港里,高雄市新興區南港里七賢一路430號,"22.634557,120.305564",1,718,
一般建築,,XX0242,文昌里,高雄市新興區文昌里中正二路218號,"22.630769,120.315423",1,720,
一般建築,,QJ0433,新生里,高雄市前金區新生里自強一路139巷11號,"22.632221,120.291824",1,723,
一般建築,,QJ0204,青山里,高雄市前金區青山里新盛二街83號,"22.628603,120.297055",1,725,
一般建築,,QJ0565,復元里,高雄市前金區復元里福音街104之2號,"22.62637379,120.295251996182",1.2,726,
一般建築,,QJ0685,民生里,高雄市前金區民生里中華三路103號,"22.628412,120.295991",1.2.3,727,
一般建築,,QJ0577,青山里,高雄市前金區青山里自立橫路75號,"22.62909,120.298714",1,736,
一般建築,,QJ0283,青山里,高雄市前金區青山里中華三路98號,"22.628312,120.296559",1,737,
一般建築,,QJ0698,新生里,高雄市前金區新生里七賢二路397號,"22.630355,120.287997",1.2.3,737,
一般建築,,QJ0670,新生里,高雄市前金區新生里七賢二路288號,"22.631985,120.291702",1.2.3,738,
辦公室,,XX1313,德望里,高雄市新興區德望里民生一路206號,"22.627866,120.308245",1.2.3.4,738,
一般建築,,QJ0215,博孝里,高雄市前金區博孝里河東路2號,"22.621146,120.291123",1,744,
一般建築,,XX0721,新江里,高雄市新興區新江里八德一路330號,"22.636023,120.304329",1,745,
一般建築,,XX1227,興昌里,高雄市新興區興昌里民族二路97號,"22.632484,120.313018",1.2,746,
辦公室,,QJ0626,博孝里,高雄市前金區博孝里河東路10號,"22.621932,120.291107",1.2.3,750,
一般建築,,QJ0277,文東里,高雄市前金區文東里中山二路533號,"22.620659,120.301548",1,754,
辦公室,,XX1452,浩然里,高雄市新興區浩然里復興二路286號,"22.623833,120.309111",1,754,
一般建築,,XX0833,德政里,高雄市新興區德政里球庭路7之1號,"22.630047,120.306923",1,754,
一般建築,,XX0238,永寧里,高雄市新興區永寧里五福二路146號,"22.625214,120.30667",1,765,
一般建築,,QJ0610,長城里,高雄市前金區長城里中正四路118號,"22.630233,120.297647",1,770,
一般建築,,XX1508,浩然里,高雄市新興區浩然里復興二路161號之1,"22.62477129,120.308380796182",1.2.3,772,
一般建築,,XX0355,德望里,高雄市新興區德望里復興一路42號,"22.630026,120.308392",1,772,
商場,,QJ0554,東金里,高雄市前金區東金里六合二路160號,"22.630779,120.294652",1.2,778,
一般建築,,XX1475,振華里,高雄市新興區振華里民享街109號,"22.621604,120.304522",1.2,785,
一般建築,,QJ0663,復元里,高雄市前金區復元里文武二街138號,"22.626705,120.296221",1.2,786,
一般建築,,QJ0606,民生里,高雄市前金區民生里大同二路20號,"22.627314,120.295562",1.2,792,
一般建築,,XX0243,文昌里,高雄市新興區文昌里和平一路215之4號,"22.631354,120.317179",1,793,
一般建築,,XX1305,德生里,高雄市新興區德生里五福一路106號,"22.627445,120.313174",1.2,793,
一般建築,,XX1120,浩然里,高雄市新興區浩然里林森一路10之1號,"22.624061,120.305271",1,794,
辦公室,,XX1428,黎明里,高雄市新興區黎明里七賢一路467之1號,"22.63417,120.304225",1,794,
政府機關,,QJ0458,民生里,高雄市前金區民生里中正四路191號,"22.628599,120.294289",1,798,
一般建築,,XX1013,愛平里,高雄市新興區愛平里中正三路156號,"22.631481,120.304379",1,800,
一般建築,,XX1338,開平里,高雄市新興區開平里河南一路19號,"22.636583,120.310226",1,801,
一般建築,,XX0527,德望里,高雄市新興區德望里中正三路45號,"22.630588,120.308795",1.2,805,
醫院照護,,XX1468,南港里,高雄市新興區南港里七賢一路420號,"22.634512,120.306079",1,813,
一般建築,,XX0603,秋山里,高雄市新興區秋山里七賢二路25號,"22.634481,120.300856",1,813,
一般建築,,XX1189,光耀里,高雄市新興區光耀里復橫一路31號,"22.628976,120.311919",1,816,
一般建築,,XX1528,順昌里,高雄市新興區順昌里七賢一路121號,"22.63360709,120.314088196183",1.2.3.4.5.6.7,820,
一般建築,,XX1497,南港里,高雄市新興區南港里林森一路252號,"22.635369,120.305148",1.2.3,823,
一般建築,,XX0201,興昌里,高雄市新興區興昌里七賢一路225號,"22.63370169,120.310362667346",1.2,826,
一般建築,,QJ0701,林投里,高雄市前金區林投里成功一路412號,"22.62732,120.292716",1.2.3.4,3321,
一般建築,,QJ0675,社東里,高雄市前金區社東里自強二路51號,"22.623415,120.295872",1.2.3,837,
一般建築,,QJ0680,長生里,高雄市前金區長生里長生街8號,"22.622751,120.29709",1.2.3.4.5,841,
一般建築,,XX0152,玉衡里,高雄市新興區玉衡里文橫一路17號,"22.624728,120.302831",1,848,
一般建築,,XX1210,玉衡里,高雄市新興區玉衡里玉竹二街14號,"22.624573,120.302578",1,849,
辦公室,,QJ0225,林投里,高雄市前金區林投里自強二路169號,"22.627535,120.294278",1,855,
一般建築,,XX0875,光耀里,高雄市新興區光耀里民生一路22號,"22.628443,120.311997",1,861,
旅館,,XX1489,新江里,高雄市新興區新江里中山一路280號,"22.635427,120.302646",1.2.3.4,862,
一般建築,,XX1529,文昌里,高雄市新興區文昌里中正二路196號,"22.630742,120.315856",1.2.3.4.5.6,872,
一般建築,,QJ0601,北金里,高雄市前金區北金里八德二路196號,"22.634467,120.293486",1.2,872,
商場,,QJ0586,青山里,高雄市前金區青山里中正四路151號,"22.629169,120.296396",1.2.3,873,
辦公室,,QJ0224,後金里,高雄市前金區後金里中正四路226號,"22.629079,120.292734",1,877,
學校,,QJ0184,博孝里,高雄市前金區博孝里五福三路122號,"22.62192103838953, 120.29412097973614",1,879,
政府機關,,QJ0559,後金里,高雄市前金區後金里中正四路260號,"22.627922,120.290643",1,884,
一般建築,,XX0914,南港里,高雄市新興區南港里南華橫二路33號,"22.634889,120.306629",1,889,
旅館,,QJ0114,新生里,高雄市前金區新生里七賢二路394號,"22.631015,120.288664",1,890,
辦公室,,XX1377,建華里,高雄市新興區建華里七賢二路110號,"22.634181,120.298002",1.2.3,892,
一般建築,,QJ0681,新生里,高雄市前金區新生里自強一路83巷21號,"22.631504,120.292219",1.2.3,893,
一般建築,,QJ0689,新生里,高雄市前金區新生里旺盛街46號,"22.631436,120.292467",1.2.3,893,
商場,,XX1431,文昌里,高雄市新興區文昌里中正二路222號,"22.630821,120.314925",1.2.3,894,
一般建築,,XX0757,建華里,高雄市新興區建華里中山一路263號,"22.635408,120.301911",1,894,
一般建築,,QJ0175,東金里,高雄市前金區東金里自強一路54號,"22.630638,120.293439",1,895,
一般建築,,XX1321,光耀里,高雄市新興區光耀里錦田路20號,"22.628561,120.310306",1.2,907,
一般建築,,XX0782,建華里,高雄市新興區建華里七賢二路74號,"22.634602,120.299338",1,908,
一般建築,,QJ0581,北金里,高雄市前金區北金里八德二路212號,"22.634174,120.292593",1,910,
一般建築,,XX1274,建華里,高雄市新興區建華里同愛街28號,"22.635456,120.300648",1.2.3.4.5,912,
一般建築,,XX0794,秋山里,高雄市新興區秋山里明星街5號,"22.633949,120.300939",1,913,
一般建築,,XX0501,德生里,高雄市新興區德生里民生一路99號,"22.627482,120.311601",1,914,
學校,,QJ0036,博孝里,高雄市前金區博孝里五福三路122號,"22.621376350712243, 120.29253311196503",1,916,
一般建築,,QJ0706,青山里,高雄市前金區青山里大同一路270號,"22.62796,120.297203",1.2.3.4.5,7531,
一般建築,,XX0469,新江里,高雄市新興區新江里七賢一路480號,"22.634677,120.304089",1,918,
一般建築,,QJ0665,新生里,高雄市前金區新生里七賢二路289號,"22.631409,120.29118",1.2.3.4,923,
一般建築,,XX1111,振華里,高雄市新興區振華里新田路99號,"22.622634,120.305184",1,932,
旅館,,XX0229,秋山里,高雄市新興區秋山里民主路16號,"22.633378,120.300248",1.2,935,
一般建築,,QJ0646,復元里,高雄市前金區復元里中華三路65號,"22.625409,120.297155",1.2.3,935,
一般建築,,QJ0307,草江里,高雄市前金區草江里中華三路156號,"22.631485,120.295272",1,937,
一般建築,,QJ0336,復元里,高雄市前金區復元里中華三路67號,"22.626408,120.296705",1,938,
一般建築,,QJ0300,青山里,高雄市前金區青山里中正四路87號,"22.630019,120.298638",1.2,940,
一般建築,,XX0549,永寧里,高雄市新興區永寧里五福二路196號,"22.624775,120.305379",1,943,
一般建築,,XX1370,黎明里,高雄市新興區黎明里南華橫一路11號,"22.633565,120.304242",1,943,
辦公室,,XX1339,順昌里,高雄市新興區順昌里七賢一路18號,"22.63389740785929, 120.31580722088735",1,944,
一般建築,,XX0354,仁聲里,高雄市新興區仁聲里復興一路49號,"22.629916,120.307875",1,946,
一般建築,,XX1455,仁聲里,高雄市新興區仁聲里中正三路69號,"22.630776,120.307677",1.2.3,956,
商場,,XX1260,文昌里,高雄市新興區文昌里和平一路199號,"22.631057,120.317385",1.2,957,
一般建築,,QJ0570,北金里,高雄市前金區北金里河南二路123號,"22.634426,120.293051",1,961,
一般建築,,QJ0536,榮復里,高雄市前金區榮復里五福三路79號,"22.621176,120.296235",1.2,964,
政府機關,,XX1418,東坡里,高雄市新興區東坡里中山一路100號,"22.630659,120.302207",1.2,965,
一般建築,,XX1532,仁聲里,高雄市新興區仁聲里仁愛一街86號,"22.630254432726503, 120.30735736541715",1.2,967,
商場,,XX1408,浩然里,高雄市新興區浩然里五福二路65號,"22.624527,120.305982",1,978,
一般建築,,XX0323,光耀里,高雄市新興區光耀里黃海街36號,"22.629619,120.312558",1,979,
辦公室,,QJ0354,榮復里,高雄市前金區榮復里五福三路87號,"22.621067,120.29584",1.2,981,
一般建築,,XX1122,振華里,高雄市新興區振華里新田路103號,"22.622616,120.305107",1,992,
一般建築,,XX1256,浩然里,高雄市新興區浩然里五福二路49號,"22.624886,120.306952",1.2,996,
商場,,XX1365,開平里,高雄市新興區開平里七賢一路216號,"22.634253,120.310772",1.2.3,996,
一般建築,,QJ0590,榮復里,高雄市前金區榮復里五福三路63號,"22.621386,120.296626",1.2.3,998,
一般建築,,XX1484,建華里,高雄市新興區建華里八德二路70號,"22.635992,120.298548",1.2.3,999,
辦公室,,QJ0571,青山里,高雄市前金區青山里中華三路108號,"22.628926,120.296336",1.2,1005,
一般建築,,XX1372,浩然里,高雄市新興區浩然里復興二路171號,"22.625022,120.308287",1.2,1005,
一般建築,,XX1477,永寧里,高雄市新興區永寧里五福二路136號,"22.625304,120.306918",1.2.3.4.5,1020,
辦公室,,XX0817,永寧里,高雄市新興區永寧里五福二路200號,"22.624693,120.305122",1,1029,
一般建築,,XX1156,仁聲里,高雄市新興區仁聲里復興一路47之1號,"22.629788,120.307866",1,1030,
一般建築,,XX0852,開平里,高雄市新興區開平里開封路449號,"22.636256,120.311952",1,1030,
一般建築,,XX1511,玉衡里,高雄市新興區玉衡里民生一路345號之1,"22.62697689,120.303681367346",1.2.3,1038,
商場,,QJ0569,長城里,高雄市前金區長城里六合二路107之1號,"22.631488,120.297861",1.2.3,1038,
一般建築,,QJ0282,新生里,高雄市前金區新生里七賢二路426號,"22.630749,120.287764",1,1041,
商場,,XX1304,德生里,高雄市新興區德生里民生一路111號,"22.627455,120.311206",1.2,1045,
一般建築,,XX1514,秋山里,高雄市新興區秋山里七賢二路57號,"22.634371,120.299957",1.2.3.4.5,1046,
一般建築,,QJ0537,長城里,高雄市前金區長城里河南二路106號,"22.634806,120.294432",1,1047,
一般建築,,XX1503,明莊里,高雄市新興區明莊里自立二路86號,"22.631347,120.299",1.2.3.4.5,1049,
一般建築,,XX0445,大明里,高雄市新興區大明里中正四路53號,"22.630496,120.300034",1,1059,
商場,,XX0472,仁聲里,高雄市新興區仁聲里復興一路19號,"22.628796,120.307809",1,1064,
一般建築,,XX1373,德望里,高雄市新興區德望里民生一路176號,"22.627943,120.309242",1.2,1064,
一般建築,,XX1449,長驛里,高雄市新興區長驛里民主路59號之1,"22.63275259,120.299152125019",1.2,1067,
一般建築,,QJ0558,新生里,高雄市前金區新生里河南二路174號,"22.633305,120.289807",1,1067,
辦公室,,XX0639,南港里,高雄市新興區南港里忠孝一路456號,"22.634551,120.306492",1.2,1084,
一般建築,,XX1354,文昌里,高雄市新興區文昌里信守街12號,"22.631335,120.316641",1.2,1090,
一般建築,,XX1470,新江里,高雄市新興區新江里七賢一路510號,"22.634688,120.30331",1.2.3.4,1097,
學校,,QJ0346,國民里,高雄市前金區國民里大同二路61號,"22.62600975871684, 120.29338829660557",1,1100,
學校,,QJ0619,林投里,高雄市前金區林投里大同二路76號,"22.626574,120.293344",1,1106,
一般建築,,XX1384,德望里,高雄市新興區德望里達仁街20號,"22.628105,120.308871",1.2,1127,
一般建築,,QJ0222,長生里,高雄市前金區長生里民生二路71號,"22.625205,120.296229",1,1144,
一般建築,,XX0171,中東里,高雄市新興區中東里七賢一路301號,"22.633928,120.308659",1,1147,
一般建築,,QJ0367,長城里,高雄市前金區長城里中山橫路95號,"22.631067,120.298665",1,1148,
體育設施,,QJ0145,新生里,高雄市前金區新生里河南二路196之1號,"22.6320814,120.287103667346",1,1149,
一般建築,,QJ0200,文東里,高雄市前金區文東里五福三路21號,"22.622312,120.299715",1.2,1168,
一般建築,,QJ0654,東金里,高雄市前金區東金里旺盛街28號,"22.631732,120.293319",1.2,1171,
辦公室,,QJ0534,文東里,高雄市前金區文東里中山二路505號,"22.620253,120.30174",1.2,1177,
一般建築,,XX0336,德望里,高雄市新興區德望里復興一路22號,"22.629138,120.308164",1,1182,
一般建築,,QJ0034,青山里,高雄市前金區青山里中正四路99號,"22.629919,120.298226",1.2,1187,
商場,,XX1367,仁聲里,高雄市新興區仁聲里復興一路63號B,"22.630413,120.307907",1.2.3,1190,
一般建築,,QJ0511,草江里,高雄市前金區草江里瑞源路140號,"22.632966,120.296983",1.2,1201,
一般建築,,XX1442,德政里,高雄市新興區德政里忠孝一路262號,"22.630006,120.306102",1,1205,
一般建築,,XX0812,德生里,高雄市新興區德生里五福一街2號之1,"22.62608689,120.308828267346",1,1206,
一般建築,,XX1485,德生里,高雄市新興區德生里復興街22號,"22.626801,120.309173",1.2,1206,
辦公室,,XX1326,德生里,高雄市新興區德生里民生一路247號,"22.627099,120.308115",1.2.3,1214,
一般建築,,QJ0643,榮復里,高雄市前金區榮復里五福三路68號,"22.621817,120.296407",1.2.3,1220,
旅館,,XX1226,秋山里,高雄市新興區秋山里七賢二路11號,"22.634447,120.301419",1.2.3,1221,
一般建築,,XX0874,振成里,高雄市新興區振成里林森一路14號,"22.624945,120.304975",1,1222,
一般建築,,XX0837,黎明里,高雄市新興區黎明里中山一路242號,"22.634208,120.302533",1,1228,
一般建築,,XX1454,成功里,高雄市新興區成功里忠孝一路322號,"22.631808,120.306444",1.2,1249,
宗教設施,,QJ0182,新生里,高雄市前金區新生里七賢二路329號,"22.630994,120.290048",1.2,1253,
辦公室,,XX1300,中東里,高雄市新興區中東里中正三路38號,"22.631115,120.309496",1.2.3,1260,
一般建築,,XX0770,中東里,高雄市新興區中東里七賢一路299號,"22.633897,120.308908",1,1271,
一般建築,,QJ0596,東金里,高雄市前金區東金里自強一路22號,"22.629674,120.293816",1.2,1281,
辦公室,,XX0637,新江里,高雄市新興區新江里中山一路308號,"22.636413,120.302722",1.2,1282,
辦公室,,XX0302,文昌里,高雄市新興區文昌里六合路67號,"22.63177,120.317117",1,1290,
一般建築,,QJ0432,後金里,高雄市前金區後金里中正四路192號,"22.628814,120.293481",1,1293,
一般建築,,XX1121,開平里,高雄市新興區開平里開封路435號,"22.635729,120.311806",1,1319,
辦公室,,QJ0192,東金里,高雄市前金區東金里中正四路168號,"22.629445,120.295244",1.2.3,1323,
辦公室,,QJ0457,復元里,高雄市前金區復元里大同二路23號,"22.627026,120.295638",1.2,1332,
辦公室,,XX1311,黎明里,高雄市新興區黎明里七賢一路469號,"22.634252,120.304049",1.2.3,1347,
一般建築,,XX0335,德望里,高雄市新興區德望里復橫一路156之1號,"22.62948,120.308421",1,1353,
一般建築,,XX1337,建華里,高雄市新興區建華里七賢二路58號,"22.634816,120.299861",1,1355,
一般建築,,XX0681,仁聲里,高雄市新興區仁聲里復興一路51號,"22.630023,120.307879",1,1356,
一般建築,,QJ0630,社東里,高雄市前金區社東里民生二路129號,"22.624887,120.295202",1.2.3.4,1357,
一般建築,,XX1440,德望里,高雄市新興區德望里復興一路10號,"22.628378,120.308126",1.2.3,1358,
一般建築,,XX0103,新江里,高雄市新興區新江里八德一路316號,"22.635981,120.304871",1.2,1362,
商場,,XX0104,新江里,高雄市新興區新江里林森一路267號,"22.636261,120.304878",1.2,1372,
辦公室,,QJ0568,東金里,高雄市前金區東金里中華三路149號,"22.630502,120.295165",1,1413,
學校,,XX0645,浩然里,高雄市新興區浩然里五福二路3號,"22.625236778324307, 120.30877633099703",1,1417,
一般建築,,XX0952,玉衡里,高雄市新興區玉衡里中山一路12之2號,"22.626033,120.301655",1.2,1421,
宗教設施,,XX1140,建華里,高雄市新興區建華里河南二路2號,"22.636561,120.301232",1,1432,
一般建築,,QJ0555,社東里,高雄市前金區社東里五福三路80號,"22.621763,120.296165",1.2,1440,
一般建築,,QJ0651,新生里,高雄市前金區新生里市中一路232號,"22.63045,120.289614",1.2,1443,
一般建築,,XX1533,文昌里,高雄市新興區文昌里中正二路186號,"22.630605648770487, 120.31638524620593",1.2.3,1454,
一般建築,,QJ0688,青山里,高雄市前金區青山里中華三路106號,"22.62876,120.296368",1.2.3,1459,
一般建築,,QJ0522,社東里,高雄市前金區社東里光復二街48號,"22.623747,120.295306",1,1461,
一般建築,,XX1494,成功里,高雄市新興區成功里復興一路89號之1,"22.63194139,120.308115396182",1.2.3,1487,
一般建築,,XX0328,光耀里,高雄市新興區光耀里中正三路5號,"22.630434,120.311047",1,1498,
商場,,QJ0399,草江里,高雄市前金區草江里六合二路132號,"22.631163,120.295862",1,1510,
一般建築,,QJ0314,後金里,高雄市前金區後金里中正四路258號,"22.628143,120.29134",1,1520,
一般建築,,QJ0115,文東里,高雄市前金區文東里中山二路575號,"22.621993,120.301012",1,1548,
一般建築,,XX1095,文昌里,高雄市新興區文昌里中正二路184號,"22.630701,120.316543",1.2,1555,
旅館,,XX1327,玉衡里,高雄市新興區玉衡里中山一路4號,"22.624351,120.30144",1.2.3,1563,
一般建築,,QJ0269,長生里,高雄市前金區長生里光復一街2號,"22.623694,120.297693",1,1583,
旅館,,QJ0142,後金里,高雄市前金區後金里六合二路279號,"22.6292,120.290974",1,1596,
辦公室,,QJ0617,後金里,高雄市前金區後金里成功一路436號,"22.629194,120.292043",1.2.3,1597,
一般建築,,XX0227,德生里,高雄市新興區德生里五福一路142號,"22.627053,120.31204",1,1601,
一般建築,,QJ0644,新生里,高雄市前金區新生里市中一路268號,"22.631875,120.289097",1.2,1604,
一般建築,,,青山里,高雄市前金區青山里中正四路107號,"22.629691,120.297679",1.2,1606,
郵局,,QJ0679,長興里,高雄市前金區長興里六合二路147號,"22.630851,120.296075",1.2.3.4,1607,
一般建築,,XX0114,建華里,高雄市新興區建華里自立一路66之16號,"22.635974,120.297499",1.2,1608,
一般建築,,XX0505,光耀里,高雄市新興區光耀里渤海街16號,"22.63008,120.312479",1,1610,
一般建築,,XX0976,愛平里,高雄市新興區愛平里中正三路158號,"22.631488,120.30423",1.2,1627,
一般建築,,QJ0144,復元里,高雄市前金區復元里民生二路58號,"22.626467,120.297907",1,1639,
一般建築,,QJ0348,青山里,高雄市前金區青山里自立橫路65號,"22.629214,120.299035",1,1642,
學校,,XX0816,浩然里,高雄市新興區浩然里五福二路3號,"22.624949586562405, 120.30895872121397",1,1661,
一般建築,,XX1436,開平里,高雄市新興區開平里興邦路88號,"22.636212,120.310053",1.2,1661,
一般建築,,XX0288,東坡里,高雄市新興區東坡里林森一路163號,"22.630139,120.304424",1,1733,
學校,,QJ0310,後金里,高雄市前金區後金里六合二路278號,"22.629882627003212, 120.29003981011144",1,1736,
學校,,XX1347,興昌里,高雄市新興區興昌里中正三路32號,"22.631232,120.310909",1,1752,
一般建築,,QJ0363,復元里,高雄市前金區復元里中華三路68號,"22.626989,120.297205",1.2,1769,
一般建築,,QJ0493,博孝里,高雄市前金區博孝里河東路8號,"22.621661,120.291167",1.2.3,1775,
一般建築,,XX0143,南港里,高雄市新興區南港里林森一路242號,"22.634943,120.305179",1.2,1793,
辦公室,,QJ0405,草江里,高雄市前金區草江里中華三路148號,"22.631215,120.295407",1.2,1800,
一般建築,,XX1093,中東里,高雄市新興區中東里六合一路98號,"22.632795,120.307687",1.2,1812,
一般建築,,QJ0575,博孝里,高雄市前金區博孝里光復二街167號,"22.621963,120.291756",1.2.3,1815,
學校,,QJ0294,博孝里,高雄市前金區博孝里五福三路122號,"22.620936,120.292738",1,1824,
辦公室,,,順昌里,高雄市新興區順昌里七賢一路18號,"22.634184,120.315854",1.2,1832,
一般建築,,QJ0628,青山里,高雄市前金區青山里中正四路111號,"22.629584,120.297327",1.2.3,1833,
學校,,XX1462,興昌里,高雄市新興區興昌里中正三路32號,"22.63126100523254, 120.31054063285892",1,1835,
一般建築,,XX1350,浩然里,高雄市新興區浩然里林森一路60號,"22.62624419,120.30496533851",1,1841,
辦公室,,XX1422,興昌里,高雄市新興區興昌里民族二路95號,"22.632014,120.312825",1.2.3.4,1845,
商場,,XX1303,明莊里,高雄市新興區明莊里六合二路1號,"22.632742,120.301593",1.2,1859,
辦公室,,XX1047,成功里,高雄市新興區成功里林森一路230號,"22.63382674720717, 120.30513712308989",1,1869,
一般建築,,XX1447,榮治里,高雄市新興區榮治里民生二路36號,"22.627775,120.300338",1.2.3.4.5.6.7,1870,
一般建築,,XX1155,德生里,高雄市新興區德生里德順街17號,"22.627051,120.309687",1.2,1887,
一般建築,,XX1275,浩然里,高雄市新興區浩然里復興二路260號,"22.622781,120.309588",1.2,1892,
一般建築,,XX0570,中東里,高雄市新興區中東里七賢一路321號,"22.634015,120.307813",1,1897,
辦公室,,XX1176,中東里,高雄市新興區中東里中正三路34號,"22.631027,120.310097",1,1916,
