類別,建築物名稱,電腦編號,村里別,地址,緯經度,地下樓層數,可容納人數,備註
辦公室,,QJ0146,文西里,高雄市前金區文西里五福三路61號,"22.621452,120.297067",1.2,1942,
一般建築,,XX0451,南港里,高雄市新興區南港里七賢一路398號,"22.634463,120.306861",1.2,1942,
一般建築,,XX1343,德生里,高雄市新興區德生里民權一路251號地下室,"22.627063,120.310169",1.2.3.4,1946,
一般建築,,XX0349,南港里,高雄市新興區南港里仁愛一街291巷8號,"22.634708,120.307231",1,1994,
一般建築,,XX1315,大明里,高雄市新興區大明里大同一路188號,"22.629027,120.300687",1.2.3,2062,
商場,,XX1381,東坡里,高雄市新興區東坡里林森一路165號,"22.630565,120.30425",1.2.3,2103,
辦公室,,XX0906,興昌里,高雄市新興區興昌里中正三路2號,"22.630956,120.312712",1.2.3,2116,
辦公室,,QJ0370,新生里,高雄市前金區新生里河南二路196號,"22.632247,120.287426",1,2192,
一般建築,,XX0057,東坡里,高雄市新興區東坡里中正三路179號,"22.630897,120.303154",1,2216,
一般建築,,QJ0567,社東里,高雄市前金區社東里民生二路139號,"22.624647,120.294663",1.2,2222,
一般建築,,XX0949,中東里,高雄市新興區中東里六合一路55號,"22.632427,120.308713",1,2233,
一般建築,,QJ0312,青山里,高雄市前金區青山里瑞源路31之1號,"22.628944,120.29821",1,2233,
學校,,QJ0482,後金里,高雄市前金區後金里六合二路278號,"22.62936,120.290459",1,2245,
辦公室,,QJ0658,後金里,高雄市前金區後金里成功一路428號,"22.628678,120.292312",1.2,2250,
一般建築,,XX1182,振華里,高雄市新興區振華里新田路71號,"22.62303989,120.306310796182",1.2,2256,
辦公室,,QJ0631,新生里,高雄市前金區新生里河南二路167號,"22.633375,120.290544",1.2.3,2271,
一般建築,,XX1402,德望里,高雄市新興區德望里中正三路55號之1,"22.63073669,120.308326467346",1.2.3.4,2334,
一般建築,,QJ0465,林投里,高雄市前金區林投里中正四路259號,"22.627247,120.2903",1.2,2369,
一般建築,,QJ0640,新生里,高雄市前金區新生里河南二路150號,"22.63381,120.291338",1.2,2371,
一般建築,,XX1414,開平里,高雄市新興區開平里七賢一路302號,"22.63448,120.308717",1.2.3.4,2390,
一般建築,,XX1248,順昌里,高雄市新興區順昌里七賢一路20號,"22.634039,120.315528",1.2,2405,
一般建築,,XX1005,開平里,高雄市新興區開平里七賢一路300號之1,"22.634445,120.309022",1,2411,
學校,,XX1027,榮治里,高雄市新興區榮治里大同一路231號,"22.627951,120.298454",1,2471,
一般建築,,QJ0504,新生里,高雄市前金區新生里七賢二路396號,"22.630821,120.287985",1.2,2498,
一般建築,,QJ0641,新生里,高雄市前金區新生里鼎盛街88號,"22.632408,120.289724",1.2,2504,
一般建築,,QJ0655,長城里,高雄市前金區長城里新盛一街28號,"22.630707,120.296505",1.2.3,2518,
辦公室,,XX0903,中東里,高雄市新興區中東里七賢一路249號,"22.633842,120.309702",1.2,2522,
一般建築,,XX1391,振成里,高雄市新興區振成里新田路100號,"22.622802,120.304875",1.2,2541,
學校,,XX1330,玉衡里,高雄市新興區玉衡里五福二路218號,"22.624607356392044, 120.30359671567332",1,2615,
一般建築,,QJ0652,長生里,高雄市前金區長生里自強二路50巷12號,"22.623532,120.296544",1.2.3,2640,
辦公室,,XX1334,光耀里,高雄市新興區光耀里民生一路54號,"22.628094,120.310603",1.2.3,2690,
一般建築,,XX1028,東坡里,高雄市新興區東坡里中正三路177號,"22.63088,120.303486",1,2712,
商場,,QJ0609,國民里,高雄市前金區國民里河東路176號,"22.624845,120.290226",1.2.3,2752,
一般建築,,XX1469,開平里,高雄市新興區開平里同心路25號,"22.634518,120.312175",1.2.3,2823,
一般建築,,QJ0709,文西里,高雄市前金區文西里光明街2號,"22.621279,120.297907",1.2.3.4,2828,
一般建築,,XX1530,南港里,高雄市新興區南港里八德一路210號,"22.635731,120.307818",1.2.3,2868,
一般建築,,XX1487,文昌里,高雄市新興區文昌里民族二路72號,"22.632757,120.31391",1.2.3.4.5.6,2879,
商場,,XX1458,玉衡里,高雄市新興區玉衡里五福二路262號,"22.623557,120.301689",1.2,2879,
學校,,XX1441,浩然里,高雄市新興區浩然里五福二路3號,"22.625236778324307, 120.30958099371885",1,2895,
學校,,XX1426,玉衡里,高雄市新興區玉衡里五福二路218號,"22.62469649,120.303897125019",1,3120,
一般建築,,QJ0660,國民里,高雄市前金區國民里民生二路200號,"22.624471,120.291555",1.2.3.4.5,3177,
學校,,QJ0574,國民里,高雄市前金區國民里大同二路61號,"22.626227626704047, 120.29389255191123",1,3209,
一般建築,,XX1444,文昌里,高雄市新興區文昌里民族二路38號,"22.631699,120.313674",1.2.3.4.5,3293,
一般建築,,QJ0711,長生里,高雄市前金區長生里光復三街39號,"22.624447650660898, 120.29621124567886",1.2.3.4,3433,
商場,,QJ0653,文西里,高雄市前金區文西里五福三路57號,"22.621649,120.298278",1.2.3.4.5,3439,
一般建築,,XX1448,德生里,高雄市新興區德生里五福一路140號,"22.627108,120.312406",1.2.3.4.5,3537,
商場,,QJ0027,國民里,高雄市前金區國民里大同二路145號十之6,"22.62522319,120.290172696182",1.2,3549,
一般建築,,XX1393,德生里,高雄市新興區德生里復興二路316號,"22.625836,120.308307",1.2.3,3585,
商場,,QJ0334,文西里,高雄市前金區文西里五福三路59號,"22.621617,120.297619",1.2.3,3592,
一般建築,,QJ0707,新生里,高雄市前金區新生里旺盛街126號,"22.630721,120.290443",1.2.3,3701,
一般建築,,XX1459,愛平里,高雄市新興區愛平里興華路67號,"22.632051,120.303597",1.2,3732,
辦公室,,QJ0605,林投里,高雄市前金區林投里中正四路215號,"22.628062,120.292762",1.2.3.4,3734,
一般建築,,QJ0510,林投里,高雄市前金區林投里中正四路235號,"22.628062,120.292762",1.2.3.4,3779,
一般建築,,QJ0637,青山里,高雄市前金區青山里新盛二街86號,"22.629061,120.297127",1.2.3,3792,
旅館,,XX1410,中東里,高雄市新興區中東里七賢一路311號,"22.633944,120.308092",1.2.3.4.5,3984,
一般建築,,XX0439,中東里,高雄市新興區中東里六合一路96巷18號,"22.633338,120.307975",1,4095,
一般建築,,QJ0710,民生里,高雄市前金區民生里中正四路169號,"22.628924913051424, 120.29527677312788",1.2.3.4,4238,
商場,,XX1435,開平里,高雄市新興區開平里洛陽街66號,"22.634419,120.309379",1.2.3.4,4245,
一般建築,,XX1407,開平里,高雄市新興區開平里錦田路113號,"22.634468,120.310436",1,4294,
辦公室,,XX0329,成功里,高雄市新興區成功里林森一路230號,"22.633914,120.305226",1,4450,
辦公室,,XX1430,德望里,高雄市新興區德望里中正三路25號,"22.630502,120.309897",1.2.3.4,4616,
一般建築,,QJ0607,新生里,高雄市前金區新生里河南二路158號,"22.633725,120.291071",1.2,5487,
辦公室,,QJ0635,林投里,高雄市前金區林投里前金二街30號,"22.627642,120.293492",1,5731,
旅館,,QJ0206,國民里,高雄市前金區國民里民生二路202號,"22.624213,120.290678",1.2.3,14504,
一般建築,,XX1527,漢民里,高雄市新興區漢民里民生一路362號,"22.627689,120.303095",1.2.3.4.5,6464,
一般建築,,QJ0531,復元里,高雄市前金區復元里中華三路68號,"22.62700861656165, 120.29747104689012",1.2,6735,
辦公室,,QJ0533,林投里,高雄市前金區林投里河東路188號,"22.626196,120.289519",1.2,9883,
商場,,QJ0597,榮復里,高雄市前金區榮復里成功一路266號,"22.619333,120.296032",1.2.3.4.5.6.7,10051,
一般建築,,QJ0712,三川里,高雄市前金區三川里七賢二路148號,"22.633818428349613, 120.2971654723852",1.2.3.4.5.6,10460,
一般建築,,QJ0713,草江里,高雄市前金區草江里瑞源路101號,"22.631575606558624, 120.29723293984028",1.2.3.4.5.6,13720,
一般建築,,LY0601,林中里,高雄市苓雅區林中里五權街200號,"22.620481,120.319506",1,27,
一般建築,,,苓雅里,高雄市苓雅區苓雅里四維四路172之8號,"22.614871,120.296379",1,34,
一般建築,,LY3864,正大里,高雄市苓雅區正大里中正一路258號,"22.629445,120.328838",1,75,
一般建築,,LY3936,同慶里,高雄市苓雅區同慶里凱旋二路75號,"22.624365,120.323635",1,80,
一般建築,,LY3430,林中里,高雄市苓雅區林中里光華一路146號,"22.62141,120.316768",1,85,
一般建築,,LY3915,正大里,高雄市苓雅區正大里正言路46之1號,"22.630451,120.330033",2,89,
一般建築,,LY3923,林西里,高雄市苓雅區林西里五權街133之2號,"22.620138,120.319107",1,89,
一般建築,,LY3792,晴朗里,高雄市苓雅區晴朗里苓雅一路252號,"22.62115,120.310357",1,92,
一般建築,,,苓雅里,高雄市苓雅區苓雅里苓雅二路235號,"22.615918,120.295457",1,100,
一般建築,,LY3476,林富里,高雄市苓雅區林富里福建街194號,"22.621825,120.315634",1,106,
一般建築,,LY2075,永康里,高雄市苓雅區永康里四維一路78號,"22.626162,120.330232",1,109,
一般建築,,LY3474,同慶里,高雄市苓雅區同慶里同慶路90號,"22.627435,120.320393",1,111,
一般建築,,LY2137,林貴里,高雄市苓雅區林貴里和平二路324號,"22.615891,120.322802",1,113,
一般建築,,LY3911,華堂里,高雄市苓雅區華堂里苓雅一路317號,"22.619824,120.307175",1,113,
一般建築,,LY3624,晴朗里,高雄市苓雅區晴朗里苓雅一路195號,"22.620941,120.3108",1,114,
一般建築,,LY1258,鼓中里,高雄市苓雅區鼓中里苓雅二路85之5號,"22.617349,120.299711",1,115,
一般建築,,LY3935,五福里,高雄市苓雅區五福里憲政路2號,"22.634634,120.328154",1,116,
一般建築,,LY4037,林中里,高雄市苓雅區林中里光華一路100巷13號,"22.620754,120.317421",1,118,
一般建築,,LY3102,林圍里,高雄市苓雅區林圍里青年一路98號,"22.623749,120.312304",1,124,
一般建築,,LY2412,美田里,高雄市苓雅區美田里林森二路73號,"22.620571,120.306263",1,124,
一般建築,,LY3879,民主里,高雄市苓雅區民主里憲昌路41號,"22.636894,120.32415",1,131,
一般建築,,LY3777,正義里,高雄市苓雅區正義里正義路1號,"22.62782,120.337773",1,135,
一般建築,,LY3954,建軍里,高雄市苓雅區建軍里義勇路55號,"22.632829,120.341274",1,135,
一般建築,,LY4036,日中里,高雄市苓雅區日中里永樂街91號,"22.615993,120.308629",1,137,
郵局,,LY1047,城北里,高雄市苓雅區城北里成功一路134號,"22.614661,120.297712",1,137,
一般建築,,LY3959,林中里,高雄市苓雅區林中里廣東一街35號,"22.620674,120.319941",1,138,
一般建築,,LY3827,美田里,高雄市苓雅區美田里中興街127號,"22.619969,120.30501",1,147,
一般建築,,LY3740,林泉里,高雄市苓雅區林泉里四維二路94之21號,"22.622677,120.319438",1,148,
一般建築,,LY1730,晴朗里,高雄市苓雅區晴朗里永定街155號,"22.621514,120.310552",1,148,
一般建築,,LY4029,同慶里,高雄市苓雅區同慶里凱旋二路55號,"22.624103,120.323729",1,149,
一般建築,,LY3575,尚義里,高雄市苓雅區尚義里民族二路2號,"22.629877,120.313565",1,149,
一般建築,,LY3958,林安里,高雄市苓雅區林安里金門街88號,"22.62655,120.312665",1,149,
一般建築,,LY3288,林富里,高雄市苓雅區林富里福建街207之1號,"22.62177,120.315396",1,150,
一般建築,,LY1627,苓昇里,高雄市苓雅區苓昇里青年二路149號,"22.617671,120.295644",1,152,
一般建築,,LY3760,正道里,高雄市苓雅區正道里福德一路56號,"22.634426,120.33461",1,153,
一般建築,,LY2588,凱旋里,高雄市苓雅區凱旋里凱旋二路131號,"22.629083,120.321821",1,153,
一般建築,,LY2788,正文里,高雄市苓雅區正文里武廟路122號,"22.631079,120.328796",1,154,
一般建築,,LY3818,福西里,高雄市苓雅區福西里福西街64號,"22.624625,120.331742",2,155,
一般建築,,LY3770,民主里,高雄市苓雅區民主里憲法路8之4號,"22.636887,120.322971",1,158,
一般建築,,LY3759,林富里,高雄市苓雅區林富里光華一路131號,"22.621834,120.316165",1,158,
一般建築,,LY3862,福祥里,高雄市苓雅區福祥里河南路46號,"22.625121,120.32937",1,159,
一般建築,,LY3246,華堂里,高雄市苓雅區華堂里興中一路349號,"22.616429,120.307063",1,160,
一般建築,,LY3993,正大里,高雄市苓雅區正大里心正路28號,"22.629868,120.331021",1,164,
一般建築,,LY1513,林安里,高雄市苓雅區林安里金門街53號,"22.625945,120.312665",1,166,
一般建築,,LY2821,中正里,高雄市苓雅區中正里青年一路1之18號,"22.624323,120.315766",1,167,
一般建築,,LY3887,正言里,高雄市苓雅區正言里正言路39號,"22.630469,120.329739",1,167,
一般建築,,LY3987,永康里,高雄市苓雅區永康里福安路21號,"22.6251,120.330844",1,169,
一般建築,,LY3765,日中里,高雄市苓雅區日中里永樂街48號,"22.616747,120.309723",1,172,
一般建築,,LY2062,日中里,高雄市苓雅區日中里永樂街64號,"22.616482,120.308885",1,173,
一般建築,,LY3588,林華里,高雄市苓雅區林華里和平二路365號,"22.616918,120.322396",1,173,
一般建築,,LY3933,苓雅里,高雄市苓雅區苓雅里四維四路139號,"22.614467,120.296486",1,174,
一般建築,,LY3776,五權里,高雄市苓雅區五權里河北路228號,"22.631087,120.322345",1,175,
一般建築,,LY4018,林泉里,高雄市苓雅區林泉里四維二路110之5號,"22.621897,120.317192",1,175,
一般建築,,LY1868,中正里,高雄市苓雅區中正里林德街10巷4號,"22.624165,120.316782",1,178,
一般建築,,LY3186,苓東里,高雄市苓雅區苓東里四維四路237號,"22.614298,120.292527",1,180,
一般建築,,LY3656,林西里,高雄市苓雅區林西里五權街117號,"22.620321,120.319594",1,181,
一般建築,,LY3929,福隆里,高雄市苓雅區福隆里漢陽街108號,"22.619147,120.329263",1,181,
一般建築,,LY1991,田西里,高雄市苓雅區田西里中華四路193號,"22.618942,120.299629",1,183,
一般建築,,LY3868,中正里,高雄市苓雅區中正里廣州一街143之6號,"22.625266,120.316528",1,184,
一般建築,,LY3953,正義里,高雄市苓雅區正義里建國一路57號,"22.629487,120.338953",1,188,
一般建築,,LY1122,林西里,高雄市苓雅區林西里五權街113號,"22.620348,120.319655",1,188,
一般建築,,LY2024,中正里,高雄市苓雅區中正里林德街26巷12號,"22.624253,120.316261",1,189,
一般建築,,LY3893,民主里,高雄市苓雅區民主里行信路5號,"22.634315,120.325059",1,191,
一般建築,,LY3810,五福里,高雄市苓雅區五福里福德一路293號,"22.635456,120.330327",1,192,
一般建築,,LY4068,民主里,高雄市苓雅區民主里建國一路348號,"22.633022,120.324404",1,198,
一般建築,,LY2691,中正里,高雄市苓雅區中正里青年一路6號,"22.624921,120.316231",1,199,
醫院照護,,LY4054,鼓中里,高雄市苓雅區鼓中里永昌街49號,"22.615874,120.297726",1,199,
一般建築,,LY3819,五權里,高雄市苓雅區五權里大順三路11巷30號,"22.63137,120.322827",1,200,
一般建築,,LY3869,民主里,高雄市苓雅區民主里樂仁路122之1號,"22.63605,120.32535",1,200,
一般建築,,LY0140,意誠里,高雄市苓雅區意誠里新光路24巷1號,"22.612204,120.303436",1,200,
一般建築,,LY2873,廣澤里,高雄市苓雅區廣澤里三多三路224號,"22.614809,120.306518",1,203,
一般建築,,LY1824,日中里,高雄市苓雅區日中里忠孝二路63號,"22.618223,120.308533",1,204,
一般建築,,LY3847,和煦里,高雄市苓雅區和煦里忠孝二路118號,"22.620723,120.307969",1,205,
一般建築,,LY2456,正大里,高雄市苓雅區正大里輔仁路175號,"22.630645,120.333188",1,209,
一般建築,,LY3992,正心里,高雄市苓雅區正心里正大路79號,"22.632807,120.33393",1,210,
一般建築,,LY3617,苓中里,高雄市苓雅區苓中里四維四路226號,"22.614177,120.293797",1,210,
一般建築,,LY3834,正大里,高雄市苓雅區正大里中正一路256號之B1,"22.6294438,120.328854025019",1,212,
一般建築,,LY2287,正文里,高雄市苓雅區正文里武廟路124號,"22.631087,120.32872",1,212,
一般建築,,LY2176,中正里,高雄市苓雅區中正里廣州一街159號,"22.627285,120.315757",1,213,
一般建築,,LY2916,林泉里,高雄市苓雅區林泉里四維二路96之5號,"22.622503,120.318979",1,215,
一般建築,,LY2863,林泉里,高雄市苓雅區林泉里林泉街15號,"22.623456,120.319902",1,215,
一般建築,,LY2109,普天里,高雄市苓雅區普天里三多二路390號,"22.617782,120.31537",1,216,
一般建築,,LY2968,林中里,高雄市苓雅區林中里五權街230號,"22.620294,120.318893",1,217,
一般建築,,LY2023,中正里,高雄市苓雅區中正里林德街10巷9號,"22.624199,120.316407",1,220,
一般建築,,LY1884,中正里,高雄市苓雅區中正里廣州一街143之1號,"22.624499,120.316805",1,220,
一般建築,,LY1920,林南里,高雄市苓雅區林南里林泉街80巷15號,"22.62332,120.31683",1,220,
一般建築,,LY3741,福南里,高雄市苓雅區福南里福安路470號,"22.628641,120.324479",1,224,
一般建築,,LY3674,林南里,高雄市苓雅區林南里光華一路148之42號,"22.623429,120.316045",1,225,
一般建築,,LY3902,林圍里,高雄市苓雅區林圍里光華一路259號,"22.624915,120.314972",2,225,
一般建築,,LY3490,苓雅里,高雄市苓雅區苓雅里四維四路172之3號,"22.614988,120.296637",1,228,
一般建築,,LY3669,福西里,高雄市苓雅區福西里三多一路94號,"22.62359,120.332666",1,228,
一般建築,,LY3905,民主里,高雄市苓雅區民主里樂仁路118號,"22.635887,120.325308",2,233,
一般建築,,LY2868,林泉里,高雄市苓雅區林泉里林泉街35號,"22.623227,120.319211",1,237,
一般建築,,LY3989,安祥里,高雄市苓雅區安祥里泰豐街40號,"22.631316,120.318701",1,239,
一般建築,,LY1905,華堂里,高雄市苓雅區華堂里忠孝二路85號,"22.619675,120.308104",1,240,
一般建築,,LY2356,林泉里,高雄市苓雅區林泉里廣州一街123號,"22.622404,120.317702",1,241,
一般建築,,LY3670,五權里,高雄市苓雅區五權里河北路219號,"22.630853,120.322607",1,244,
一般建築,,LY2489,尚義里,高雄市苓雅區尚義里尚志街4號,"22.628764,120.315096",1,245,
一般建築,,LY2281,林泉里,高雄市苓雅區林泉里和平一路147之5號,"22.623638,120.320373",1,248,
一般建築,,LY4017,林泉里,高雄市苓雅區林泉里四維二路110之6號,"22.621873,120.317117",1,250,
一般建築,,LY2914,晴朗里,高雄市苓雅區晴朗里永定街133號,"22.620645,120.310834",1,253,
一般建築,,LY2088,苓中里,高雄市苓雅區苓中里永平路42號,"22.614898,120.293468",1,256,
一般建築,,LY2644,尚義里,高雄市苓雅區尚義里中正二路81號,"22.630054,120.317145",1,257,
一般建築,,LY2864,林泉里,高雄市苓雅區林泉里林泉街19號,"22.62341,120.319766",1,257,
一般建築,,LY2865,林泉里,高雄市苓雅區林泉里林泉街23號,"22.623363,120.319623",1,257,
一般建築,,LY2866,林泉里,高雄市苓雅區林泉里林泉街27號,"22.623308,120.319486",1,257,
一般建築,,LY2867,林泉里,高雄市苓雅區林泉里林泉街31號,"22.623273,120.319349",1,257,
一般建築,,LY0611,正言里,高雄市苓雅區正言里中正一路478號,"22.630064,120.32365",1,258,
一般建築,,LY3608,林靖里,高雄市苓雅區林靖里三多二路62號,"22.621628,120.327507",1,260,
一般建築,,LY3916,林榮里,高雄市苓雅區林榮里英義街240號,"22.616492,120.326055",1,261,
一般建築,,LY3883,正文里,高雄市苓雅區正文里建國一路175號,"22.632641,120.326488",1,265,
一般建築,,LY4142,林華里,高雄市苓雅區林華里和平二路369號,"22.617025,120.322446",1,265,
一般建築,,LY3622,苓雅里,高雄市苓雅區苓雅里四維四路174之1號,"22.614844,120.296235",1,266,
一般建築,,LY3922,普天里,高雄市苓雅區普天里福建街32號,"22.619225,120.316669",1,266,
一般建築,,LY3687,華堂里,高雄市苓雅區華堂里四維三路174號,"22.61867,120.307445",1,266,
一般建築,,LY0535,華堂里,高雄市苓雅區華堂里林森二路84號,"22.618912,120.307244",1,266,
一般建築,,LY3769,福東里,高雄市苓雅區福東里武嶺街46號,"22.62177,120.333978",1,266,
一般建築,,LY3971,林中里,高雄市苓雅區林中里五權街240之4號,"22.620077,120.318285",1,267,
一般建築,,LY2455,林泉里,高雄市苓雅區林泉里廣東一街111號,"22.622765,120.319137",1,267,
一般建築,,LY3605,苓雅里,高雄市苓雅區苓雅里四維四路170之7號,"22.615026,120.296743",1,267,
一般建築,,LY4221,普照里,高雄市苓雅區普照里民權一路39巷19號,"22.618015,120.313064",1,267,
一般建築,,LY2557,林中里,高雄市苓雅區林中里五權街244號,"22.620062,120.318139",1,269,
一般建築,,LY3950,福隆里,高雄市苓雅區福隆里福德三路54號,"22.619752,120.328258",1,269,
一般建築,,LY4081,尚義里,高雄市苓雅區尚義里尚志街17號,"22.628278,120.31459",1,270,
一般建築,,LY4157,林安里,高雄市苓雅區林安里金門街93號,"22.626515,120.312449",1,270,
一般建築,,LY1637,城東里,高雄市苓雅區城東里中華四路126號,"22.615168,120.301623",1,271,
一般建築,,LY3900,苓中里,高雄市苓雅區苓中里苓中路203號,"22.615366,120.293193",1,271,
一般建築,,LY1921,尚義里,高雄市苓雅區尚義里中正二路83號,"22.630063,120.317063",1,274,
一般建築,,LY2738,日中里,高雄市苓雅區日中里忠孝二路63之2號,"22.618323,120.308591",1,277,
一般建築,,LY2666,福壽里,高雄市苓雅區福壽里河南路102號,"22.626629,120.327134",1,280,
一般建築,,LY3994,安祥里,高雄市苓雅區安祥里中正二路56巷3號,"22.630659,120.319372",1,281,
一般建築,,LY3780,正文里,高雄市苓雅區正文里建國一路175之3號,"22.632639,120.326295",1,284,
一般建築,,LY3975,安祥里,高雄市苓雅區安祥里中正二路56巷7號,"22.630749,120.319339",1,288,
一般建築,,LY2552,中正里,高雄市苓雅區中正里青年一路1之11號,"22.624506,120.316184",1,289,
一般建築,,LY1915,普照里,高雄市苓雅區普照里永定街2號,"22.616955,120.312575",1,292,
一般建築,,LY3635,林華里,高雄市苓雅區林華里廣東二街76號,"22.617374,120.321205",1,293,
醫院照護,,LY3613,林興里,高雄市苓雅區林興里三多二路353號,"22.618227,120.318057",1,298,
一般建築,,LY4014,仁政里,高雄市苓雅區仁政里仁智街117號,"22.61914,120.303372",1,303,
一般建築,,LY2377,正大里,高雄市苓雅區正大里建民路37號,"22.628523,120.333125",1,305,
一般建築,,LY1870,林興里,高雄市苓雅區林興里三多二路293號,"22.618549,120.319391",1,307,
一般建築,,LY3705,福南里,高雄市苓雅區福南里中正一路255號,"22.629415,120.326047",2,308,
一般建築,,LY2807,林泉里,高雄市苓雅區林泉里廣州一街121號,"22.622273,120.317763",1,309,
一般建築,,LY1914,林安里,高雄市苓雅區林安里民權一路92號,"22.625128,120.311773",1,311,
一般建築,,LY2130,林興里,高雄市苓雅區林興里林西街48巷12號,"22.618272,120.320049",1,313,
一般建築,,LY2917,林德里,高雄市苓雅區林德里英明路300號,"22.622204,120.322922",1,320,
一般建築,,LY3116,林富里,高雄市苓雅區林富里苓雅一路35號,"22.622267,120.314522",1,329,
一般建築,,LY3510,林富里,高雄市苓雅區林富里福建街225號,"22.622268,120.315254",1,330,
一般建築,,LY3941,林榮里,高雄市苓雅區林榮里英祥街19號,"22.616779,120.325702",1,330,
一般建築,,LY3996,正文里,高雄市苓雅區正文里建國一路175之5號,"22.632639,120.326216",1,335,
一般建築,,LY4155,正大里,高雄市苓雅區正大里武廟路95號,"22.630786,120.328878",1,336,
一般建築,,LY3646,正文里,高雄市苓雅區正文里福德二路75巷11號,"22.631931,120.327472",1,337,
一般建築,,LY3932,林貴里,高雄市苓雅區林貴里英明路273號,"22.619316,120.323455",1,337,
一般建築,,LY3978,城西里,高雄市苓雅區城西里中華四路75號,"22.614508,120.301347",2,339,
一般建築,,LY3244,安祥里,高雄市苓雅區安祥里中正二路56巷25號,"22.631489,120.319063",1,340,
一般建築,,LY3997,正道里,高雄市苓雅區正道里正大路33號,"22.632532,120.334936",1,344,
一般建築,,LY4024,林安里,高雄市苓雅區林安里光華一路321號,"22.626484,120.314358",1,347,
一般建築,,LY3927,永康里,高雄市苓雅區永康里中正一路177之2號,"22.62856,120.330074",1,348,
一般建築,,LY4034,苓洲里,高雄市苓雅區苓洲里允文街133號,"22.618223,120.294407",1,350,
一般建築,,LY3790,正文里,高雄市苓雅區正文里身修路31號,"22.63136,120.328973",1,358,
一般建築,,LY3241,正大里,高雄市苓雅區正大里武廟路66號,"22.630403,120.331172",1,363,
一般建築,,LY3913,英明里,高雄市苓雅區英明里英明路118之1號,"22.614331,120.325391",1,363,
一般建築,,LY1894,林華里,高雄市苓雅區林華里和平二路373號,"22.617118,120.322402",1,366,
一般建築,,LY3526,苓中里,高雄市苓雅區苓中里四維四路196號,"22.614315,120.294629",1,366,
一般建築,,LY3125,林泉里,高雄市苓雅區林泉里林泉街73號,"22.622886,120.317936",1,367,
一般建築,,LY3774,安祥里,高雄市苓雅區安祥里凱旋一路1號,"22.630424,120.321296",2,372,
一般建築,,LY3875,林榮里,高雄市苓雅區林榮里凱旋三路631巷2弄24號,"22.616727,120.326374",1,376,
一般建築,,LY3238,城北里,高雄市苓雅區城北里四維四路69號,"22.615245,120.298768",1,377,
一般建築,,LY1843,廣澤里,高雄市苓雅區廣澤里中山二路320號,"22.615908,120.304105",1,378,
一般建築,,LY2681,中正里,高雄市苓雅區中正里青年一路1之7號,"22.624561,120.316376",1,379,
一般建築,,LY3178,城東里,高雄市苓雅區城東里興中二路11號,"22.615203,120.303409",1,379,
