一般建築,D0962,後庄里,高雄市大寮區後庄里鳳屏一路5號,"22.630206,120.383013",1,489.0,
一般建築,D0963,後庄里,高雄市大寮區後庄里鳳屏一路67號,"22.63212859,120.385944267346",1,2774.0,
一般建築,D0964,後庄里,高雄市大寮區後庄里鳳屏一路71號,"22.63215829,120.386008525019",1,40.0,
一般建築,D0965,後庄里,高雄市大寮區後庄里鳳屏一路7之2號,"22.63053199,120.383614296183",1,741.0,
一般建築,D0966,拷潭里,高雄市大寮區拷潭里拷潭路163之1號,"22.584752,120.380306",2,3110.0,
一般建築,D0967,昭明里,高雄市大寮區昭明里鳳林一路300巷80號,"22.54239,120.408514",1,582.0,
一般建築,D0968,琉球里,高雄市大寮區琉球里農場路1之10號,"22.60417209,120.431857896458",1,5760.0,
一般建築,D0969,琉球里,高雄市大寮區琉球里農場路1之10號,"22.60412176180413, 120.43185096541607",1,1047.0,
一般建築,D0970,翁園里,高雄市大寮區翁園里翁園路79號,"22.623246,120.408663",1,1332.0,
一般建築,D0971,翁園里,高雄市大寮區翁園里翁園路79號,"22.623106343155207, 120.40798572058291",1,131.0,
一般建築,D0972,翁園里,高雄市大寮區翁園里翁園路79號,"22.62330777735432, 120.40866825626907",1,60.0,
一般建築,D0973,翁園里,高雄市大寮區翁園里翁園路79號,"22.622952052930764, 120.40836645477519",1,108.0,
一般建築,D0974,頂厝里,高雄市林園區頂厝里沿海路3段216號,"22.500311,120.38722",1,214.0,
一般建築,D0975,頂厝里,高雄市林園區頂厝里校前路6巷23號,"22.504379,120.379405",2,3144.0,
一般建築,D0976,頂厝里,高雄市林園區頂厝里頂厝路50巷91號,"22.500164,120.379937",2,3580.0,
一般建築,D0977,新厝里,高雄市大寮區新厝里新厝路56之3號,"22.5615054,120.409938425017",1,1346.0,
一般建築,D0978,新厝里,高雄市大寮區新厝里鳳林二路277號,"22.569315,120.409981",1,267.0,
一般建築,D0979,會社里,高雄市大寮區會社里正氣路73之7號,"22.601438,120.394312",1,1286.0,
一般建築,D0980,會社里,高雄市大寮區會社里正氣路79號,"22.599865,120.392557",1,445.0,
一般建築,D0981,會社里,高雄市大寮區會社里正氣路79號,"22.60035341332938, 120.39315681787173",1,1022.0,
一般建築,D0982,會社里,高雄市大寮區會社里正氣路79號,"22.600131869805516, 120.3933826731798",1,1123.0,
一般建築,D0983,會社里,高雄市大寮區會社里鳳林三路105巷24弄47號,"22.596508,120.398458",1,2768.0,
一般建築,D0984,會社里,高雄市大寮區會社里鳳林三路373巷8號,"22.601858,120.396558",1,444.0,
一般建築,D0985,溪州里,高雄市林園區溪州里工業一路1號,"22.500541,120.407225",1,187.0,
一般建築,D0986,溪州里,高雄市林園區溪州里工業一路2號,"22.501664,120.406249",1,913.0,
一般建築,D0987,溪州里,高雄市林園區溪州里工業一路5號,"22.506515,120.408445",1,100.0,
一般建築,D0988,溪州里,高雄市林園區溪州里工業一路5號,"22.504965926246655, 120.40617373657555",1,75.0,
一般建築,D0989,溪州里,高雄市林園區溪州里工業一路6號,"22.50328671,120.406197896179",1,374.0,
一般建築,D0990,溪州里,高雄市林園區溪州里工業一路7號,"22.50313029,120.406271938506",1,240.0,
一般建築,D0991,溪州里,高雄市林園區溪州里工業一路9號,"22.512554,120.405322",1,407.0,
一般建築,D0992,溪州里,高雄市林園區溪州里工業二路1之1號,"22.500547,120.414066",1,326.0,
一般建築,D0993,溪州里,高雄市林園區溪州里工業二路1之1號,"22.49856579747587, 120.41441987890273",1,46.0,
一般建築,D0994,溪州里,高雄市林園區溪州里工業二路3號,"22.503314,120.413563",1,255.0,
一般建築,D0995,溪州里,高雄市林園區溪州里石化一路1之1號,"22.507294,120.412377",1,154.0,
一般建築,D0996,溪州里,高雄市林園區溪州里石化一路1之1號,"22.50769507361616, 120.41265353657569",1,125.0,
一般建築,D0997,溪州里,高雄市林園區溪州里石化一路1號,"22.507192,120.410588",1,373.0,
一般建築,D0998,溪州里,高雄市林園區溪州里石化一路1號,"22.507678761273805, 120.41276004960135",1,234.0,
一般建築,D0999,溪州里,高雄市林園區溪州里石化一路1號,"22.50768562740417, 120.41253955924843",1,2525.0,
一般建築,D1000,溪州里,高雄市林園區溪州里石化一路1號,"22.50752999503232, 120.41274270766348",1,308.0,
一般建築,D1001,溪州里,高雄市林園區溪州里石化一路1號,"22.50751626275581, 120.41280959799528",1,243.0,
一般建築,D1002,溪州里,高雄市林園區溪州里石化一路1號,"22.507484220771982, 120.41248010117576",1,109.0,
一般建築,D1003,溪州里,高雄市林園區溪州里石化一路1號,"22.50739267220582, 120.41259653990146",1,74.0,
一般建築,D1004,溪州里,高雄市林園區溪州里石化一路1號,"22.507275947696073, 120.4128021657362",1,528.0,
一般建築,D1005,溪州里,高雄市林園區溪州里石化一路1號,"22.50755974829343, 120.41235375277128",1,161.0,
一般建築,D1006,溪州里,高雄市林園區溪洲里工業二路1號,"22.499009,120.414456",1,590.0,
一般建築,D1007,溪州里,高雄市林園區溪洲里石化二路1號,"22.49885569,120.406826125015",1,422.0,
學校,D1008,溪寮里,高雄市大寮區溪寮里溪寮路68號,"22.62915529,120.419563725019",2,1289.0,
一般建築,D1009,義和里,高雄市大寮區義和里義和路123之39號,"22.640059,120.420094",1,793.0,
一般建築,D1010,過溪里,高雄市大寮區大寮里華西路26號,"22.579388,120.42321",1,996.0,
一般建築,D1011,過溪里,高雄市大寮區過溪里大發工業區華西路33號,"22.580207,120.422343",1,2283.0,
一般建築,D1012,過溪里,高雄市大寮區過溪里大業街18號,"22.581603,120.43118",1,3286.0,
一般建築,D1013,過溪里,高雄市大寮區過溪里大業街35號,"22.587395,120.430137",1,162.0,
一般建築,D1014,過溪里,高雄市大寮區過溪里大業街7號,"22.581057,120.430159",1,302.0,
一般建築,D1015,過溪里,高雄市大寮區過溪里大業街8之1號,"22.580262,120.430695",1,217.0,
一般建築,D1016,過溪里,高雄市大寮區過溪里光華路17之1號,"22.582156,120.424088",1,345.0,
一般建築,D1017,過溪里,高雄市大寮區過溪里光華路17號,"22.582187,120.424468",1,263.0,
一般建築,D1018,過溪里,高雄市大寮區過溪里光華路19號,"22.582208,120.423615",1,214.0,
一般建築,D1019,過溪里,高雄市大寮區過溪里光華路27之1號,"22.58282769,120.423388567345",1,345.0,
一般建築,D1020,過溪里,高雄市大寮區過溪里光華路5之3號,"22.582574,120.430384",1,1176.0,
一般建築,D1021,過溪里,高雄市大寮區過溪里莒光一街12號,"22.581166,120.425541",1,159.0,
一般建築,D1022,過溪里,高雄市大寮區過溪里莒光一街16號,"22.58125,120.424549",1,305.0,
一般建築,D1023,過溪里,高雄市大寮區過溪里莒光二街22號,"22.579039,120.424017",4,3344.0,
一般建築,D1024,過溪里,高雄市大寮區過溪里莒光二街22號,"22.578962919644216, 120.4240543138479",1,1434.0,
一般建築,D1025,過溪里,高雄市大寮區過溪里莒光二街22號,"22.57911521833828, 120.42410318535325",1,257.0,
一般建築,D1026,過溪里,高雄市大寮區過溪里莒光三街2號,"22.577328,120.428268",1,792.0,
一般建築,D1027,過溪里,高雄市大寮區過溪里莒光街15號,"22.58069286,120.425238810554",1,300.0,
一般建築,D1028,過溪里,高雄市大寮區過溪里華中路21號,"22.579505,120.427829",1,190.0,
一般建築,D1029,過溪里,高雄市大寮區過溪里華中路22號,"22.578371,120.429102",1,517.0,
一般建築,D1030,過溪里,高雄市大寮區過溪里華中路32號,"22.581678,120.429561",1,155.0,
一般建築,D1031,過溪里,高雄市大寮區過溪里華西路16號,"22.577908,120.423669",1,405.0,
一般建築,D1032,過溪里,高雄市大寮區過溪里華西路20號,"22.580124,120.423199",1,187.0,
一般建築,D1033,過溪里,高雄市大寮區過溪里華西路31號,"22.579014,120.422292",1,2137.0,
一般建築,D1034,過溪里,高雄市大寮區過溪里華西路33號,"22.580207,120.422343",1,151.0,
一般建築,D1035,過溪里,高雄市大寮區過溪里華西路35號,"22.58071,120.422214",1,193.0,
一般建築,D1036,過溪里,高雄市大寮區過溪里華西路8之1號,"22.574812,120.425675",1,586.0,
一般建築,D1037,過溪里,高雄市大寮區過溪里華西路8之1號,"22.574922504608185, 120.42290469657748",1,440.0,
一般建築,D1038,過溪里,高雄市大寮區過溪里過溪路52之4號,"22.57546409,120.417424325017",1,256.0,
一般建築,D1039,過溪里,高雄市大寮區過溪里過溪路5之11號,"22.57553659,120.417163767345",1,1289.0,
一般建築,D1040,過溪里,高雄市大寮區過溪里鳳林二路546號,"22.5768965,120.409147567345",1,240.0,
一般建築,D1041,鳳芸里,高雄市林園區鳳芸里鳳芸二路95巷98號,"22.48831791,120.398671325015",1,430.0,
一般建築,D1042,廣應里,高雄市林園區廣應里東林西路298巷78號,"22.5061536,120.388327925015",1,643.0,
一般建築,D1043,廣應里,高雄市林園區廣應里東林西路360號,"22.503844,120.386635",1,483.0,
一般建築,D1044,廣應里,高雄市林園區王公里東林西路364巷10號,"22.504182,120.386519",1,336.0,
一般建築,D1045,潮寮里,高雄市大寮區大寮里大有一街12號,"22.588826,120.430352",1,192.0,
一般建築,D1046,潮寮里,高雄市大寮區大寮里大有一街13號,"22.588301,120.42797",1,287.0,
一般建築,D1047,潮寮里,高雄市大寮區大寮里大有一街14號,"22.5889726,120.430240167345",1,221.0,
一般建築,D1048,潮寮里,高雄市大寮區大寮里大有一街32號,"22.588995,120.424431",1,412.0,
一般建築,D1049,潮寮里,高雄市大寮區大寮里大有二街1號,"22.587226,120.428473",1,160.0,
一般建築,D1050,潮寮里,高雄市大寮區大寮里大有二街20號,"22.587838,120.425556",1,343.0,
一般建築,D1051,潮寮里,高雄市大寮區大寮里大有二街27號,"22.587149,120.424544",1,135.0,
一般建築,D1052,潮寮里,高雄市大寮區大寮里大有二街4號,"22.587837,120.427812",1,204.0,
一般建築,D1053,潮寮里,高雄市大寮區大寮里大有三街15號,"22.585813,120.425344",1,276.0,
一般建築,D1054,潮寮里,高雄市大寮區大寮里大有三街3號,"22.585753,120.427719",1,190.0,
一般建築,D1055,潮寮里,高雄市大寮區大寮里大有三街5號,"22.58575,120.427295",1,209.0,
一般建築,D1056,潮寮里,高雄市大寮區大寮里大有四街13號,"22.584515,120.424867",1,458.0,
一般建築,D1057,潮寮里,高雄市大寮區大寮里大有四街3號,"22.584534,120.427622",1,219.0,
一般建築,D1058,潮寮里,高雄市大寮區大寮里大有四街7號,"22.584629,120.426078",1,319.0,
一般建築,D1059,潮寮里,高雄市大寮區大寮里大業街19號,"22.58368249,120.430469167345",1,842.0,
一般建築,D1060,潮寮里,高雄市大寮區大寮里大業街38號,"22.586008,120.4314",1,266.0,
一般建築,D1061,潮寮里,高雄市大寮區大寮里大業街42號,"22.587036,120.431368",1,238.0,
一般建築,D1062,潮寮里,高雄市大寮區大寮里利民街22號,"22.587776,120.434635",1,231.0,
一般建築,D1063,潮寮里,高雄市大寮區大寮里華中路44之2號,"22.58686559,120.428870073463",1,373.0,
一般建築,D1064,潮寮里,高雄市大寮區大寮里華東路43號,"22.588246,120.432903",1,213.0,
一般建築,D1065,潮寮里,高雄市大寮區大寮里裕民街30號,"22.590833,120.435334",1,284.0,
一般建築,D1066,潮寮里,高雄市大寮區大寮里裕民街37號,"22.5894,120.435287",1,187.0,
一般建築,D1067,潮寮里,高雄市大寮區潮寮里大有一街20號,"22.588911,120.427446",1,1160.0,
一般建築,D1068,潮寮里,高雄市大寮區潮寮里大有二街11號,"22.587071,120.426741",1,108.0,
一般建築,D1069,潮寮里,高雄市大寮區潮寮里大發工業區興業路40號,"22.589762,120.42413",1,424.0,
一般建築,D1070,潮寮里,高雄市大寮區潮寮里大業街5號,"22.580589,120.430063",2,5586.0,
一般建築,D1071,潮寮里,高雄市大寮區潮寮里田單三街8號,"22.575282,120.43087",1,111.0,
一般建築,D1072,潮寮里,高雄市大寮區潮寮里田單五街6號,"22.5732149,120.431690567345",1,140.0,
一般建築,D1073,潮寮里,高雄市大寮區潮寮里建業路29號,"22.570563,120.421535",1,799.0,
一般建築,D1074,潮寮里,高雄市大寮區潮寮里華中路1號,"22.582401,120.429272",1,245.0,
一般建築,D1075,潮寮里,高雄市大寮區潮寮里華中路1號,"22.58239056393375, 120.42919150417059",1,262.0,
一般建築,D1076,潮寮里,高雄市大寮區潮寮里華東路28號,"22.579488,120.433719",1,1074.0,
一般建築,D1077,潮寮里,高雄市大寮區潮寮里潮寮路51之9號,"22.563414,120.425175",1,347.0,
學校,D1078,潮寮里,高雄市大寮區潮寮里潮寮路61號,"22.565715,120.425144",1,923.0,
一般建築,D1079,廈莊里,高雄市小港區廈莊里9鄰孔鳳路464號,"22.581544,120.360009",1,14.0,
一般建築,D1080,廈莊里,高雄市小港區廈莊里9鄰孔鳳路466號,"22.581544,120.359967",1,14.0,
一般建築,D1081,廈莊里,高雄市小港區廈莊里9鄰孔鳳路468號,"22.581544,120.359905",1,49.0,
一般建築,D1082,廈莊里,高雄市小港區廈莊里9鄰孔鳳路470巷1號,"22.581679,120.359778",1,12.0,
一般建築,D1083,廈莊里,高雄市小港區廈莊里9鄰孔鳳路470巷2號,"22.581679,120.359906",1,14.0,
一般建築,D1084,廈莊里,高雄市小港區廈莊里9鄰孔鳳路470巷3號,"22.581716,120.359781",1,12.0,
一般建築,D1085,廈莊里,高雄市小港區廈莊里9鄰孔鳳路470巷4號,"22.581716,120.359904",1,14.0,
一般建築,D1086,廈莊里,高雄市小港區廈莊里9鄰孔鳳路472號,"22.581544,120.35978",1,43.0,
一般建築,D1087,廈莊里,高雄市小港區廈莊里9鄰孔鳳路474號,"22.581544,120.359725",1,13.0,
一般建築,D1088,廈莊里,高雄市小港區廈莊里9鄰孔鳳路476號,"22.581544,120.359689",1,13.0,
一般建築,D1089,廈莊里,高雄市小港區廈莊里9鄰孔鳳路478號,"22.581551,120.359652",1,13.0,
一般建築,D1090,廈莊里,高雄市小港區廈莊里9鄰孔鳳路480號,"22.581551,120.359612",1,13.0,
一般建築,D1091,廈莊里,高雄市小港區廈莊里9鄰孔鳳路481號,"22.58208,120.358541",1,13.0,
一般建築,D1092,廈莊里,高雄市小港區廈莊里9鄰孔鳳路482號,"22.581551,120.359573",1,13.0,
一般建築,D1093,廈莊里,高雄市小港區廈莊里9鄰孔鳳路484號,"22.581551,120.359534",1,13.0,
一般建築,D1094,廈莊里,高雄市小港區廈莊里9鄰孔鳳路488號,"22.581551,120.359452",1,13.0,
一般建築,D1095,廈莊里,高雄市小港區廈莊里9鄰孔鳳路490號,"22.581551,120.359415",1,17.0,
一般建築,D1096,鳳林里,高雄市小港區鳳林里13鄰鳳林路166巷13號,"22.527016,120.342197",1,22.0,
工廠,D1097,鳳林里,高雄市小港區鳳林里1鄰中林路25號,"22.526683,120.353977",1,3156.0,
一般建築,D1098,鳳林里,高雄市小港區鳳林里1鄰鳳林路138巷10之1號,"22.528046,120.344628",1,16.0,
一般建築,D1099,鳳林里,高雄市小港區鳳林里1鄰鳳林路138巷10之2號,"22.528009,120.344635",1,16.0,
一般建築,D1100,鳳林里,高雄市小港區鳳林里1鄰鳳林路138巷10之3號,"22.527992,120.344678",1,16.0,
一般建築,D1101,鳳林里,高雄市小港區鳳林里1鄰鳳林路138巷10之4號,"22.527964,120.344714",1,16.0,
一般建築,D1102,鳳林里,高雄市小港區鳳林里2鄰鳳林路132之1號,"22.527688,120.345318",1,18.0,
一般建築,D1103,鳳林里,高雄市小港區鳳林里2鄰鳳林路132之2號,"22.527715,120.345284",1,18.0,
一般建築,D1104,鳳林里,高雄市小港區鳳林里2鄰鳳林路132號,"22.52766,120.34535",1,18.0,
一般建築,D1105,鳳林里,高雄市小港區鳳林里2鄰鳳林路134號,"22.52775,120.345257",1,18.0,
一般建築,D1106,鳳林里,高雄市小港區鳳林里2鄰鳳林路136之1號,"22.527805,120.345196",1,18.0,
一般建築,D1107,鳳林里,高雄市小港區鳳林里2鄰鳳林路136之2號,"22.527832,120.34517",1,18.0,
一般建築,D1108,鳳林里,高雄市小港區鳳林里2鄰鳳林路136號,"22.527778,120.345228",1,18.0,
一般建築,D1109,鳳林里,高雄市小港區鳳林里3鄰鳳西街9之1號,"22.523429,120.346705",1,11.0,
一般建築,D1110,鳳林里,高雄市小港區鳳林里8鄰鳳林路93號,"22.526346,120.34636",1,28.0,
一般建築,D1111,鳳宮里,高雄市小港區鳳宮里大業北路162號,"22.561257,120.350081",1,21.0,
一般建築,D1112,鳳宮里,高雄市小港區鳳宮里大業北路166號,"22.561311,120.350026",1,18.0,
工廠,D1113,鳳宮里,高雄市小港區鳳宮里中林路16號,"22.538343,120.367921",1,476.0,
工廠,D1114,鳳宮里,高雄市小港區鳳宮里中林路20號,"22.537654,120.366913",1,171.0,
工廠,D1115,鳳宮里,高雄市小港區鳳宮里中林路26號,"22.536773,120.365874",1,242.0,
工廠,D1116,鳳宮里,高雄市小港區鳳宮里中鋼路1號,"22.529525,120.354687",1,314.0,
工廠,D1117,鳳宮里,高雄市小港區鳳宮里中鋼路1號,"22.559557894950288, 120.35622650827369",1,284.0,
工廠,D1118,鳳宮里,高雄市小港區鳳宮里中鋼路1號,"22.55785382138137, 120.35649710686755",1,6243.0,
工廠,D1119,鳳宮里,高雄市小港區鳳宮里中鋼路1號,"22.557893453379926, 120.35543495207475",1,372.0,
工廠,D1120,鳳宮里,高雄市小港區鳳宮里中鋼路1號,"22.55785788200193, 120.35406459243033",1,1287.0,
工廠,D1121,鳳宮里,高雄市小港區鳳宮里中鋼路1號,"22.55526196132784, 120.35628546148745",1,204.0,
工廠,D1122,鳳宮里,高雄市小港區鳳宮里中鋼路1號,"22.554508937042804, 120.35745490464319",1,1462.0,
工廠,D1123,鳳宮里,高雄市小港區鳳宮里中鋼路1號,"22.55515297122522, 120.35715449722706",1,1312.0,
工廠,D1124,鳳宮里,高雄市小港區鳳宮里中鋼路1號,"22.552569945192662, 120.35784560629054",1,362.0,
工廠,D1125,鳳宮里,高雄市小港區鳳宮里中鋼路1號,"22.552023462635297, 120.35862878158758",1,556.0,
工廠,D1126,鳳宮里,高雄市小港區鳳宮里中鋼路1號,"22.5514207220103, 120.35910738871355",1,385.0,
工廠,D1127,鳳宮里,高雄市小港區鳳宮里中鋼路1號,"22.553406354401872, 120.35208492427277",1,70.0,
工廠,D1128,鳳宮里,高雄市小港區鳳宮里中鋼路1號,"22.55682318538372, 120.3522819473745",1,1146.0,
工廠,D1129,鳳宮里,高雄市小港區鳳宮里中鋼路1號,"22.55724923195481, 120.3511661484002",1,229.0,
工廠,D1130,鳳宮里,高雄市小港區鳳宮里中鋼路1號,"22.557982425327648, 120.35426678204043",1,1087.0,
工廠,D1131,鳳宮里,高雄市小港區鳳宮里中鋼路1號,"22.556476402326677, 120.35545768283122",1,78.0,
工廠,D1132,鳳宮里,高雄市小港區鳳宮里中鋼路1號,"22.557011438689212, 120.35697044874829",1,483.0,
工廠,D1133,鳳宮里,高雄市小港區鳳宮里中鋼路1號,"22.555372348479157, 120.35480104496864",1,308.0,
工廠,D1134,鳳宮里,高雄市小港區鳳宮里台機路15號,"22.556004,120.34114",1,208.0,
工廠,D1135,鳳宮里,高雄市小港區鳳宮里台機路3號,"22.5608,120.34754",1,443.0,
一般建築,D1136,鳳宮里,高雄市小港區鳳宮里店中路198號,"22.562324,120.350728",1.2,1846.0,
一般建築,D1137,鳳宮里,高雄市小港區鳳宮里店中路198號,"22.56228025517849, 120.35080834358965",1.2,1846.0,
一般建築,D1138,鳳宮里,高雄市小港區鳳宮里店北路200號,"22.56341,120.35122",1,2892.0,
一般建築,D1139,鳳宮里,高雄市小港區鳳宮里店北路31號,"22.559643,120.352806",1,2168.0,
一般建築,D1140,鳳宮里,高雄市小港區鳳宮里店北路58號,"22.560139,120.352727",1,670.0,
一般建築,D1141,鳳宮里,高雄市小港區鳳宮里店北路61之1號,"22.560341,120.352169",1,745.0,
一般建築,D1142,鳳宮里,高雄市小港區鳳宮里漢民路8號,"22.562387,120.349377",1.2.3,3267.0,
一般建築,D1143,鳳宮里,高雄市小港區鳳宮里漢民路8號,"22.562254417481775, 120.34922337471009",1.2.3,3267.0,
一般建築,D1144,鳳宮里,高雄市小港區鳳宮里漢民路8號,"22.562191459677944, 120.34921872636373",1.2.3,3267.0,
一般建築,D1145,鳳森里,高雄市小港區鳳森里10鄰鳳林路2之14號,"22.524899,120.348108",1,26.0,
一般建築,D1146,鳳森里,高雄市小港區鳳森里10鄰鳳林路2之15號,"22.524926,120.348072",1,26.0,
一般建築,D1147,鳳森里,高雄市小港區鳳森里10鄰鳳林路2之16號,"22.524953,120.348043",1,27.0,
一般建築,D1148,鳳森里,高雄市小港區鳳森里11鄰鳳城街407號,"22.524324,120.348669",1,99.0,
工廠,D1149,鳳森里,高雄市小港區鳳森里1鄰大業南路45號,"22.531027,120.366254",1,410.0,
工廠,D1150,鳳森里,高雄市小港區鳳森里1鄰中亨街47號,"22.52848,120.362962",1,302.0,
工廠,D1151,鳳森里,高雄市小港區鳳森里1鄰中利街22號,"22.528293,120.357578",1,56.0,
工廠,D1152,鳳森里,高雄市小港區鳳森里1鄰中利街22號,"22.528511755611945, 120.35776898019738",1,179.0,
工廠,D1153,鳳森里,高雄市小港區鳳森里1鄰中利街22號,"22.52843361136913, 120.3578350740622",1,285.0,
工廠,D1154,鳳森里,高雄市小港區鳳森里1鄰中林路34號,"22.535236,120.363712",1,26.0,
工廠,D1155,鳳森里,高雄市小港區鳳森里1鄰中林路36號,"22.534465,120.36279",1,313.0,
工廠,D1156,鳳森里,高雄市小港區鳳森里1鄰中智街25號,"22.532727,120.362779",1,499.0,
工廠,D1157,鳳森里,高雄市小港區鳳森里1鄰中智街5號,"22.53028,120.364937",1,332.0,
工廠,D1158,鳳森里,高雄市小港區鳳森里1鄰中智街7號,"22.530328,120.364898",1,255.0,
工廠,D1159,鳳森里,高雄市小港區鳳森里1鄰中智街9號,"22.530722,120.364585",1,141.0,
一般建築,D1160,鳳森里,高雄市小港區鳳森里4鄰鳳林路80巷1之5號,"22.526727,120.34679",1,220.0,
工廠,D1161,鳳森里,高雄市小港區鳳森里6鄰大林路3號,"22.532463,120.335967",1,200.0,
工廠,D1162,鳳森里,高雄市小港區鳳森里6鄰大林路3號,"22.536931521456584, 120.33202198760922",1,2535.0,
工廠,D1163,鳳森里,高雄市小港區鳳森里6鄰大林路3號,"22.536948675529896, 120.33268595089572",1,3270.0,
工廠,D1164,鳳森里,高雄市小港區鳳森里6鄰大林路3號,"22.537353927783577, 120.33168224108783",1,3270.0,
工廠,D1165,鳳森里,高雄市小港區鳳森里6鄰南星路2800號,"22.549806,120.318601",1,1339.0,
一般建築,D1166,鳳森里,高雄市小港區鳳森里6鄰鳳北路4號,"22.530017,120.341984",1,283.0,
工廠,D1167,鳳森里,高雄市小港區鳳森里7鄰沿海四路50號,"22.52944752,120.347369225016",1,433.0,
工廠,D1168,鳳森里,高雄市小港區鳳森里7鄰沿海四路50號,"22.52990929150573, 120.34721986907358",1,2516.0,
工廠,D1169,鳳森里,高雄市小港區鳳森里7鄰沿海四路50號,"22.529692270421233, 120.34705453206645",1,415.0,
工廠,D1170,鳳森里,高雄市小港區鳳森里7鄰沿海四路50號,"22.529153735146014, 120.34825540085525",1,412.0,
工廠,D1171,鳳森里,高雄市小港區鳳森里7鄰沿海四路50號,"22.528968864343533, 120.34802044826613",1,248.0,
工廠,D1172,鳳森里,高雄市小港區鳳森里7鄰沿海四路50號,"22.530078085446814, 120.34823799695975",1,67.0,
工廠,D1173,鳳森里,高雄市小港區鳳森里7鄰沿海四路50號,"22.530359408223553, 120.34779419762475",1,3490.0,
工廠,D1174,鳳森里,高雄市小港區鳳森里7鄰沿海四路50號,"22.53050408828561, 120.34723727296908",1,3275.0,
工廠,D1175,鳳森里,高雄市小港區鳳森里7鄰沿海四路50號,"22.52931449216442, 120.34883843135414",1,286.0,
政府機關,D1176,鳳森里,高雄市小港區鳳森里鳳林路116號,"22.52707,120.346013",1,535.0,
一般建築,D1177,鳳源里,高雄市小港區鳳源里10鄰鳳北路191巷14弄1號,"22.527633,120.343328",1,92.0,
一般建築,D1178,鳳源里,高雄市小港區鳳源里10鄰鳳北路191巷14弄6號,"22.527823,120.343397",1,19.0,
一般建築,D1179,鳳源里,高雄市小港區鳳源里13鄰鳳林路166巷15號,"22.527052,120.342181",1,21.0,
一般建築,D1180,鳳源里,高雄市小港區鳳源里13鄰鳳林路166巷7之17號,"22.527608,120.342665",1,17.0,
一般建築,D1181,鳳源里,高雄市小港區鳳源里13鄰鳳林路166巷7之21號,"22.527602,120.342509",1,17.0,
一般建築,D1182,鳳源里,高雄市小港區鳳源里18鄰鳳林路166巷5之1號,"22.527425,120.34307",1,16.0,
一般建築,D1183,鳳源里,高雄市小港區鳳源里18鄰鳳林路166巷5之2號,"22.527462,120.343047",1,17.0,
一般建築,D1184,鳳源里,高雄市小港區鳳源里18鄰鳳林路166巷5之3號,"22.527488,120.343016",1,17.0,
一般建築,D1185,鳳源里,高雄市小港區鳳源里18鄰鳳林路166巷5之4號,"22.527515,120.342996",1,30.0,
一般建築,D1186,鳳鳴里,高雄市小港區鳳鳴里11鄰丹山三路18號,"22.513328,120.359278",1,24.0,
一般建築,D1187,鳳鳴里,高雄市小港區鳳鳴里13鄰丹山三路51之1號,"22.511257,120.358124",1,54.0,
一般建築,D1188,鳳鳴里,高雄市小港區鳳鳴里13鄰丹山三路51號,"22.511293,120.358165",1,28.0,
一般建築,D1189,鳳鳴里,高雄市小港區鳳鳴里16鄰丹山一路15之5號,"22.510418,120.360657",1,50.0,
一般建築,D1190,鳳鳴里,高雄市小港區鳳鳴里16鄰丹山一路15之6號,"22.510373,120.36071",1,50.0,
工廠,D1191,鳳鳴里,高雄市小港區鳳鳴里17鄰沿海三路26之3號,"22.526361,120.368301",1,265.0,
工廠,D1192,鳳鳴里,高雄市小港區鳳鳴里17鄰沿海三路36號,"22.523204,120.36675",1,513.0,
工廠,D1193,鳳鳴里,高雄市小港區鳳鳴里1鄰大業南路21號,"22.526147,120.364498",1,150.0,
工廠,D1194,鳳鳴里,高雄市小港區鳳鳴里1鄰大業南路28號,"22.525517,120.364813",1,850.0,
工廠,D1195,鳳鳴里,高雄市小港區鳳鳴里1鄰大業南路32號,"22.527562,120.365862",1,305.0,
工廠,D1196,鳳鳴里,高雄市小港區鳳鳴里1鄰大業南路34號,"22.528793,120.366408",1,171.0,
工廠,D1197,鳳鳴里,高雄市小港區鳳鳴里1鄰大業南路38號,"22.530037,120.367149",1,377.0,
